full,team,logo,season,PTS,W,Conference,Division,playoffs,gf%,xg_dif,sv%,shooting%,g_dif,PP_g_dif,PK_g_dif,projected_cap_hit,projected_cap_space,5on5_rank,PP_rank,PK_rank,XG_dif_rank,Save%_rank,Shooting%_rank,5on5_color,PP_color,PK_color,xg_color,sv_color,sh_color,expiring_contracts,expiring_salary,nhl_contracts_2324,2023-24 Salary,nhl_contracts_2425,2024-25 Salary,nhl_contracts_2526,2025-26 Salary,nhl_contracts_2627,2026-27 Salary,nhl_contracts_2728,2027-28 Salary,cap_remaining,GM,gm_start,coach,coach_start,avg_age_2324,avg_age_2425,avg_age_2526,avg_age_2627,avg_age_2728,players_under_contract_2324,players_under_contract_2425,players_under_contract_2526,players_under_contract_2627,players_under_contract_2728,draft_capital_rank
Anaheim Ducks,ANA,ANA.png,20222023,26,11,west,pacific,none,0.365,-34.15,0.908,0.071,-46,+13,-39,68573153,13926847.0,27,19,19,32,13,20,red,#fc4d47,#fc4d47,red,black,#fc4d47,0.0,0.0,11,36756667.0,5,22444167,3,17900000,2,11400000,0.0,0.0,13926847.0,Pat Verbeek,"February 3, 2022",Dallas Eakins,"June 17, 2019",28.45,29.2,32.67,33.0,,"John Gibson, Colton White, Urho Vaakanainen, Brett Leason, Sam Carrick, Adam Henrique, Jakob Silfverberg, Ryan Strome, Frank Vatrano, Cam Fowler, Mason McTavish","John Gibson, Ryan Strome, Frank Vatrano, Cam Fowler, Mason McTavish","John Gibson, Ryan Strome, Cam Fowler","John Gibson, Ryan Strome",,4.0
Arizona Coyotes,ARI,ARI.png,20222023,31,13,west,central,none,0.458,-27.72,0.906,0.105,-14,+22,-36,64181106,18318894.0,22,12,17,29,15,3,#fc4d47,#3568f2,#fc4d47,red,black,#052ca3,0.0,0.0,12,36786667.0,5,24625000,3,17300000,2,11450000,1.0,7150000.0,18318894.0,Bill Armstrong,"September 17, 2020",Andre Tourigny,"July 1, 2021",27.25,27.0,28.0,28.5,30.0,"Lawson Crouse, Zack Kassian, Karel Vejmelka, J.J. Moser, Joshua Brown, Patrik Nemeth, Liam O'Brien, Travis Boyd, Barrett Hayton, Clayton Keller, Nick Schmaltz, Jakob Chychrun","Lawson Crouse, Karel Vejmelka, Clayton Keller, Nick Schmaltz, Jakob Chychrun","Lawson Crouse, Clayton Keller, Nick Schmaltz","Lawson Crouse, Clayton Keller",Clayton Keller,1.0
Boston Bruins,BOS,BOS.png,20222023,64,30,east,atlantic,top3,0.635,+21.16,0.936,0.1,+42,+30,-16,83690388,-1190388.0,1,5,4,3,1,4,#052ca3,#052ca3,#052ca3,#052ca3,#052ca3,#052ca3,0.0,0.0,11,51062500.0,7,42475000,4,25350000,3,20100000,2.0,16000000.0,-1190388.0,Don Sweeney,"May 20, 2015",Jim Montgomery,"July 1, 2022",29.45,31.0,30.25,30.33,32.5,"Matt Grzelcyk, Derek Forbort, Jakub Zboril, Brandon Carlo, Linus Ullmark, Hampus Lindholm, AJ Greer, Charlie Coyle, Taylor Hall, Charlie McAvoy, Brad Marchand","Brandon Carlo, Linus Ullmark, Hampus Lindholm, Charlie Coyle, Taylor Hall, Charlie McAvoy, Brad Marchand","Brandon Carlo, Hampus Lindholm, Charlie Coyle, Charlie McAvoy","Brandon Carlo, Hampus Lindholm, Charlie McAvoy","Hampus Lindholm, Charlie McAvoy",26.0
Buffalo Sabres,BUF,BUF.png,20222023,40,19,east,atlantic,none,0.533,-6.48,0.907,0.11,+12,+31,-26,65174235,17325765.0,8,4,12,23,14,1,#3568f2,#052ca3,#3568f2,#fc4d47,black,#052ca3,0.0,0.0,13,46527737.0,6,26897737,4,25178571,3,20428571,2.0,11428571.0,17325765.0,Kevyn Adams,"June 16, 2020",Don Granato,"March 17, 2021",24.92,26.0,28.75,29.67,29.5,"Owen Power, Mattias Samuelsson, Jacob Bryson, Ilya Lyubushkin, Rasmus Dahlin, John-Jason Peterka, Peyton Krebs, Tage Thompson, Jeff Skinner, Casey Mittelstadt, Victor Olofsson, Alex Tuch, Jack Quinn","Mattias Samuelsson, John-Jason Peterka, Tage Thompson, Jeff Skinner, Alex Tuch, Jack Quinn","Mattias Samuelsson, Tage Thompson, Jeff Skinner, Alex Tuch","Mattias Samuelsson, Tage Thompson, Jeff Skinner","Mattias Samuelsson, Tage Thompson",8.0
Calgary Flames,CGY,CGY.png,20222023,43,18,west,pacific,wc,0.518,+11.55,0.903,0.082,+6,+22,-17,81072230,1427770.0,13,12,5,7,17,18,black,#3568f2,#052ca3,#3568f2,#fc4d47,#fc4d47,0.0,0.0,16,77912500.0,8,47200000,6,39200000,4,28650000,3.0,23750000.0,1427770.0,Brad Treliving,"April 28, 2014",Darryl Sutter,"March 4, 2021",29.25,30.62,32.67,34.0,35.67,"Daniel Vladar, Jacob Markstrom, MacKenzie Weegar, Nikita Zadorov, Christopher Tanev, Rasmus Andersson, Noah Hanifin, Dillon Dube, Tyler Toffoli, Elias Lindholm, Blake Coleman, Nazem Kadri, Mikael Backlund, Adam Ruzicka, Andrew Mangiapane, Jonathan Huberdeau","Daniel Vladar, Jacob Markstrom, MacKenzie Weegar, Rasmus Andersson, Blake Coleman, Nazem Kadri, Andrew Mangiapane, Jonathan Huberdeau","Jacob Markstrom, MacKenzie Weegar, Rasmus Andersson, Blake Coleman, Nazem Kadri, Jonathan Huberdeau","MacKenzie Weegar, Blake Coleman, Nazem Kadri, Jonathan Huberdeau","MacKenzie Weegar, Nazem Kadri, Jonathan Huberdeau",24.0
Carolina Hurricanes,CAR,CAR.png,20222023,56,25,east,metro,top3,0.566,+28.26,0.915,0.079,+20,+19,-22,86058534,-3558534.0,5,14,10,2,7,19,#052ca3,black,#3568f2,#052ca3,#3568f2,#fc4d47,0.0,0.0,13,53504417.0,4,23150000,2,12570000,2,12570000,2.0,12570000.0,-3558534.0,Don Waddell,"May 8, 2018",Rod Brind'Amour,"May 8, 2018",27.62,29.25,25.0,26.0,28.0,"Jalen Chatfield, Brett Pesce, Brady Skjei, Brent Burns, Jaccob Slavin, Stefan Noesen, Seth Jarvis, Jordan Martinook, Martin Necas, Jesperi Kotkaniemi, Teuvo Teravainen, Andrei Svechnikov, Sebastian Aho","Brent Burns, Jaccob Slavin, Jesperi Kotkaniemi, Andrei Svechnikov","Jesperi Kotkaniemi, Andrei Svechnikov","Jesperi Kotkaniemi, Andrei Svechnikov","Jesperi Kotkaniemi, Andrei Svechnikov",7.0
Chicago Blackhawks,CHI,CHI.png,20222023,20,8,west,central,none,0.324,-28.61,0.901,0.065,-52,+16,-24,77503866,4996134.0,28,17,11,30,18,23,red,#fc4d47,#3568f2,red,#fc4d47,#fc4d47,0.0,0.0,13,35800833.0,3,17900000,2,13900000,1,9500000,1.0,9500000.0,4996134.0,Kyle Davidson,"October 26, 2021",Luke Richardson,"June 27, 2022",27.46,30.67,31.5,32.0,34.0,"Boris Katchouk, Reese Johnson, Petr Mrazek, Jake McCabe, Connor Murphy, Seth Jones, Taylor Raddysh, Isaak Phillips, Tyler Johnson, Jason Dickinson, Colin Blackwell, Sam Lafferty, Lukas Reichel","Jake McCabe, Connor Murphy, Seth Jones","Connor Murphy, Seth Jones",Seth Jones,Seth Jones,2.0
Colorado Avalanche,COL,COL.png,20222023,41,19,west,central,none,0.471,+1.9,0.924,0.066,-8,+27,-24,84113785,-1613785.0,20,7,11,17,2,22,#fc4d47,#3568f2,#3568f2,#fc4d47,#052ca3,#fc4d47,0.0,0.0,12,57537500.0,8,50925000,5,37225000,5,37225000,2.0,18725000.0,-1613785.0,Chris MacFarland,"July 11, 2022",Jared Bednar,"August 25, 2016",28.17,27.88,28.8,29.8,33.0,"Mikko Rantanen, Nathan MacKinnon, Valeri Nichushkin, Artturi Lehkonen, Alexandar Georgiev, Logan O'Connor, Brad Hunt, Kurtis MacDermid, Devon Toews, Jacob MacDonald, Cale Makar, Samuel Girard","Mikko Rantanen, Nathan MacKinnon, Valeri Nichushkin, Artturi Lehkonen, Alexandar Georgiev, Logan O'Connor, Cale Makar, Samuel Girard","Nathan MacKinnon, Valeri Nichushkin, Artturi Lehkonen, Cale Makar, Samuel Girard","Nathan MacKinnon, Valeri Nichushkin, Artturi Lehkonen, Cale Makar, Samuel Girard","Nathan MacKinnon, Valeri Nichushkin",30.0
Columbus Blue Jackets,CBJ,CBJ.png,20222023,24,11,east,metro,none,0.395,-16.55,0.894,0.083,-39,+10,-20,84759953,-2259953.0,26,21,8,25,20,17,red,#fc4d47,#3568f2,red,#fc4d47,#fc4d47,0.0,0.0,14,45737500.0,7,35700000,5,30600000,2,15150000,1.0,9750000.0,-2259953.0,Jarmo Kekalainen,"February 13, 2013",Brad Larsen,"June 10, 2021",25.57,28.57,30.0,32.5,35.0,"Johnny Gaudreau, Patrik Laine, Jack Roslovic, Sean Kuraly, Eric Robinson, Kent Johnson, Kirill Marchenko, Cole Sillinger, Emil Bemstrom, Liam Foudy, Erik Gudbranson, Adam Boqvist, Andrew Peeke, Elvis Merzlikins","Johnny Gaudreau, Patrik Laine, Sean Kuraly, Erik Gudbranson, Adam Boqvist, Andrew Peeke, Elvis Merzlikins","Johnny Gaudreau, Patrik Laine, Erik Gudbranson, Andrew Peeke, Elvis Merzlikins","Johnny Gaudreau, Elvis Merzlikins",Johnny Gaudreau,11.0
Dallas Stars,DAL,DAL.png,20222023,52,23,west,central,top3,0.557,+10.0,0.921,0.099,+20,+32,-17,82193333,306667.0,5,3,5,11,4,5,#052ca3,#052ca3,#052ca3,#3568f2,#052ca3,#052ca3,0.0,0.0,16,74869167.0,11,66094167,5,39000000,3,26750000,2.0,16900000.0,306667.0,Jim Nill,"April 29, 2013",Peter DeBoer,"June 21, 2022",29.0,29.09,28.8,30.33,30.5,"Colin Miller, Scott Wedgewood, Jake Oettinger, Nils Lundkvist, Jani Hakanpaa, Ryan Suter, Miro Heiskanen, Wyatt Johnston, Roope Hintz, Radek Faksa, Mason Marchment, Esa Lindell, Jamie Benn, Joe Pavelski, Tyler Seguin, Jason Robertson","Jake Oettinger, Ryan Suter, Miro Heiskanen, Wyatt Johnston, Roope Hintz, Radek Faksa, Mason Marchment, Esa Lindell, Jamie Benn, Tyler Seguin, Jason Robertson","Miro Heiskanen, Roope Hintz, Mason Marchment, Tyler Seguin, Jason Robertson","Miro Heiskanen, Roope Hintz, Tyler Seguin","Miro Heiskanen, Roope Hintz",29.0
Detroit Red Wings,DET,DET.png,20222023,39,16,east,atlantic,none,0.491,-4.65,0.909,0.099,-3,+17,-24,77689371,4810629.0,19,16,11,22,12,5,#fc4d47,black,#3568f2,#fc4d47,#3568f2,#052ca3,0.0,0.0,12,35826666.0,5,20003333,2,10375000,1,5625000,0.0,0.0,4810629.0,Steve Yzerman,"April 19, 2019",Derek Lalonde,"June 30, 2022",26.42,28.6,32.5,32.0,,"Robby Fabbri, David Perron, Andrew Copp, Dominik Kubalik, Jonatan Berggren, Lucas Raymond, Elmer Soderblom, Michael Rasmussen, Filip Hronek, Ben Chiarot, Ville Husso, Moritz Seider","Robby Fabbri, Andrew Copp, Elmer Soderblom, Ben Chiarot, Ville Husso","Andrew Copp, Ben Chiarot",Andrew Copp,,6.0
Edmonton Oilers,EDM,EDM.png,20222023,44,21,west,pacific,wc,0.494,+5.85,0.911,0.088,-2,+39,-29,91949964,-9449964.0,18,1,13,15,10,13,#fc4d47,#052ca3,black,black,#3568f2,black,0.0,0.0,16,68183333.0,9,54475000,7,42725000,4,24875000,3.0,19875000.0,-9449964.0,Ken Holland,"May 7, 2019",Jay Woodcroft,"February 10, 2022",27.25,29.78,30.71,33.0,34.67,"Leon Draisaitl, Connor McDavid, Zach Hyman, Ryan Nugent-Hopkins, Kailer Yamamoto, Warren Foegele, Dylan Holloway, Darnell Nurse, Tyson Barrie, Cody Ceci, Brett Kulak, Philip Broberg, Markus Niemelainen, Jack Campbell, James Hamblin, Stuart Skinner","Leon Draisaitl, Connor McDavid, Zach Hyman, Ryan Nugent-Hopkins, Darnell Nurse, Cody Ceci, Brett Kulak, Jack Campbell, Stuart Skinner","Connor McDavid, Zach Hyman, Ryan Nugent-Hopkins, Darnell Nurse, Brett Kulak, Jack Campbell, Stuart Skinner","Zach Hyman, Ryan Nugent-Hopkins, Darnell Nurse, Jack Campbell","Zach Hyman, Ryan Nugent-Hopkins, Darnell Nurse",27.0
Florida Panthers,FLA,FLA.png,20222023,38,17,east,atlantic,none,0.524,+14.02,0.906,0.089,+9,+25,-32,87398555,-4898555.0,11,9,14,6,15,12,#3568f2,#3568f2,black,#052ca3,black,#3568f2,0.0,0.0,15,67845834.0,7,50091667,4,34000000,2,19500000,2.0,19500000.0,-4898555.0,Bill Zito,"September 2, 2020",Paul Maurice,"June 22, 2022",27.2,28.57,29.75,30.0,32.0,"Aleksander Barkov, Matthew Tkachuk, Sam Reinhart, Sam Bennett, Carter Verhaeghe, Eetu Luostarinen, Nick Cousins, Anton Lundell, Ryan Lomberg, Sergei Bobrovsky, Matt Kiersted, Spencer Knight, Gustav Forsling, Brandon Montour, Aaron Ekblad","Aleksander Barkov, Matthew Tkachuk, Sam Bennett, Carter Verhaeghe, Sergei Bobrovsky, Spencer Knight, Aaron Ekblad","Aleksander Barkov, Matthew Tkachuk, Sergei Bobrovsky, Spencer Knight","Aleksander Barkov, Matthew Tkachuk","Aleksander Barkov, Matthew Tkachuk",32.0
Los Angeles Kings,LAK,LAK.png,20222023,50,22,west,pacific,top3,0.497,+7.88,0.901,0.085,-1,+26,-37,81633488,866512.0,17,8,18,13,18,15,#fc4d47,#3568f2,#fc4d47,black,#fc4d47,black,0.0,0.0,14,63694167.0,6,38075000,5,34075000,4,28575000,2.0,12075000.0,866512.0,Rob Blake,"April 10, 2017",Todd McLellan,"April 16, 2019",28.36,30.33,31.2,32.75,32.5,"Matt Roy, Sean Walker, Sean Durzi, Drew Doughty, Quinton Byfield, Carl Grundstrom, Blake Lizotte, Trevor Moore, Alex Iafallo, Viktor Arvidsson, Adrian Kempe, Phillip Danault, Anze Kopitar, Kevin Fiala","Drew Doughty, Trevor Moore, Alex Iafallo, Adrian Kempe, Phillip Danault, Kevin Fiala","Drew Doughty, Trevor Moore, Adrian Kempe, Phillip Danault, Kevin Fiala","Drew Doughty, Trevor Moore, Phillip Danault, Kevin Fiala","Trevor Moore, Kevin Fiala",14.0
Minnesota Wild,MIN,MIN.png,20222023,46,22,west,central,top3,0.526,+4.16,0.916,0.093,+8,+26,-17,78735187,3764813.0,12,8,5,16,6,9,#3568f2,#3568f2,#052ca3,black,#052ca3,#3568f2,0.0,0.0,13,51575000.0,7,34475000,4,27825000,3,18825000,2.0,11250000.0,3764813.0,Bill Guerin,"August 21, 2019",Dean Evason,"February 14, 2020",30.69,29.71,31.0,33.0,33.0,"Kirill Kaprizov, Mats Zuccarello, Joel Eriksson Ek, Marcus Foligno, Jordan Greenway, Ryan Hartman, Connor Dewar, Jared Spurgeon, Jonas Brodin, Jacob Middleton, Alex Goligoski, Jon Merrill, Marc-Andre Fleury","Kirill Kaprizov, Joel Eriksson Ek, Jordan Greenway, Jared Spurgeon, Jonas Brodin, Jacob Middleton, Jon Merrill","Kirill Kaprizov, Joel Eriksson Ek, Jared Spurgeon, Jonas Brodin","Joel Eriksson Ek, Jared Spurgeon, Jonas Brodin","Joel Eriksson Ek, Jonas Brodin",20.0
Montreal Canadiens,MTL,MTL.png,20222023,33,15,east,atlantic,none,0.429,-28.84,0.893,0.089,-26,+12,-34,93769742,-11269742.0,25,20,16,31,21,12,red,#fc4d47,black,red,#fc4d47,#3568f2,0.0,0.0,17,53370000.0,11,41854167,4,23237500,3,19875000,1.0,7875000.0,-11269742.0,Kent Hughes,"January 18, 2022",Martin St. Louis,"February 9, 2022",27.59,28.36,28.5,31.0,29.0,"Samuel Montembeault, Jake Allen, Chris Wideman, Johnathan Kovacevic, Justin Barron, David Savard, Joel Edmundson, Juraj Slafkovsky, Jake Evans, Kirby Dach, Joel Armia, Christian Dvorak, Mike Hoffman, Josh Anderson, Brendan Gallagher, Nick Suzuki, Arber Xhekaj","Jake Allen, Johnathan Kovacevic, David Savard, Juraj Slafkovsky, Jake Evans, Kirby Dach, Joel Armia, Christian Dvorak, Josh Anderson, Brendan Gallagher, Nick Suzuki","Kirby Dach, Josh Anderson, Brendan Gallagher, Nick Suzuki","Josh Anderson, Brendan Gallagher, Nick Suzuki",Nick Suzuki,3.0
Nashville Predators,NSH,NSH.png,20222023,40,17,west,central,none,0.5,-1.45,0.924,0.082,0,+18,-24,81012398,1487602.0,16,15,11,19,2,18,black,black,#3568f2,#fc4d47,#052ca3,#fc4d47,0.0,0.0,14,68729476.0,10,61416143,7,43416143,2,17559000,2.0,17559000.0,1487602.0,David Poile,"July 9, 1997",John Hynes,"January 7, 2020",29.5,31.7,33.0,34.0,36.0,"Jeremy Lauzon, Roland McKeown, Juuse Saros, Mattias Ekholm, Roman Josi, Mikael Granlund, Nino Niederreiter, Colton Sissons, Yakov Trenin, Ryan McDonagh, Filip Forsberg, Matt Duchene, Ryan Johansen, Juuso Parssinen","Jeremy Lauzon, Juuse Saros, Mattias Ekholm, Roman Josi, Mikael Granlund, Colton Sissons, Ryan McDonagh, Filip Forsberg, Matt Duchene, Ryan Johansen","Jeremy Lauzon, Mattias Ekholm, Roman Josi, Colton Sissons, Ryan McDonagh, Filip Forsberg, Matt Duchene","Roman Josi, Filip Forsberg","Roman Josi, Filip Forsberg",10.0
New Jersey Devils,NJD,NJD.png,20222023,51,24,east,metro,top3,0.581,+29.02,0.913,0.09,+28,+18,-18,84223796,-1723796.0,3,15,6,1,9,11,#052ca3,black,#052ca3,#052ca3,#3568f2,#3568f2,0.0,0.0,10,40727501.0,7,37944167,5,33650000,5,33650000,3.0,20400000.0,-1723796.0,Tom Fitzgerald,"January 12, 2020",Lindy Ruff,"July 9, 2020",26.2,27.14,29.0,30.0,31.0,"Ondrej Palat, Nico Hischier, Jack Hughes, Alexander Holtz, Dawson Mercer, Dougie Hamilton, Jonas Siegenthaler, Brendan Smith, Nikita Okhotiuk, Vitek Vanecek","Ondrej Palat, Nico Hischier, Jack Hughes, Alexander Holtz, Dougie Hamilton, Jonas Siegenthaler, Vitek Vanecek","Ondrej Palat, Nico Hischier, Jack Hughes, Dougie Hamilton, Jonas Siegenthaler","Ondrej Palat, Nico Hischier, Jack Hughes, Dougie Hamilton, Jonas Siegenthaler","Jack Hughes, Dougie Hamilton, Jonas Siegenthaler",18.0
New York Islanders,NYI,NYI.png,20222023,46,22,east,metro,none,0.553,-8.07,0.92,0.1,+19,+15,-16,81005576,1494424.0,6,18,4,24,5,4,#052ca3,#fc4d47,#052ca3,red,#052ca3,#052ca3,0.0,0.0,17,62261667.0,10,44236667,6,30900000,3,17800000,2.0,15300000.0,1494424.0,Lou Lamoriello,"June 5, 2018",Lane Lambert,"May 16, 2022",28.82,29.0,32.0,32.0,32.5,"Mathew Barzal, Anders Lee, Brock Nelson, Josh Bailey, Anthony Beauvillier, Jean-Gabriel Pageau, Casey Cizikas, Cal Clutterbuck, Matt Martin, Ross Johnston, Aatu Raty, Noah Dobson, Alexander Romanov, Ryan Pulock, Sebastian Aho, Robin Salo, Ilya Sorokin","Mathew Barzal, Anders Lee, Brock Nelson, Jean-Gabriel Pageau, Casey Cizikas, Ross Johnston, Aatu Raty, Noah Dobson, Alexander Romanov, Ryan Pulock","Mathew Barzal, Anders Lee, Jean-Gabriel Pageau, Casey Cizikas, Ross Johnston, Ryan Pulock","Mathew Barzal, Casey Cizikas, Ryan Pulock","Mathew Barzal, Ryan Pulock",16.0
New York Rangers,NYR,NYR.png,20222023,50,22,east,metro,wc,0.533,+0.48,0.914,0.091,+11,+26,-12,81284510,1215490.0,9,8,1,18,8,10,#3568f2,#3568f2,#052ca3,#fc4d47,#3568f2,#3568f2,0.0,0.0,13,66663691.0,9,59876191,7,53409524,5,33766667,3.0,23625000.0,1215490.0,Chris Drury,"May 5, 2021",Gerard Gallant,"June 16, 2021",28.08,30.56,31.71,32.4,33.33,"Barclay Goodrow, Artemi Panarin, Mika Zibanejad, Chris Kreider, Vincent Trocheck, Jonny Brodzinski, Kaapo Kakko, Adam Fox, Jacob Trouba, Ryan Lindgren, Jimmy Vesey, Igor Shesterkin, Braden Schneider","Barclay Goodrow, Artemi Panarin, Mika Zibanejad, Chris Kreider, Vincent Trocheck, Adam Fox, Jacob Trouba, Jimmy Vesey, Igor Shesterkin","Barclay Goodrow, Artemi Panarin, Mika Zibanejad, Chris Kreider, Vincent Trocheck, Adam Fox, Jacob Trouba","Barclay Goodrow, Mika Zibanejad, Chris Kreider, Vincent Trocheck, Adam Fox","Mika Zibanejad, Vincent Trocheck, Adam Fox",12.0
Ottawa Senators,OTT,OTT.png,20222023,39,18,east,atlantic,none,0.438,+7.16,0.907,0.07,-19,+35,-18,79132602,3367398.0,23,2,6,14,14,21,#fc4d47,#052ca3,#052ca3,black,black,#fc4d47,0.0,0.0,10,45903214.0,8,44215714,5,34130714,5,34130714,3.0,24555714.0,3367398.0,Pierre Dorion,"April 10, 2016",D. J. Smith,"May 23, 2019",25.9,27.75,26.8,27.8,28.67,"Anton Forsberg, Tim Stutzle, Artem Zub, Thomas Chabot, Parker Kelly, Mark Kastelic, Jake Sanderson, Brady Tkachuk, Drake Batherson, Claude Giroux","Anton Forsberg, Tim Stutzle, Artem Zub, Thomas Chabot, Mark Kastelic, Brady Tkachuk, Drake Batherson, Claude Giroux","Tim Stutzle, Artem Zub, Thomas Chabot, Brady Tkachuk, Drake Batherson","Tim Stutzle, Artem Zub, Thomas Chabot, Brady Tkachuk, Drake Batherson","Tim Stutzle, Thomas Chabot, Brady Tkachuk",15.0
Philadelphia Flyers,PHI,PHI.png,20222023,37,15,east,metro,none,0.473,-20.52,0.91,0.084,-9,+16,-19,86586976,-4086976.0,21,17,7,28,11,16,#fc4d47,#fc4d47,#3568f2,red,#3568f2,black,0.0,0.0,14,53391024.0,8,40492857,6,28242857,3,16350000,2.0,11250000.0,-4086976.0,Chuck Fletcher,"December 3, 2018",John Tortorella,"June 17, 2022",27.14,28.88,30.5,29.33,30.0,"Carter Hart, Nick Seeler, Travis Sanheim, Anthony Deangelo, Rasmus Ristolainen, Ivan Provorov, Wade Allison, Nicolas Deslauriers, Owen Tippett, Scott Laughton, Joel Farabee, Travis Konecny, Kevin Hayes, Samuel Ersson","Travis Sanheim, Rasmus Ristolainen, Ivan Provorov, Nicolas Deslauriers, Scott Laughton, Joel Farabee, Travis Konecny, Kevin Hayes","Travis Sanheim, Rasmus Ristolainen, Nicolas Deslauriers, Scott Laughton, Joel Farabee, Kevin Hayes","Travis Sanheim, Rasmus Ristolainen, Joel Farabee","Travis Sanheim, Joel Farabee",9.0
Pittsburgh Penguins,PIT,PIT.png,20222023,44,19,east,metro,none,0.509,+11.42,0.916,0.091,+3,+22,-15,84514837,-2014837.0,15,12,3,8,6,10,black,#3568f2,#052ca3,#3568f2,#052ca3,#3568f2,0.0,0.0,14,50975175.0,7,34450175,3,16225000,2,10125000,2.0,10125000.0,-2014837.0,Ron Hextall,"February 9, 2021",Mike Sullivan,"December 12, 2015",31.07,32.86,34.67,33.5,35.5,"Bryan Rust, Jan Rutta, Rickard Rakell, Kasperi Kapanen, Jeff Carter, Brock McGinn, Marcus Pettersson, Pierre-Olivier Joseph, Chad Ruhwedel, Mark Friedman, Casey DeSmith, Evgeni Malkin, Jake Guentzel, Sidney Crosby","Bryan Rust, Jan Rutta, Rickard Rakell, Brock McGinn, Marcus Pettersson, Evgeni Malkin, Sidney Crosby","Bryan Rust, Rickard Rakell, Evgeni Malkin","Bryan Rust, Rickard Rakell","Bryan Rust, Rickard Rakell",17.0
San Jose Sharks,SJS,SJS.png,20222023,31,12,west,pacific,none,0.444,-2.87,0.88,0.1,-23,+17,-15,83018659,-518659.0,24,16,3,20,22,4,red,black,#052ca3,#fc4d47,#fc4d47,#052ca3,0.0,0.0,15,58510000.0,7,41137500,6,39137500,3,27637500,1.0,8137500.0,-518659.0,Mike Grier,"July 5, 2022",David Quinn,"July 21, 2022",29.2,31.71,33.17,35.33,35.0,"Nick Cicek, Matthew Benning, Radim Simek, Mario Ferraro, Marc-Edouard Vlasic, Erik Karlsson, Nico Sturm, Steven Lorentz, Jaycob Megna, Alexander Barabanov, Oskar Lindblom, Kevin Labanc, Logan Couture, Kaapo Kahkonen, Tomas Hertl","Matthew Benning, Mario Ferraro, Marc-Edouard Vlasic, Erik Karlsson, Nico Sturm, Logan Couture, Tomas Hertl","Matthew Benning, Mario Ferraro, Marc-Edouard Vlasic, Erik Karlsson, Logan Couture, Tomas Hertl","Erik Karlsson, Logan Couture, Tomas Hertl",Tomas Hertl,13.0
St. Louis Blues,STL,STL.png,20222023,41,19,west,central,none,0.451,-18.52,0.898,0.095,-19,+21,-22,85745513,-3245513.0,23,13,10,27,19,7,#fc4d47,black,#3568f2,red,#fc4d47,#3568f2,0.0,0.0,14,60190000.0,10,56885833,8,50250000,6,41750000,4.0,29250000.0,-3245513.0,Doug Armstrong,"July 1, 2010",Craig Berube,"November 19, 2018",28.5,29.4,31.38,31.67,32.75,"Pavel Buchnevich, Brayden Schenn, Brandon Saad, Jordan Kyrou, Robert Thomas, Jake Neighbours, Nikita Alexandrov, Nathan Walker, Justin Faulk, Colton Parayko, Nick Leddy, Robert Bortuzzo, Calle Rosen, Jordan Binnington","Pavel Buchnevich, Brayden Schenn, Brandon Saad, Jordan Kyrou, Robert Thomas, Jake Neighbours, Justin Faulk, Colton Parayko, Nick Leddy, Jordan Binnington","Brayden Schenn, Brandon Saad, Jordan Kyrou, Robert Thomas, Justin Faulk, Colton Parayko, Nick Leddy, Jordan Binnington","Brayden Schenn, Jordan Kyrou, Robert Thomas, Justin Faulk, Colton Parayko, Jordan Binnington","Brayden Schenn, Jordan Kyrou, Robert Thomas, Colton Parayko",21.0
Tampa Bay Lightning,TBL,TBL.png,20222023,49,24,east,atlantic,top3,0.53,+11.19,0.913,0.094,+10,+26,-20,89878585,-7378585.0,10,8,8,9,9,8,#3568f2,#3568f2,#3568f2,#3568f2,#3568f2,#3568f2,0.0,0.0,14,73212500.0,9,60600000,7,51600000,7,51600000,6.0,42100000.0,-7378585.0,Julien BriseBois,"September 11, 2018",Jon Cooper,"March 25, 2013",28.71,28.67,29.29,30.29,31.83,"Steven Stamkos, Andrei Vasilevskiy, Haydn Fleury, Nick Perbix, Zach Bogosian, Mikhail Sergachev, Victor Hedman, Patrick Maroon, Nikita Kucherov, Brayden Point, Anthony Cirelli, Erik Cernak, Nicholas Paul, Brandon Hagel","Andrei Vasilevskiy, Nick Perbix, Mikhail Sergachev, Victor Hedman, Nikita Kucherov, Brayden Point, Anthony Cirelli, Erik Cernak, Nicholas Paul","Andrei Vasilevskiy, Mikhail Sergachev, Nikita Kucherov, Brayden Point, Anthony Cirelli, Erik Cernak, Nicholas Paul","Andrei Vasilevskiy, Mikhail Sergachev, Nikita Kucherov, Brayden Point, Anthony Cirelli, Erik Cernak, Nicholas Paul","Andrei Vasilevskiy, Mikhail Sergachev, Brayden Point, Anthony Cirelli, Erik Cernak, Nicholas Paul",31.0
Toronto Maple Leafs,TOR,TOR.png,20222023,53,23,east,atlantic,top3,0.58,+16.57,0.921,0.097,+26,+28,-21,88091438,-5591438.0,4,6,9,5,4,6,#052ca3,#052ca3,#3568f2,#052ca3,#052ca3,#052ca3,0.0,0.0,11,63393116.0,4,31503000,2,9600000,1,7500000,1.0,7500000.0,-5591438.0,Kyle Dubas,"May 11, 2018",Sheldon Keefe,"November 20, 2019",29.27,31.0,32.5,32.0,34.0,"William Nylander, Mark Giordano, Rasmus Sandin, Timothy Liljegren, TJ Brodie, Morgan Rielly, Calle Jarnkrok, Matt Murray, John Tavares, Auston Matthews, Mitchell Marner","Morgan Rielly, Calle Jarnkrok, John Tavares, Mitchell Marner","Morgan Rielly, Calle Jarnkrok",Morgan Rielly,Morgan Rielly,28.0
Vancouver Canucks,VAN,VAN.png,20222023,37,17,west,pacific,none,0.478,-17.4,0.904,0.1,-8,+23,-32,87221546,-4721546.0,20,11,14,26,16,4,#fc4d47,#3568f2,black,red,black,#052ca3,0.0,0.0,14,58272500.0,7,40460000,5,32810000,3,23110000,1.0,8000000.0,-4721546.0,Patrik Allvin,"January 26, 2022",Bruce Boudreau,"December 5, 2021",27.64,29.0,30.4,31.67,35.0,"Riley Stillman, Brock Boeser, J.T. Miller, Conor Garland, Ilya Mikheyev, Curtis Lazar, Dakota Joshua, Jack Studnicka, Sheldon Dries, Quinn Hughes, Oliver Ekman-Larsson, Tyler Myers, Spencer Martin, Elias Pettersson","Brock Boeser, J.T. Miller, Conor Garland, Ilya Mikheyev, Curtis Lazar, Quinn Hughes, Oliver Ekman-Larsson","J.T. Miller, Conor Garland, Ilya Mikheyev, Quinn Hughes, Oliver Ekman-Larsson","J.T. Miller, Quinn Hughes, Oliver Ekman-Larsson",J.T. Miller,19.0
Vegas Golden Knights,VGK,VGK.png,20222023,56,27,west,pacific,top3,0.511,+17.39,0.913,0.086,+4,+27,-13,97731798,-15231798.0,14,7,2,4,9,14,black,#3568f2,#052ca3,#052ca3,#3568f2,black,0.0,0.0,18,62777484.0,13,56252484,6,37975000,4,27200000,0.0,0.0,-15231798.0,Kelly McCrimmon,"September 1, 2019",Bruce Cassidy,"June 14, 2022",28.06,29.0,30.5,33.0,,"Logan Thompson, Daniil Miromanov, Ben Hutton, Nicolas Hague, Brayden McNabb, Shea Theodore, Alex Pietrangelo, Paul Cotter, Michael Amadio, Jake Leschyshyn, Keegan Kolesar, William Carrier, Chandler Stephenson, Nicolas Roy, Reilly Smith, William Karlsson, Mark Stone, Jack Eichel","Logan Thompson, Nicolas Hague, Brayden McNabb, Shea Theodore, Alex Pietrangelo, Paul Cotter, Jake Leschyshyn, Keegan Kolesar, Nicolas Roy, Reilly Smith, William Karlsson, Mark Stone, Jack Eichel","Alex Pietrangelo, Paul Cotter, Nicolas Roy, William Karlsson, Mark Stone, Jack Eichel","Alex Pietrangelo, Nicolas Roy, William Karlsson, Mark Stone",,22.0
Washington Capitals,WSH,WSH.png,20222023,50,22,east,metro,wc,0.539,+10.95,0.916,0.093,+14,+24,-17,91691832,-9191832.0,7,10,5,10,6,9,#3568f2,#3568f2,#052ca3,#3568f2,#052ca3,#3568f2,0.0,0.0,9,37989167.0,6,30700000,2,14750000,1,5250000,0.0,0.0,-9191832.0,Brian MacLellan,"May 26, 2014",Peter Laviolette,"September 15, 2020",31.33,34.67,37.5,36.0,,"Charlie Lindgren, Darcy Kuemper, Aliaksei Protas, Joe Snively, Nic Dowd, Anthony Mantha, T.J. Oshie, Alex Ovechkin, Evgeny Kuznetsov","Charlie Lindgren, Darcy Kuemper, Nic Dowd, T.J. Oshie, Alex Ovechkin, Evgeny Kuznetsov","Darcy Kuemper, Alex Ovechkin",Darcy Kuemper,,25.0
