full,team,logo,season,PTS,W,Conference,Division,playoffs,gf%,xg_dif,sv%,shooting%,g_dif,PP_g_dif,PK_g_dif,projected_cap_hit,projected_cap_space,5on5_rank,PP_rank,PK_rank,XG_dif_rank,Save%_rank,Shooting%_rank,5on5_color,PP_color,PK_color,xg_color,sv_color,sh_color,expiring_contracts,expiring_salary,nhl_contracts_2324,2023-24 Salary,nhl_contracts_2425,2024-25 Salary,nhl_contracts_2526,2025-26 Salary,nhl_contracts_2627,2026-27 Salary,nhl_contracts_2728,2027-28 Salary,cap_remaining,GM,gm_start,coach,coach_start,avg_age_2324,avg_age_2425,avg_age_2526,avg_age_2627,avg_age_2728,players_under_contract_2324,players_under_contract_2425,players_under_contract_2526,players_under_contract_2627,players_under_contract_2728,draft_capital_rank
Anaheim Ducks,ANA,ANA.png,20222023,56,23,west,pacific,none,0.394,-67.68,0.908,0.084,-76,+27,-66,68669478,13830522.0,29,20,25,32,12,16,red,#fc4d47,red,red,#3568f2,black,0.0,0.0,13,36851667.0,6,25194167,3,17900000,2,11400000,0.0,0.0,13830522.0,Pat Verbeek,"February 3, 2022",Dallas Eakins,"June 17, 2019",27.69,29.83,32.67,33.0,,"Max Jones, John Gibson, Colton White, Cam Fowler, Brett Leason, Sam Carrick, Mason McTavish, Jakob Silfverberg, Nikita Nesterenko, Isac Lundestrom, Brock McGinn, Frank Vatrano, Ryan Strome","John Gibson, Cam Fowler, Mason McTavish, Brock McGinn, Frank Vatrano, Ryan Strome","John Gibson, Cam Fowler, Ryan Strome","John Gibson, Ryan Strome",,7.0
Arizona Coyotes,ARI,ARI.png,20222023,67,27,west,central,none,0.471,-45.95,0.913,0.1,-19,+36,-64,66868138,15631862.0,22,14,24,29,8,3,#fc4d47,black,red,red,#3568f2,#052ca3,0.0,0.0,13,34050000.0,4,20025000,3,17300000,2,11450000,1.0,7150000.0,15631862.0,Bill Armstrong,"September 17, 2020",Andre Tourigny,"July 1, 2021",27.23,27.5,28.33,28.5,30.0,"Clayton Keller, Lawson Crouse, Zack Kassian, Barrett Hayton, Travis Boyd, Liam O'Brien, Patrik Nemeth, Juuso Valimaki, Joshua Brown, J.J. Moser, Victor Soderstrom, Karel Vejmelka, Nick Schmaltz","Clayton Keller, Lawson Crouse, Karel Vejmelka, Nick Schmaltz","Clayton Keller, Lawson Crouse, Nick Schmaltz","Clayton Keller, Lawson Crouse",Clayton Keller,1.0
Boston Bruins,BOS,BOS.png,20222023,121,58,east,atlantic,top3,0.644,+26.5,0.937,0.105,+89,+43,-25,84062543,-1562543.0,1,9,2,6,1,2,#052ca3,#3568f2,#052ca3,#052ca3,#052ca3,#052ca3,0.0,0.0,13,65062500.0,8,52475000,6,41350000,5,36100000,3.0,27250000.0,-1562543.0,Don Sweeney,"May 20, 2015",Jim Montgomery,"July 1, 2022",28.92,30.12,30.0,30.2,32.67,"David Pastrnak, Brad Marchand, Charlie Coyle, Jake DeBrusk, Pavel Zacha, AJ Greer, Charlie McAvoy, Hampus Lindholm, Brandon Carlo, Matt Grzelcyk, Derek Forbort, Jakub Zboril, Linus Ullmark","David Pastrnak, Brad Marchand, Charlie Coyle, Pavel Zacha, Charlie McAvoy, Hampus Lindholm, Brandon Carlo, Linus Ullmark","David Pastrnak, Charlie Coyle, Pavel Zacha, Charlie McAvoy, Hampus Lindholm, Brandon Carlo","David Pastrnak, Pavel Zacha, Charlie McAvoy, Hampus Lindholm, Brandon Carlo","David Pastrnak, Charlie McAvoy, Hampus Lindholm",31.0
Buffalo Sabres,BUF,BUF.png,20222023,79,36,east,atlantic,none,0.481,-11.47,0.896,0.099,-15,+46,-45,65395356,17104644.0,19,7,19,23,20,4,#fc4d47,#3568f2,#fc4d47,#fc4d47,#fc4d47,#052ca3,0.0,0.0,20,64040237.0,9,37922737,5,32278571,4,27528571,3.0,18528571.0,17104644.0,Kevyn Adams,"June 16, 2020",Don Granato,"March 17, 2021",25.1,25.89,28.2,29.0,29.33,"Peyton Krebs, Jack Quinn, Casey Mittelstadt, Jordan Greenway, Victor Olofsson, Alex Tuch, Jeff Skinner, John-Jason Peterka, Rasmus Dahlin, Ilya Lyubushkin, Henri Jokiharju, Jacob Bryson, Riley Stillman, Mattias Samuelsson, Owen Power, Eric Comrie, Devon Levi, Ukko-Pekka Luukkonen, Tage Thompson, Dylan Cozens","Jack Quinn, Jordan Greenway, Alex Tuch, Jeff Skinner, John-Jason Peterka, Mattias Samuelsson, Devon Levi, Tage Thompson, Dylan Cozens","Alex Tuch, Jeff Skinner, Mattias Samuelsson, Tage Thompson, Dylan Cozens","Jeff Skinner, Mattias Samuelsson, Tage Thompson, Dylan Cozens","Mattias Samuelsson, Tage Thompson, Dylan Cozens",14.0
Calgary Flames,CGY,CGY.png,20222023,85,35,west,pacific,none,0.516,+31.35,0.896,0.084,+11,+42,-32,82280221,219779.0,15,10,9,3,20,16,black,#3568f2,#3568f2,#052ca3,#fc4d47,black,0.0,0.0,19,80463333.0,9,48125000,6,39200000,4,28650000,3.0,23750000.0,219779.0,Brad Treliving,"April 28, 2014",Darryl Sutter,"March 4, 2021",28.58,29.89,33.0,34.25,36.0,"Andrew Mangiapane, Mikael Backlund, Jonathan Huberdeau, Daniel Vladar, Nazem Kadri, Blake Coleman, Elias Lindholm, Tyler Toffoli, Dillon Dube, Matthew Coronato, Jakob Pelletier, Noah Hanifin, Rasmus Andersson, Christopher Tanev, Nikita Zadorov, MacKenzie Weegar, Dennis Gilbert, Jacob Markstrom, Adam Ruzicka","Andrew Mangiapane, Jonathan Huberdeau, Daniel Vladar, Nazem Kadri, Blake Coleman, Matthew Coronato, Rasmus Andersson, MacKenzie Weegar, Jacob Markstrom","Jonathan Huberdeau, Nazem Kadri, Blake Coleman, Rasmus Andersson, MacKenzie Weegar, Jacob Markstrom","Jonathan Huberdeau, Nazem Kadri, Blake Coleman, MacKenzie Weegar","Jonathan Huberdeau, Nazem Kadri, MacKenzie Weegar",18.0
Carolina Hurricanes,CAR,CAR.png,20222023,103,47,east,metro,top3,0.548,+56.2,0.907,0.083,+30,+37,-24,87703858,-5203858.0,7,13,1,1,13,17,#3568f2,black,#052ca3,#052ca3,black,#fc4d47,0.0,0.0,13,46679417.0,3,15400000,1,4820000,1,4820000,1.0,4820000.0,-5203858.0,Don Waddell,"May 8, 2018",Rod Brind'Amour,"May 8, 2018",28.08,31.33,25.0,26.0,28.0,"Jack Drury, Jalen Chatfield, Brett Pesce, Brady Skjei, Brent Burns, Jaccob Slavin, Stefan Noesen, Seth Jarvis, Jordan Martinook, Martin Necas, Jesperi Kotkaniemi, Teuvo Teravainen, Sebastian Aho","Brent Burns, Jaccob Slavin, Jesperi Kotkaniemi",Jesperi Kotkaniemi,Jesperi Kotkaniemi,Jesperi Kotkaniemi,13.0
Chicago Blackhawks,CHI,CHI.png,20222023,54,24,west,central,none,0.388,-56.45,0.902,0.082,-75,+25,-41,77417555,5082445.0,28,21,15,31,15,18,red,#fc4d47,black,red,black,#fc4d47,0.0,0.0,15,37875000.0,3,14816667,2,13900000,1,9500000,1.0,9500000.0,5082445.0,Kyle Davidson,"October 26, 2021",Luke Richardson,"June 27, 2022",26.93,28.0,32.0,32.0,34.0,"Tyler Johnson, Jason Dickinson, Colin Blackwell, Cole Guttman, Lukas Reichel, Mackenzie Entwistle, Reese Johnson, Boris Katchouk, Taylor Raddysh, Seth Jones, Nikita Zaitsev, Connor Murphy, Wyatt Kaiser, Alex Vlasic, Petr Mrazek","Seth Jones, Connor Murphy, Wyatt Kaiser","Seth Jones, Connor Murphy",Seth Jones,Seth Jones,2.0
Colorado Avalanche,COL,COL.png,20222023,94,44,west,central,top3,0.528,+10.71,0.922,0.083,+17,+49,-38,83913150,-1413150.0,12,5,12,14,3,17,#3568f2,#052ca3,#3568f2,black,#052ca3,#fc4d47,0.0,0.0,13,63275000.0,9,55425000,6,41725000,5,37225000,2.0,18725000.0,-1413150.0,Chris MacFarland,"July 11, 2022",Jared Bednar,"August 25, 2016",29.0,28.67,29.83,30.0,33.5,"Mikko Rantanen, Alexandar Georgiev, Nathan MacKinnon, Valeri Nichushkin, Artturi Lehkonen, Pavel Francouz, Logan O'Connor, Kurtis MacDermid, Devon Toews, Brad Hunt, Samuel Girard, Cale Makar, Josh Manson","Mikko Rantanen, Alexandar Georgiev, Nathan MacKinnon, Valeri Nichushkin, Artturi Lehkonen, Logan O'Connor, Samuel Girard, Cale Makar, Josh Manson","Nathan MacKinnon, Valeri Nichushkin, Artturi Lehkonen, Samuel Girard, Cale Makar, Josh Manson","Nathan MacKinnon, Valeri Nichushkin, Artturi Lehkonen, Samuel Girard, Cale Makar","Nathan MacKinnon, Valeri Nichushkin",26.0
Columbus Blue Jackets,CBJ,CBJ.png,20222023,54,23,east,metro,none,0.401,-35.64,0.897,0.083,-73,+28,-42,81641643,858357.0,27,19,16,27,19,17,red,#fc4d47,black,red,#fc4d47,#fc4d47,0.0,0.0,16,50337500.0,9,40400000,6,34350000,2,15150000,1.0,9750000.0,858357.0,Jarmo Kekalainen,"February 13, 2013",Brad Larsen,"June 10, 2021",26.19,28.44,30.67,32.5,35.0,"Erik Gudbranson, Adam Boqvist, Andrew Peeke, Elvis Merzlikins, Nick Blankenburg, Liam Foudy, Emil Bemstrom, Kirill Marchenko, Kent Johnson, Hunter McKown, Eric Robinson, Sean Kuraly, Boone Jenner, Jack Roslovic, Johnny Gaudreau, Patrik Laine","Erik Gudbranson, Adam Boqvist, Andrew Peeke, Elvis Merzlikins, Hunter McKown, Sean Kuraly, Boone Jenner, Johnny Gaudreau, Patrik Laine","Erik Gudbranson, Andrew Peeke, Elvis Merzlikins, Boone Jenner, Johnny Gaudreau, Patrik Laine","Elvis Merzlikins, Johnny Gaudreau",Johnny Gaudreau,8.0
Dallas Stars,DAL,DAL.png,20222023,96,41,west,central,top3,0.558,+22.95,0.918,0.1,+39,+48,-27,82370144,129856.0,5,6,4,9,6,3,#052ca3,#052ca3,#052ca3,#3568f2,#052ca3,#052ca3,0.0,0.0,15,73869167.0,11,66094167,5,39000000,3,26750000,2.0,16900000.0,129856.0,Jim Nill,"April 29, 2013",Peter DeBoer,"June 21, 2022",29.13,29.36,29.0,30.67,30.5,"Colin Miller, Jake Oettinger, Nils Lundkvist, Jani Hakanpaa, Ryan Suter, Miro Heiskanen, Wyatt Johnston, Roope Hintz, Radek Faksa, Mason Marchment, Esa Lindell, Jamie Benn, Joe Pavelski, Tyler Seguin, Jason Robertson","Jake Oettinger, Ryan Suter, Miro Heiskanen, Wyatt Johnston, Roope Hintz, Radek Faksa, Mason Marchment, Esa Lindell, Jamie Benn, Tyler Seguin, Jason Robertson","Miro Heiskanen, Roope Hintz, Mason Marchment, Tyler Seguin, Jason Robertson","Miro Heiskanen, Roope Hintz, Tyler Seguin","Miro Heiskanen, Roope Hintz",25.0
Detroit Red Wings,DET,DET.png,20222023,75,33,east,atlantic,none,0.467,-11.09,0.902,0.094,-22,+37,-39,74476966,8023034.0,23,13,13,22,15,8,#fc4d47,black,black,#fc4d47,black,#3568f2,0.0,0.0,16,48650833.0,10,37925000,4,22475000,2,14325000,1.0,8700000.0,8023034.0,Steve Yzerman,"April 19, 2019",Derek Lalonde,"June 30, 2022",26.69,27.6,31.0,31.0,32.0,"David Perron, Robby Fabbri, Andrew Copp, Dylan Larkin, Dominik Kubalik, Filip Zadina, Marco Kasper, Jonatan Berggren, Austin Czarnik, Lucas Raymond, Ben Chiarot, Olli Maatta, Jake Walman, Simon Edvinsson, Ville Husso, Moritz Seider","Robby Fabbri, Andrew Copp, Dylan Larkin, Filip Zadina, Marco Kasper, Ben Chiarot, Olli Maatta, Jake Walman, Simon Edvinsson, Ville Husso","Andrew Copp, Dylan Larkin, Ben Chiarot, Jake Walman","Andrew Copp, Dylan Larkin",Dylan Larkin,4.0
Edmonton Oilers,EDM,EDM.png,20222023,97,44,west,pacific,top3,0.527,+30.16,0.909,0.098,+20,+72,-43,90961396,-8461396.0,9,1,17,4,11,5,#3568f2,#052ca3,#fc4d47,#052ca3,#3568f2,#052ca3,0.0,0.0,15,73075833.0,11,65600000,9,53850000,4,24875000,3.0,19875000.0,-8461396.0,Ken Holland,"May 7, 2019",Jay Woodcroft,"February 10, 2022",28.6,30.73,31.89,33.5,35.0,"Kailer Yamamoto, Connor McDavid, Leon Draisaitl, Zach Hyman, Ryan Nugent-Hopkins, Evander Kane, Warren Foegele, Darnell Nurse, Mattias Ekholm, Cody Ceci, Brett Kulak, Philip Broberg, Vincent Desharnais, Jack Campbell, Stuart Skinner","Connor McDavid, Leon Draisaitl, Zach Hyman, Ryan Nugent-Hopkins, Evander Kane, Darnell Nurse, Mattias Ekholm, Cody Ceci, Brett Kulak, Jack Campbell, Stuart Skinner","Connor McDavid, Zach Hyman, Ryan Nugent-Hopkins, Evander Kane, Darnell Nurse, Mattias Ekholm, Brett Kulak, Jack Campbell, Stuart Skinner","Zach Hyman, Ryan Nugent-Hopkins, Darnell Nurse, Jack Campbell","Zach Hyman, Ryan Nugent-Hopkins, Darnell Nurse",27.0
Florida Panthers,FLA,FLA.png,20222023,83,38,east,atlantic,none,0.524,+23.61,0.906,0.089,+18,+48,-56,87398420,-4898420.0,11,6,22,8,14,12,#3568f2,#052ca3,#fc4d47,#3568f2,black,#3568f2,0.0,0.0,15,66508334.0,6,45591667,3,29500000,2,19500000,2.0,19500000.0,-4898420.0,Bill Zito,"September 2, 2020",Paul Maurice,"June 22, 2022",27.67,29.67,31.67,30.0,32.0,"Sergei Bobrovsky, Aleksander Barkov, Matthew Tkachuk, Sam Reinhart, Sam Bennett, Carter Verhaeghe, Anthony Duclair, Eetu Luostarinen, Nick Cousins, Ryan Lomberg, Aaron Ekblad, Brandon Montour, Gustav Forsling, Anton Lundell, Josh Mahura","Sergei Bobrovsky, Aleksander Barkov, Matthew Tkachuk, Sam Bennett, Carter Verhaeghe, Aaron Ekblad","Sergei Bobrovsky, Aleksander Barkov, Matthew Tkachuk","Aleksander Barkov, Matthew Tkachuk","Aleksander Barkov, Matthew Tkachuk",30.0
Los Angeles Kings,LAK,LAK.png,20222023,96,43,west,pacific,top3,0.522,+21.67,0.901,0.09,+15,+50,-49,81124330,1375670.0,13,4,21,10,16,11,black,#052ca3,#fc4d47,#3568f2,black,#3568f2,0.0,0.0,17,70213334.0,7,42200000,6,38200000,5,32700000,3.0,16200000.0,1375670.0,Rob Blake,"April 10, 2017",Todd McLellan,"April 16, 2019",28.12,29.86,30.67,32.0,31.67,"Sean Durzi, Michael Anderson, Sean Walker, Pheonix Copley, Arthur Kaliyev, Drew Doughty, Quinton Byfield, Carl Grundstrom, Blake Lizotte, Trevor Moore, Alex Iafallo, Viktor Arvidsson, Matt Roy, Kevin Fiala, Anze Kopitar, Adrian Kempe, Phillip Danault","Michael Anderson, Drew Doughty, Trevor Moore, Alex Iafallo, Kevin Fiala, Adrian Kempe, Phillip Danault","Michael Anderson, Drew Doughty, Trevor Moore, Kevin Fiala, Adrian Kempe, Phillip Danault","Michael Anderson, Drew Doughty, Trevor Moore, Kevin Fiala, Phillip Danault","Michael Anderson, Trevor Moore, Kevin Fiala",21.0
Minnesota Wild,MIN,MIN.png,20222023,97,44,west,central,top3,0.522,+4.28,0.924,0.085,+13,+44,-31,81450475,1049525.0,14,8,8,17,2,15,black,#3568f2,#3568f2,#fc4d47,#052ca3,black,0.0,0.0,13,55575000.0,7,38475000,5,34825000,4,25825000,3.0,18250000.0,1049525.0,Bill Guerin,"August 21, 2019",Dean Evason,"February 14, 2020",30.54,29.43,29.8,31.25,31.33,"Kirill Kaprizov, Mats Zuccarello, Joel Eriksson Ek, Marcus Foligno, Ryan Hartman, Matthew Boldy, Connor Dewar, Jared Spurgeon, Jonas Brodin, Jacob Middleton, Alex Goligoski, Jon Merrill, Marc-Andre Fleury","Kirill Kaprizov, Joel Eriksson Ek, Matthew Boldy, Jared Spurgeon, Jonas Brodin, Jacob Middleton, Jon Merrill","Kirill Kaprizov, Joel Eriksson Ek, Matthew Boldy, Jared Spurgeon, Jonas Brodin","Joel Eriksson Ek, Matthew Boldy, Jared Spurgeon, Jonas Brodin","Joel Eriksson Ek, Matthew Boldy, Jonas Brodin",16.0
Montreal Canadiens,MTL,MTL.png,20222023,66,30,east,atlantic,none,0.451,-50.28,0.898,0.098,-36,+30,-61,95798918,-13298918.0,25,17,23,30,18,5,red,#fc4d47,#fc4d47,red,#fc4d47,#052ca3,0.0,0.0,20,60727500.0,14,48940000,5,28112500,3,19875000,1.0,7875000.0,-13298918.0,Kent Hughes,"January 18, 2022",Martin St. Louis,"February 9, 2022",27.7,28.21,29.4,31.0,29.0,"Samuel Montembeault, Jake Allen, Chris Wideman, Johnathan Kovacevic, Jordan Harris, Kaiden Guhle, Justin Barron, David Savard, Joel Edmundson, Michael Matheson, Sean Farrell, Rem Pitlick, Jake Evans, Kirby Dach, Joel Armia, Christian Dvorak, Mike Hoffman, Josh Anderson, Nick Suzuki, Brendan Gallagher","Jake Allen, Johnathan Kovacevic, Jordan Harris, Kaiden Guhle, David Savard, Michael Matheson, Sean Farrell, Jake Evans, Kirby Dach, Joel Armia, Christian Dvorak, Josh Anderson, Nick Suzuki, Brendan Gallagher","Michael Matheson, Kirby Dach, Josh Anderson, Nick Suzuki, Brendan Gallagher","Josh Anderson, Nick Suzuki, Brendan Gallagher",Nick Suzuki,5.0
Nashville Predators,NSH,NSH.png,20222023,82,37,west,central,none,0.497,-12.58,0.92,0.087,-2,+31,-40,79318119,3181881.0,16,16,14,24,5,13,black,black,black,red,#052ca3,black,0.0,0.0,16,56430309.0,7,41666143,5,28666143,1,9059000,1.0,9059000.0,3181881.0,David Poile,"July 9, 1997",John Hynes,"January 7, 2020",28.44,31.71,33.2,36.0,38.0,"Matt Duchene, Ryan Johansen, Colton Sissons, Philip Tomasino, Juuso Parssinen, Thomas Novak, Cole Smith, Mark Jankowski, Roman Josi, Ryan McDonagh, Tyson Barrie, Dante Fabbro, Jeremy Lauzon, Juuse Saros, Kevin Lankinen, Yakov Trenin","Matt Duchene, Ryan Johansen, Colton Sissons, Roman Josi, Ryan McDonagh, Jeremy Lauzon, Juuse Saros","Matt Duchene, Colton Sissons, Roman Josi, Ryan McDonagh, Jeremy Lauzon",Roman Josi,Roman Josi,3.0
New Jersey Devils,NJD,NJD.png,20222023,102,47,east,metro,top3,0.568,+51.31,0.913,0.092,+47,+29,-28,83676053,-1176053.0,2,18,5,2,8,10,#052ca3,#fc4d47,#052ca3,#052ca3,#3568f2,#3568f2,0.0,0.0,10,44444167.0,8,42450000,6,38050000,6,38050000,3.0,20400000.0,-1176053.0,Tom Fitzgerald,"January 12, 2020",Lindy Ruff,"July 9, 2020",27.6,28.38,29.0,30.0,31.0,"Curtis Lazar, Dawson Mercer, Dougie Hamilton, John Marino, Jonas Siegenthaler, Brendan Smith, Vitek Vanecek, Nico Hischier, Ondrej Palat, Jack Hughes","Curtis Lazar, Dougie Hamilton, John Marino, Jonas Siegenthaler, Vitek Vanecek, Nico Hischier, Ondrej Palat, Jack Hughes","Dougie Hamilton, John Marino, Jonas Siegenthaler, Nico Hischier, Ondrej Palat, Jack Hughes","Dougie Hamilton, John Marino, Jonas Siegenthaler, Nico Hischier, Ondrej Palat, Jack Hughes","Dougie Hamilton, Jonas Siegenthaler, Jack Hughes",23.0
New York Islanders,NYI,NYI.png,20222023,87,39,east,metro,wc,0.539,-5.19,0.921,0.094,+26,+24,-26,81117864,1382136.0,8,22,3,21,4,8,#3568f2,#fc4d47,#052ca3,#fc4d47,#052ca3,#3568f2,0.0,0.0,18,76588333.0,12,62650000,8,45150000,5,32050000,4.0,29550000.0,1382136.0,Lou Lamoriello,"June 5, 2018",Lane Lambert,"May 16, 2022",29.67,30.33,31.88,32.0,33.0,"Sebastian Aho, Alexander Romanov, Noah Dobson, Adam Pelech, Ryan Pulock, Simon Holmstrom, Ross Johnston, Cal Clutterbuck, Casey Cizikas, Bo Horvat, Kyle Palmieri, Jean-Gabriel Pageau, Josh Bailey, Brock Nelson, Anders Lee, Mathew Barzal, Matt Martin, Ilya Sorokin","Alexander Romanov, Noah Dobson, Adam Pelech, Ryan Pulock, Ross Johnston, Casey Cizikas, Bo Horvat, Kyle Palmieri, Jean-Gabriel Pageau, Brock Nelson, Anders Lee, Mathew Barzal","Adam Pelech, Ryan Pulock, Ross Johnston, Casey Cizikas, Bo Horvat, Jean-Gabriel Pageau, Anders Lee, Mathew Barzal","Adam Pelech, Ryan Pulock, Casey Cizikas, Bo Horvat, Mathew Barzal","Adam Pelech, Ryan Pulock, Bo Horvat, Mathew Barzal",22.0
New York Rangers,NYR,NYR.png,20222023,99,44,east,metro,top3,0.548,-1.94,0.918,0.097,+32,+41,-25,82498392,1608.0,6,11,2,19,6,6,#052ca3,#3568f2,#052ca3,#fc4d47,#052ca3,#052ca3,0.0,0.0,14,71126191.0,11,65101191,8,57847024,6,38204167,3.0,23625000.0,1608.0,Chris Drury,"May 5, 2021",Gerard Gallant,"June 16, 2021",28.07,30.27,31.38,31.83,33.67,"Vincent Trocheck, Artemi Panarin, Mika Zibanejad, Chris Kreider, Ryan Lindgren, Barclay Goodrow, Kaapo Kakko, Jimmy Vesey, Adam Fox, Jacob Trouba, Filip Chytil, Ben Harpur, Braden Schneider, Igor Shesterkin","Vincent Trocheck, Artemi Panarin, Mika Zibanejad, Chris Kreider, Barclay Goodrow, Jimmy Vesey, Adam Fox, Jacob Trouba, Filip Chytil, Ben Harpur, Igor Shesterkin","Vincent Trocheck, Artemi Panarin, Mika Zibanejad, Chris Kreider, Barclay Goodrow, Adam Fox, Jacob Trouba, Filip Chytil","Vincent Trocheck, Mika Zibanejad, Chris Kreider, Barclay Goodrow, Adam Fox, Filip Chytil","Vincent Trocheck, Mika Zibanejad, Adam Fox",24.0
Ottawa Senators,OTT,OTT.png,20222023,79,37,east,atlantic,none,0.458,+9.69,0.901,0.08,-28,+56,-36,79149728,3350272.0,24,2,11,15,16,20,red,#052ca3,#3568f2,black,black,#fc4d47,0.0,0.0,13,52483214.0,11,50795714,6,37080714,5,34130714,3.0,24555714.0,3350272.0,Pierre Dorion,"April 10, 2016",D. J. Smith,"May 23, 2019",25.23,26.73,27.5,28.2,29.33,"Tyler Kleven, Jake Sanderson, Ridly Greig, Artem Zub, Jakob Chychrun, Thomas Chabot, Parker Kelly, Mark Kastelic, Tim Stutzle, Brady Tkachuk, Claude Giroux, Drake Batherson, Mathieu Joseph","Tyler Kleven, Ridly Greig, Artem Zub, Jakob Chychrun, Thomas Chabot, Mark Kastelic, Tim Stutzle, Brady Tkachuk, Claude Giroux, Drake Batherson, Mathieu Joseph","Artem Zub, Thomas Chabot, Tim Stutzle, Brady Tkachuk, Drake Batherson, Mathieu Joseph","Artem Zub, Thomas Chabot, Tim Stutzle, Brady Tkachuk, Drake Batherson","Thomas Chabot, Tim Stutzle, Brady Tkachuk",28.0
Philadelphia Flyers,PHI,PHI.png,20222023,71,29,east,metro,none,0.476,-23.57,0.911,0.086,-15,+24,-40,86395444,-3895444.0,19,22,14,26,10,14,#fc4d47,#fc4d47,black,red,#3568f2,black,0.0,0.0,15,54069357.0,8,40492857,6,28242857,3,16350000,2.0,11250000.0,-3895444.0,Daniel Briere (interim),"March 10, 2023",John Tortorella,"June 17, 2022",27.67,29.5,31.0,30.0,31.0,"Ivan Provorov, Tanner Laczynski, Wade Allison, Owen Tippett, Nicolas Deslauriers, Joel Farabee, Travis Konecny, Kevin Hayes, Rasmus Ristolainen, Scott Laughton, Anthony Deangelo, Travis Sanheim, Nick Seeler, Carter Hart, Felix Sandstrom","Ivan Provorov, Nicolas Deslauriers, Joel Farabee, Travis Konecny, Kevin Hayes, Rasmus Ristolainen, Scott Laughton, Travis Sanheim","Nicolas Deslauriers, Joel Farabee, Kevin Hayes, Rasmus Ristolainen, Scott Laughton, Travis Sanheim","Joel Farabee, Rasmus Ristolainen, Travis Sanheim","Joel Farabee, Travis Sanheim",11.0
Pittsburgh Penguins,PIT,PIT.png,20222023,84,37,east,metro,wc,0.494,+26.89,0.911,0.081,-4,+41,-43,83789824,-1289824.0,17,11,17,5,10,19,#fc4d47,#3568f2,#fc4d47,#052ca3,#3568f2,#fc4d47,0.0,0.0,13,57575000.0,8,45025000,4,22325000,3,16225000,3.0,16225000.0,-1289824.0,Ron Hextall,"February 9, 2021",Mike Sullivan,"December 12, 2015",32.92,34.88,35.5,35.33,37.33,"Rickard Rakell, Jeff Carter, Chad Ruhwedel, Jeff Petry, Kris Letang, Jan Rutta, Pierre-Olivier Joseph, Casey DeSmith, Mikael Granlund, Jake Guentzel, Evgeni Malkin, Sidney Crosby, Bryan Rust","Rickard Rakell, Jeff Petry, Kris Letang, Jan Rutta, Mikael Granlund, Evgeni Malkin, Sidney Crosby, Bryan Rust","Rickard Rakell, Kris Letang, Evgeni Malkin, Bryan Rust","Rickard Rakell, Kris Letang, Bryan Rust","Rickard Rakell, Kris Letang, Bryan Rust",17.0
San Jose Sharks,SJS,SJS.png,20222023,57,21,west,pacific,none,0.436,-1.89,0.884,0.093,-50,+21,-33,82827298,-327298.0,26,23,10,18,21,9,red,#fc4d47,#3568f2,#fc4d47,#fc4d47,#3568f2,0.0,0.0,16,59504167.0,7,41137500,6,39137500,3,27637500,1.0,8137500.0,-327298.0,Mike Grier,"July 5, 2022",David Quinn,"July 21, 2022",28.88,32.0,33.5,35.67,35.0,"Tomas Hertl, Logan Couture, Kevin Labanc, Oskar Lindblom, Alexander Barabanov, Nico Sturm, Steven Lorentz, Thomas Bordeleau, Kaapo Kahkonen, Jacob MacDonald, Matthew Benning, Radim Simek, Henry Thrun, Marc-Edouard Vlasic, Erik Karlsson, Mario Ferraro","Tomas Hertl, Logan Couture, Nico Sturm, Matthew Benning, Marc-Edouard Vlasic, Erik Karlsson, Mario Ferraro","Tomas Hertl, Logan Couture, Matthew Benning, Marc-Edouard Vlasic, Erik Karlsson, Mario Ferraro","Tomas Hertl, Logan Couture, Erik Karlsson",Tomas Hertl,9.0
St. Louis Blues,STL,STL.png,20222023,76,35,west,central,none,0.472,-45.53,0.897,0.105,-22,+34,-43,83161982,-661982.0,23,15,17,28,19,2,#fc4d47,black,#fc4d47,red,#fc4d47,#052ca3,0.0,0.0,18,75973333.0,11,63385833,9,56750000,7,48250000,4.0,29250000.0,-661982.0,Doug Armstrong,"July 1, 2010",Craig Berube,"November 19, 2018",29.44,30.0,31.89,32.29,32.75,"Calle Rosen, Robert Bortuzzo, Marco Scandella, Nick Leddy, Colton Parayko, Torey Krug, Justin Faulk, Nathan Walker, Jordan Binnington, Jake Neighbours, Brandon Saad, Pavel Buchnevich, Brayden Schenn, Samuel Blais, Robert Thomas, Jordan Kyrou, Jakub Vrana, Kasperi Kapanen","Nick Leddy, Colton Parayko, Torey Krug, Justin Faulk, Jordan Binnington, Jake Neighbours, Brandon Saad, Pavel Buchnevich, Brayden Schenn, Robert Thomas, Jordan Kyrou","Nick Leddy, Colton Parayko, Torey Krug, Justin Faulk, Jordan Binnington, Brandon Saad, Brayden Schenn, Robert Thomas, Jordan Kyrou","Colton Parayko, Torey Krug, Justin Faulk, Jordan Binnington, Brayden Schenn, Robert Thomas, Jordan Kyrou","Colton Parayko, Brayden Schenn, Robert Thomas, Jordan Kyrou",6.0
Tampa Bay Lightning,TBL,TBL.png,20222023,94,44,east,atlantic,top3,0.528,+12.72,0.913,0.095,+19,+51,-38,89618491,-7118491.0,10,3,12,12,8,7,#3568f2,#052ca3,#3568f2,#3568f2,#3568f2,#3568f2,0.0,0.0,15,73975000.0,9,60600000,7,51600000,7,51600000,6.0,42100000.0,-7118491.0,Julien BriseBois,"September 11, 2018",Jon Cooper,"March 25, 2013",28.87,28.89,29.57,30.57,32.17,"Andrei Vasilevskiy, Darren Raddysh, Haydn Fleury, Nick Perbix, Zach Bogosian, Mikhail Sergachev, Victor Hedman, Patrick Maroon, Erik Cernak, Nikita Kucherov, Brayden Point, Steven Stamkos, Anthony Cirelli, Nicholas Paul, Brandon Hagel","Andrei Vasilevskiy, Nick Perbix, Mikhail Sergachev, Victor Hedman, Erik Cernak, Nikita Kucherov, Brayden Point, Anthony Cirelli, Nicholas Paul","Andrei Vasilevskiy, Mikhail Sergachev, Erik Cernak, Nikita Kucherov, Brayden Point, Anthony Cirelli, Nicholas Paul","Andrei Vasilevskiy, Mikhail Sergachev, Erik Cernak, Nikita Kucherov, Brayden Point, Anthony Cirelli, Nicholas Paul","Andrei Vasilevskiy, Mikhail Sergachev, Erik Cernak, Brayden Point, Anthony Cirelli, Nicholas Paul",32.0
Toronto Maple Leafs,TOR,TOR.png,20222023,98,44,east,atlantic,top3,0.567,+25.36,0.918,0.098,+43,+46,-32,89013521,-6513521.0,3,7,9,7,6,5,#052ca3,#3568f2,#3568f2,#3568f2,#052ca3,#052ca3,0.0,0.0,13,66243116.0,6,34603000,2,9600000,1,7500000,1.0,7500000.0,-6513521.0,Kyle Dubas,"May 11, 2018",Sheldon Keefe,"November 20, 2019",29.54,30.33,33.0,33.0,35.0,"John Tavares, Auston Matthews, Mitchell Marner, William Nylander, Calle Jarnkrok, Sam Lafferty, Morgan Rielly, TJ Brodie, Jake McCabe, Timothy Liljegren, Mark Giordano, Matt Murray, Conor Timmins","John Tavares, Mitchell Marner, Calle Jarnkrok, Morgan Rielly, Jake McCabe, Conor Timmins","Calle Jarnkrok, Morgan Rielly",Morgan Rielly,Morgan Rielly,29.0
Vancouver Canucks,VAN,VAN.png,20222023,75,34,west,pacific,none,0.477,-13.34,0.897,0.099,-17,+41,-44,89044673,-6544673.0,21,11,18,25,19,4,#fc4d47,#3568f2,#fc4d47,red,#fc4d47,#052ca3,0.0,0.0,19,67258750.0,9,40275000,4,25800000,2,15850000,1.0,8000000.0,-6544673.0,Patrik Allvin,"January 26, 2022",Rick Tocchet,"January 22, 2023",27.0,28.89,29.75,30.5,36.0,"Tyler Myers, Thatcher Demko, Christian Wolanin, Guillaume Brisebois, Filip Hronek, Brock Boeser, J.T. Miller, Conor Garland, Anthony Beauvillier, Andrei Kuzmenko, Aidan McDonough, Vasily Podkolzin, Nils Åman, Dakota Joshua, Jack Studnicka, Sheldon Dries, Elias Pettersson, Quinn Hughes, Phillip Di Giuseppe","Thatcher Demko, Christian Wolanin, Guillaume Brisebois, Brock Boeser, J.T. Miller, Conor Garland, Andrei Kuzmenko, Quinn Hughes, Phillip Di Giuseppe","Thatcher Demko, J.T. Miller, Conor Garland, Quinn Hughes","J.T. Miller, Quinn Hughes",J.T. Miller,15.0
