full,team,logo,season,PTS,W,Conference,Division,playoffs,gf%,xg_dif,sv%,shooting%,g_dif,PP_g_dif,PK_g_dif,projected_cap_hit,projected_cap_space,5on5_rank,PP_rank,PK_rank,XG_dif_rank,Save%_rank,Shooting%_rank,5on5_color,PP_color,PK_color,xg_color,sv_color,sh_color,expiring_contracts,expiring_salary,nhl_contracts_2324,2023-24 Salary,nhl_contracts_2425,2024-25 Salary,nhl_contracts_2526,2025-26 Salary,nhl_contracts_2627,2026-27 Salary,nhl_contracts_2728,2027-28 Salary,cap_remaining,GM,gm_start,coach,coach_start,avg_age_2324,avg_age_2425,avg_age_2526,avg_age_2627,avg_age_2728,players_under_contract_2324,players_under_contract_2425,players_under_contract_2526,players_under_contract_2627,players_under_contract_2728,draft_capital_rank
Anaheim Ducks,ANA,ANA.png,20222023,31,13,west,pacific,none,0.357,-44.33,0.903,0.074,-63,+16,-44,68573153,13926847.0,27,20,19,32,18,22,red,#fc4d47,#fc4d47,red,#fc4d47,#fc4d47,0.0,0.0,13,39851667.0,5,22444167,3,17900000,2,11400000,0.0,0.0,13926847.0,Pat Verbeek,"February 3, 2022",Dallas Eakins,"June 17, 2019",27.85,29.2,32.67,33.0,,"John Gibson, Colton White, Urho Vaakanainen, Cam Fowler, Brett Leason, Sam Carrick, Mason McTavish, Adam Henrique, Jakob Silfverberg, Ryan Strome, Frank Vatrano, Isac Lundestrom, Max Jones","John Gibson, Cam Fowler, Mason McTavish, Ryan Strome, Frank Vatrano","John Gibson, Cam Fowler, Ryan Strome","John Gibson, Ryan Strome",,4.0
Arizona Coyotes,ARI,ARI.png,20222023,35,15,west,central,none,0.441,-35.76,0.908,0.096,-24,+23,-42,64635314,17864686.0,21,15,18,31,15,8,#fc4d47,black,#fc4d47,red,black,#3568f2,0.0,0.0,14,38498334.0,6,25519167,3,17300000,2,11450000,1.0,7150000.0,17864686.0,Bill Armstrong,"September 17, 2020",Andre Tourigny,"July 1, 2021",26.64,26.0,28.0,28.5,30.0,"Lawson Crouse, Zack Kassian, Karel Vejmelka, J.J. Moser, Joshua Brown, Patrik Nemeth, Jakob Chychrun, Milos Kelemen, Dylan Guenther, Travis Boyd, Barrett Hayton, Clayton Keller, Nick Schmaltz, Liam O'Brien","Lawson Crouse, Karel Vejmelka, Jakob Chychrun, Dylan Guenther, Clayton Keller, Nick Schmaltz","Lawson Crouse, Clayton Keller, Nick Schmaltz","Lawson Crouse, Clayton Keller",Clayton Keller,1.0
Boston Bruins,BOS,BOS.png,20222023,78,37,east,atlantic,top3,0.649,+21.43,0.937,0.104,+57,+35,-17,83868543,-1368543.0,1,5,3,3,1,2,#052ca3,#052ca3,#052ca3,#052ca3,#052ca3,#052ca3,0.0,0.0,12,55812500.0,8,47225000,5,30100000,4,24850000,2.0,16000000.0,-1368543.0,Don Sweeney,"May 20, 2015",Jim Montgomery,"July 1, 2022",29.25,30.62,30.0,30.25,33.0,"Matt Grzelcyk, Derek Forbort, Jakub Zboril, Linus Ullmark, Brandon Carlo, Hampus Lindholm, AJ Greer, Pavel Zacha, Taylor Hall, Charlie Coyle, Charlie McAvoy, Brad Marchand","Linus Ullmark, Brandon Carlo, Hampus Lindholm, Pavel Zacha, Taylor Hall, Charlie Coyle, Charlie McAvoy, Brad Marchand","Brandon Carlo, Hampus Lindholm, Pavel Zacha, Charlie Coyle, Charlie McAvoy","Brandon Carlo, Hampus Lindholm, Pavel Zacha, Charlie McAvoy","Hampus Lindholm, Charlie McAvoy",26.0
Buffalo Sabres,BUF,BUF.png,20222023,51,24,east,atlantic,none,0.511,-4.16,0.904,0.102,+5,+36,-28,64234487,18265513.0,13,4,11,22,17,3,black,#052ca3,#3568f2,#fc4d47,#fc4d47,#052ca3,0.0,0.0,16,51665237.0,6,26897737,4,25178571,3,20428571,2.0,11428571.0,18265513.0,Kevyn Adams,"June 16, 2020",Don Granato,"March 17, 2021",25.06,26.17,28.75,29.67,29.5,"Ukko-Pekka Luukkonen, Eric Comrie, Owen Power, Mattias Samuelsson, Jacob Bryson, Henri Jokiharju, Ilya Lyubushkin, Rasmus Dahlin, Jack Quinn, Peyton Krebs, Tage Thompson, Jeff Skinner, Casey Mittelstadt, Victor Olofsson, Alex Tuch, John-Jason Peterka","Mattias Samuelsson, Jack Quinn, Tage Thompson, Jeff Skinner, Alex Tuch, John-Jason Peterka","Mattias Samuelsson, Tage Thompson, Jeff Skinner, Alex Tuch","Mattias Samuelsson, Tage Thompson, Jeff Skinner","Mattias Samuelsson, Tage Thompson",8.0
Calgary Flames,CGY,CGY.png,20222023,55,23,west,pacific,wc,0.526,+15.73,0.903,0.083,+11,+27,-21,81585802,914198.0,8,12,6,5,18,18,#3568f2,#3568f2,#052ca3,#052ca3,#fc4d47,#fc4d47,0.0,0.0,17,78775833.0,8,47200000,6,39200000,4,28650000,3.0,23750000.0,914198.0,Brad Treliving,"April 28, 2014",Darryl Sutter,"March 4, 2021",28.88,30.75,32.83,34.25,36.0,"Jacob Markstrom, MacKenzie Weegar, Nikita Zadorov, Christopher Tanev, Rasmus Andersson, Noah Hanifin, Adam Ruzicka, Dillon Dube, Tyler Toffoli, Elias Lindholm, Blake Coleman, Nazem Kadri, Mikael Backlund, Andrew Mangiapane, Jakob Pelletier, Jonathan Huberdeau, Daniel Vladar","Jacob Markstrom, MacKenzie Weegar, Rasmus Andersson, Blake Coleman, Nazem Kadri, Andrew Mangiapane, Jonathan Huberdeau, Daniel Vladar","Jacob Markstrom, MacKenzie Weegar, Rasmus Andersson, Blake Coleman, Nazem Kadri, Jonathan Huberdeau","MacKenzie Weegar, Blake Coleman, Nazem Kadri, Jonathan Huberdeau","MacKenzie Weegar, Nazem Kadri, Jonathan Huberdeau",24.0
Carolina Hurricanes,CAR,CAR.png,20222023,66,29,east,metro,top3,0.566,+32.95,0.913,0.081,+24,+23,-22,85657777,-3157777.0,5,15,7,1,11,20,#052ca3,black,#3568f2,#052ca3,#3568f2,#fc4d47,0.0,0.0,13,53504417.0,4,23150000,2,12570000,2,12570000,2.0,12570000.0,-3157777.0,Don Waddell,"May 8, 2018",Rod Brind'Amour,"May 8, 2018",27.69,29.25,25.0,26.0,28.0,"Jalen Chatfield, Brett Pesce, Brady Skjei, Brent Burns, Stefan Noesen, Seth Jarvis, Jordan Martinook, Martin Necas, Jesperi Kotkaniemi, Teuvo Teravainen, Jaccob Slavin, Sebastian Aho, Andrei Svechnikov","Brent Burns, Jesperi Kotkaniemi, Jaccob Slavin, Andrei Svechnikov","Jesperi Kotkaniemi, Andrei Svechnikov","Jesperi Kotkaniemi, Andrei Svechnikov","Jesperi Kotkaniemi, Andrei Svechnikov",7.0
Chicago Blackhawks,CHI,CHI.png,20222023,32,14,west,central,none,0.376,-34.15,0.905,0.077,-47,+17,-26,77458974,5041026.0,26,19,10,29,16,21,red,#fc4d47,#3568f2,red,black,#fc4d47,0.0,0.0,12,30741666.0,3,17900000,2,13900000,1,9500000,1.0,9500000.0,5041026.0,Kyle Davidson,"October 26, 2021",Luke Richardson,"June 27, 2022",27.5,30.67,31.5,32.0,34.0,"Taylor Raddysh, Petr Mrazek, Filip Roos, Jake McCabe, Connor Murphy, Seth Jones, Jason Dickinson, Colin Blackwell, Sam Lafferty, Mackenzie Entwistle, Reese Johnson, Boris Katchouk","Jake McCabe, Connor Murphy, Seth Jones","Connor Murphy, Seth Jones",Seth Jones,Seth Jones,2.0
Colorado Avalanche,COL,COL.png,20222023,53,25,west,central,none,0.512,+5.55,0.928,0.074,+4,+31,-29,83679127,-1179127.0,14,8,12,16,2,22,black,#3568f2,#3568f2,black,#052ca3,#fc4d47,0.0,0.0,13,59537500.0,8,50925000,5,37225000,5,37225000,2.0,18725000.0,-1179127.0,Chris MacFarland,"July 11, 2022",Jared Bednar,"August 25, 2016",28.54,27.88,28.8,29.8,33.0,"Mikko Rantanen, Alexandar Georgiev, Nathan MacKinnon, Valeri Nichushkin, Artturi Lehkonen, Pavel Francouz, Logan O'Connor, Jacob MacDonald, Brad Hunt, Kurtis MacDermid, Samuel Girard, Cale Makar, Devon Toews","Mikko Rantanen, Alexandar Georgiev, Nathan MacKinnon, Valeri Nichushkin, Artturi Lehkonen, Logan O'Connor, Samuel Girard, Cale Makar","Nathan MacKinnon, Valeri Nichushkin, Artturi Lehkonen, Samuel Girard, Cale Makar","Nathan MacKinnon, Valeri Nichushkin, Artturi Lehkonen, Samuel Girard, Cale Makar","Nathan MacKinnon, Valeri Nichushkin",30.0
Columbus Blue Jackets,CBJ,CBJ.png,20222023,31,14,east,metro,none,0.399,-20.47,0.897,0.083,-46,+14,-26,83845449,-1345449.0,25,22,10,27,21,18,red,#fc4d47,#3568f2,red,#fc4d47,#fc4d47,0.0,0.0,16,50312500.0,8,39450000,6,34350000,2,15150000,1.0,9750000.0,-1345449.0,Jarmo Kekalainen,"February 13, 2013",Brad Larsen,"June 10, 2021",25.94,29.12,30.5,32.5,35.0,"Johnny Gaudreau, Patrik Laine, Jack Roslovic, Boone Jenner, Sean Kuraly, Eric Robinson, Kent Johnson, Kirill Marchenko, Cole Sillinger, Emil Bemstrom, Liam Foudy, Erik Gudbranson, Adam Boqvist, Nick Blankenburg, Andrew Peeke, Elvis Merzlikins","Johnny Gaudreau, Patrik Laine, Boone Jenner, Sean Kuraly, Erik Gudbranson, Adam Boqvist, Andrew Peeke, Elvis Merzlikins","Johnny Gaudreau, Patrik Laine, Boone Jenner, Erik Gudbranson, Andrew Peeke, Elvis Merzlikins","Johnny Gaudreau, Elvis Merzlikins",Johnny Gaudreau,11.0
Dallas Stars,DAL,DAL.png,20222023,64,28,west,central,top3,0.576,+12.98,0.925,0.099,+32,+36,-20,81869009,630991.0,4,4,5,8,4,6,#052ca3,#052ca3,#052ca3,#3568f2,#052ca3,#052ca3,0.0,0.0,16,74869167.0,11,66094167,5,39000000,3,26750000,2.0,16900000.0,630991.0,Jim Nill,"April 29, 2013",Peter DeBoer,"June 21, 2022",29.12,29.27,28.8,30.33,30.5,"Jani Hakanpaa, Scott Wedgewood, Jake Oettinger, Nils Lundkvist, Colin Miller, Esa Lindell, Miro Heiskanen, Wyatt Johnston, Roope Hintz, Radek Faksa, Mason Marchment, Ryan Suter, Tyler Seguin, Joe Pavelski, Jamie Benn, Jason Robertson","Jake Oettinger, Esa Lindell, Miro Heiskanen, Wyatt Johnston, Roope Hintz, Radek Faksa, Mason Marchment, Ryan Suter, Tyler Seguin, Jamie Benn, Jason Robertson","Miro Heiskanen, Roope Hintz, Mason Marchment, Tyler Seguin, Jason Robertson","Miro Heiskanen, Roope Hintz, Tyler Seguin","Miro Heiskanen, Roope Hintz",29.0
Detroit Red Wings,DET,DET.png,20222023,46,19,east,atlantic,none,0.488,-4.81,0.905,0.1,-5,+21,-30,76698452,5801548.0,16,16,13,23,16,5,black,black,black,#fc4d47,black,#052ca3,0.0,0.0,11,34948333.0,4,19125000,2,10375000,1,5625000,0.0,0.0,5801548.0,Steve Yzerman,"April 19, 2019",Derek Lalonde,"June 30, 2022",26.91,30.25,32.5,32.0,,"Robby Fabbri, David Perron, Andrew Copp, Dominik Kubalik, Michael Rasmussen, Jonatan Berggren, Lucas Raymond, Filip Hronek, Ben Chiarot, Ville Husso, Moritz Seider","Robby Fabbri, Andrew Copp, Ben Chiarot, Ville Husso","Andrew Copp, Ben Chiarot",Andrew Copp,,6.0
Edmonton Oilers,EDM,EDM.png,20222023,57,27,west,pacific,wc,0.525,+11.82,0.914,0.094,+11,+46,-33,91938315,-9438315.0,8,1,14,11,10,9,#3568f2,#052ca3,black,#3568f2,#3568f2,#3568f2,0.0,0.0,16,70208333.0,10,59600000,8,47850000,4,24875000,3.0,19875000.0,-9438315.0,Ken Holland,"May 7, 2019",Jay Woodcroft,"February 10, 2022",27.94,30.3,31.38,33.25,34.67,"Zach Hyman, Stuart Skinner, Connor McDavid, Leon Draisaitl, Ryan Nugent-Hopkins, Evander Kane, Warren Foegele, Dylan Holloway, Darnell Nurse, Tyson Barrie, Cody Ceci, Brett Kulak, Philip Broberg, Vincent Desharnais, Jack Campbell, James Hamblin","Zach Hyman, Stuart Skinner, Connor McDavid, Leon Draisaitl, Ryan Nugent-Hopkins, Evander Kane, Darnell Nurse, Cody Ceci, Brett Kulak, Jack Campbell","Zach Hyman, Stuart Skinner, Connor McDavid, Ryan Nugent-Hopkins, Evander Kane, Darnell Nurse, Brett Kulak, Jack Campbell","Zach Hyman, Ryan Nugent-Hopkins, Darnell Nurse, Jack Campbell","Zach Hyman, Ryan Nugent-Hopkins, Darnell Nurse",27.0
Florida Panthers,FLA,FLA.png,20222023,51,23,east,atlantic,none,0.509,+12.16,0.904,0.088,+4,+39,-39,87852095,-5352095.0,14,3,16,10,17,14,black,#052ca3,black,#3568f2,#fc4d47,black,0.0,0.0,14,67083334.0,7,50091667,4,34000000,2,19500000,2.0,19500000.0,-5352095.0,Bill Zito,"September 2, 2020",Paul Maurice,"June 22, 2022",27.36,28.57,29.75,30.0,32.0,"Aleksander Barkov, Matthew Tkachuk, Sam Reinhart, Sam Bennett, Carter Verhaeghe, Eetu Luostarinen, Nick Cousins, Anton Lundell, Ryan Lomberg, Aaron Ekblad, Spencer Knight, Sergei Bobrovsky, Gustav Forsling, Brandon Montour","Aleksander Barkov, Matthew Tkachuk, Sam Bennett, Carter Verhaeghe, Aaron Ekblad, Spencer Knight, Sergei Bobrovsky","Aleksander Barkov, Matthew Tkachuk, Spencer Knight, Sergei Bobrovsky","Aleksander Barkov, Matthew Tkachuk","Aleksander Barkov, Matthew Tkachuk",32.0
Los Angeles Kings,LAK,LAK.png,20222023,58,26,west,pacific,top3,0.486,+8.74,0.896,0.084,-6,+33,-39,82424281,75719.0,17,7,16,14,22,17,#fc4d47,#3568f2,black,black,#fc4d47,#fc4d47,0.0,0.0,13,59088334.0,5,33875000,4,29875000,3,24375000,1.0,7875000.0,75719.0,Rob Blake,"April 10, 2017",Todd McLellan,"April 16, 2019",28.08,30.6,31.5,33.33,32.0,"Matt Roy, Sean Walker, Sean Durzi, Drew Doughty, Kevin Fiala, Alex Turcotte, Quinton Byfield, Blake Lizotte, Alex Iafallo, Viktor Arvidsson, Adrian Kempe, Phillip Danault, Anze Kopitar","Drew Doughty, Kevin Fiala, Alex Iafallo, Adrian Kempe, Phillip Danault","Drew Doughty, Kevin Fiala, Adrian Kempe, Phillip Danault","Drew Doughty, Kevin Fiala, Phillip Danault",Kevin Fiala,14.0
Minnesota Wild,MIN,MIN.png,20222023,54,25,west,central,top3,0.519,+4.84,0.916,0.091,+7,+29,-22,78747349,3752651.0,11,10,7,17,8,11,#3568f2,#3568f2,#3568f2,#fc4d47,#3568f2,#3568f2,0.0,0.0,14,58575000.0,8,41475000,5,34825000,4,25825000,3.0,18250000.0,3752651.0,Bill Guerin,"August 21, 2019",Dean Evason,"February 14, 2020",30.07,28.88,29.6,31.0,31.0,"Marc-Andre Fleury, Ryan Hartman, Jon Merrill, Kirill Kaprizov, Mats Zuccarello, Joel Eriksson Ek, Marcus Foligno, Jordan Greenway, Matthew Boldy, Connor Dewar, Jared Spurgeon, Jonas Brodin, Jacob Middleton, Alex Goligoski","Jon Merrill, Kirill Kaprizov, Joel Eriksson Ek, Jordan Greenway, Matthew Boldy, Jared Spurgeon, Jonas Brodin, Jacob Middleton","Kirill Kaprizov, Joel Eriksson Ek, Matthew Boldy, Jared Spurgeon, Jonas Brodin","Joel Eriksson Ek, Matthew Boldy, Jared Spurgeon, Jonas Brodin","Joel Eriksson Ek, Matthew Boldy, Jonas Brodin",20.0
Montreal Canadiens,MTL,MTL.png,20222023,43,20,east,atlantic,none,0.437,-35.4,0.9,0.088,-27,+16,-41,95530242,-13030242.0,22,20,17,30,19,14,#fc4d47,#fc4d47,#fc4d47,red,#fc4d47,black,0.0,0.0,14,45695000.0,8,34179167,4,21612500,2,13375000,1.0,7875000.0,-13030242.0,Kent Hughes,"January 18, 2022",Martin St. Louis,"February 9, 2022",28.07,29.0,28.25,29.5,29.0,"Samuel Montembeault, Jake Allen, Chris Wideman, Johnathan Kovacevic, Arber Xhekaj, Justin Barron, David Savard, Joel Edmundson, Michael Matheson, Kirby Dach, Christian Dvorak, Mike Hoffman, Josh Anderson, Nick Suzuki","Jake Allen, Johnathan Kovacevic, David Savard, Michael Matheson, Kirby Dach, Christian Dvorak, Josh Anderson, Nick Suzuki","Michael Matheson, Kirby Dach, Josh Anderson, Nick Suzuki","Josh Anderson, Nick Suzuki",Nick Suzuki,3.0
Nashville Predators,NSH,NSH.png,20222023,50,22,west,central,none,0.516,+0.79,0.927,0.084,+6,+19,-30,80310979,2189021.0,12,18,13,19,3,17,#3568f2,#fc4d47,black,#fc4d47,#052ca3,#fc4d47,0.0,0.0,13,67966976.0,10,61416143,7,43416143,2,17559000,2.0,17559000.0,2189021.0,David Poile,"July 9, 1997",John Hynes,"January 7, 2020",29.85,31.8,33.14,34.0,36.0,"Filip Forsberg, Matt Duchene, Ryan Johansen, Mikael Granlund, Nino Niederreiter, Yakov Trenin, Juuso Parssinen, Roman Josi, Ryan McDonagh, Mattias Ekholm, Jeremy Lauzon, Juuse Saros, Colton Sissons","Filip Forsberg, Matt Duchene, Ryan Johansen, Mikael Granlund, Roman Josi, Ryan McDonagh, Mattias Ekholm, Jeremy Lauzon, Juuse Saros, Colton Sissons","Filip Forsberg, Matt Duchene, Roman Josi, Ryan McDonagh, Mattias Ekholm, Jeremy Lauzon, Colton Sissons","Filip Forsberg, Roman Josi","Filip Forsberg, Roman Josi",10.0
New Jersey Devils,NJD,NJD.png,20222023,64,30,east,metro,top3,0.598,+30.4,0.919,0.094,+40,+19,-21,83815085,-1315085.0,3,18,6,2,6,9,#052ca3,#fc4d47,#052ca3,#052ca3,#052ca3,#3568f2,0.0,0.0,10,40727501.0,7,37944167,5,33650000,5,33650000,3.0,20400000.0,-1315085.0,Tom Fitzgerald,"January 12, 2020",Lindy Ruff,"July 9, 2020",26.4,27.43,29.0,30.0,31.0,"Dawson Mercer, Dougie Hamilton, Jonas Siegenthaler, Nikita Okhotiuk, Vitek Vanecek, Brendan Smith, Alexander Holtz, Jack Hughes, Nico Hischier, Ondrej Palat","Dougie Hamilton, Jonas Siegenthaler, Vitek Vanecek, Alexander Holtz, Jack Hughes, Nico Hischier, Ondrej Palat","Dougie Hamilton, Jonas Siegenthaler, Jack Hughes, Nico Hischier, Ondrej Palat","Dougie Hamilton, Jonas Siegenthaler, Jack Hughes, Nico Hischier, Ondrej Palat","Dougie Hamilton, Jonas Siegenthaler, Jack Hughes",18.0
New York Islanders,NYI,NYI.png,20222023,51,23,east,metro,none,0.521,-9.04,0.915,0.094,+9,+15,-18,80956873,1543127.0,9,21,4,24,9,9,#3568f2,#fc4d47,#052ca3,red,#3568f2,#3568f2,0.0,0.0,18,71325000.0,12,54986667,7,36650000,4,23550000,3.0,21050000.0,1543127.0,Lou Lamoriello,"June 5, 2018",Lane Lambert,"May 16, 2022",28.5,29.5,31.86,32.0,33.0,"Anders Lee, Mathew Barzal, Ilya Sorokin, Sebastian Aho, Alexander Romanov, Noah Dobson, Adam Pelech, Ryan Pulock, Aatu Raty, Simon Holmstrom, Ross Johnston, Matt Martin, Casey Cizikas, Anthony Beauvillier, Kyle Palmieri, Jean-Gabriel Pageau, Josh Bailey, Brock Nelson","Anders Lee, Mathew Barzal, Alexander Romanov, Noah Dobson, Adam Pelech, Ryan Pulock, Aatu Raty, Ross Johnston, Casey Cizikas, Kyle Palmieri, Jean-Gabriel Pageau, Brock Nelson","Anders Lee, Mathew Barzal, Adam Pelech, Ryan Pulock, Ross Johnston, Casey Cizikas, Jean-Gabriel Pageau","Mathew Barzal, Adam Pelech, Ryan Pulock, Casey Cizikas","Mathew Barzal, Adam Pelech, Ryan Pulock",16.0
New York Rangers,NYR,NYR.png,20222023,59,26,east,metro,top3,0.539,+1.73,0.919,0.087,+15,+28,-16,81300951,1199049.0,7,11,2,18,6,15,#3568f2,#3568f2,#052ca3,#fc4d47,#052ca3,black,0.0,0.0,14,67496191.0,11,61471191,7,53409524,5,33766667,3.0,23625000.0,1199049.0,Chris Drury,"May 5, 2021",Gerard Gallant,"June 16, 2021",27.14,29.27,31.71,32.4,33.33,"Chris Kreider, Vincent Trocheck, Artemi Panarin, Mika Zibanejad, Barclay Goodrow, Kaapo Kakko, Will Cuylle, Jake Leschyshyn, Jimmy Vesey, Adam Fox, Jacob Trouba, Ryan Lindgren, Braden Schneider, Igor Shesterkin","Chris Kreider, Vincent Trocheck, Artemi Panarin, Mika Zibanejad, Barclay Goodrow, Will Cuylle, Jake Leschyshyn, Jimmy Vesey, Adam Fox, Jacob Trouba, Igor Shesterkin","Chris Kreider, Vincent Trocheck, Artemi Panarin, Mika Zibanejad, Barclay Goodrow, Adam Fox, Jacob Trouba","Chris Kreider, Vincent Trocheck, Mika Zibanejad, Barclay Goodrow, Adam Fox","Vincent Trocheck, Mika Zibanejad, Adam Fox",12.0
Ottawa Senators,OTT,OTT.png,20222023,43,20,east,atlantic,none,0.401,+9.91,0.896,0.066,-38,+41,-25,78863575,3636425.0,24,2,9,13,22,23,red,#052ca3,#3568f2,black,#fc4d47,#fc4d47,0.0,0.0,12,49616547.0,9,43429047,5,32480714,4,29530714,3.0,24555714.0,3636425.0,Pierre Dorion,"April 10, 2016",D. J. Smith,"May 23, 2019",26.0,27.11,26.6,27.25,29.0,"Anton Forsberg, Thomas Chabot, Nikita Zaitsev, Parker Kelly, Mark Kastelic, Ridly Greig, Tim Stutzle, Jake Sanderson, Brady Tkachuk, Drake Batherson, Mathieu Joseph, Claude Giroux","Anton Forsberg, Thomas Chabot, Mark Kastelic, Ridly Greig, Tim Stutzle, Brady Tkachuk, Drake Batherson, Mathieu Joseph, Claude Giroux","Thomas Chabot, Tim Stutzle, Brady Tkachuk, Drake Batherson, Mathieu Joseph","Thomas Chabot, Tim Stutzle, Brady Tkachuk, Drake Batherson","Thomas Chabot, Tim Stutzle, Brady Tkachuk",15.0
Philadelphia Flyers,PHI,PHI.png,20222023,47,20,east,metro,none,0.464,-19.04,0.909,0.082,-15,+21,-20,86196868,-3696868.0,18,16,5,26,14,19,#fc4d47,black,#052ca3,red,black,#fc4d47,0.0,0.0,14,53306857.0,8,40492857,6,28242857,3,16350000,2.0,11250000.0,-3696868.0,Chuck Fletcher,"December 3, 2018",John Tortorella,"June 17, 2022",27.43,29.0,30.5,29.33,30.0,"Wade Allison, Travis Sanheim, Anthony Deangelo, Nick Seeler, Rasmus Ristolainen, Ivan Provorov, Scott Laughton, Owen Tippett, Nicolas Deslauriers, Joel Farabee, Travis Konecny, Kevin Hayes, Carter Hart, Felix Sandstrom","Travis Sanheim, Rasmus Ristolainen, Ivan Provorov, Scott Laughton, Nicolas Deslauriers, Joel Farabee, Travis Konecny, Kevin Hayes","Travis Sanheim, Rasmus Ristolainen, Scott Laughton, Nicolas Deslauriers, Joel Farabee, Kevin Hayes","Travis Sanheim, Rasmus Ristolainen, Joel Farabee","Travis Sanheim, Joel Farabee",9.0
Pittsburgh Penguins,PIT,PIT.png,20222023,54,23,east,metro,wc,0.512,+13.85,0.918,0.089,+5,+27,-22,84566792,-2066792.0,13,12,7,7,7,13,black,#3568f2,#3568f2,#3568f2,#3568f2,black,0.0,0.0,14,54475175.0,7,37950175,3,16225000,2,10125000,2.0,10125000.0,-2066792.0,Ron Hextall,"February 9, 2021",Mike Sullivan,"December 12, 2015",31.29,33.29,34.67,33.5,35.5,"Rickard Rakell, Kasperi Kapanen, Jeff Petry, Jeff Carter, Brock McGinn, Marcus Pettersson, Pierre-Olivier Joseph, Chad Ruhwedel, Mark Friedman, Casey DeSmith, Bryan Rust, Jake Guentzel, Evgeni Malkin, Sidney Crosby","Rickard Rakell, Jeff Petry, Brock McGinn, Marcus Pettersson, Bryan Rust, Evgeni Malkin, Sidney Crosby","Rickard Rakell, Bryan Rust, Evgeni Malkin","Rickard Rakell, Bryan Rust","Rickard Rakell, Bryan Rust",17.0
San Jose Sharks,SJS,SJS.png,20222023,37,14,west,pacific,none,0.444,+0.66,0.881,0.099,-29,+19,-20,83415956,-915956.0,23,18,5,20,23,6,#fc4d47,#fc4d47,#052ca3,#fc4d47,#fc4d47,#052ca3,0.0,0.0,14,56260000.0,7,41137500,6,39137500,3,27637500,1.0,8137500.0,-915956.0,Mike Grier,"July 5, 2022",David Quinn,"July 21, 2022",29.07,31.71,33.17,35.33,35.0,"Tomas Hertl, Logan Couture, Kevin Labanc, Alexander Barabanov, Nico Sturm, Steven Lorentz, Oskar Lindblom, Marc-Edouard Vlasic, Erik Karlsson, Kaapo Kahkonen, Jaycob Megna, Nick Cicek, Matthew Benning, Mario Ferraro","Tomas Hertl, Logan Couture, Nico Sturm, Marc-Edouard Vlasic, Erik Karlsson, Matthew Benning, Mario Ferraro","Tomas Hertl, Logan Couture, Marc-Edouard Vlasic, Erik Karlsson, Matthew Benning, Mario Ferraro","Tomas Hertl, Logan Couture, Erik Karlsson",Tomas Hertl,13.0
St. Louis Blues,STL,STL.png,20222023,49,23,west,central,none,0.455,-20.81,0.898,0.096,-21,+25,-24,85482855,-2982855.0,20,13,8,28,20,8,#fc4d47,black,#3568f2,red,#fc4d47,#3568f2,0.0,0.0,12,59123333.0,10,57585833,9,56750000,7,48250000,4.0,29250000.0,-2982855.0,Doug Armstrong,"July 1, 2010",Craig Berube,"November 19, 2018",28.83,29.8,31.67,32.14,32.75,"Jordan Binnington, Calle Rosen, Colton Parayko, Torey Krug, Justin Faulk, Nathan Walker, Jake Neighbours, Nick Leddy, Robert Thomas, Jordan Kyrou, Brayden Schenn, Brandon Saad","Jordan Binnington, Colton Parayko, Torey Krug, Justin Faulk, Jake Neighbours, Nick Leddy, Robert Thomas, Jordan Kyrou, Brayden Schenn, Brandon Saad","Jordan Binnington, Colton Parayko, Torey Krug, Justin Faulk, Nick Leddy, Robert Thomas, Jordan Kyrou, Brayden Schenn, Brandon Saad","Jordan Binnington, Colton Parayko, Torey Krug, Justin Faulk, Robert Thomas, Jordan Kyrou, Brayden Schenn","Colton Parayko, Robert Thomas, Jordan Kyrou, Brayden Schenn",21.0
Tampa Bay Lightning,TBL,TBL.png,20222023,59,29,east,atlantic,top3,0.543,+12.7,0.912,0.101,+18,+30,-25,89878585,-7378585.0,6,9,9,9,12,4,#052ca3,#3568f2,#3568f2,#3568f2,#3568f2,#052ca3,0.0,0.0,14,73212500.0,9,60600000,7,51600000,7,51600000,6.0,42100000.0,-7378585.0,Julien BriseBois,"September 11, 2018",Jon Cooper,"March 25, 2013",28.71,28.67,29.29,30.29,31.83,"Andrei Vasilevskiy, Nick Perbix, Zach Bogosian, Erik Cernak, Mikhail Sergachev, Patrick Maroon, Haydn Fleury, Brandon Hagel, Victor Hedman, Nicholas Paul, Anthony Cirelli, Steven Stamkos, Brayden Point, Nikita Kucherov","Andrei Vasilevskiy, Nick Perbix, Erik Cernak, Mikhail Sergachev, Victor Hedman, Nicholas Paul, Anthony Cirelli, Brayden Point, Nikita Kucherov","Andrei Vasilevskiy, Erik Cernak, Mikhail Sergachev, Nicholas Paul, Anthony Cirelli, Brayden Point, Nikita Kucherov","Andrei Vasilevskiy, Erik Cernak, Mikhail Sergachev, Nicholas Paul, Anthony Cirelli, Brayden Point, Nikita Kucherov","Andrei Vasilevskiy, Erik Cernak, Mikhail Sergachev, Nicholas Paul, Anthony Cirelli, Brayden Point",31.0
Toronto Maple Leafs,TOR,TOR.png,20222023,66,29,east,atlantic,top3,0.58,+18.35,0.922,0.097,+32,+34,-22,88451451,-5951451.0,4,6,7,4,5,7,#052ca3,#052ca3,#3568f2,#052ca3,#052ca3,#3568f2,0.0,0.0,11,59155616.0,4,31503000,2,9600000,1,7500000,1.0,7500000.0,-5951451.0,Kyle Dubas,"May 11, 2018",Sheldon Keefe,"November 20, 2019",28.73,31.0,32.5,32.0,34.0,"Calle Jarnkrok, Auston Matthews, John Tavares, Mitchell Marner, William Nylander, Bobby McMann, Morgan Rielly, Timothy Liljegren, Rasmus Sandin, Mark Giordano, Matt Murray","Calle Jarnkrok, John Tavares, Mitchell Marner, Morgan Rielly","Calle Jarnkrok, Morgan Rielly",Morgan Rielly,Morgan Rielly,28.0
Vancouver Canucks,VAN,VAN.png,20222023,39,18,west,pacific,none,0.465,-18.63,0.898,0.097,-16,+27,-37,87221546,-4721546.0,19,12,15,25,20,7,#fc4d47,#3568f2,black,red,#fc4d47,#3568f2,0.0,0.0,14,58272500.0,7,40460000,5,32810000,3,23110000,1.0,8000000.0,-4721546.0,Patrik Allvin,"January 26, 2022",Rick Tocchet,"January 22, 2023",27.64,29.0,30.4,31.67,35.0,"Spencer Martin, Riley Stillman, Tyler Myers, Oliver Ekman-Larsson, Quinn Hughes, Sheldon Dries, Jack Studnicka, Dakota Joshua, Curtis Lazar, Ilya Mikheyev, Conor Garland, J.T. Miller, Brock Boeser, Elias Pettersson","Oliver Ekman-Larsson, Quinn Hughes, Curtis Lazar, Ilya Mikheyev, Conor Garland, J.T. Miller, Brock Boeser","Oliver Ekman-Larsson, Quinn Hughes, Ilya Mikheyev, Conor Garland, J.T. Miller","Oliver Ekman-Larsson, Quinn Hughes, J.T. Miller",J.T. Miller,19.0
Vegas Golden Knights,VGK,VGK.png,20222023,60,29,west,pacific,top3,0.495,+14.01,0.908,0.085,-2,+28,-15,97679970,-15179970.0,15,11,1,6,15,16,black,#3568f2,#052ca3,#052ca3,black,black,0.0,0.0,18,66449984.0,11,50285817,6,37975000,4,27200000,0.0,0.0,-15179970.0,Kelly McCrimmon,"September 1, 2019",Bruce Cassidy,"June 14, 2022",28.78,29.64,30.83,33.5,,"Chandler Stephenson, Mark Stone, Jack Eichel, Daniil Miromanov, Ben Hutton, Nicolas Hague, Brayden McNabb, Alec Martinez, Alex Pietrangelo, Paul Cotter, Michael Amadio, Keegan Kolesar, Kaedan Korczak, Logan Thompson, William Karlsson, Jonathan Marchessault, Reilly Smith, Nicolas Roy","Mark Stone, Jack Eichel, Nicolas Hague, Brayden McNabb, Alex Pietrangelo, Paul Cotter, Keegan Kolesar, Logan Thompson, William Karlsson, Reilly Smith, Nicolas Roy","Mark Stone, Jack Eichel, Alex Pietrangelo, Paul Cotter, William Karlsson, Nicolas Roy","Mark Stone, Alex Pietrangelo, William Karlsson, Nicolas Roy",,22.0
Washington Capitals,WSH,WSH.png,20222023,56,25,east,metro,wc,0.521,+11.15,0.913,0.09,+9,+24,-20,91229774,-8729774.0,9,14,5,12,11,12,#3568f2,black,#052ca3,#3568f2,#3568f2,#3568f2,0.0,0.0,9,50255834.0,6,38600000,2,14750000,1,5250000,0.0,0.0,-8729774.0,Brian MacLellan,"May 26, 2014",Peter Laviolette,"September 15, 2020",31.78,35.17,37.5,36.0,,"Alex Ovechkin, Nicklas Backstrom, Evgeny Kuznetsov, T.J. Oshie, Anthony Mantha, Tom Wilson, Aliaksei Protas, Darcy Kuemper, Charlie Lindgren","Alex Ovechkin, Nicklas Backstrom, Evgeny Kuznetsov, T.J. Oshie, Darcy Kuemper, Charlie Lindgren","Alex Ovechkin, Darcy Kuemper",Darcy Kuemper,,25.0
