full,team,logo,season,PTS,W,Conference,Division,playoffs,gf%,xg_dif,sv%,shooting%,g_dif,PP_g_dif,PK_g_dif,projected_cap_hit,projected_cap_space,5on5_rank,PP_rank,PK_rank,XG_dif_rank,Save%_rank,Shooting%_rank,5on5_color,PP_color,PK_color,xg_color,sv_color,sh_color,expiring_contracts,expiring_salary,nhl_contracts_2324,2023-24 Salary,nhl_contracts_2425,2024-25 Salary,nhl_contracts_2526,2025-26 Salary,nhl_contracts_2627,2026-27 Salary,nhl_contracts_2728,2027-28 Salary,cap_remaining,GM,gm_start,coach,coach_start,avg_age_2324,avg_age_2425,avg_age_2526,avg_age_2627,avg_age_2728,players_under_contract_2324,players_under_contract_2425,players_under_contract_2526,players_under_contract_2627,players_under_contract_2728,draft_capital_rank
Anaheim Ducks,ANA,ANA.png,20222023,58,23,west,pacific,none,0.399,-74.39,0.908,0.086,-80,+28,-74,48451667,35048333.0,28,21,21,32,10,13,red,#fc4d47,#fc4d47,red,#3568f2,black,4.0,0.0,7,29194167.0,4,21900000,2,11400000,0.0,0.0,0.0,0.0,35048333.0,Pat Verbeek,"February 3, 2022",Greg Cronin,"June 5, 2023",28.31,30.57,33.5,33.0,,"John Gibson, Colton White, Jackson LaCombe, Radko Gudas, Cam Fowler, Brett Leason, Sam Carrick, Mason McTavish, Nikita Nesterenko, Max Jones, Isac Lundestrom, Brock McGinn, Frank Vatrano, Adam Henrique, Ryan Strome, Jakob Silfverberg","John Gibson, Radko Gudas, Cam Fowler, Mason McTavish, Brock McGinn, Frank Vatrano, Ryan Strome","John Gibson, Radko Gudas, Cam Fowler, Ryan Strome","John Gibson, Ryan Strome",,7.0
Arizona Coyotes,ARI,ARI.png,20222023,70,28,west,central,none,0.464,-43.91,0.909,0.099,-26,+37,-74,61652144,21847856.0,23,16,21,27,9,4,#fc4d47,black,#fc4d47,red,#3568f2,#052ca3,2.0,0.0,5,21975000.0,4,19250000,2,11450000,1.0,7150000.0,0.0,0.0,21847856.0,Bill Armstrong,"September 17, 2020",Andre Tourigny,"July 1, 2021",27.13,28.0,28.75,29.0,30.0,"Clayton Keller, Nick Schmaltz, Jason Zucker, Lawson Crouse, Barrett Hayton, Travis Boyd, Liam O'Brien, Sean Durzi, Joshua Brown, Troy Stecher, Juuso Valimaki, J.J. Moser, Victor Soderstrom, Karel Vejmelka, Connor Ingram","Clayton Keller, Nick Schmaltz, Lawson Crouse, Karel Vejmelka, Connor Ingram","Clayton Keller, Nick Schmaltz, Lawson Crouse, Connor Ingram","Clayton Keller, Lawson Crouse",Clayton Keller,2.0
Boston Bruins,BOS,BOS.png,20222023,-121,65,east,atlantic,none,0.637,+29.06,0.936,0.104,+94,+48,-26,74695834,8804166.0,1,8,1,6,1,2,#052ca3,#3568f2,#052ca3,#052ca3,#052ca3,#052ca3,4.0,0.0,10,55275000.0,6,41350000,5,36100000,3.0,27250000.0,3.0,27250000.0,8804166.0,Don Sweeney,"May 20, 2015",Jim Montgomery,"July 1, 2022",29.82,30.3,30.33,30.6,33.0,"Linus Ullmark, David Pastrnak, Brad Marchand, Charlie Coyle, Pavel Zacha, Jake DeBrusk, Morgan Geekie, Milan Lucic, James van Riemsdyk, Patrick Brown, Charlie McAvoy, Hampus Lindholm, Brandon Carlo, Matt Grzelcyk, Derek Forbort, Jakub Zboril, AJ Greer","Linus Ullmark, David Pastrnak, Brad Marchand, Charlie Coyle, Pavel Zacha, Morgan Geekie, Patrick Brown, Charlie McAvoy, Hampus Lindholm, Brandon Carlo","David Pastrnak, Charlie Coyle, Pavel Zacha, Charlie McAvoy, Hampus Lindholm, Brandon Carlo","David Pastrnak, Pavel Zacha, Charlie McAvoy, Hampus Lindholm, Brandon Carlo","David Pastrnak, Charlie McAvoy, Hampus Lindholm",31.0
Buffalo Sabres,BUF,BUF.png,20222023,91,42,east,atlantic,none,0.485,-11.8,0.897,0.099,-13,+50,-49,77623570,5876430.0,19,7,17,22,16,4,#fc4d47,#3568f2,#fc4d47,#fc4d47,black,#052ca3,0.0,0.0,10,41256070.0,6,35611904,4,27528571,3.0,18528571.0,3.0,18528571.0,5876430.0,Kevyn Adams,"June 16, 2020",Don Granato,"March 17, 2021",26.56,26.5,29.0,29.25,29.33,"Jeff Skinner, Tage Thompson, Dylan Cozens, Victor Olofsson, Ukko-Pekka Luukkonen, Eric Comrie, Alex Tuch, Jordan Greenway, Casey Mittelstadt, Zemgus Girgensons, Kyle Okposo, Tyson Jost, Peyton Krebs, Jack Quinn, John-Jason Peterka, Rasmus Dahlin, Mattias Samuelsson, Connor Clifton, Erik Johnson, Ilya Lyubushkin, Henri Jokiharju, Jacob Bryson, Riley Stillman, Owen Power, Devon Levi","Jeff Skinner, Tage Thompson, Dylan Cozens, Alex Tuch, Jordan Greenway, Jack Quinn, John-Jason Peterka, Mattias Samuelsson, Connor Clifton, Devon Levi","Jeff Skinner, Tage Thompson, Dylan Cozens, Alex Tuch, Mattias Samuelsson, Connor Clifton","Jeff Skinner, Tage Thompson, Dylan Cozens, Mattias Samuelsson","Tage Thompson, Dylan Cozens, Mattias Samuelsson",13.0
Calgary Flames,CGY,CGY.png,20222023,93,38,west,pacific,none,0.52,+35.42,0.897,0.084,+15,+43,-33,81100000,2400000.0,14,12,6,3,16,15,black,#3568f2,#052ca3,#052ca3,black,black,0.0,0.0,10,51225000.0,6,39200000,4,28650000,3.0,23750000.0,3.0,23750000.0,2400000.0,Craig Conroy,"May 23, 2023",Ryan Huska,"June 12, 2023",28.83,29.8,33.17,34.5,36.33,"Andrew Mangiapane, Daniel Vladar, Mikael Backlund, Blake Coleman, Elias Lindholm, Yegor Sharangovich, Dillon Dube, Matthew Coronato, Adam Ruzicka, Noah Hanifin, Rasmus Andersson, Christopher Tanev, Nikita Zadorov, Dennis Gilbert, Jacob Markstrom, MacKenzie Weegar, Nazem Kadri, Jonathan Huberdeau","Andrew Mangiapane, Daniel Vladar, Blake Coleman, Yegor Sharangovich, Matthew Coronato, Rasmus Andersson, Jacob Markstrom, MacKenzie Weegar, Nazem Kadri, Jonathan Huberdeau","Blake Coleman, Rasmus Andersson, Jacob Markstrom, MacKenzie Weegar, Nazem Kadri, Jonathan Huberdeau","Blake Coleman, MacKenzie Weegar, Nazem Kadri, Jonathan Huberdeau","MacKenzie Weegar, Nazem Kadri, Jonathan Huberdeau",17.0
Carolina Hurricanes,CAR,CAR.png,20222023,113,52,east,metro,top3,0.55,+63.26,0.908,0.082,+34,+39,-26,80676917,2823083.0,7,15,1,1,10,16,#3568f2,black,#052ca3,#052ca3,#3568f2,black,1.0,0.0,9,37145000.0,3,12220000,2,7720000,1.0,4820000.0,1.0,4820000.0,2823083.0,Don Waddell,"May 8, 2018",Rod Brind'Amour,"May 8, 2018",28.68,31.56,30.67,32.0,28.0,"Sebastian Aho, Ryan Suzuki, Seth Jarvis, Jack Drury, Jesper Fast, Jordan Staal, Martin Necas, Michael Bunting, Jesperi Kotkaniemi, Teuvo Teravainen, Jamieson Rees, Vasili Ponomarev, Jordan Martinook, Dmitry Orlov, Stefan Noesen, Antti Raanta, Jalen Chatfield, Brett Pesce, Jaccob Slavin, Brent Burns, Frederik Andersen, Brady Skjei","Jesper Fast, Jordan Staal, Michael Bunting, Jesperi Kotkaniemi, Vasili Ponomarev, Dmitry Orlov, Jaccob Slavin, Brent Burns, Frederik Andersen","Jordan Staal, Michael Bunting, Jesperi Kotkaniemi","Jordan Staal, Jesperi Kotkaniemi",Jesperi Kotkaniemi,11.0
Chicago Blackhawks,CHI,CHI.png,20222023,59,26,west,central,none,0.393,-57.42,0.9,0.084,-81,+25,-45,62571790,20928210.0,29,22,13,31,14,15,red,#fc4d47,black,red,black,black,1.0,0.0,4,24150000.0,2,13900000,1,9500000,1.0,9500000.0,1.0,9500000.0,20928210.0,Kyle Davidson,"October 26, 2021",Luke Richardson,"June 27, 2022",30.0,31.25,32.0,32.0,34.0,"Connor Murphy, Jarred Tinordi, Nikita Zaitsev, Seth Jones, Taylor Raddysh, Boris Katchouk, Reese Johnson, Petr Mrazek, Cole Guttman, Colin Blackwell, Jason Dickinson, Corey Perry, Andreas Athanasiou, Tyler Johnson, Taylor Hall, Nick Foligno, Mackenzie Entwistle","Connor Murphy, Seth Jones, Andreas Athanasiou, Taylor Hall","Connor Murphy, Seth Jones",Seth Jones,Seth Jones,1.0
Colorado Avalanche,COL,COL.png,20222023,109,51,west,central,top3,0.543,+15.62,0.922,0.087,+30,+52,-43,74925000,8575000.0,9,6,12,13,2,12,#3568f2,#052ca3,#3568f2,black,#052ca3,#3568f2,2.0,0.0,10,59425000.0,6,41725000,5,37225000,2.0,18725000.0,2.0,18725000.0,8575000.0,Chris MacFarland,"July 11, 2022",Jared Bednar,"August 25, 2016",28.79,29.1,30.0,30.2,33.5,"Nathan MacKinnon, Pavel Francouz, Alexandar Georgiev, Kurtis MacDermid, Devon Toews, Josh Manson, Samuel Girard, Cale Makar, Mikko Rantanen, Valeri Nichushkin, Artturi Lehkonen, Ryan Johansen, Fredrik Olofsson, Logan O'Connor","Nathan MacKinnon, Alexandar Georgiev, Josh Manson, Samuel Girard, Cale Makar, Mikko Rantanen, Valeri Nichushkin, Artturi Lehkonen, Ryan Johansen, Logan O'Connor","Nathan MacKinnon, Josh Manson, Samuel Girard, Cale Makar, Valeri Nichushkin, Artturi Lehkonen","Nathan MacKinnon, Samuel Girard, Cale Makar, Valeri Nichushkin, Artturi Lehkonen","Nathan MacKinnon, Valeri Nichushkin",21.0
Columbus Blue Jackets,CBJ,CBJ.png,20222023,59,25,east,metro,none,0.387,-47.1,0.896,0.081,-92,+30,-48,78745833,4754167.0,30,20,16,28,17,17,red,#fc4d47,black,red,#fc4d47,#fc4d47,1.0,0.0,12,52575000.0,7,40600000,3,21400000,2.0,16000000.0,2.0,16000000.0,4754167.0,Jarmo Kekalainen,"February 13, 2013",Mike Babcock,"July 1, 2023",26.52,29.08,31.14,32.67,34.5,"Daniil Tarasov, Elvis Merzlikins, Eric Robinson, Adam Boqvist, Andrew Peeke, Erik Gudbranson, Ivan Provorov, Damon Severson, Liam Foudy, Emil Bemstrom, Cole Sillinger, Kirill Marchenko, Kent Johnson, Nick Blankenburg, Johnny Gaudreau, Patrik Laine, Jack Roslovic, Boone Jenner, Sean Kuraly, Mathieu Olivier, Alexandre Texier","Daniil Tarasov, Elvis Merzlikins, Adam Boqvist, Andrew Peeke, Erik Gudbranson, Ivan Provorov, Damon Severson, Johnny Gaudreau, Patrik Laine, Boone Jenner, Sean Kuraly, Mathieu Olivier","Elvis Merzlikins, Andrew Peeke, Erik Gudbranson, Damon Severson, Johnny Gaudreau, Patrik Laine, Boone Jenner","Elvis Merzlikins, Damon Severson, Johnny Gaudreau","Damon Severson, Johnny Gaudreau",14.0
Dallas Stars,DAL,DAL.png,20222023,108,47,west,central,top3,0.561,+25.74,0.919,0.099,+44,+58,-29,82142829,1357171.0,5,2,4,8,4,4,#052ca3,#052ca3,#052ca3,#3568f2,#052ca3,#052ca3,1.0,0.0,13,69131667.0,5,39000000,3,26750000,2.0,16900000.0,2.0,16900000.0,1357171.0,Jim Nill,"April 29, 2013",Peter DeBoer,"June 21, 2022",29.67,30.46,29.2,30.67,30.5,"Jamie Benn, Matt Duchene, Roope Hintz, Jason Robertson, Mason Marchment, Joe Pavelski, Radek Faksa, Evgeni Dadonov, Miro Heiskanen, Wyatt Johnston, Sam Steel, Esa Lindell, Ryan Suter, Jani Hakanpaa, Nils Lundkvist, Craig Smith, Thomas Harley, Jake Oettinger, Scott Wedgewood, Joel Hanley, Tyler Seguin","Jamie Benn, Roope Hintz, Jason Robertson, Mason Marchment, Radek Faksa, Evgeni Dadonov, Miro Heiskanen, Wyatt Johnston, Esa Lindell, Ryan Suter, Jake Oettinger, Joel Hanley, Tyler Seguin","Roope Hintz, Jason Robertson, Mason Marchment, Miro Heiskanen, Tyler Seguin","Roope Hintz, Miro Heiskanen, Tyler Seguin","Roope Hintz, Miro Heiskanen",26.0
Detroit Red Wings,DET,DET.png,20222023,80,35,east,atlantic,none,0.462,-14.12,0.9,0.095,-28,+40,-45,63893056,19606944.0,25,14,13,23,14,8,red,black,black,#fc4d47,black,#3568f2,1.0,0.0,11,42368333.0,6,26793333,2,14325000,1.0,8700000.0,1.0,8700000.0,19606944.0,Steve Yzerman,"April 19, 2019",Derek Lalonde,"June 30, 2022",27.71,28.64,30.17,31.0,32.0,"Filip Zadina, James Reimer, Ville Husso, Moritz Seider, Gustav Lindstrom, Olli Maatta, Jake Walman, Justin Holl, Ben Chiarot, Austin Czarnik, Matt Luff, Marco Kasper, Dylan Larkin, Andrew Copp, David Perron, Robby Fabbri, Lucas Raymond, Klim Kostin, Daniel Sprong, Dominik Kubalik, Jonatan Berggren","Filip Zadina, Ville Husso, Olli Maatta, Jake Walman, Justin Holl, Ben Chiarot, Marco Kasper, Dylan Larkin, Andrew Copp, Robby Fabbri, Klim Kostin","Jake Walman, Justin Holl, Ben Chiarot, Marco Kasper, Dylan Larkin, Andrew Copp","Dylan Larkin, Andrew Copp",Dylan Larkin,4.0
Edmonton Oilers,EDM,EDM.png,20222023,109,50,west,pacific,top3,0.541,+35.16,0.912,0.098,+32,+76,-41,77880000,5620000.0,8,1,10,4,7,5,#3568f2,#052ca3,#3568f2,#052ca3,#3568f2,#052ca3,2.0,0.0,13,67275000.0,9,53850000,4,24875000,3.0,19875000.0,2.0,14375000.0,5620000.0,Ken Holland,"May 7, 2019",Jay Woodcroft,"February 10, 2022",29.05,31.23,32.22,34.0,35.67,"Stuart Skinner, Jack Campbell, Markus Niemelainen, Vincent Desharnais, Warren Foegele, Brett Kulak, Connor McDavid, Leon Draisaitl, Zach Hyman, Evander Kane, Ryan Nugent-Hopkins, Mattias Janmark, Dylan Holloway, Derek Ryan, Connor Brown, Lane Pederson, Darnell Nurse, Mattias Ekholm, Cody Ceci, Philip Broberg","Stuart Skinner, Jack Campbell, Brett Kulak, Connor McDavid, Leon Draisaitl, Zach Hyman, Evander Kane, Ryan Nugent-Hopkins, Derek Ryan, Lane Pederson, Darnell Nurse, Mattias Ekholm, Cody Ceci","Stuart Skinner, Jack Campbell, Brett Kulak, Connor McDavid, Zach Hyman, Evander Kane, Ryan Nugent-Hopkins, Darnell Nurse, Mattias Ekholm","Jack Campbell, Zach Hyman, Ryan Nugent-Hopkins, Darnell Nurse","Zach Hyman, Ryan Nugent-Hopkins, Darnell Nurse",27.0
Florida Panthers,FLA,FLA.png,20222023,92,42,east,atlantic,top3,0.533,+22.74,0.908,0.09,+26,+54,-56,78262501,5237499.0,11,4,19,10,10,11,#3568f2,#052ca3,#fc4d47,#3568f2,#3568f2,#3568f2,1.0,0.0,7,46366667.0,3,29500000,2,19500000,2.0,19500000.0,2.0,19500000.0,5237499.0,Bill Zito,"September 2, 2020",Paul Maurice,"June 22, 2022",28.4,30.57,31.67,30.0,32.0,"Nick Cousins, Sergei Bobrovsky, Lucas Carlsson, Josh Mahura, Mike Reilly, Oliver Ekman-Larsson, Gustav Forsling, Brandon Montour, Aaron Ekblad, Ryan Lomberg, Aleksander Barkov, Matthew Tkachuk, Sam Reinhart, Sam Bennett, Carter Verhaeghe, Anthony Duclair, Eetu Luostarinen, Kevin Stenlund, Anton Lundell, Zac Dalpe","Sergei Bobrovsky, Aaron Ekblad, Aleksander Barkov, Matthew Tkachuk, Sam Bennett, Carter Verhaeghe, Zac Dalpe","Sergei Bobrovsky, Aleksander Barkov, Matthew Tkachuk","Aleksander Barkov, Matthew Tkachuk","Aleksander Barkov, Matthew Tkachuk",30.0
Los Angeles Kings,LAK,LAK.png,20222023,104,47,west,pacific,top3,0.522,+24.8,0.902,0.09,+16,+54,-52,84196667,-696667.0,13,4,18,9,12,11,black,#052ca3,#fc4d47,#3568f2,#3568f2,#3568f2,0.0,0.0,10,54438333.0,8,47563333,6,41200000,4.0,24700000.0,3.0,20500000.0,-696667.0,Rob Blake,"April 10, 2017",Todd McLellan,"April 16, 2019",28.18,28.6,29.5,31.67,31.75,"Pheonix Copley, Vladislav Gavrikov, Cam Talbot, Jordan Spence, Brandt Clarke, Andreas Englund, Matt Roy, Michael Anderson, Drew Doughty, Carl Grundstrom, Jaret Anderson-Dolan, Arthur Kaliyev, Quinton Byfield, Blake Lizotte, Trevor Moore, Viktor Arvidsson, Adrian Kempe, Phillip Danault, Kevin Fiala, Trevor Lewis, Pierre-Luc Dubois, Anze Kopitar","Vladislav Gavrikov, Brandt Clarke, Andreas Englund, Michael Anderson, Drew Doughty, Trevor Moore, Adrian Kempe, Phillip Danault, Kevin Fiala, Pierre-Luc Dubois","Brandt Clarke, Michael Anderson, Drew Doughty, Trevor Moore, Adrian Kempe, Phillip Danault, Kevin Fiala, Pierre-Luc Dubois","Michael Anderson, Drew Doughty, Trevor Moore, Phillip Danault, Kevin Fiala, Pierre-Luc Dubois","Michael Anderson, Trevor Moore, Kevin Fiala, Pierre-Luc Dubois",22.0
Minnesota Wild,MIN,MIN.png,20222023,103,46,west,central,top3,0.508,+1.53,0.922,0.085,+5,+46,-29,75206088,8293912.0,15,10,4,17,2,14,black,#3568f2,#052ca3,#fc4d47,#052ca3,black,3.0,0.0,9,42575000.0,6,36925000,5,27925000,4.0,20350000.0,2.0,12250000.0,8293912.0,Bill Guerin,"August 21, 2019",Dean Evason,"February 14, 2020",30.44,30.44,30.67,32.0,32.75,"Kirill Kaprizov, Matthew Boldy, Mats Zuccarello, Joel Eriksson Ek, Marcus Foligno, Frederick Gaudreau, Marcus Johansson, Ryan Hartman, Connor Dewar, Jared Spurgeon, Jonas Brodin, Jacob Middleton, Alex Goligoski, Marc-Andre Fleury, Hunter Jones, Jon Merrill","Kirill Kaprizov, Matthew Boldy, Joel Eriksson Ek, Frederick Gaudreau, Marcus Johansson, Jared Spurgeon, Jonas Brodin, Jacob Middleton, Jon Merrill","Kirill Kaprizov, Matthew Boldy, Joel Eriksson Ek, Frederick Gaudreau, Jared Spurgeon, Jonas Brodin","Matthew Boldy, Joel Eriksson Ek, Frederick Gaudreau, Jared Spurgeon, Jonas Brodin","Matthew Boldy, Joel Eriksson Ek, Frederick Gaudreau, Jonas Brodin",16.0
Montreal Canadiens,MTL,MTL.png,20222023,68,31,east,atlantic,none,0.442,-56.74,0.897,0.096,-46,+30,-65,83009166,490834.0,26,20,20,30,16,7,red,#fc4d47,#fc4d47,red,black,#3568f2,1.0,0.0,14,48855000.0,5,28112500,3,19875000,1.0,7875000.0,1.0,7875000.0,490834.0,Kent Hughes,"January 18, 2022",Martin St. Louis,"February 9, 2022",28.05,28.79,29.8,31.67,29.0,"Mike Hoffman, Samuel Montembeault, Jake Allen, Johnathan Kovacevic, Kaiden Guhle, Justin Barron, Jordan Harris, David Savard, Michael Matheson, Michael Pezzetta, Rem Pitlick, Jake Evans, Kirby Dach, Joel Armia, Christian Dvorak, Josh Anderson, Brendan Gallagher, Nick Suzuki, Chris Wideman","Jake Allen, Johnathan Kovacevic, Kaiden Guhle, Jordan Harris, David Savard, Michael Matheson, Michael Pezzetta, Jake Evans, Kirby Dach, Joel Armia, Christian Dvorak, Josh Anderson, Brendan Gallagher, Nick Suzuki","Michael Matheson, Kirby Dach, Josh Anderson, Brendan Gallagher, Nick Suzuki","Josh Anderson, Brendan Gallagher, Nick Suzuki",Nick Suzuki,8.0
Nashville Predators,NSH,NSH.png,20222023,92,42,west,central,none,0.491,-17.34,0.92,0.086,-6,+35,-39,72220865,11279135.0,18,17,9,24,3,13,#fc4d47,#fc4d47,#3568f2,red,#052ca3,black,1.0,0.0,10,39376143.0,6,27916143,2,13559000,1.0,9059000.0,0.0,0.0,11279135.0,David Poile,"July 9, 1997",Andrew Brunette,"May 31, 2023",28.9,31.6,34.17,36.5,39.0,"Kevin Lankinen, Juuse Saros, Jake Livingstone, Juuso Parssinen, Dante Fabbro, Luke Schenn, Tyson Barrie, Thomas Novak, Michael McCarron, Kiefer Sherwood, Cole Smith, Jeremy Lauzon, Ryan O'Reilly, Gustav Nyquist, Colton Sissons, Cody Glass, Yakov Trenin, Philip Tomasino, Roman Josi, Ryan McDonagh","Juuse Saros, Jake Livingstone, Luke Schenn, Jeremy Lauzon, Ryan O'Reilly, Gustav Nyquist, Colton Sissons, Cody Glass, Roman Josi, Ryan McDonagh","Luke Schenn, Jeremy Lauzon, Ryan O'Reilly, Colton Sissons, Roman Josi, Ryan McDonagh","Ryan O'Reilly, Roman Josi",Roman Josi,3.0
New Jersey Devils,NJD,NJD.png,20222023,112,52,east,metro,top3,0.572,+57.78,0.912,0.095,+56,+33,-29,77892500,5607500.0,2,18,4,2,7,8,#052ca3,#fc4d47,#052ca3,#052ca3,#3568f2,#3568f2,1.0,0.0,13,64550000.0,9,57875000,8,54725000,5.0,37075000.0,3.0,24675000.0,5607500.0,Tom Fitzgerald,"January 12, 2020",Lindy Ruff,"July 9, 2020",27.58,28.23,29.89,30.25,31.6,"Jack Hughes, Jesper Bratt, Nico Hischier, Ondrej Palat, Tyler Toffoli, Timo Meier, Michael McLeod, Nathan Bastian, Curtis Lazar, Erik Haula, Dougie Hamilton, John Marino, Jonas Siegenthaler, Colin Miller, Akira Schmid, Vitek Vanecek, Luke Hughes, Dawson Mercer, Brendan Smith","Jack Hughes, Jesper Bratt, Nico Hischier, Ondrej Palat, Timo Meier, Nathan Bastian, Curtis Lazar, Erik Haula, Dougie Hamilton, John Marino, Jonas Siegenthaler, Vitek Vanecek, Luke Hughes","Jack Hughes, Jesper Bratt, Nico Hischier, Ondrej Palat, Timo Meier, Erik Haula, Dougie Hamilton, John Marino, Jonas Siegenthaler","Jack Hughes, Jesper Bratt, Nico Hischier, Ondrej Palat, Timo Meier, Dougie Hamilton, John Marino, Jonas Siegenthaler","Jack Hughes, Jesper Bratt, Timo Meier, Dougie Hamilton, Jonas Siegenthaler",23.0
New York Islanders,NYI,NYI.png,20222023,93,42,east,metro,wc,0.539,-3.75,0.92,0.093,+28,+24,-27,73163333,10336667.0,10,23,2,18,3,9,#3568f2,#fc4d47,#052ca3,#fc4d47,#052ca3,#3568f2,1.0,0.0,14,64225000.0,8,45150000,5,32050000,4.0,29550000.0,4.0,29550000.0,10336667.0,Lou Lamoriello,"June 5, 2018",Lane Lambert,"May 16, 2022",29.21,29.93,32.12,32.4,33.5,"Mathew Barzal, Bo Horvat, Anders Lee, Cal Clutterbuck, Jean-Gabriel Pageau, Brock Nelson, Kyle Palmieri, Casey Cizikas, Matt Martin, Ross Johnston, Hudson Fasching, Ryan Pulock, Adam Pelech, Simon Holmstrom, Alexander Romanov, Sebastian Aho, Samuel Bolduc, Ilya Sorokin, Noah Dobson","Mathew Barzal, Bo Horvat, Anders Lee, Jean-Gabriel Pageau, Brock Nelson, Kyle Palmieri, Casey Cizikas, Ross Johnston, Hudson Fasching, Ryan Pulock, Adam Pelech, Alexander Romanov, Samuel Bolduc, Noah Dobson","Mathew Barzal, Bo Horvat, Anders Lee, Jean-Gabriel Pageau, Casey Cizikas, Ross Johnston, Ryan Pulock, Adam Pelech","Mathew Barzal, Bo Horvat, Casey Cizikas, Ryan Pulock, Adam Pelech","Mathew Barzal, Bo Horvat, Ryan Pulock, Adam Pelech",25.0
New York Rangers,NYR,NYR.png,20222023,107,47,east,metro,top3,0.549,-4.05,0.919,0.097,+35,+48,-26,75724583,7775417.0,6,8,1,19,4,6,#052ca3,#3568f2,#052ca3,#fc4d47,#052ca3,#052ca3,2.0,0.0,12,65876191.0,8,57847024,6,38204167,3.0,23625000.0,3.0,23625000.0,7775417.0,Chris Drury,"May 5, 2021",Peter Laviolette,"June 13, 2023",30.05,30.75,31.62,32.17,34.0,"Kaapo Kakko, Artemi Panarin, Mika Zibanejad, Chris Kreider, Vincent Trocheck, Filip Chytil, Barclay Goodrow, Blake Wheeler, Jacob Trouba, Jimmy Vesey, Nick Bonino, Tyler Pitlick, Alex Belzile, Adam Fox, Ryan Lindgren, Braden Schneider, Ben Harpur, Igor Shesterkin, Jonathan Quick","Artemi Panarin, Mika Zibanejad, Chris Kreider, Vincent Trocheck, Filip Chytil, Barclay Goodrow, Jacob Trouba, Jimmy Vesey, Alex Belzile, Adam Fox, Ben Harpur, Igor Shesterkin","Artemi Panarin, Mika Zibanejad, Chris Kreider, Vincent Trocheck, Filip Chytil, Barclay Goodrow, Jacob Trouba, Adam Fox","Mika Zibanejad, Chris Kreider, Vincent Trocheck, Filip Chytil, Barclay Goodrow, Adam Fox","Mika Zibanejad, Vincent Trocheck, Adam Fox",24.0
Ottawa Senators,OTT,OTT.png,20222023,86,39,east,atlantic,none,0.465,+16.36,0.902,0.08,-25,+58,-45,73229047,10270953.0,22,2,13,12,12,18,#fc4d47,#052ca3,black,#3568f2,#3568f2,#fc4d47,2.0,0.0,11,53820714.0,7,41080714,6,38130714,4.0,28555714.0,1.0,8350000.0,10270953.0,Pierre Dorion,"April 10, 2016",D. J. Smith,"May 23, 2019",26.07,27.82,28.29,29.17,30.75,"Artem Zub, Joonas Korpisalo, Jacob Bernard-Docker, Jake Sanderson, Erik Brannstrom, Jakob Chychrun, Thomas Chabot, Tim Stutzle, Brady Tkachuk, Claude Giroux, Drake Batherson, Mark Kastelic, Mathieu Joseph, Parker Kelly","Artem Zub, Joonas Korpisalo, Jacob Bernard-Docker, Jakob Chychrun, Thomas Chabot, Tim Stutzle, Brady Tkachuk, Claude Giroux, Drake Batherson, Mark Kastelic, Mathieu Joseph","Artem Zub, Joonas Korpisalo, Thomas Chabot, Tim Stutzle, Brady Tkachuk, Drake Batherson, Mathieu Joseph","Artem Zub, Joonas Korpisalo, Thomas Chabot, Tim Stutzle, Brady Tkachuk, Drake Batherson","Joonas Korpisalo, Thomas Chabot, Tim Stutzle, Brady Tkachuk",28.0
Philadelphia Flyers,PHI,PHI.png,20222023,75,31,east,metro,none,0.463,-22.98,0.906,0.084,-27,+25,-45,74527095,8972905.0,24,22,13,26,11,15,red,#fc4d47,black,red,#3568f2,black,3.0,0.0,7,31600000.0,5,21100000,3,16350000,2.0,11250000.0,1.0,6250000.0,8972905.0,Daniel Briere,"March 10, 2023",John Tortorella,"June 17, 2022",27.69,29.57,30.8,30.0,31.0,"Nick Seeler, Sean Walker, Anthony Deangelo, Rasmus Ristolainen, Travis Sanheim, Nicolas Deslauriers, Wade Allison, Ryan Poehling, Owen Tippett, Scott Laughton, Joel Farabee, Travis Konecny, Cal Petersen, Tanner Laczynski, Carter Hart, Felix Sandstrom","Rasmus Ristolainen, Travis Sanheim, Nicolas Deslauriers, Scott Laughton, Joel Farabee, Travis Konecny, Cal Petersen","Rasmus Ristolainen, Travis Sanheim, Nicolas Deslauriers, Scott Laughton, Joel Farabee","Rasmus Ristolainen, Travis Sanheim, Joel Farabee","Travis Sanheim, Joel Farabee",5.0
Pittsburgh Penguins,PIT,PIT.png,20222023,91,40,east,metro,none,0.495,+27.01,0.911,0.082,-4,+47,-46,69191842,14308158.0,17,9,14,7,8,16,#fc4d47,#3568f2,black,#3568f2,#3568f2,black,1.0,0.0,11,54950175.0,4,22325000,3,16225000,3.0,16225000.0,0.0,0.0,14308158.0,Kyle Dubas (Interim),"June 1, 2023",Mike Sullivan,"December 12, 2015",32.41,34.27,36.25,36.33,38.33,"Bryan Rust, Jeff Carter, Reilly Smith, Rickard Rakell, Mikael Granlund, Jake Guentzel, Evgeni Malkin, Matt Nieto, Alexander Nylander, Jeff Petry, Kris Letang, Marcus Pettersson, Jan Rutta, Pierre-Olivier Joseph, Chad Ruhwedel, Casey DeSmith, Sidney Crosby","Bryan Rust, Reilly Smith, Rickard Rakell, Mikael Granlund, Evgeni Malkin, Matt Nieto, Jeff Petry, Kris Letang, Marcus Pettersson, Jan Rutta, Sidney Crosby","Bryan Rust, Rickard Rakell, Evgeni Malkin, Kris Letang","Bryan Rust, Rickard Rakell, Kris Letang","Bryan Rust, Rickard Rakell, Kris Letang",20.0
San Jose Sharks,SJS,SJS.png,20222023,60,22,west,pacific,none,0.426,-10.2,0.884,0.092,-63,+25,-37,74445834,9054166.0,27,22,8,21,18,10,red,#fc4d47,#3568f2,#fc4d47,#fc4d47,#3568f2,1.0,0.0,12,47500833.0,8,41100833,3,27637500,1.0,8137500.0,1.0,8137500.0,9054166.0,Mike Grier,"July 5, 2022",David Quinn,"July 21, 2022",28.43,30.0,32.0,36.0,35.0,"Marc-Edouard Vlasic, Erik Karlsson, Jacob Peterson, Givani Smith, William Eklund, Mario Ferraro, Steven Lorentz, Oskar Lindblom, Alexander Barabanov, Kevin Labanc, Logan Couture, Nico Sturm, Radim Simek, Nikolai Knyzhov, Matthew Benning, Mackenzie Blackwood, Kaapo Kahkonen, Jacob MacDonald, Henry Thrun, Kyle Burroughs, Tomas Hertl","Marc-Edouard Vlasic, Erik Karlsson, Givani Smith, William Eklund, Mario Ferraro, Logan Couture, Nico Sturm, Nikolai Knyzhov, Matthew Benning, Mackenzie Blackwood, Kyle Burroughs, Tomas Hertl","Marc-Edouard Vlasic, Erik Karlsson, William Eklund, Mario Ferraro, Logan Couture, Matthew Benning, Kyle Burroughs, Tomas Hertl","Erik Karlsson, Logan Couture, Tomas Hertl",Tomas Hertl,9.0
St. Louis Blues,STL,STL.png,20222023,81,37,west,central,none,0.476,-47.97,0.9,0.103,-20,+32,-52,80364762,3135238.0,20,19,18,29,14,3,#fc4d47,#fc4d47,#fc4d47,red,black,#052ca3,1.0,0.0,13,67757262.0,10,60321429,7,48250000,4.0,29250000.0,3.0,22750000.0,3135238.0,Doug Armstrong,"July 1, 2010",Craig Berube,"November 19, 2018",29.55,30.15,32.4,32.71,33.25,"Samuel Blais, Kasperi Kapanen, Kevin Hayes, Brandon Saad, Pavel Buchnevich, Brayden Schenn, Robert Thomas, Jordan Kyrou, Jakub Vrana, Jake Neighbours, Nathan Walker, Justin Faulk, Torey Krug, Colton Parayko, Nick Leddy, Marco Scandella, Robert Bortuzzo, Tyler Tucker, Calle Rosen, Jordan Binnington","Kevin Hayes, Brandon Saad, Pavel Buchnevich, Brayden Schenn, Robert Thomas, Jordan Kyrou, Jake Neighbours, Justin Faulk, Torey Krug, Colton Parayko, Nick Leddy, Tyler Tucker, Jordan Binnington","Kevin Hayes, Brandon Saad, Brayden Schenn, Robert Thomas, Jordan Kyrou, Justin Faulk, Torey Krug, Colton Parayko, Nick Leddy, Jordan Binnington","Brayden Schenn, Robert Thomas, Jordan Kyrou, Justin Faulk, Torey Krug, Colton Parayko, Jordan Binnington","Brayden Schenn, Robert Thomas, Jordan Kyrou, Colton Parayko",6.0
