full,team,logo,season,PTS,W,Conference,Division,playoffs,gf%,xg_dif,sv%,shooting%,g_dif,PP_g_dif,PK_g_dif,projected_cap_hit,projected_cap_space,5on5_rank,PP_rank,PK_rank,XG_dif_rank,Save%_rank,Shooting%_rank,5on5_color,PP_color,PK_color,xg_color,sv_color,sh_color,expiring_contracts,expiring_salary,nhl_contracts_2324,2023-24 Salary,nhl_contracts_2425,2024-25 Salary,nhl_contracts_2526,2025-26 Salary,nhl_contracts_2627,2026-27 Salary,nhl_contracts_2728,2027-28 Salary,cap_remaining,GM,gm_start,coach,coach_start,avg_age_2324,avg_age_2425,avg_age_2526,avg_age_2627,avg_age_2728,players_under_contract_2324,players_under_contract_2425,players_under_contract_2526,players_under_contract_2627,players_under_contract_2728,draft_capital_rank
Anaheim Ducks,ANA,ANA.png,20222023,58,23,west,pacific,none,0.397,-73.0,0.908,0.085,-80,+28,-73,68694437,13805563.0,27,21,22,32,13,14,red,#fc4d47,#fc4d47,red,black,black,0.0,0.0,15,43601667.0,6,25194167,3,17900000,2,11400000,0.0,0.0,13805563.0,Pat Verbeek,"February 3, 2022",Dallas Eakins,"June 17, 2019",27.8,29.83,32.67,33.0,,"Max Jones, John Gibson, Colton White, Jackson LaCombe, Cam Fowler, Brett Leason, Sam Carrick, Mason McTavish, Adam Henrique, Jakob Silfverberg, Nikita Nesterenko, Isac Lundestrom, Brock McGinn, Frank Vatrano, Ryan Strome","John Gibson, Cam Fowler, Mason McTavish, Brock McGinn, Frank Vatrano, Ryan Strome","John Gibson, Cam Fowler, Ryan Strome","John Gibson, Ryan Strome",,7.0
Arizona Coyotes,ARI,ARI.png,20222023,69,28,west,central,none,0.46,-46.13,0.909,0.098,-29,+37,-72,66868138,15631862.0,24,14,21,29,12,6,red,black,#fc4d47,red,#3568f2,#052ca3,0.0,0.0,13,34050000.0,4,20025000,3,17300000,2,11450000,1.0,7150000.0,15631862.0,Bill Armstrong,"September 17, 2020",Andre Tourigny,"July 1, 2021",27.23,27.5,28.33,28.5,30.0,"Clayton Keller, Lawson Crouse, Zack Kassian, Barrett Hayton, Travis Boyd, Liam O'Brien, Patrik Nemeth, Juuso Valimaki, Joshua Brown, J.J. Moser, Victor Soderstrom, Karel Vejmelka, Nick Schmaltz","Clayton Keller, Lawson Crouse, Karel Vejmelka, Nick Schmaltz","Clayton Keller, Lawson Crouse, Nick Schmaltz","Clayton Keller, Lawson Crouse",Clayton Keller,1.0
Boston Bruins,BOS,BOS.png,20222023,-123,64,east,atlantic,none,0.636,+29.4,0.936,0.103,+91,+49,-26,84044570,-1544570.0,1,7,1,6,1,3,#052ca3,#3568f2,#052ca3,#052ca3,#052ca3,#052ca3,0.0,0.0,13,68062500.0,9,58475000,6,41350000,5,36100000,3.0,27250000.0,-1544570.0,Don Sweeney,"May 20, 2015",Jim Montgomery,"July 1, 2022",29.0,30.56,30.17,30.4,32.67,"David Pastrnak, Brad Marchand, Taylor Hall, Charlie Coyle, Jake DeBrusk, Pavel Zacha, AJ Greer, Charlie McAvoy, Hampus Lindholm, Brandon Carlo, Matt Grzelcyk, Jakub Zboril, Linus Ullmark","David Pastrnak, Brad Marchand, Taylor Hall, Charlie Coyle, Pavel Zacha, Charlie McAvoy, Hampus Lindholm, Brandon Carlo, Linus Ullmark","David Pastrnak, Charlie Coyle, Pavel Zacha, Charlie McAvoy, Hampus Lindholm, Brandon Carlo","David Pastrnak, Pavel Zacha, Charlie McAvoy, Hampus Lindholm, Brandon Carlo","David Pastrnak, Charlie McAvoy, Hampus Lindholm",31.0
Buffalo Sabres,BUF,BUF.png,20222023,87,40,east,atlantic,none,0.481,-13.07,0.896,0.099,-16,+49,-48,65395356,17104644.0,17,7,16,23,19,5,#fc4d47,#3568f2,black,#fc4d47,#fc4d47,#052ca3,0.0,0.0,20,64040237.0,9,37922737,5,32278571,4,27528571,3.0,18528571.0,17104644.0,Kevyn Adams,"June 16, 2020",Don Granato,"March 17, 2021",25.15,25.89,28.2,29.0,29.33,"Jack Quinn, John-Jason Peterka, Tage Thompson, Casey Mittelstadt, Jordan Greenway, Victor Olofsson, Alex Tuch, Jeff Skinner, Rasmus Dahlin, Ilya Lyubushkin, Henri Jokiharju, Jacob Bryson, Riley Stillman, Mattias Samuelsson, Owen Power, Eric Comrie, Devon Levi, Ukko-Pekka Luukkonen, Dylan Cozens, Peyton Krebs","Jack Quinn, John-Jason Peterka, Tage Thompson, Jordan Greenway, Alex Tuch, Jeff Skinner, Mattias Samuelsson, Devon Levi, Dylan Cozens","Tage Thompson, Alex Tuch, Jeff Skinner, Mattias Samuelsson, Dylan Cozens","Tage Thompson, Jeff Skinner, Mattias Samuelsson, Dylan Cozens","Tage Thompson, Mattias Samuelsson, Dylan Cozens",14.0
Calgary Flames,CGY,CGY.png,20222023,91,37,west,pacific,none,0.518,+33.78,0.896,0.084,+13,+43,-33,82280221,219779.0,13,10,6,4,19,15,black,#3568f2,#052ca3,#052ca3,#fc4d47,black,0.0,0.0,19,80463333.0,9,48125000,6,39200000,4,28650000,3.0,23750000.0,219779.0,Brad Treliving,"April 28, 2014",Darryl Sutter,"March 4, 2021",28.63,30.0,33.0,34.25,36.0,"Andrew Mangiapane, Mikael Backlund, Jonathan Huberdeau, Jacob Markstrom, Nazem Kadri, Blake Coleman, Elias Lindholm, Tyler Toffoli, Dillon Dube, Matthew Coronato, Jakob Pelletier, Daniel Vladar, Adam Ruzicka, Noah Hanifin, Rasmus Andersson, Christopher Tanev, Nikita Zadorov, MacKenzie Weegar, Dennis Gilbert","Andrew Mangiapane, Jonathan Huberdeau, Jacob Markstrom, Nazem Kadri, Blake Coleman, Matthew Coronato, Daniel Vladar, Rasmus Andersson, MacKenzie Weegar","Jonathan Huberdeau, Jacob Markstrom, Nazem Kadri, Blake Coleman, Rasmus Andersson, MacKenzie Weegar","Jonathan Huberdeau, Nazem Kadri, Blake Coleman, MacKenzie Weegar","Jonathan Huberdeau, Nazem Kadri, MacKenzie Weegar",18.0
Carolina Hurricanes,CAR,CAR.png,20222023,111,51,east,metro,top3,0.548,+62.29,0.909,0.08,+32,+39,-26,87703858,-5203858.0,7,13,1,1,12,18,#3568f2,black,#052ca3,#052ca3,#3568f2,#fc4d47,0.0,0.0,13,46679417.0,3,15400000,1,4820000,1,4820000,1.0,4820000.0,-5203858.0,Don Waddell,"May 8, 2018",Rod Brind'Amour,"May 8, 2018",28.08,31.33,25.0,26.0,28.0,"Brett Pesce, Brent Burns, Jaccob Slavin, Stefan Noesen, Seth Jarvis, Jack Drury, Jordan Martinook, Martin Necas, Jesperi Kotkaniemi, Teuvo Teravainen, Sebastian Aho, Jalen Chatfield, Brady Skjei","Brent Burns, Jaccob Slavin, Jesperi Kotkaniemi",Jesperi Kotkaniemi,Jesperi Kotkaniemi,Jesperi Kotkaniemi,13.0
Chicago Blackhawks,CHI,CHI.png,20222023,58,26,west,central,none,0.391,-57.2,0.9,0.084,-81,+24,-44,77393951,5106049.0,28,23,12,31,17,15,red,#fc4d47,#3568f2,red,#fc4d47,black,0.0,0.0,14,37283333.0,3,14816667,2,13900000,1,9500000,1.0,9500000.0,5106049.0,Kyle Davidson,"October 26, 2021",Luke Richardson,"June 27, 2022",28.14,28.0,32.0,32.0,34.0,"Jason Dickinson, Tyler Johnson, Colin Blackwell, Cole Guttman, Mackenzie Entwistle, Reese Johnson, Boris Katchouk, Taylor Raddysh, Seth Jones, Nikita Zaitsev, Connor Murphy, Wyatt Kaiser, Jarred Tinordi, Petr Mrazek","Seth Jones, Connor Murphy, Wyatt Kaiser","Seth Jones, Connor Murphy",Seth Jones,Seth Jones,2.0
Colorado Avalanche,COL,COL.png,20222023,105,49,west,central,top3,0.538,+13.07,0.922,0.086,+26,+52,-42,83946258,-1446258.0,11,6,11,14,2,13,#3568f2,#052ca3,#3568f2,black,#052ca3,black,0.0,0.0,13,63275000.0,9,55425000,6,41725000,5,37225000,2.0,18725000.0,-1446258.0,Chris MacFarland,"July 11, 2022",Jared Bednar,"August 25, 2016",29.0,28.67,29.83,30.0,33.5,"Mikko Rantanen, Pavel Francouz, Brad Hunt, Nathan MacKinnon, Valeri Nichushkin, Artturi Lehkonen, Alexandar Georgiev, Logan O'Connor, Kurtis MacDermid, Devon Toews, Josh Manson, Cale Makar, Samuel Girard","Mikko Rantanen, Nathan MacKinnon, Valeri Nichushkin, Artturi Lehkonen, Alexandar Georgiev, Logan O'Connor, Josh Manson, Cale Makar, Samuel Girard","Nathan MacKinnon, Valeri Nichushkin, Artturi Lehkonen, Josh Manson, Cale Makar, Samuel Girard","Nathan MacKinnon, Valeri Nichushkin, Artturi Lehkonen, Cale Makar, Samuel Girard","Nathan MacKinnon, Valeri Nichushkin",26.0
Columbus Blue Jackets,CBJ,CBJ.png,20222023,57,24,east,metro,none,0.387,-46.12,0.895,0.082,-90,+29,-46,81522704,977296.0,29,20,14,28,20,17,red,#fc4d47,black,red,#fc4d47,#fc4d47,0.0,0.0,16,50337500.0,9,40400000,6,34350000,2,15150000,1.0,9750000.0,977296.0,Jarmo Kekalainen,"February 13, 2013",Brad Larsen,"June 10, 2021",26.19,28.44,30.67,32.5,35.0,"Erik Gudbranson, Adam Boqvist, Andrew Peeke, Elvis Merzlikins, Nick Blankenburg, Liam Foudy, Emil Bemstrom, Kirill Marchenko, Kent Johnson, Hunter McKown, Eric Robinson, Sean Kuraly, Boone Jenner, Jack Roslovic, Johnny Gaudreau, Patrik Laine","Erik Gudbranson, Adam Boqvist, Andrew Peeke, Elvis Merzlikins, Hunter McKown, Sean Kuraly, Boone Jenner, Johnny Gaudreau, Patrik Laine","Erik Gudbranson, Andrew Peeke, Elvis Merzlikins, Boone Jenner, Johnny Gaudreau, Patrik Laine","Elvis Merzlikins, Johnny Gaudreau",Johnny Gaudreau,8.0
Dallas Stars,DAL,DAL.png,20222023,104,45,west,central,top3,0.559,+23.22,0.918,0.1,+42,+55,-28,82372829,127171.0,5,3,3,10,5,4,#052ca3,#052ca3,#052ca3,#3568f2,#052ca3,#052ca3,0.0,0.0,17,75732500.0,11,66094167,5,39000000,3,26750000,2.0,16900000.0,127171.0,Jim Nill,"April 29, 2013",Peter DeBoer,"June 21, 2022",28.82,29.36,29.0,30.67,30.5,"Colin Miller, Scott Wedgewood, Jake Oettinger, Thomas Harley, Nils Lundkvist, Jani Hakanpaa, Ryan Suter, Miro Heiskanen, Wyatt Johnston, Roope Hintz, Radek Faksa, Mason Marchment, Esa Lindell, Tyler Seguin, Joe Pavelski, Jamie Benn, Jason Robertson","Jake Oettinger, Ryan Suter, Miro Heiskanen, Wyatt Johnston, Roope Hintz, Radek Faksa, Mason Marchment, Esa Lindell, Tyler Seguin, Jamie Benn, Jason Robertson","Miro Heiskanen, Roope Hintz, Mason Marchment, Tyler Seguin, Jason Robertson","Miro Heiskanen, Roope Hintz, Tyler Seguin","Miro Heiskanen, Roope Hintz",25.0
Detroit Red Wings,DET,DET.png,20222023,80,35,east,atlantic,none,0.467,-11.39,0.9,0.097,-24,+40,-44,74492506,8007494.0,21,12,12,22,17,7,#fc4d47,#3568f2,#3568f2,#fc4d47,#fc4d47,#3568f2,0.0,0.0,15,47725833.0,9,37000000,4,22475000,2,14325000,1.0,8700000.0,8007494.0,Steve Yzerman,"April 19, 2019",Derek Lalonde,"June 30, 2022",27.2,28.33,31.0,31.0,32.0,"Andrew Copp, David Perron, Ville Husso, Dylan Larkin, Robby Fabbri, Dominik Kubalik, Filip Zadina, Marco Kasper, Jonatan Berggren, Austin Czarnik, Lucas Raymond, Ben Chiarot, Olli Maatta, Moritz Seider, Jake Walman","Andrew Copp, Ville Husso, Dylan Larkin, Robby Fabbri, Filip Zadina, Marco Kasper, Ben Chiarot, Olli Maatta, Jake Walman","Andrew Copp, Dylan Larkin, Ben Chiarot, Jake Walman","Andrew Copp, Dylan Larkin",Dylan Larkin,4.0
Edmonton Oilers,EDM,EDM.png,20222023,107,49,west,pacific,top3,0.539,+34.22,0.912,0.097,+30,+75,-41,90969504,-8469504.0,8,1,10,3,9,7,#3568f2,#052ca3,#3568f2,#052ca3,#3568f2,#3568f2,0.0,0.0,15,73075833.0,11,65600000,9,53850000,4,24875000,3.0,19875000.0,-8469504.0,Ken Holland,"May 7, 2019",Jay Woodcroft,"February 10, 2022",28.67,30.82,32.0,33.75,35.33,"Kailer Yamamoto, Connor McDavid, Leon Draisaitl, Zach Hyman, Ryan Nugent-Hopkins, Evander Kane, Warren Foegele, Darnell Nurse, Mattias Ekholm, Cody Ceci, Brett Kulak, Philip Broberg, Vincent Desharnais, Jack Campbell, Stuart Skinner","Connor McDavid, Leon Draisaitl, Zach Hyman, Ryan Nugent-Hopkins, Evander Kane, Darnell Nurse, Mattias Ekholm, Cody Ceci, Brett Kulak, Jack Campbell, Stuart Skinner","Connor McDavid, Zach Hyman, Ryan Nugent-Hopkins, Evander Kane, Darnell Nurse, Mattias Ekholm, Brett Kulak, Jack Campbell, Stuart Skinner","Zach Hyman, Ryan Nugent-Hopkins, Darnell Nurse, Jack Campbell","Zach Hyman, Ryan Nugent-Hopkins, Darnell Nurse",27.0
Florida Panthers,FLA,FLA.png,20222023,92,42,east,atlantic,top3,0.536,+23.71,0.91,0.089,+28,+54,-56,87364460,-4864460.0,9,4,19,8,11,11,#3568f2,#052ca3,#fc4d47,#3568f2,#3568f2,#3568f2,0.0,0.0,15,66508334.0,6,45591667,3,29500000,2,19500000,2.0,19500000.0,-4864460.0,Bill Zito,"September 2, 2020",Paul Maurice,"June 22, 2022",27.73,29.67,31.67,30.0,32.0,"Sergei Bobrovsky, Aleksander Barkov, Matthew Tkachuk, Sam Reinhart, Carter Verhaeghe, Anthony Duclair, Eetu Luostarinen, Sam Bennett, Anton Lundell, Josh Mahura, Gustav Forsling, Nick Cousins, Aaron Ekblad, Brandon Montour, Ryan Lomberg","Sergei Bobrovsky, Aleksander Barkov, Matthew Tkachuk, Carter Verhaeghe, Sam Bennett, Aaron Ekblad","Sergei Bobrovsky, Aleksander Barkov, Matthew Tkachuk","Aleksander Barkov, Matthew Tkachuk","Aleksander Barkov, Matthew Tkachuk",30.0
Los Angeles Kings,LAK,LAK.png,20222023,102,46,west,pacific,top3,0.522,+23.42,0.902,0.089,+16,+53,-52,81136812,1363188.0,12,5,18,9,15,11,#3568f2,#052ca3,#fc4d47,#3568f2,black,#3568f2,0.0,0.0,18,71088334.0,8,43075000,6,38200000,5,32700000,3.0,16200000.0,1363188.0,Rob Blake,"April 10, 2017",Todd McLellan,"April 16, 2019",27.83,29.0,30.67,32.0,31.67,"Sean Walker, Pheonix Copley, Michael Anderson, Sean Durzi, Drew Doughty, Alex Laferriere, Arthur Kaliyev, Quinton Byfield, Carl Grundstrom, Blake Lizotte, Trevor Moore, Alex Iafallo, Matt Roy, Anze Kopitar, Kevin Fiala, Viktor Arvidsson, Phillip Danault, Adrian Kempe","Michael Anderson, Drew Doughty, Alex Laferriere, Trevor Moore, Alex Iafallo, Kevin Fiala, Phillip Danault, Adrian Kempe","Michael Anderson, Drew Doughty, Trevor Moore, Kevin Fiala, Phillip Danault, Adrian Kempe","Michael Anderson, Drew Doughty, Trevor Moore, Kevin Fiala, Phillip Danault","Michael Anderson, Trevor Moore, Kevin Fiala",21.0
Minnesota Wild,MIN,MIN.png,20222023,102,46,west,central,top3,0.506,+1.52,0.922,0.084,+4,+47,-29,81514416,985584.0,14,8,4,17,2,15,black,#3568f2,#052ca3,#fc4d47,#052ca3,black,0.0,0.0,14,56500000.0,8,39400000,5,34825000,4,25825000,3.0,18250000.0,985584.0,Bill Guerin,"August 21, 2019",Dean Evason,"February 14, 2020",29.93,28.62,30.0,31.5,31.67,"Kirill Kaprizov, Mats Zuccarello, Joel Eriksson Ek, Marcus Foligno, Ryan Hartman, Matthew Boldy, Connor Dewar, Jared Spurgeon, Jonas Brodin, Jacob Middleton, Alex Goligoski, Jon Merrill, Brock Faber, Marc-Andre Fleury","Kirill Kaprizov, Joel Eriksson Ek, Matthew Boldy, Jared Spurgeon, Jonas Brodin, Jacob Middleton, Jon Merrill, Brock Faber","Kirill Kaprizov, Joel Eriksson Ek, Matthew Boldy, Jared Spurgeon, Jonas Brodin","Joel Eriksson Ek, Matthew Boldy, Jared Spurgeon, Jonas Brodin","Joel Eriksson Ek, Matthew Boldy, Jonas Brodin",16.0
Montreal Canadiens,MTL,MTL.png,20222023,68,31,east,atlantic,none,0.446,-54.64,0.899,0.097,-41,+30,-66,95812598,-13312598.0,25,19,20,30,18,7,red,#fc4d47,#fc4d47,red,#fc4d47,#3568f2,0.0,0.0,20,60727500.0,14,48940000,5,28112500,3,19875000,1.0,7875000.0,-13312598.0,Kent Hughes,"January 18, 2022",Martin St. Louis,"February 9, 2022",27.75,28.21,29.4,31.0,29.0,"Samuel Montembeault, Jake Allen, Chris Wideman, Johnathan Kovacevic, Jordan Harris, Kaiden Guhle, Justin Barron, David Savard, Joel Edmundson, Michael Matheson, Sean Farrell, Rem Pitlick, Jake Evans, Kirby Dach, Joel Armia, Christian Dvorak, Mike Hoffman, Josh Anderson, Nick Suzuki, Brendan Gallagher","Jake Allen, Johnathan Kovacevic, Jordan Harris, Kaiden Guhle, David Savard, Michael Matheson, Sean Farrell, Jake Evans, Kirby Dach, Joel Armia, Christian Dvorak, Josh Anderson, Nick Suzuki, Brendan Gallagher","Michael Matheson, Kirby Dach, Josh Anderson, Nick Suzuki, Brendan Gallagher","Josh Anderson, Nick Suzuki, Brendan Gallagher",Nick Suzuki,5.0
Nashville Predators,NSH,NSH.png,20222023,90,41,west,central,none,0.495,-15.53,0.922,0.086,-3,+34,-40,79354740,3145260.0,16,16,9,24,2,13,black,black,#3568f2,red,#052ca3,black,0.0,0.0,16,56430309.0,7,41666143,5,28666143,1,9059000,1.0,9059000.0,3145260.0,David Poile,"July 9, 1997",John Hynes,"January 7, 2020",28.44,31.71,33.2,36.0,38.0,"Matt Duchene, Kevin Lankinen, Ryan Johansen, Philip Tomasino, Juuso Parssinen, Thomas Novak, Cole Smith, Yakov Trenin, Mark Jankowski, Roman Josi, Ryan McDonagh, Tyson Barrie, Dante Fabbro, Jeremy Lauzon, Juuse Saros, Colton Sissons","Matt Duchene, Ryan Johansen, Roman Josi, Ryan McDonagh, Jeremy Lauzon, Juuse Saros, Colton Sissons","Matt Duchene, Roman Josi, Ryan McDonagh, Jeremy Lauzon, Colton Sissons",Roman Josi,Roman Josi,3.0
New Jersey Devils,NJD,NJD.png,20222023,110,51,east,metro,top3,0.575,+56.38,0.913,0.095,+57,+32,-29,83701053,-1201053.0,2,17,4,2,8,9,#052ca3,#fc4d47,#052ca3,#052ca3,#3568f2,#3568f2,0.0,0.0,11,45369167.0,9,43375000,6,38050000,6,38050000,3.0,20400000.0,-1201053.0,Tom Fitzgerald,"January 12, 2020",Lindy Ruff,"July 9, 2020",26.91,27.56,29.0,30.0,31.0,"Curtis Lazar, Dawson Mercer, Dougie Hamilton, John Marino, Jonas Siegenthaler, Brendan Smith, Luke Hughes, Vitek Vanecek, Ondrej Palat, Nico Hischier, Jack Hughes","Curtis Lazar, Dougie Hamilton, John Marino, Jonas Siegenthaler, Luke Hughes, Vitek Vanecek, Ondrej Palat, Nico Hischier, Jack Hughes","Dougie Hamilton, John Marino, Jonas Siegenthaler, Ondrej Palat, Nico Hischier, Jack Hughes","Dougie Hamilton, John Marino, Jonas Siegenthaler, Ondrej Palat, Nico Hischier, Jack Hughes","Dougie Hamilton, Jonas Siegenthaler, Jack Hughes",23.0
New York Islanders,NYI,NYI.png,20222023,91,41,east,metro,wc,0.537,-6.2,0.92,0.093,+26,+24,-27,81117864,1382136.0,11,23,2,19,3,10,#3568f2,#fc4d47,#052ca3,#fc4d47,#052ca3,#3568f2,0.0,0.0,18,76588333.0,12,62650000,8,45150000,5,32050000,4.0,29550000.0,1382136.0,Lou Lamoriello,"June 5, 2018",Lane Lambert,"May 16, 2022",29.72,30.42,32.0,32.2,33.25,"Sebastian Aho, Alexander Romanov, Noah Dobson, Adam Pelech, Ryan Pulock, Simon Holmstrom, Ross Johnston, Cal Clutterbuck, Casey Cizikas, Bo Horvat, Kyle Palmieri, Jean-Gabriel Pageau, Josh Bailey, Brock Nelson, Anders Lee, Mathew Barzal, Matt Martin, Ilya Sorokin","Alexander Romanov, Noah Dobson, Adam Pelech, Ryan Pulock, Ross Johnston, Casey Cizikas, Bo Horvat, Kyle Palmieri, Jean-Gabriel Pageau, Brock Nelson, Anders Lee, Mathew Barzal","Adam Pelech, Ryan Pulock, Ross Johnston, Casey Cizikas, Bo Horvat, Jean-Gabriel Pageau, Anders Lee, Mathew Barzal","Adam Pelech, Ryan Pulock, Casey Cizikas, Bo Horvat, Mathew Barzal","Adam Pelech, Ryan Pulock, Bo Horvat, Mathew Barzal",22.0
New York Rangers,NYR,NYR.png,20222023,107,47,east,metro,top3,0.552,-4.32,0.919,0.098,+37,+47,-26,82498392,1608.0,6,8,1,18,4,6,#052ca3,#3568f2,#052ca3,#fc4d47,#052ca3,#052ca3,0.0,0.0,14,71126191.0,11,65101191,8,57847024,6,38204167,3.0,23625000.0,1608.0,Chris Drury,"May 5, 2021",Gerard Gallant,"June 16, 2021",28.07,30.27,31.38,31.83,33.67,"Vincent Trocheck, Artemi Panarin, Mika Zibanejad, Chris Kreider, Jacob Trouba, Barclay Goodrow, Filip Chytil, Kaapo Kakko, Jimmy Vesey, Adam Fox, Braden Schneider, Ben Harpur, Ryan Lindgren, Igor Shesterkin","Vincent Trocheck, Artemi Panarin, Mika Zibanejad, Chris Kreider, Jacob Trouba, Barclay Goodrow, Filip Chytil, Jimmy Vesey, Adam Fox, Ben Harpur, Igor Shesterkin","Vincent Trocheck, Artemi Panarin, Mika Zibanejad, Chris Kreider, Jacob Trouba, Barclay Goodrow, Filip Chytil, Adam Fox","Vincent Trocheck, Mika Zibanejad, Chris Kreider, Barclay Goodrow, Filip Chytil, Adam Fox","Vincent Trocheck, Mika Zibanejad, Adam Fox",24.0
Ottawa Senators,OTT,OTT.png,20222023,85,39,east,atlantic,none,0.465,+17.05,0.901,0.08,-25,+57,-44,79246647,3253353.0,22,2,12,11,16,18,#fc4d47,#052ca3,#3568f2,#3568f2,black,#fc4d47,0.0,0.0,13,52544881.0,10,49932381,6,37080714,5,34130714,3.0,24555714.0,3253353.0,Pierre Dorion,"April 10, 2016",D. J. Smith,"May 23, 2019",25.38,27.2,27.5,28.2,29.33,"Mads Sogaard, Tyler Kleven, Jake Sanderson, Mark Kastelic, Artem Zub, Jakob Chychrun, Thomas Chabot, Parker Kelly, Tim Stutzle, Brady Tkachuk, Drake Batherson, Mathieu Joseph, Claude Giroux","Tyler Kleven, Mark Kastelic, Artem Zub, Jakob Chychrun, Thomas Chabot, Tim Stutzle, Brady Tkachuk, Drake Batherson, Mathieu Joseph, Claude Giroux","Artem Zub, Thomas Chabot, Tim Stutzle, Brady Tkachuk, Drake Batherson, Mathieu Joseph","Artem Zub, Thomas Chabot, Tim Stutzle, Brady Tkachuk, Drake Batherson","Thomas Chabot, Tim Stutzle, Brady Tkachuk",28.0
Philadelphia Flyers,PHI,PHI.png,20222023,73,30,east,metro,none,0.462,-23.2,0.906,0.084,-27,+24,-44,86447460,-3947460.0,23,23,12,26,14,15,#fc4d47,#fc4d47,#3568f2,red,black,black,0.0,0.0,15,54069357.0,8,40492857,6,28242857,3,16350000,2.0,11250000.0,-3947460.0,Daniel Briere (interim),"March 10, 2023",John Tortorella,"June 17, 2022",27.67,29.5,31.0,30.0,31.0,"Rasmus Ristolainen, Wade Allison, Tanner Laczynski, Ivan Provorov, Owen Tippett, Nicolas Deslauriers, Anthony Deangelo, Joel Farabee, Travis Konecny, Kevin Hayes, Scott Laughton, Travis Sanheim, Nick Seeler, Felix Sandstrom, Carter Hart","Rasmus Ristolainen, Ivan Provorov, Nicolas Deslauriers, Joel Farabee, Travis Konecny, Kevin Hayes, Scott Laughton, Travis Sanheim","Rasmus Ristolainen, Nicolas Deslauriers, Joel Farabee, Kevin Hayes, Scott Laughton, Travis Sanheim","Rasmus Ristolainen, Joel Farabee, Travis Sanheim","Joel Farabee, Travis Sanheim",11.0
Pittsburgh Penguins,PIT,PIT.png,20222023,90,40,east,metro,wc,0.496,+26.63,0.91,0.083,-3,+45,-45,83765500,-1265500.0,16,9,13,7,11,16,black,#3568f2,black,#3568f2,#3568f2,black,0.0,0.0,14,58350000.0,8,45025000,4,22325000,3,16225000,3.0,16225000.0,-1265500.0,Ron Hextall,"February 9, 2021",Mike Sullivan,"December 12, 2015",32.57,34.88,35.5,35.33,37.33,"Bryan Rust, Jeff Carter, Rickard Rakell, Mikael Granlund, Jeff Petry, Kris Letang, Jan Rutta, Pierre-Olivier Joseph, Chad Ruhwedel, Casey DeSmith, Mark Friedman, Evgeni Malkin, Jake Guentzel, Sidney Crosby","Bryan Rust, Rickard Rakell, Mikael Granlund, Jeff Petry, Kris Letang, Jan Rutta, Evgeni Malkin, Sidney Crosby","Bryan Rust, Rickard Rakell, Kris Letang, Evgeni Malkin","Bryan Rust, Rickard Rakell, Kris Letang","Bryan Rust, Rickard Rakell, Kris Letang",17.0
San Jose Sharks,SJS,SJS.png,20222023,60,22,west,pacific,none,0.43,-7.62,0.884,0.093,-59,+25,-36,82805384,-305384.0,26,22,8,21,21,10,red,#fc4d47,#3568f2,#fc4d47,#fc4d47,#3568f2,0.0,0.0,17,60754167.0,8,42387500,6,39137500,3,27637500,1.0,8137500.0,-305384.0,Mike Grier,"July 5, 2022",David Quinn,"July 21, 2022",28.71,31.38,33.5,35.67,35.0,"Tomas Hertl, Logan Couture, Oskar Lindblom, Alexander Barabanov, Nico Sturm, Steven Lorentz, Thomas Bordeleau, Kevin Labanc, Erik Karlsson, Marc-Edouard Vlasic, Mario Ferraro, Radim Simek, Matthew Benning, Henry Thrun, Nikolai Knyzhov, Jacob MacDonald, Kaapo Kahkonen","Tomas Hertl, Logan Couture, Nico Sturm, Erik Karlsson, Marc-Edouard Vlasic, Mario Ferraro, Matthew Benning, Nikolai Knyzhov","Tomas Hertl, Logan Couture, Erik Karlsson, Marc-Edouard Vlasic, Mario Ferraro, Matthew Benning","Tomas Hertl, Logan Couture, Erik Karlsson",Tomas Hertl,9.0
St. Louis Blues,STL,STL.png,20222023,81,37,west,central,none,0.478,-45.46,0.899,0.104,-18,+31,-49,83259279,-759279.0,18,18,17,27,18,2,#fc4d47,#fc4d47,#fc4d47,red,#fc4d47,#052ca3,0.0,0.0,18,75973333.0,11,63385833,9,56750000,7,48250000,4.0,29250000.0,-759279.0,Doug Armstrong,"July 1, 2010",Craig Berube,"November 19, 2018",29.5,30.09,32.0,32.43,32.75,"Jordan Binnington, Brayden Schenn, Calle Rosen, Colton Parayko, Robert Bortuzzo, Marco Scandella, Nick Leddy, Torey Krug, Justin Faulk, Nathan Walker, Jake Neighbours, Kasperi Kapanen, Brandon Saad, Pavel Buchnevich, Samuel Blais, Robert Thomas, Jakub Vrana, Jordan Kyrou","Jordan Binnington, Brayden Schenn, Colton Parayko, Nick Leddy, Torey Krug, Justin Faulk, Jake Neighbours, Brandon Saad, Pavel Buchnevich, Robert Thomas, Jordan Kyrou","Jordan Binnington, Brayden Schenn, Colton Parayko, Nick Leddy, Torey Krug, Justin Faulk, Brandon Saad, Robert Thomas, Jordan Kyrou","Jordan Binnington, Brayden Schenn, Colton Parayko, Torey Krug, Justin Faulk, Robert Thomas, Jordan Kyrou","Brayden Schenn, Colton Parayko, Robert Thomas, Jordan Kyrou",6.0
Tampa Bay Lightning,TBL,TBL.png,20222023,96,45,east,atlantic,top3,0.517,+11.11,0.911,0.095,+13,+55,-42,89618491,-7118491.0,13,3,11,15,10,9,black,#052ca3,#3568f2,black,#3568f2,#3568f2,0.0,0.0,15,73975000.0,9,60600000,7,51600000,7,51600000,6.0,42100000.0,-7118491.0,Julien BriseBois,"September 11, 2018",Jon Cooper,"March 25, 2013",28.87,28.89,29.57,30.57,32.17,"Andrei Vasilevskiy, Darren Raddysh, Haydn Fleury, Nick Perbix, Zach Bogosian, Erik Cernak, Victor Hedman, Patrick Maroon, Mikhail Sergachev, Brandon Hagel, Nicholas Paul, Anthony Cirelli, Steven Stamkos, Brayden Point, Nikita Kucherov","Andrei Vasilevskiy, Nick Perbix, Erik Cernak, Victor Hedman, Mikhail Sergachev, Nicholas Paul, Anthony Cirelli, Brayden Point, Nikita Kucherov","Andrei Vasilevskiy, Erik Cernak, Mikhail Sergachev, Nicholas Paul, Anthony Cirelli, Brayden Point, Nikita Kucherov","Andrei Vasilevskiy, Erik Cernak, Mikhail Sergachev, Nicholas Paul, Anthony Cirelli, Brayden Point, Nikita Kucherov","Andrei Vasilevskiy, Erik Cernak, Mikhail Sergachev, Nicholas Paul, Anthony Cirelli, Brayden Point",32.0
Toronto Maple Leafs,TOR,TOR.png,20222023,109,49,east,atlantic,top3,0.563,+31.97,0.919,0.095,+44,+53,-32,88999602,-6499602.0,4,5,5,5,4,9,#052ca3,#052ca3,#052ca3,#052ca3,#052ca3,#3568f2,0.0,0.0,14,67168116.0,7,35528000,2,9600000,1,7500000,1.0,7500000.0,-6499602.0,Kyle Dubas,"May 11, 2018",Sheldon Keefe,"November 20, 2019",28.93,29.14,33.0,33.0,35.0,"John Tavares, Mitchell Marner, William Nylander, Calle Jarnkrok, Auston Matthews, Sam Lafferty, Matthew Knies, Morgan Rielly, TJ Brodie, Jake McCabe, Timothy Liljegren, Conor Timmins, Matt Murray, Mark Giordano","John Tavares, Mitchell Marner, Calle Jarnkrok, Matthew Knies, Morgan Rielly, Jake McCabe, Conor Timmins","Calle Jarnkrok, Morgan Rielly",Morgan Rielly,Morgan Rielly,29.0
Vancouver Canucks,VAN,VAN.png,20222023,81,37,west,pacific,none,0.474,-17.01,0.899,0.096,-20,+43,-47,89052403,-6552403.0,19,10,15,25,18,8,#fc4d47,#3568f2,black,red,#fc4d47,#3568f2,0.0,0.0,20,68181250.0,9,40275000,4,25800000,2,15850000,1.0,8000000.0,-6552403.0,Patrik Allvin,"January 26, 2022",Rick Tocchet,"January 22, 2023",26.75,28.89,29.75,30.5,36.0,"Thatcher Demko, Christian Wolanin, Guillaume Brisebois, Cole McWard, Elias Pettersson, Brock Boeser, J.T. Miller, Conor Garland, Anthony Beauvillier, Andrei Kuzmenko, Aidan McDonough, Vasily Podkolzin, Nils Åman, Dakota Joshua, Jack Studnicka, Sheldon Dries, Phillip Di Giuseppe, Quinn Hughes, Filip Hronek, Tyler Myers","Thatcher Demko, Christian Wolanin, Guillaume Brisebois, Brock Boeser, J.T. Miller, Conor Garland, Andrei Kuzmenko, Phillip Di Giuseppe, Quinn Hughes","Thatcher Demko, J.T. Miller, Conor Garland, Quinn Hughes","J.T. Miller, Quinn Hughes",J.T. Miller,15.0
