St. Louis Blues,STL,STL.png,20222023,81,37,west,central,none,0.476,-95.95,0.9,0.103,-40,+64,-104,81139762,2360238.0,20,19,18,29,14,3,#fc4d47,#fc4d47,#fc4d47,red,black,#052ca3,1.0,0.0,14,68532262.0,10,60321429,7,48250000,4.0,29250000.0,3.0,22750000.0,2360238.0,Doug Armstrong,"July 1, 2010",Craig Berube,"November 19, 2018",29.67,30.36,32.6,33.0,33.5,"Brandon Saad, Calle Rosen, Justin Faulk, Torey Krug, Colton Parayko, Marco Scandella, Robert Bortuzzo, Tyler Tucker, Nathan Walker, Nick Leddy, Mackenzie MacEachern, Kevin Hayes, Pavel Buchnevich, Brayden Schenn, Jordan Binnington, Kasperi Kapanen, Jakub Vrana, Sammy Blais, Jake Neighbours, Robert Thomas, Jordan Kyrou","Brandon Saad, Justin Faulk, Torey Krug, Colton Parayko, Tyler Tucker, Nick Leddy, Mackenzie MacEachern, Kevin Hayes, Pavel Buchnevich, Brayden Schenn, Jordan Binnington, Jake Neighbours, Robert Thomas, Jordan Kyrou","Brandon Saad, Justin Faulk, Torey Krug, Colton Parayko, Nick Leddy, Kevin Hayes, Brayden Schenn, Jordan Binnington, Robert Thomas, Jordan Kyrou","Justin Faulk, Torey Krug, Colton Parayko, Brayden Schenn, Jordan Binnington, Robert Thomas, Jordan Kyrou","Colton Parayko, Brayden Schenn, Robert Thomas, Jordan Kyrou",5.0
Tampa Bay Lightning,TBL,TBL.png,20222023,98,46,east,atlantic,top3,0.523,+27.68,0.912,0.095,+34,+112,-84,87395833,-3895833.0,12,3,11,15,7,8,#3568f2,#052ca3,#3568f2,black,#3568f2,#3568f2,1.0,800000.0,14,65775000.0,8,53600000,7,51600000,6.0,42100000.0,5.0,32600000.0,-4695833.0,Julien BriseBois,"September 11, 2018",Jon Cooper,"March 25, 2013",29.29,30.14,30.5,31.0,32.5,"Luke Glendening, Brandon Hagel, Calvin de Haan, Conor Sheary, Steven Stamkos, Alex Barre-Boulet, Mikhail Sergachev, Nick Perbix, Erik Cernak, Victor Hedman, Jonas Johansson, Haydn Fleury, Andrei Vasilevskiy, Nick Paul, Michael Eyssimont, Josh Archibald, Nikita Kucherov, Brayden Point, Anthony Cirelli, Zach Bogosian, Philippe Myers","Luke Glendening, Conor Sheary, Mikhail Sergachev, Nick Perbix, Erik Cernak, Victor Hedman, Jonas Johansson, Andrei Vasilevskiy, Nick Paul, Michael Eyssimont, Josh Archibald, Nikita Kucherov, Brayden Point, Anthony Cirelli","Conor Sheary, Mikhail Sergachev, Erik Cernak, Andrei Vasilevskiy, Nick Paul, Nikita Kucherov, Brayden Point, Anthony Cirelli","Mikhail Sergachev, Erik Cernak, Andrei Vasilevskiy, Nick Paul, Nikita Kucherov, Brayden Point, Anthony Cirelli","Mikhail Sergachev, Erik Cernak, Andrei Vasilevskiy, Nick Paul, Brayden Point, Anthony Cirelli",32.0
Toronto Maple Leafs,TOR,TOR.png,20222023,111,50,east,atlantic,top3,0.565,+63.39,0.919,0.096,+92,+106,-66,92331450,-8831450.0,4,5,6,5,4,7,#052ca3,#052ca3,#052ca3,#052ca3,#052ca3,#3568f2,1.0,1800000.0,11,40844667.0,4,13350000,2,9900000,1.0,7500000.0,1.0,7500000.0,-10631450.0,Brad Treliving,"May 31, 2023",Sheldon Keefe,"November 20, 2019",29.18,29.55,34.0,32.5,35.0,"Timothy Liljegren, Conor Timmins, Jake McCabe, John Klingberg, Auston Matthews, Ryan Reaves, William Nylander, Max Domi, David Kampf, Tyler Bertuzzi, Matthew Knies, John Tavares, Joseph Woll, Mitchell Marner, Matt Murray, Calle Jarnkrok, Mark Giordano, Pontus Holmberg, Morgan Rielly, Sam Lafferty, TJ Brodie, Dylan Gambrell","Conor Timmins, Jake McCabe, Ryan Reaves, David Kampf, Matthew Knies, John Tavares, Joseph Woll, Mitchell Marner, Calle Jarnkrok, Pontus Holmberg, Morgan Rielly","Ryan Reaves, David Kampf, Calle Jarnkrok, Morgan Rielly","David Kampf, Morgan Rielly",Morgan Rielly,29.0
Vancouver Canucks,VAN,VAN.png,20222023,83,38,west,pacific,none,0.47,-38.47,0.898,0.096,-46,+90,-94,87842917,-4342917.0,21,11,15,25,15,7,#fc4d47,#3568f2,black,red,black,#3568f2,1.0,875000.0,10,43850000.0,5,29050000,2,15850000,1.0,8000000.0,1.0,8000000.0,-5217917.0,Patrik Allvin,"January 26, 2022",Rick Tocchet,"January 22, 2023",28.04,28.4,30.0,30.5,36.0,"Matt Irwin, Ian Cole, Guillaume Brisebois, Thatcher Demko, Jack Studnicka, Andrei Kuzmenko, Filip Hronek, Spencer Martin, Nils Aman, Sheldon Dries, Vasily Podkolzin, Dakota Joshua, Phillip Di Giuseppe, Nils Hoglander, Anthony Beauvillier, Conor Garland, Elias Pettersson, J.T. Miller, Quinn Hughes, Tyler Myers, Teddy Blueger, Carson Soucy, Brock Boeser","Guillaume Brisebois, Thatcher Demko, Andrei Kuzmenko, Phillip Di Giuseppe, Nils Hoglander, Conor Garland, J.T. Miller, Quinn Hughes, Carson Soucy, Brock Boeser","Thatcher Demko, Conor Garland, J.T. Miller, Quinn Hughes, Carson Soucy","J.T. Miller, Quinn Hughes",J.T. Miller,15.0
Vegas Golden Knights,VGK,VGK.png,20222023,111,51,west,pacific,top3,0.537,+33.4,0.918,0.095,+56,+74,-56,84923317,-1423317.0,10,16,3,11,5,8,#3568f2,black,#052ca3,#3568f2,#052ca3,#3568f2,1.0,1500000.0,15,63910817.0,8,45725000,6,34950000,2.0,7750000.0,0.0,0.0,-2923317.0,Kelly McCrimmon,"September 1, 2019",Bruce Cassidy,"June 14, 2022",29.0,29.13,30.75,32.83,32.5,"Adin Hill, Brayden Pachal, Mark Stone, Jack Eichel, Jonathan Marchessault, Ivan Barbashev, Nicolas Roy, Chandler Stephenson, William Carrier, Keegan Kolesar, Michael Amadio, Logan Thompson, Paul Cotter, Nicolas Hague, Zach Whitecloud, Brayden McNabb, Ben Hutton, Shea Theodore, Alec Martinez, Alex Pietrangelo, William Karlsson","Adin Hill, Brayden Pachal, Mark Stone, Jack Eichel, Ivan Barbashev, Nicolas Roy, Keegan Kolesar, Logan Thompson, Paul Cotter, Nicolas Hague, Zach Whitecloud, Brayden McNabb, Shea Theodore, Alex Pietrangelo, William Karlsson","Mark Stone, Jack Eichel, Ivan Barbashev, Nicolas Roy, Paul Cotter, Zach Whitecloud, Alex Pietrangelo, William Karlsson","Mark Stone, Ivan Barbashev, Nicolas Roy, Zach Whitecloud, Alex Pietrangelo, William Karlsson","Ivan Barbashev, Zach Whitecloud",18.0
Washington Capitals,WSH,WSH.png,20222023,80,35,east,metro,none,0.474,-15.97,0.9,0.09,-40,+78,-70,82611667,888333.0,20,15,7,20,14,11,#fc4d47,black,#3568f2,#fc4d47,black,#3568f2,0.0,0.0,14,65350000.0,8,39375000,2,10250000,1.0,5000000.0,0.0,0.0,888333.0,Brian MacLellan,"May 26, 2014",Spencer Carbery,"May 30, 2023",30.79,32.64,33.25,33.5,32.0,"Tom Wilson, Dylan Strome, Sonny Milano, Nic Dowd, Nicolas Aube-Kubel, John Carlson, Nick Jensen, Trevor van Riemsdyk, Charlie Lindgren, Rasmus Sandin, Alexander Alexeyev, Darcy Kuemper, Anthony Mantha, Joel Edmundson, T.J. Oshie, Alex Ovechkin, Martin Fehervary, Evgeny Kuznetsov, Nicklas Backstrom","Dylan Strome, Sonny Milano, Nic Dowd, John Carlson, Nick Jensen, Trevor van Riemsdyk, Charlie Lindgren, Alexander Alexeyev, Darcy Kuemper, T.J. Oshie, Alex Ovechkin, Martin Fehervary, Evgeny Kuznetsov, Nicklas Backstrom","Dylan Strome, Sonny Milano, John Carlson, Nick Jensen, Trevor van Riemsdyk, Darcy Kuemper, Alex Ovechkin, Martin Fehervary","Dylan Strome, Darcy Kuemper",Dylan Strome,12.0
Winnipeg Jets,WPG,WPG.png,20222023,95,46,west,central,wc,0.5,+15.99,0.914,0.087,0,+82,-64,74932857,8567143.0,16,13,5,16,6,12,black,black,#052ca3,black,#052ca3,#3568f2,4.0,3513333.0,11,44809524.0,3,16642857,1,6250000,1.0,6250000.0,0.0,0.0,5053810.0,Kevin Cheveldayoff,"June 8, 2011",Rick Bowness,"July 3, 2022",29.11,29.64,31.0,32.0,34.0,"Josh Morrissey, Mark Scheifele, Nikolaj Ehlers, Alex Iafallo, Nino Niederreiter, Connor Hellebuyck, Adam Lowry, David Gustafsson, Dylan DeMelo, Brenden Dillon, Mason Appleton, Laurent Brossoit, Nate Schmidt, Kyle Connor, Axel Jonsson-Fjallby, Dylan Samberg, Neal Pionk, Kyle Capobianco, Vladislav Namestnikov","Josh Morrissey, Nikolaj Ehlers, Alex Iafallo, Adam Lowry, Mason Appleton, Nate Schmidt, Kyle Connor, Axel Jonsson-Fjallby, Dylan Samberg, Neal Pionk, Vladislav Namestnikov","Josh Morrissey, Adam Lowry, Kyle Connor",Josh Morrissey,Josh Morrissey,19.0
Seattle Kraken,SEA,SEA.png,20222023,100,46,west,pacific,wc,0.56,+28.56,0.901,0.109,+96,+70,-90,74431576,9068424.0,3,17,13,14,13,1,#052ca3,#fc4d47,black,black,black,#052ca3,1.0,4000000.0,12,46916666.0,5,26400000,2,10900000,0.0,0.0,0.0,0.0,5068424.0,Ron Francis,"July 18, 2019",Dave Hakstol,"June 24, 2021",29.81,30.83,32.4,33.0,,"Pierre-Edouard Bellemare, Will Borgen, Cale Fleury, Jaycob Megna, Philipp Grubauer, Joey Daccord, Justin Schultz, Chris Driedger, Eeli Tolvanen, Matty Beniers, Kailer Yamamoto, Alexander Wennberg, Jared McCann, Yanni Gourde, Brandon Tanev, Adam Larsson, Brian Dumoulin, Jordan Eberle, Jaden Schwartz, Jamie Oleksiak, Oliver Bjorkstrand","Will Borgen, Cale Fleury, Philipp Grubauer, Joey Daccord, Jared McCann, Yanni Gourde, Brandon Tanev, Adam Larsson, Brian Dumoulin, Jaden Schwartz, Jamie Oleksiak, Oliver Bjorkstrand","Philipp Grubauer, Jared McCann, Jaden Schwartz, Jamie Oleksiak, Oliver Bjorkstrand","Philipp Grubauer, Jared McCann",,10.0
