full,team,logo,season,PTS,W,Conference,Division,playoffs,gf%,xg_dif,sv%,shooting%,g_dif,PP_g_dif,PK_g_dif,projected_cap_hit,projected_cap_space,5on5_rank,PP_rank,PK_rank,XG_dif_rank,Save%_rank,Shooting%_rank,5on5_color,PP_color,PK_color,xg_color,sv_color,sh_color,expiring_contracts,expiring_salary,nhl_contracts_2324,2023-24 Salary,nhl_contracts_2425,2024-25 Salary,nhl_contracts_2526,2025-26 Salary,nhl_contracts_2627,2026-27 Salary,nhl_contracts_2728,2027-28 Salary,cap_remaining,GM,gm_start,coach,coach_start,avg_age_2324,avg_age_2425,avg_age_2526,avg_age_2627,avg_age_2728,players_under_contract_2324,players_under_contract_2425,players_under_contract_2526,players_under_contract_2627,players_under_contract_2728,draft_capital_rank
Anaheim Ducks,ANA,ANA.png,20222023,28,12,west,pacific,none,0.35,-40.41,0.904,0.072,-59,+14,-42,68573153,13926847.0,27,19,18,32,17,18,red,#fc4d47,#fc4d47,red,#fc4d47,#fc4d47,0.0,0.0,12,38051667.0,5,22444167,3,17900000,2,11400000,0.0,0.0,13926847.0,Pat Verbeek,"February 3, 2022",Dallas Eakins,"June 17, 2019",28.17,29.2,32.67,33.0,,"John Gibson, Colton White, Urho Vaakanainen, Brett Leason, Sam Carrick, Mason McTavish, Adam Henrique, Jakob Silfverberg, Ryan Strome, Frank Vatrano, Cam Fowler, Max Jones","John Gibson, Mason McTavish, Ryan Strome, Frank Vatrano, Cam Fowler","John Gibson, Ryan Strome, Cam Fowler","John Gibson, Ryan Strome",,4.0
Arizona Coyotes,ARI,ARI.png,20222023,31,13,west,central,none,0.439,-33.75,0.904,0.098,-23,+23,-37,64265584,18234416.0,22,12,16,31,17,6,#fc4d47,#3568f2,black,red,#fc4d47,#052ca3,0.0,0.0,13,37680834.0,6,25519167,3,17300000,2,11450000,1.0,7150000.0,18234416.0,Bill Armstrong,"September 17, 2020",Andre Tourigny,"July 1, 2021",26.69,26.0,28.0,28.5,30.0,"Nick Schmaltz, Lawson Crouse, Karel Vejmelka, J.J. Moser, Joshua Brown, Patrik Nemeth, Liam O'Brien, Dylan Guenther, Travis Boyd, Barrett Hayton, Zack Kassian, Clayton Keller, Jakob Chychrun","Nick Schmaltz, Lawson Crouse, Karel Vejmelka, Dylan Guenther, Clayton Keller, Jakob Chychrun","Nick Schmaltz, Lawson Crouse, Clayton Keller","Lawson Crouse, Clayton Keller",Clayton Keller,1.0
Boston Bruins,BOS,BOS.png,20222023,70,33,east,atlantic,top3,0.633,+21.45,0.934,0.101,+47,+32,-17,83132955,-632955.0,2,5,3,3,1,4,#052ca3,#052ca3,#052ca3,#052ca3,#052ca3,#052ca3,0.0,0.0,12,55812500.0,8,47225000,5,30100000,4,24850000,2.0,16000000.0,-632955.0,Don Sweeney,"May 20, 2015",Jim Montgomery,"July 1, 2022",29.17,30.5,29.8,30.0,32.5,"Jakub Zboril, Linus Ullmark, Derek Forbort, Matt Grzelcyk, Hampus Lindholm, Charlie McAvoy, AJ Greer, Pavel Zacha, Taylor Hall, Charlie Coyle, Brandon Carlo, Brad Marchand","Linus Ullmark, Hampus Lindholm, Charlie McAvoy, Pavel Zacha, Taylor Hall, Charlie Coyle, Brandon Carlo, Brad Marchand","Hampus Lindholm, Charlie McAvoy, Pavel Zacha, Charlie Coyle, Brandon Carlo","Hampus Lindholm, Charlie McAvoy, Pavel Zacha, Brandon Carlo","Hampus Lindholm, Charlie McAvoy",26.0
Buffalo Sabres,BUF,BUF.png,20222023,44,21,east,atlantic,none,0.524,-5.83,0.905,0.108,+10,+35,-28,64354293,18145707.0,12,3,12,23,16,2,#3568f2,#052ca3,#3568f2,#fc4d47,black,#052ca3,0.0,0.0,15,50801904.0,6,26897737,4,25178571,3,20428571,2.0,11428571.0,18145707.0,Kevyn Adams,"June 16, 2020",Don Granato,"March 17, 2021",25.27,26.17,28.75,29.67,29.5,"Eric Comrie, Owen Power, Mattias Samuelsson, Jacob Bryson, Henri Jokiharju, Ilya Lyubushkin, Rasmus Dahlin, John-Jason Peterka, Jack Quinn, Tage Thompson, Casey Mittelstadt, Jeff Skinner, Victor Olofsson, Alex Tuch, Ukko-Pekka Luukkonen","Mattias Samuelsson, John-Jason Peterka, Jack Quinn, Tage Thompson, Jeff Skinner, Alex Tuch","Mattias Samuelsson, Tage Thompson, Jeff Skinner, Alex Tuch","Mattias Samuelsson, Tage Thompson, Jeff Skinner","Mattias Samuelsson, Tage Thompson",8.0
Calgary Flames,CGY,CGY.png,20222023,51,21,west,pacific,wc,0.528,+12.65,0.904,0.085,+11,+25,-18,81585802,914198.0,11,10,4,8,17,14,#3568f2,#3568f2,#052ca3,#3568f2,#fc4d47,black,0.0,0.0,17,78775833.0,8,47200000,6,39200000,4,28650000,3.0,23750000.0,914198.0,Brad Treliving,"April 28, 2014",Darryl Sutter,"March 4, 2021",28.88,30.75,32.83,34.25,36.0,"Jacob Markstrom, MacKenzie Weegar, Nikita Zadorov, Christopher Tanev, Rasmus Andersson, Noah Hanifin, Adam Ruzicka, Dillon Dube, Tyler Toffoli, Elias Lindholm, Blake Coleman, Nazem Kadri, Mikael Backlund, Andrew Mangiapane, Jakob Pelletier, Jonathan Huberdeau, Daniel Vladar","Jacob Markstrom, MacKenzie Weegar, Rasmus Andersson, Blake Coleman, Nazem Kadri, Andrew Mangiapane, Jonathan Huberdeau, Daniel Vladar","Jacob Markstrom, MacKenzie Weegar, Rasmus Andersson, Blake Coleman, Nazem Kadri, Jonathan Huberdeau","MacKenzie Weegar, Blake Coleman, Nazem Kadri, Jonathan Huberdeau","MacKenzie Weegar, Nazem Kadri, Jonathan Huberdeau",24.0
Carolina Hurricanes,CAR,CAR.png,20222023,61,27,east,metro,top3,0.56,+31.18,0.914,0.078,+20,+21,-22,86058534,-3558534.0,6,13,8,2,11,17,#052ca3,black,#3568f2,#052ca3,#3568f2,#fc4d47,0.0,0.0,14,55504417.0,5,25150000,3,14570000,3,14570000,2.0,12570000.0,-3558534.0,Don Waddell,"May 8, 2018",Rod Brind'Amour,"May 8, 2018",27.43,28.4,25.33,26.33,28.0,"Jalen Chatfield, Brett Pesce, Brady Skjei, Brent Burns, Jaccob Slavin, Stefan Noesen, Jordan Martinook, Martin Necas, Jesperi Kotkaniemi, Teuvo Teravainen, Sebastian Aho, Seth Jarvis, Andrei Svechnikov, Pyotr Kochetkov","Brent Burns, Jaccob Slavin, Jesperi Kotkaniemi, Andrei Svechnikov, Pyotr Kochetkov","Jesperi Kotkaniemi, Andrei Svechnikov, Pyotr Kochetkov","Jesperi Kotkaniemi, Andrei Svechnikov, Pyotr Kochetkov","Jesperi Kotkaniemi, Andrei Svechnikov",7.0
Chicago Blackhawks,CHI,CHI.png,20222023,26,11,west,central,none,0.347,-29.15,0.901,0.07,-52,+18,-26,76686170,5813830.0,26,16,11,29,18,20,red,black,#3568f2,red,#fc4d47,#fc4d47,0.0,0.0,13,35675833.0,3,17900000,2,13900000,1,9500000,1.0,9500000.0,5813830.0,Kyle Davidson,"October 26, 2021",Luke Richardson,"June 27, 2022",27.69,30.67,31.5,32.0,34.0,"Taylor Raddysh, Boris Katchouk, Petr Mrazek, Isaak Phillips, Jake McCabe, Connor Murphy, Seth Jones, Tyler Johnson, Jason Dickinson, Colin Blackwell, Sam Lafferty, Mackenzie Entwistle, Reese Johnson","Jake McCabe, Connor Murphy, Seth Jones","Connor Murphy, Seth Jones",Seth Jones,Seth Jones,2.0
Colorado Avalanche,COL,COL.png,20222023,45,21,west,central,none,0.497,+5.68,0.925,0.071,-1,+28,-28,84182704,-1682704.0,18,7,12,17,3,19,#fc4d47,#3568f2,#3568f2,#fc4d47,#052ca3,#fc4d47,0.0,0.0,13,59537500.0,8,50925000,5,37225000,5,37225000,2.0,18725000.0,-1682704.0,Chris MacFarland,"July 11, 2022",Jared Bednar,"August 25, 2016",28.54,27.88,28.8,29.8,33.0,"Mikko Rantanen, Pavel Francouz, Nathan MacKinnon, Valeri Nichushkin, Artturi Lehkonen, Alexandar Georgiev, Logan O'Connor, Brad Hunt, Kurtis MacDermid, Devon Toews, Jacob MacDonald, Cale Makar, Samuel Girard","Mikko Rantanen, Nathan MacKinnon, Valeri Nichushkin, Artturi Lehkonen, Alexandar Georgiev, Logan O'Connor, Cale Makar, Samuel Girard","Nathan MacKinnon, Valeri Nichushkin, Artturi Lehkonen, Cale Makar, Samuel Girard","Nathan MacKinnon, Valeri Nichushkin, Artturi Lehkonen, Cale Makar, Samuel Girard","Nathan MacKinnon, Valeri Nichushkin",30.0
Columbus Blue Jackets,CBJ,CBJ.png,20222023,28,13,east,metro,none,0.4,-19.26,0.897,0.084,-41,+11,-25,84322206,-1822206.0,25,20,10,27,21,15,red,#fc4d47,#3568f2,red,#fc4d47,black,0.0,0.0,16,50312500.0,8,39450000,6,34350000,2,15150000,1.0,9750000.0,-1822206.0,Jarmo Kekalainen,"February 13, 2013",Brad Larsen,"June 10, 2021",25.88,29.0,30.5,32.5,35.0,"Johnny Gaudreau, Patrik Laine, Jack Roslovic, Boone Jenner, Sean Kuraly, Eric Robinson, Kent Johnson, Kirill Marchenko, Cole Sillinger, Emil Bemstrom, Liam Foudy, Erik Gudbranson, Adam Boqvist, Nick Blankenburg, Andrew Peeke, Elvis Merzlikins","Johnny Gaudreau, Patrik Laine, Boone Jenner, Sean Kuraly, Erik Gudbranson, Adam Boqvist, Andrew Peeke, Elvis Merzlikins","Johnny Gaudreau, Patrik Laine, Boone Jenner, Erik Gudbranson, Andrew Peeke, Elvis Merzlikins","Johnny Gaudreau, Elvis Merzlikins",Johnny Gaudreau,11.0
Dallas Stars,DAL,DAL.png,20222023,57,25,west,central,top3,0.561,+10.75,0.923,0.097,+23,+34,-19,82193333,306667.0,5,4,5,10,4,7,#052ca3,#052ca3,#052ca3,#3568f2,#052ca3,#3568f2,0.0,0.0,16,74869167.0,11,66094167,5,39000000,3,26750000,2.0,16900000.0,306667.0,Jim Nill,"April 29, 2013",Peter DeBoer,"June 21, 2022",29.06,29.18,28.8,30.33,30.5,"Colin Miller, Scott Wedgewood, Jake Oettinger, Nils Lundkvist, Jani Hakanpaa, Ryan Suter, Miro Heiskanen, Wyatt Johnston, Roope Hintz, Radek Faksa, Mason Marchment, Esa Lindell, Tyler Seguin, Joe Pavelski, Jamie Benn, Jason Robertson","Jake Oettinger, Ryan Suter, Miro Heiskanen, Wyatt Johnston, Roope Hintz, Radek Faksa, Mason Marchment, Esa Lindell, Tyler Seguin, Jamie Benn, Jason Robertson","Miro Heiskanen, Roope Hintz, Mason Marchment, Tyler Seguin, Jason Robertson","Miro Heiskanen, Roope Hintz, Tyler Seguin","Miro Heiskanen, Roope Hintz",29.0
Detroit Red Wings,DET,DET.png,20222023,43,18,east,atlantic,none,0.495,-5.64,0.907,0.104,-2,+19,-28,77233587,5266413.0,19,15,12,22,15,3,#fc4d47,black,#3568f2,#fc4d47,black,#052ca3,0.0,0.0,11,34948333.0,4,19125000,2,10375000,1,5625000,0.0,0.0,5266413.0,Steve Yzerman,"April 19, 2019",Derek Lalonde,"June 30, 2022",26.82,30.0,32.5,32.0,,"Andrew Copp, David Perron, Robby Fabbri, Michael Rasmussen, Jonatan Berggren, Lucas Raymond, Dominik Kubalik, Ben Chiarot, Filip Hronek, Moritz Seider, Ville Husso","Andrew Copp, Robby Fabbri, Ben Chiarot, Ville Husso","Andrew Copp, Ben Chiarot",Andrew Copp,,6.0
Edmonton Oilers,EDM,EDM.png,20222023,51,24,west,pacific,wc,0.512,+6.66,0.913,0.091,+5,+44,-32,92305558,-9805558.0,15,1,13,15,12,9,black,#052ca3,black,black,#3568f2,#3568f2,0.0,0.0,15,65538333.0,8,51875000,6,40125000,4,24875000,3.0,19875000.0,-9805558.0,Ken Holland,"May 7, 2019",Jay Woodcroft,"February 10, 2022",27.73,30.5,31.67,33.25,34.67,"Leon Draisaitl, Connor McDavid, Zach Hyman, Ryan Nugent-Hopkins, Kailer Yamamoto, Warren Foegele, Dylan Holloway, Darnell Nurse, Tyson Barrie, Cody Ceci, Brett Kulak, Philip Broberg, Vincent Desharnais, Markus Niemelainen, Jack Campbell","Leon Draisaitl, Connor McDavid, Zach Hyman, Ryan Nugent-Hopkins, Darnell Nurse, Cody Ceci, Brett Kulak, Jack Campbell","Connor McDavid, Zach Hyman, Ryan Nugent-Hopkins, Darnell Nurse, Brett Kulak, Jack Campbell","Zach Hyman, Ryan Nugent-Hopkins, Darnell Nurse, Jack Campbell","Zach Hyman, Ryan Nugent-Hopkins, Darnell Nurse",27.0
Florida Panthers,FLA,FLA.png,20222023,44,20,east,atlantic,none,0.505,+14.04,0.905,0.086,+2,+32,-35,87773352,-5273352.0,16,5,14,6,16,13,black,#052ca3,black,#052ca3,black,black,0.0,0.0,13,62583334.0,6,45591667,3,29500000,2,19500000,2.0,19500000.0,-5273352.0,Bill Zito,"September 2, 2020",Paul Maurice,"June 22, 2022",27.77,29.5,31.67,30.0,32.0,"Aleksander Barkov, Matthew Tkachuk, Sam Reinhart, Sam Bennett, Carter Verhaeghe, Eetu Luostarinen, Nick Cousins, Anton Lundell, Ryan Lomberg, Aaron Ekblad, Brandon Montour, Gustav Forsling, Sergei Bobrovsky","Aleksander Barkov, Matthew Tkachuk, Sam Bennett, Carter Verhaeghe, Aaron Ekblad, Sergei Bobrovsky","Aleksander Barkov, Matthew Tkachuk, Sergei Bobrovsky","Aleksander Barkov, Matthew Tkachuk","Aleksander Barkov, Matthew Tkachuk",32.0
Los Angeles Kings,LAK,LAK.png,20222023,56,25,west,pacific,top3,0.498,+8.57,0.899,0.086,-1,+32,-38,81246677,1253323.0,18,5,17,13,19,13,#fc4d47,#052ca3,#fc4d47,black,#fc4d47,black,0.0,0.0,13,59494167.0,5,33875000,4,29875000,3,24375000,1.0,7875000.0,1253323.0,Rob Blake,"April 10, 2017",Todd McLellan,"April 16, 2019",28.38,30.6,31.5,33.33,32.0,"Matt Roy, Sean Walker, Sean Durzi, Drew Doughty, Quinton Byfield, Carl Grundstrom, Blake Lizotte, Alex Iafallo, Viktor Arvidsson, Adrian Kempe, Phillip Danault, Kevin Fiala, Anze Kopitar","Drew Doughty, Alex Iafallo, Adrian Kempe, Phillip Danault, Kevin Fiala","Drew Doughty, Adrian Kempe, Phillip Danault, Kevin Fiala","Drew Doughty, Phillip Danault, Kevin Fiala",Kevin Fiala,14.0
Minnesota Wild,MIN,MIN.png,20222023,52,24,west,central,top3,0.524,+6.21,0.917,0.09,+8,+27,-19,78747349,3752651.0,14,8,5,16,8,10,black,#3568f2,#052ca3,black,#3568f2,#3568f2,0.0,0.0,13,51575000.0,7,34475000,4,27825000,3,18825000,2.0,11250000.0,3752651.0,Bill Guerin,"August 21, 2019",Dean Evason,"February 14, 2020",30.69,29.71,31.0,33.0,33.0,"Marc-Andre Fleury, Jon Merrill, Kirill Kaprizov, Mats Zuccarello, Joel Eriksson Ek, Marcus Foligno, Jordan Greenway, Ryan Hartman, Connor Dewar, Jared Spurgeon, Jonas Brodin, Jacob Middleton, Alex Goligoski","Jon Merrill, Kirill Kaprizov, Joel Eriksson Ek, Jordan Greenway, Jared Spurgeon, Jonas Brodin, Jacob Middleton","Kirill Kaprizov, Joel Eriksson Ek, Jared Spurgeon, Jonas Brodin","Joel Eriksson Ek, Jared Spurgeon, Jonas Brodin","Joel Eriksson Ek, Jonas Brodin",20.0
Montreal Canadiens,MTL,MTL.png,20222023,37,17,east,atlantic,none,0.422,-30.02,0.895,0.087,-31,+15,-36,94288485,-11788485.0,24,18,15,30,22,12,red,#fc4d47,black,red,#fc4d47,#3568f2,0.0,0.0,16,46870000.0,10,35354167,3,16737500,2,13375000,1.0,7875000.0,-11788485.0,Kent Hughes,"January 18, 2022",Martin St. Louis,"February 9, 2022",27.44,28.0,27.0,29.5,29.0,"Samuel Montembeault, Jake Allen, Chris Wideman, Johnathan Kovacevic, Arber Xhekaj, Justin Barron, David Savard, Joel Edmundson, Juraj Slafkovsky, Jake Evans, Kirby Dach, Joel Armia, Christian Dvorak, Mike Hoffman, Josh Anderson, Nick Suzuki","Jake Allen, Johnathan Kovacevic, David Savard, Juraj Slafkovsky, Jake Evans, Kirby Dach, Joel Armia, Christian Dvorak, Josh Anderson, Nick Suzuki","Kirby Dach, Josh Anderson, Nick Suzuki","Josh Anderson, Nick Suzuki",Nick Suzuki,3.0
Nashville Predators,NSH,NSH.png,20222023,44,19,west,central,none,0.515,+0.53,0.927,0.083,+5,+18,-28,81010033,1489967.0,15,16,12,18,2,16,black,black,#3568f2,#fc4d47,#052ca3,black,0.0,0.0,13,67966976.0,10,61416143,7,43416143,2,17559000,2.0,17559000.0,1489967.0,David Poile,"July 9, 1997",John Hynes,"January 7, 2020",29.77,31.7,33.0,34.0,36.0,"Ryan McDonagh, Mattias Ekholm, Juuse Saros, Jeremy Lauzon, Roman Josi, Juuso Parssinen, Matt Duchene, Ryan Johansen, Mikael Granlund, Nino Niederreiter, Colton Sissons, Yakov Trenin, Filip Forsberg","Ryan McDonagh, Mattias Ekholm, Juuse Saros, Jeremy Lauzon, Roman Josi, Matt Duchene, Ryan Johansen, Mikael Granlund, Colton Sissons, Filip Forsberg","Ryan McDonagh, Mattias Ekholm, Jeremy Lauzon, Roman Josi, Matt Duchene, Colton Sissons, Filip Forsberg","Roman Josi, Filip Forsberg","Roman Josi, Filip Forsberg",10.0
New Jersey Devils,NJD,NJD.png,20222023,59,28,east,metro,top3,0.601,+31.52,0.917,0.095,+39,+19,-21,84211751,-1711751.0,3,15,7,1,8,8,#052ca3,black,#3568f2,#052ca3,#3568f2,#3568f2,0.0,0.0,11,41590834.0,7,37944167,5,33650000,5,33650000,3.0,20400000.0,-1711751.0,Tom Fitzgerald,"January 12, 2020",Lindy Ruff,"July 9, 2020",26.0,27.29,29.0,30.0,31.0,"Jack Hughes, Nico Hischier, Alexander Holtz, Dawson Mercer, Nolan Foote, Ondrej Palat, Dougie Hamilton, Jonas Siegenthaler, Brendan Smith, Nikita Okhotiuk, Vitek Vanecek","Jack Hughes, Nico Hischier, Alexander Holtz, Ondrej Palat, Dougie Hamilton, Jonas Siegenthaler, Vitek Vanecek","Jack Hughes, Nico Hischier, Ondrej Palat, Dougie Hamilton, Jonas Siegenthaler","Jack Hughes, Nico Hischier, Ondrej Palat, Dougie Hamilton, Jonas Siegenthaler","Jack Hughes, Dougie Hamilton, Jonas Siegenthaler",18.0
New York Islanders,NYI,NYI.png,20222023,49,23,east,metro,wc,0.539,-9.1,0.919,0.095,+15,+15,-16,80182819,2317181.0,7,18,2,24,6,8,#3568f2,#fc4d47,#052ca3,red,#052ca3,#3568f2,0.0,0.0,16,61488333.0,9,43400000,6,30900000,3,17800000,2.0,15300000.0,2317181.0,Lou Lamoriello,"June 5, 2018",Lane Lambert,"May 16, 2022",29.19,29.89,32.0,32.0,32.5,"Mathew Barzal, Anders Lee, Brock Nelson, Josh Bailey, Anthony Beauvillier, Jean-Gabriel Pageau, Casey Cizikas, Cal Clutterbuck, Matt Martin, Ross Johnston, Simon Holmstrom, Noah Dobson, Alexander Romanov, Ryan Pulock, Sebastian Aho, Ilya Sorokin","Mathew Barzal, Anders Lee, Brock Nelson, Jean-Gabriel Pageau, Casey Cizikas, Ross Johnston, Noah Dobson, Alexander Romanov, Ryan Pulock","Mathew Barzal, Anders Lee, Jean-Gabriel Pageau, Casey Cizikas, Ross Johnston, Ryan Pulock","Mathew Barzal, Casey Cizikas, Ryan Pulock","Mathew Barzal, Ryan Pulock",16.0
New York Rangers,NYR,NYR.png,20222023,55,24,east,metro,top3,0.533,-0.22,0.916,0.089,+12,+26,-14,81272618,1227382.0,10,9,1,20,9,11,#3568f2,#3568f2,#052ca3,#fc4d47,#3568f2,#3568f2,0.0,0.0,14,67430358.0,10,60642858,7,53409524,5,33766667,3.0,23625000.0,1227382.0,Chris Drury,"May 5, 2021",Gerard Gallant,"June 16, 2021",27.79,30.0,31.71,32.4,33.33,"Barclay Goodrow, Artemi Panarin, Mika Zibanejad, Chris Kreider, Vincent Trocheck, Jake Leschyshyn, Kaapo Kakko, Jonny Brodzinski, Jimmy Vesey, Adam Fox, Ryan Lindgren, Braden Schneider, Jacob Trouba, Igor Shesterkin","Barclay Goodrow, Artemi Panarin, Mika Zibanejad, Chris Kreider, Vincent Trocheck, Jake Leschyshyn, Jimmy Vesey, Adam Fox, Jacob Trouba, Igor Shesterkin","Barclay Goodrow, Artemi Panarin, Mika Zibanejad, Chris Kreider, Vincent Trocheck, Adam Fox, Jacob Trouba","Barclay Goodrow, Mika Zibanejad, Chris Kreider, Vincent Trocheck, Adam Fox","Mika Zibanejad, Vincent Trocheck, Adam Fox",12.0
Ottawa Senators,OTT,OTT.png,20222023,41,19,east,atlantic,none,0.413,+10.17,0.897,0.069,-31,+37,-20,79132602,3367398.0,24,2,6,11,21,21,red,#052ca3,#052ca3,#3568f2,#fc4d47,#fc4d47,0.0,0.0,10,45903214.0,8,44215714,5,34130714,5,34130714,3.0,24555714.0,3367398.0,Pierre Dorion,"April 10, 2016",D. J. Smith,"May 23, 2019",26.1,28.0,27.0,28.0,29.0,"Anton Forsberg, Artem Zub, Thomas Chabot, Parker Kelly, Mark Kastelic, Tim Stutzle, Jake Sanderson, Brady Tkachuk, Drake Batherson, Claude Giroux","Anton Forsberg, Artem Zub, Thomas Chabot, Mark Kastelic, Tim Stutzle, Brady Tkachuk, Drake Batherson, Claude Giroux","Artem Zub, Thomas Chabot, Tim Stutzle, Brady Tkachuk, Drake Batherson","Artem Zub, Thomas Chabot, Tim Stutzle, Brady Tkachuk, Drake Batherson","Thomas Chabot, Tim Stutzle, Brady Tkachuk",15.0
Philadelphia Flyers,PHI,PHI.png,20222023,41,17,east,metro,none,0.47,-18.52,0.91,0.083,-11,+18,-19,86586976,-4086976.0,21,16,5,26,14,16,#fc4d47,black,#052ca3,red,black,black,0.0,0.0,14,53391024.0,8,40492857,6,28242857,3,16350000,2.0,11250000.0,-4086976.0,Chuck Fletcher,"December 3, 2018",John Tortorella,"June 17, 2022",27.21,29.0,30.5,29.33,30.0,"Wade Allison, Travis Sanheim, Anthony Deangelo, Nick Seeler, Rasmus Ristolainen, Ivan Provorov, Scott Laughton, Owen Tippett, Nicolas Deslauriers, Joel Farabee, Travis Konecny, Kevin Hayes, Carter Hart, Samuel Ersson","Travis Sanheim, Rasmus Ristolainen, Ivan Provorov, Scott Laughton, Nicolas Deslauriers, Joel Farabee, Travis Konecny, Kevin Hayes","Travis Sanheim, Rasmus Ristolainen, Scott Laughton, Nicolas Deslauriers, Joel Farabee, Kevin Hayes","Travis Sanheim, Rasmus Ristolainen, Joel Farabee","Travis Sanheim, Joel Farabee",9.0
Pittsburgh Penguins,PIT,PIT.png,20222023,48,21,east,metro,none,0.5,+11.46,0.914,0.09,0,+24,-16,84885648,-2385648.0,17,11,2,9,11,10,#fc4d47,#3568f2,#052ca3,#3568f2,#3568f2,#3568f2,0.0,0.0,15,51737675.0,7,34450175,3,16225000,2,10125000,2.0,10125000.0,-2385648.0,Ron Hextall,"February 9, 2021",Mike Sullivan,"December 12, 2015",31.33,32.86,34.67,33.5,35.5,"Rickard Rakell, Bryan Rust, Kasperi Kapanen, Jeff Carter, Brock McGinn, Marcus Pettersson, Jan Rutta, Pierre-Olivier Joseph, Mark Friedman, Taylor Fedun, Casey DeSmith, Chad Ruhwedel, Evgeni Malkin, Jake Guentzel, Sidney Crosby","Rickard Rakell, Bryan Rust, Brock McGinn, Marcus Pettersson, Jan Rutta, Evgeni Malkin, Sidney Crosby","Rickard Rakell, Bryan Rust, Evgeni Malkin","Rickard Rakell, Bryan Rust","Rickard Rakell, Bryan Rust",17.0
San Jose Sharks,SJS,SJS.png,20222023,34,13,west,pacific,none,0.445,-0.13,0.881,0.099,-26,+17,-18,83415956,-915956.0,23,17,4,19,23,5,#fc4d47,#fc4d47,#052ca3,#fc4d47,#fc4d47,#052ca3,0.0,0.0,14,56260000.0,7,41137500,6,39137500,3,27637500,1.0,8137500.0,-915956.0,Mike Grier,"July 5, 2022",David Quinn,"July 21, 2022",29.07,31.71,33.17,35.33,35.0,"Erik Karlsson, Marc-Edouard Vlasic, Matthew Benning, Nick Cicek, Mario Ferraro, Steven Lorentz, Nico Sturm, Jaycob Megna, Alexander Barabanov, Oskar Lindblom, Kevin Labanc, Tomas Hertl, Kaapo Kahkonen, Logan Couture","Erik Karlsson, Marc-Edouard Vlasic, Matthew Benning, Mario Ferraro, Nico Sturm, Tomas Hertl, Logan Couture","Erik Karlsson, Marc-Edouard Vlasic, Matthew Benning, Mario Ferraro, Tomas Hertl, Logan Couture","Erik Karlsson, Tomas Hertl, Logan Couture",Tomas Hertl,13.0
St. Louis Blues,STL,STL.png,20222023,45,21,west,central,none,0.447,-21.0,0.898,0.095,-23,+24,-24,86186099,-3686099.0,22,11,9,28,20,8,#fc4d47,#3568f2,#3568f2,red,#fc4d47,#3568f2,0.0,0.0,13,59240000.0,10,56885833,8,50250000,6,41750000,4.0,29250000.0,-3686099.0,Doug Armstrong,"July 1, 2010",Craig Berube,"November 19, 2018",28.08,29.4,31.38,31.67,32.75,"Brayden Schenn, Pavel Buchnevich, Brandon Saad, Jordan Kyrou, Robert Thomas, Jake Neighbours, Nikita Alexandrov, Nathan Walker, Justin Faulk, Colton Parayko, Nick Leddy, Calle Rosen, Jordan Binnington","Brayden Schenn, Pavel Buchnevich, Brandon Saad, Jordan Kyrou, Robert Thomas, Jake Neighbours, Justin Faulk, Colton Parayko, Nick Leddy, Jordan Binnington","Brayden Schenn, Brandon Saad, Jordan Kyrou, Robert Thomas, Justin Faulk, Colton Parayko, Nick Leddy, Jordan Binnington","Brayden Schenn, Jordan Kyrou, Robert Thomas, Justin Faulk, Colton Parayko, Jordan Binnington","Brayden Schenn, Jordan Kyrou, Robert Thomas, Colton Parayko",21.0
Tampa Bay Lightning,TBL,TBL.png,20222023,55,27,east,atlantic,top3,0.535,+12.67,0.913,0.095,+13,+30,-21,89878585,-7378585.0,9,6,7,7,12,8,#3568f2,#052ca3,#3568f2,#3568f2,#3568f2,#3568f2,0.0,0.0,14,73212500.0,9,60600000,7,51600000,7,51600000,6.0,42100000.0,-7378585.0,Julien BriseBois,"September 11, 2018",Jon Cooper,"March 25, 2013",28.71,28.67,29.29,30.29,31.83,"Nikita Kucherov, Andrei Vasilevskiy, Haydn Fleury, Nick Perbix, Zach Bogosian, Erik Cernak, Mikhail Sergachev, Victor Hedman, Patrick Maroon, Brayden Point, Steven Stamkos, Anthony Cirelli, Brandon Hagel, Nicholas Paul","Nikita Kucherov, Andrei Vasilevskiy, Nick Perbix, Erik Cernak, Mikhail Sergachev, Victor Hedman, Brayden Point, Anthony Cirelli, Nicholas Paul","Nikita Kucherov, Andrei Vasilevskiy, Erik Cernak, Mikhail Sergachev, Brayden Point, Anthony Cirelli, Nicholas Paul","Nikita Kucherov, Andrei Vasilevskiy, Erik Cernak, Mikhail Sergachev, Brayden Point, Anthony Cirelli, Nicholas Paul","Andrei Vasilevskiy, Erik Cernak, Mikhail Sergachev, Brayden Point, Anthony Cirelli, Nicholas Paul",31.0
Toronto Maple Leafs,TOR,TOR.png,20222023,59,26,east,atlantic,top3,0.574,+15.14,0.921,0.097,+27,+32,-22,88478870,-5978870.0,4,5,8,5,5,7,#052ca3,#052ca3,#3568f2,#052ca3,#052ca3,#3568f2,0.0,0.0,11,59155616.0,4,31503000,2,9600000,1,7500000,1.0,7500000.0,-5978870.0,Kyle Dubas,"May 11, 2018",Sheldon Keefe,"November 20, 2019",28.73,31.0,32.5,32.0,34.0,"Mark Giordano, Rasmus Sandin, Timothy Liljegren, Morgan Rielly, Bobby McMann, Calle Jarnkrok, Matt Murray, Auston Matthews, John Tavares, Mitchell Marner, William Nylander","Morgan Rielly, Calle Jarnkrok, John Tavares, Mitchell Marner","Morgan Rielly, Calle Jarnkrok",Morgan Rielly,Morgan Rielly,28.0
Vancouver Canucks,VAN,VAN.png,20222023,37,17,west,pacific,none,0.479,-18.33,0.901,0.101,-9,+25,-36,87221546,-4721546.0,20,10,15,25,18,4,#fc4d47,#3568f2,black,red,#fc4d47,#052ca3,0.0,0.0,14,58272500.0,7,40460000,5,32810000,3,23110000,1.0,8000000.0,-4721546.0,Patrik Allvin,"January 26, 2022",Bruce Boudreau,"December 5, 2021",27.64,29.0,30.4,31.67,35.0,"Tyler Myers, Brock Boeser, J.T. Miller, Conor Garland, Ilya Mikheyev, Curtis Lazar, Dakota Joshua, Jack Studnicka, Sheldon Dries, Quinn Hughes, Oliver Ekman-Larsson, Riley Stillman, Spencer Martin, Elias Pettersson","Brock Boeser, J.T. Miller, Conor Garland, Ilya Mikheyev, Curtis Lazar, Quinn Hughes, Oliver Ekman-Larsson","J.T. Miller, Conor Garland, Ilya Mikheyev, Quinn Hughes, Oliver Ekman-Larsson","J.T. Miller, Quinn Hughes, Oliver Ekman-Larsson",J.T. Miller,19.0
Vegas Golden Knights,VGK,VGK.png,20222023,58,28,west,pacific,top3,0.505,+16.47,0.911,0.087,+2,+27,-14,97319618,-14819618.0,16,8,1,4,13,12,black,#3568f2,#052ca3,#052ca3,black,#3568f2,0.0,0.0,19,67849984.0,11,50285817,6,37975000,4,27200000,0.0,0.0,-14819618.0,Kelly McCrimmon,"September 1, 2019",Bruce Cassidy,"June 14, 2022",28.68,29.45,30.67,33.25,,"Logan Thompson, Daniil Miromanov, Kaedan Korczak, Ben Hutton, Nicolas Hague, Brayden McNabb, Alec Martinez, Alex Pietrangelo, Paul Cotter, Michael Amadio, Keegan Kolesar, William Carrier, Chandler Stephenson, Nicolas Roy, Reilly Smith, Jonathan Marchessault, William Karlsson, Mark Stone, Jack Eichel","Logan Thompson, Nicolas Hague, Brayden McNabb, Alex Pietrangelo, Paul Cotter, Keegan Kolesar, Nicolas Roy, Reilly Smith, William Karlsson, Mark Stone, Jack Eichel","Alex Pietrangelo, Paul Cotter, Nicolas Roy, William Karlsson, Mark Stone, Jack Eichel","Alex Pietrangelo, Nicolas Roy, William Karlsson, Mark Stone",,22.0
Washington Capitals,WSH,WSH.png,20222023,52,23,east,metro,wc,0.536,+7.61,0.917,0.091,+14,+23,-20,90862918,-8362918.0,8,12,6,14,8,9,#3568f2,#3568f2,#052ca3,black,#3568f2,#3568f2,0.0,0.0,9,50766667.0,7,39900000,2,14750000,1,5250000,0.0,0.0,-8362918.0,Brian MacLellan,"May 26, 2014",Peter Laviolette,"September 15, 2020",32.89,35.0,37.5,36.0,,"Charlie Lindgren, Darcy Kuemper, Nic Dowd, Tom Wilson, Anthony Mantha, T.J. Oshie, Evgeny Kuznetsov, Alex Ovechkin, Nicklas Backstrom","Charlie Lindgren, Darcy Kuemper, Nic Dowd, T.J. Oshie, Evgeny Kuznetsov, Alex Ovechkin, Nicklas Backstrom","Darcy Kuemper, Alex Ovechkin",Darcy Kuemper,,25.0
