full,team,logo,season,PTS,W,Conference,Division,playoffs,gf%,xg_dif,sv%,shooting%,g_dif,PP_g_dif,PK_g_dif,projected_cap_hit,projected_cap_space,5on5_rank,PP_rank,PK_rank,XG_dif_rank,Save%_rank,Shooting%_rank,5on5_color,PP_color,PK_color,xg_color,sv_color,sh_color,expiring_contracts,expiring_salary,nhl_contracts_2324,2023-24 Salary,nhl_contracts_2425,2024-25 Salary,nhl_contracts_2526,2025-26 Salary,nhl_contracts_2627,2026-27 Salary,nhl_contracts_2728,2027-28 Salary,cap_remaining,GM,gm_start,coach,coach_start,avg_age_2324,avg_age_2425,avg_age_2526,avg_age_2627,avg_age_2728,players_under_contract_2324,players_under_contract_2425,players_under_contract_2526,players_under_contract_2627,players_under_contract_2728,draft_capital_rank
Anaheim Ducks,ANA,ANA.png,20222023,28,12,west,pacific,none,0.367,-36.42,0.908,0.072,-47,+13,-39,68573153,13926847.0,26,19,20,32,14,19,red,#fc4d47,#fc4d47,red,black,#fc4d47,0.0,0.0,11,36756667.0,5,22444167,3,17900000,2,11400000,0.0,0.0,13926847.0,Pat Verbeek,"February 3, 2022",Dallas Eakins,"June 17, 2019",28.45,29.2,32.67,33.0,,"John Gibson, Colton White, Urho Vaakanainen, Brett Leason, Sam Carrick, Adam Henrique, Jakob Silfverberg, Ryan Strome, Frank Vatrano, Cam Fowler, Mason McTavish","John Gibson, Ryan Strome, Frank Vatrano, Cam Fowler, Mason McTavish","John Gibson, Ryan Strome, Cam Fowler","John Gibson, Ryan Strome",,4.0
Arizona Coyotes,ARI,ARI.png,20222023,31,13,west,central,none,0.452,-28.34,0.907,0.101,-16,+22,-36,64261530,18238470.0,20,12,19,30,15,3,#fc4d47,#3568f2,#fc4d47,red,black,#052ca3,0.0,0.0,13,37680834.0,6,25519167,3,17300000,2,11450000,1.0,7150000.0,18238470.0,Bill Armstrong,"September 17, 2020",Andre Tourigny,"July 1, 2021",26.69,26.0,28.0,28.5,30.0,"Lawson Crouse, Zack Kassian, Karel Vejmelka, J.J. Moser, Joshua Brown, Patrik Nemeth, Liam O'Brien, Dylan Guenther, Travis Boyd, Barrett Hayton, Clayton Keller, Nick Schmaltz, Jakob Chychrun","Lawson Crouse, Karel Vejmelka, Dylan Guenther, Clayton Keller, Nick Schmaltz, Jakob Chychrun","Lawson Crouse, Clayton Keller, Nick Schmaltz","Lawson Crouse, Clayton Keller",Clayton Keller,1.0
Boston Bruins,BOS,BOS.png,20222023,66,31,east,atlantic,top3,0.634,+21.16,0.935,0.1,+43,+31,-16,83690388,-1190388.0,1,5,4,3,1,4,#052ca3,#052ca3,#052ca3,#052ca3,#052ca3,#052ca3,0.0,0.0,11,51062500.0,7,42475000,4,25350000,3,20100000,2.0,16000000.0,-1190388.0,Don Sweeney,"May 20, 2015",Jim Montgomery,"July 1, 2022",29.45,31.0,30.25,30.33,32.5,"Matt Grzelcyk, Derek Forbort, Jakub Zboril, Brandon Carlo, Linus Ullmark, Hampus Lindholm, AJ Greer, Charlie Coyle, Taylor Hall, Charlie McAvoy, Brad Marchand","Brandon Carlo, Linus Ullmark, Hampus Lindholm, Charlie Coyle, Taylor Hall, Charlie McAvoy, Brad Marchand","Brandon Carlo, Hampus Lindholm, Charlie Coyle, Charlie McAvoy","Brandon Carlo, Hampus Lindholm, Charlie McAvoy","Hampus Lindholm, Charlie McAvoy",26.0
Buffalo Sabres,BUF,BUF.png,20222023,42,20,east,atlantic,none,0.532,-6.48,0.907,0.11,+12,+33,-27,65174235,17325765.0,8,3,14,23,15,2,#3568f2,#052ca3,black,#fc4d47,black,#052ca3,0.0,0.0,13,46527737.0,6,26897737,4,25178571,3,20428571,2.0,11428571.0,17325765.0,Kevyn Adams,"June 16, 2020",Don Granato,"March 17, 2021",24.92,26.0,28.75,29.67,29.5,"Owen Power, Mattias Samuelsson, Jacob Bryson, Ilya Lyubushkin, Rasmus Dahlin, John-Jason Peterka, Peyton Krebs, Tage Thompson, Jeff Skinner, Casey Mittelstadt, Victor Olofsson, Alex Tuch, Jack Quinn","Mattias Samuelsson, John-Jason Peterka, Tage Thompson, Jeff Skinner, Alex Tuch, Jack Quinn","Mattias Samuelsson, Tage Thompson, Jeff Skinner, Alex Tuch","Mattias Samuelsson, Tage Thompson, Jeff Skinner","Mattias Samuelsson, Tage Thompson",8.0
Calgary Flames,CGY,CGY.png,20222023,45,19,west,pacific,wc,0.526,+11.51,0.904,0.084,+9,+22,-17,81958775,541225.0,9,12,5,8,16,16,#3568f2,#3568f2,#052ca3,#3568f2,black,black,0.0,0.0,17,78775833.0,8,47200000,6,39200000,4,28650000,3.0,23750000.0,541225.0,Brad Treliving,"April 28, 2014",Darryl Sutter,"March 4, 2021",28.88,30.75,32.83,34.25,36.0,"Jacob Markstrom, MacKenzie Weegar, Nikita Zadorov, Christopher Tanev, Rasmus Andersson, Noah Hanifin, Adam Ruzicka, Jakob Pelletier, Dillon Dube, Tyler Toffoli, Elias Lindholm, Blake Coleman, Nazem Kadri, Mikael Backlund, Andrew Mangiapane, Daniel Vladar, Jonathan Huberdeau","Jacob Markstrom, MacKenzie Weegar, Rasmus Andersson, Blake Coleman, Nazem Kadri, Andrew Mangiapane, Daniel Vladar, Jonathan Huberdeau","Jacob Markstrom, MacKenzie Weegar, Rasmus Andersson, Blake Coleman, Nazem Kadri, Jonathan Huberdeau","MacKenzie Weegar, Blake Coleman, Nazem Kadri, Jonathan Huberdeau","MacKenzie Weegar, Nazem Kadri, Jonathan Huberdeau",24.0
Carolina Hurricanes,CAR,CAR.png,20222023,57,25,east,metro,top3,0.565,+28.26,0.914,0.078,+20,+21,-24,86058534,-3558534.0,5,13,12,2,9,18,#052ca3,black,#3568f2,#052ca3,#3568f2,#fc4d47,0.0,0.0,13,53504417.0,4,23150000,2,12570000,2,12570000,2.0,12570000.0,-3558534.0,Don Waddell,"May 8, 2018",Rod Brind'Amour,"May 8, 2018",27.62,29.25,25.0,26.0,28.0,"Jalen Chatfield, Brett Pesce, Brady Skjei, Brent Burns, Jaccob Slavin, Sebastian Aho, Stefan Noesen, Jordan Martinook, Martin Necas, Jesperi Kotkaniemi, Teuvo Teravainen, Andrei Svechnikov, Seth Jarvis","Brent Burns, Jaccob Slavin, Jesperi Kotkaniemi, Andrei Svechnikov","Jesperi Kotkaniemi, Andrei Svechnikov","Jesperi Kotkaniemi, Andrei Svechnikov","Jesperi Kotkaniemi, Andrei Svechnikov",7.0
Chicago Blackhawks,CHI,CHI.png,20222023,22,9,west,central,none,0.333,-27.99,0.903,0.065,-50,+16,-24,77503866,4996134.0,27,17,12,29,17,20,red,#fc4d47,#3568f2,red,#fc4d47,#fc4d47,0.0,0.0,13,35800833.0,3,17900000,2,13900000,1,9500000,1.0,9500000.0,4996134.0,Kyle Davidson,"October 26, 2021",Luke Richardson,"June 27, 2022",27.46,30.67,31.5,32.0,34.0,"Boris Katchouk, Reese Johnson, Petr Mrazek, Jake McCabe, Connor Murphy, Seth Jones, Taylor Raddysh, Isaak Phillips, Tyler Johnson, Jason Dickinson, Colin Blackwell, Sam Lafferty, Lukas Reichel","Jake McCabe, Connor Murphy, Seth Jones","Connor Murphy, Seth Jones",Seth Jones,Seth Jones,2.0
Colorado Avalanche,COL,COL.png,20222023,43,20,west,central,none,0.474,+1.9,0.925,0.065,-7,+27,-26,84113785,-1613785.0,17,7,13,17,2,20,#fc4d47,#3568f2,black,#fc4d47,#052ca3,#fc4d47,0.0,0.0,12,57537500.0,8,50925000,5,37225000,5,37225000,2.0,18725000.0,-1613785.0,Chris MacFarland,"July 11, 2022",Jared Bednar,"August 25, 2016",28.17,27.88,28.8,29.8,33.0,"Mikko Rantanen, Nathan MacKinnon, Valeri Nichushkin, Artturi Lehkonen, Alexandar Georgiev, Logan O'Connor, Brad Hunt, Kurtis MacDermid, Devon Toews, Jacob MacDonald, Cale Makar, Samuel Girard","Mikko Rantanen, Nathan MacKinnon, Valeri Nichushkin, Artturi Lehkonen, Alexandar Georgiev, Logan O'Connor, Cale Makar, Samuel Girard","Nathan MacKinnon, Valeri Nichushkin, Artturi Lehkonen, Cale Makar, Samuel Girard","Nathan MacKinnon, Valeri Nichushkin, Artturi Lehkonen, Cale Makar, Samuel Girard","Nathan MacKinnon, Valeri Nichushkin",30.0
Columbus Blue Jackets,CBJ,CBJ.png,20222023,26,12,east,metro,none,0.396,-16.55,0.896,0.083,-39,+12,-22,84759953,-2259953.0,25,20,10,25,19,17,red,#fc4d47,#3568f2,red,#fc4d47,#fc4d47,0.0,0.0,14,45737500.0,7,35700000,5,30600000,2,15150000,1.0,9750000.0,-2259953.0,Jarmo Kekalainen,"February 13, 2013",Brad Larsen,"June 10, 2021",25.64,28.71,30.2,32.5,35.0,"Johnny Gaudreau, Patrik Laine, Jack Roslovic, Sean Kuraly, Eric Robinson, Kent Johnson, Kirill Marchenko, Cole Sillinger, Emil Bemstrom, Liam Foudy, Erik Gudbranson, Adam Boqvist, Andrew Peeke, Elvis Merzlikins","Johnny Gaudreau, Patrik Laine, Sean Kuraly, Erik Gudbranson, Adam Boqvist, Andrew Peeke, Elvis Merzlikins","Johnny Gaudreau, Patrik Laine, Erik Gudbranson, Andrew Peeke, Elvis Merzlikins","Johnny Gaudreau, Elvis Merzlikins",Johnny Gaudreau,11.0
Dallas Stars,DAL,DAL.png,20222023,52,23,west,central,top3,0.557,+10.0,0.921,0.099,+20,+32,-17,82193333,306667.0,5,4,5,11,5,5,#052ca3,#052ca3,#052ca3,#3568f2,#052ca3,#052ca3,0.0,0.0,16,74869167.0,11,66094167,5,39000000,3,26750000,2.0,16900000.0,306667.0,Jim Nill,"April 29, 2013",Peter DeBoer,"June 21, 2022",29.0,29.09,28.8,30.33,30.5,"Colin Miller, Scott Wedgewood, Jake Oettinger, Nils Lundkvist, Jani Hakanpaa, Ryan Suter, Miro Heiskanen, Wyatt Johnston, Roope Hintz, Radek Faksa, Mason Marchment, Esa Lindell, Jamie Benn, Joe Pavelski, Tyler Seguin, Jason Robertson","Jake Oettinger, Ryan Suter, Miro Heiskanen, Wyatt Johnston, Roope Hintz, Radek Faksa, Mason Marchment, Esa Lindell, Jamie Benn, Tyler Seguin, Jason Robertson","Miro Heiskanen, Roope Hintz, Mason Marchment, Tyler Seguin, Jason Robertson","Miro Heiskanen, Roope Hintz, Tyler Seguin","Miro Heiskanen, Roope Hintz",29.0
Detroit Red Wings,DET,DET.png,20222023,39,16,east,atlantic,none,0.488,-4.67,0.908,0.098,-4,+17,-27,77689371,4810629.0,16,16,14,22,14,6,black,black,black,#fc4d47,black,#052ca3,0.0,0.0,12,35826666.0,5,20003333,2,10375000,1,5625000,0.0,0.0,4810629.0,Steve Yzerman,"April 19, 2019",Derek Lalonde,"June 30, 2022",26.42,28.6,32.5,32.0,,"Robby Fabbri, David Perron, Andrew Copp, Dominik Kubalik, Jonatan Berggren, Lucas Raymond, Elmer Soderblom, Michael Rasmussen, Filip Hronek, Ben Chiarot, Ville Husso, Moritz Seider","Robby Fabbri, Andrew Copp, Elmer Soderblom, Ben Chiarot, Ville Husso","Andrew Copp, Ben Chiarot",Andrew Copp,,6.0
Edmonton Oilers,EDM,EDM.png,20222023,45,21,west,pacific,wc,0.492,+5.85,0.913,0.086,-3,+41,-29,91526572,-9026572.0,15,1,15,15,10,15,black,#052ca3,black,black,#3568f2,black,0.0,0.0,15,67375833.0,9,54475000,7,42725000,4,24875000,3.0,19875000.0,-9026572.0,Ken Holland,"May 7, 2019",Jay Woodcroft,"February 10, 2022",27.47,29.78,30.71,33.0,34.67,"Zach Hyman, Connor McDavid, Leon Draisaitl, Ryan Nugent-Hopkins, Kailer Yamamoto, Warren Foegele, Dylan Holloway, Darnell Nurse, Tyson Barrie, Cody Ceci, Brett Kulak, Philip Broberg, Markus Niemelainen, Jack Campbell, Stuart Skinner","Zach Hyman, Connor McDavid, Leon Draisaitl, Ryan Nugent-Hopkins, Darnell Nurse, Cody Ceci, Brett Kulak, Jack Campbell, Stuart Skinner","Zach Hyman, Connor McDavid, Ryan Nugent-Hopkins, Darnell Nurse, Brett Kulak, Jack Campbell, Stuart Skinner","Zach Hyman, Ryan Nugent-Hopkins, Darnell Nurse, Jack Campbell","Zach Hyman, Ryan Nugent-Hopkins, Darnell Nurse",27.0
Florida Panthers,FLA,FLA.png,20222023,40,18,east,atlantic,none,0.521,+14.03,0.907,0.089,+8,+27,-32,87398555,-4898555.0,10,7,16,6,15,13,#3568f2,#3568f2,black,#052ca3,black,black,0.0,0.0,15,67845834.0,7,50091667,4,34000000,2,19500000,2.0,19500000.0,-4898555.0,Bill Zito,"September 2, 2020",Paul Maurice,"June 22, 2022",27.2,28.57,29.75,30.0,32.0,"Aleksander Barkov, Matthew Tkachuk, Sam Reinhart, Sam Bennett, Carter Verhaeghe, Eetu Luostarinen, Nick Cousins, Anton Lundell, Ryan Lomberg, Sergei Bobrovsky, Matt Kiersted, Spencer Knight, Gustav Forsling, Brandon Montour, Aaron Ekblad","Aleksander Barkov, Matthew Tkachuk, Sam Bennett, Carter Verhaeghe, Sergei Bobrovsky, Spencer Knight, Aaron Ekblad","Aleksander Barkov, Matthew Tkachuk, Sergei Bobrovsky, Spencer Knight","Aleksander Barkov, Matthew Tkachuk","Aleksander Barkov, Matthew Tkachuk",32.0
Los Angeles Kings,LAK,LAK.png,20222023,52,23,west,pacific,top3,0.505,+7.88,0.901,0.088,+2,+26,-36,81633488,866512.0,13,8,19,13,18,14,black,#3568f2,#fc4d47,black,#fc4d47,black,0.0,0.0,14,60256667.0,5,33875000,4,29875000,3,24375000,1.0,7875000.0,866512.0,Rob Blake,"April 10, 2017",Todd McLellan,"April 16, 2019",28.14,30.6,31.5,33.33,32.0,"Sean Walker, Sean Durzi, Jacob Moverare, Matt Roy, Drew Doughty, Carl Grundstrom, Quinton Byfield, Blake Lizotte, Alex Iafallo, Viktor Arvidsson, Adrian Kempe, Phillip Danault, Anze Kopitar, Kevin Fiala","Drew Doughty, Alex Iafallo, Adrian Kempe, Phillip Danault, Kevin Fiala","Drew Doughty, Adrian Kempe, Phillip Danault, Kevin Fiala","Drew Doughty, Phillip Danault, Kevin Fiala",Kevin Fiala,14.0
Minnesota Wild,MIN,MIN.png,20222023,47,22,west,central,top3,0.525,+4.16,0.915,0.094,+8,+27,-19,79132484,3367516.0,10,7,7,16,8,9,#3568f2,#3568f2,#3568f2,black,#3568f2,#3568f2,0.0,0.0,13,51575000.0,7,34475000,4,27825000,3,18825000,2.0,11250000.0,3367516.0,Bill Guerin,"August 21, 2019",Dean Evason,"February 14, 2020",30.69,29.71,31.0,33.0,33.0,"Marc-Andre Fleury, Jon Merrill, Kirill Kaprizov, Mats Zuccarello, Joel Eriksson Ek, Marcus Foligno, Jordan Greenway, Ryan Hartman, Connor Dewar, Jared Spurgeon, Jonas Brodin, Jacob Middleton, Alex Goligoski","Jon Merrill, Kirill Kaprizov, Joel Eriksson Ek, Jordan Greenway, Jared Spurgeon, Jonas Brodin, Jacob Middleton","Kirill Kaprizov, Joel Eriksson Ek, Jared Spurgeon, Jonas Brodin","Joel Eriksson Ek, Jared Spurgeon, Jonas Brodin","Joel Eriksson Ek, Jonas Brodin",20.0
Montreal Canadiens,MTL,MTL.png,20222023,35,16,east,atlantic,none,0.434,-28.84,0.892,0.092,-25,+13,-35,93769742,-11269742.0,24,19,18,31,20,11,red,#fc4d47,#fc4d47,red,#fc4d47,#3568f2,0.0,0.0,17,53370000.0,11,41854167,4,23237500,3,19875000,1.0,7875000.0,-11269742.0,Kent Hughes,"January 18, 2022",Martin St. Louis,"February 9, 2022",27.65,28.36,28.5,31.0,29.0,"Samuel Montembeault, Jake Allen, Chris Wideman, Johnathan Kovacevic, Justin Barron, David Savard, Joel Edmundson, Juraj Slafkovsky, Jake Evans, Kirby Dach, Joel Armia, Christian Dvorak, Mike Hoffman, Josh Anderson, Brendan Gallagher, Nick Suzuki, Arber Xhekaj","Jake Allen, Johnathan Kovacevic, David Savard, Juraj Slafkovsky, Jake Evans, Kirby Dach, Joel Armia, Christian Dvorak, Josh Anderson, Brendan Gallagher, Nick Suzuki","Kirby Dach, Josh Anderson, Brendan Gallagher, Nick Suzuki","Josh Anderson, Brendan Gallagher, Nick Suzuki",Nick Suzuki,3.0
Nashville Predators,NSH,NSH.png,20222023,42,18,west,central,none,0.503,-0.86,0.924,0.084,+1,+18,-24,81012398,1487602.0,14,15,12,20,3,16,black,black,#3568f2,#fc4d47,#052ca3,black,0.0,0.0,14,68729476.0,10,61416143,7,43416143,2,17559000,2.0,17559000.0,1487602.0,David Poile,"July 9, 1997",John Hynes,"January 7, 2020",29.5,31.7,33.0,34.0,36.0,"Jeremy Lauzon, Roland McKeown, Juuse Saros, Mattias Ekholm, Roman Josi, Mikael Granlund, Nino Niederreiter, Colton Sissons, Yakov Trenin, Ryan McDonagh, Filip Forsberg, Matt Duchene, Ryan Johansen, Juuso Parssinen","Jeremy Lauzon, Juuse Saros, Mattias Ekholm, Roman Josi, Mikael Granlund, Colton Sissons, Ryan McDonagh, Filip Forsberg, Matt Duchene, Ryan Johansen","Jeremy Lauzon, Mattias Ekholm, Roman Josi, Colton Sissons, Ryan McDonagh, Filip Forsberg, Matt Duchene","Roman Josi, Filip Forsberg","Roman Josi, Filip Forsberg",10.0
New Jersey Devils,NJD,NJD.png,20222023,53,25,east,metro,top3,0.576,+29.02,0.912,0.089,+27,+19,-18,83773085,-1273085.0,4,14,6,1,11,13,#052ca3,black,#052ca3,#052ca3,#3568f2,black,0.0,0.0,10,40727501.0,7,37944167,5,33650000,5,33650000,3.0,20400000.0,-1273085.0,Tom Fitzgerald,"January 12, 2020",Lindy Ruff,"July 9, 2020",26.2,27.14,29.0,30.0,31.0,"Ondrej Palat, Nico Hischier, Jack Hughes, Alexander Holtz, Dawson Mercer, Dougie Hamilton, Jonas Siegenthaler, Brendan Smith, Nikita Okhotiuk, Vitek Vanecek","Ondrej Palat, Nico Hischier, Jack Hughes, Alexander Holtz, Dougie Hamilton, Jonas Siegenthaler, Vitek Vanecek","Ondrej Palat, Nico Hischier, Jack Hughes, Dougie Hamilton, Jonas Siegenthaler","Ondrej Palat, Nico Hischier, Jack Hughes, Dougie Hamilton, Jonas Siegenthaler","Jack Hughes, Dougie Hamilton, Jonas Siegenthaler",18.0
New York Islanders,NYI,NYI.png,20222023,46,22,east,metro,wc,0.543,-8.03,0.917,0.099,+16,+15,-16,81005576,1494424.0,6,18,4,24,6,5,#052ca3,#fc4d47,#052ca3,red,#052ca3,#052ca3,0.0,0.0,17,62261667.0,10,44236667,6,30900000,3,17800000,2.0,15300000.0,1494424.0,Lou Lamoriello,"June 5, 2018",Lane Lambert,"May 16, 2022",28.88,29.1,32.0,32.0,32.5,"Mathew Barzal, Anders Lee, Brock Nelson, Josh Bailey, Ryan Pulock, Anthony Beauvillier, Jean-Gabriel Pageau, Casey Cizikas, Cal Clutterbuck, Matt Martin, Ross Johnston, Aatu Raty, Noah Dobson, Alexander Romanov, Sebastian Aho, Robin Salo, Ilya Sorokin","Mathew Barzal, Anders Lee, Brock Nelson, Ryan Pulock, Jean-Gabriel Pageau, Casey Cizikas, Ross Johnston, Aatu Raty, Noah Dobson, Alexander Romanov","Mathew Barzal, Anders Lee, Ryan Pulock, Jean-Gabriel Pageau, Casey Cizikas, Ross Johnston","Mathew Barzal, Ryan Pulock, Casey Cizikas","Mathew Barzal, Ryan Pulock",16.0
New York Rangers,NYR,NYR.png,20222023,51,22,east,metro,top3,0.534,+0.48,0.915,0.091,+12,+26,-13,80887212,1612788.0,8,8,1,18,8,12,#3568f2,#3568f2,#052ca3,#fc4d47,#3568f2,#3568f2,0.0,0.0,13,66663691.0,9,59876191,7,53409524,5,33766667,3.0,23625000.0,1612788.0,Chris Drury,"May 5, 2021",Gerard Gallant,"June 16, 2021",28.08,30.56,31.71,32.4,33.33,"Barclay Goodrow, Artemi Panarin, Mika Zibanejad, Chris Kreider, Vincent Trocheck, Jonny Brodzinski, Kaapo Kakko, Jimmy Vesey, Jacob Trouba, Ryan Lindgren, Braden Schneider, Adam Fox, Igor Shesterkin","Barclay Goodrow, Artemi Panarin, Mika Zibanejad, Chris Kreider, Vincent Trocheck, Jimmy Vesey, Jacob Trouba, Adam Fox, Igor Shesterkin","Barclay Goodrow, Artemi Panarin, Mika Zibanejad, Chris Kreider, Vincent Trocheck, Jacob Trouba, Adam Fox","Barclay Goodrow, Mika Zibanejad, Chris Kreider, Vincent Trocheck, Adam Fox","Mika Zibanejad, Vincent Trocheck, Adam Fox",12.0
Ottawa Senators,OTT,OTT.png,20222023,39,18,east,atlantic,none,0.427,+7.16,0.901,0.072,-24,+36,-18,79132602,3367398.0,23,2,6,14,18,19,#fc4d47,#052ca3,#052ca3,black,#fc4d47,#fc4d47,0.0,0.0,10,45903214.0,8,44215714,5,34130714,5,34130714,3.0,24555714.0,3367398.0,Pierre Dorion,"April 10, 2016",D. J. Smith,"May 23, 2019",25.9,27.75,26.8,27.8,28.67,"Anton Forsberg, Parker Kelly, Jake Sanderson, Artem Zub, Thomas Chabot, Mark Kastelic, Tim Stutzle, Brady Tkachuk, Drake Batherson, Claude Giroux","Anton Forsberg, Artem Zub, Thomas Chabot, Mark Kastelic, Tim Stutzle, Brady Tkachuk, Drake Batherson, Claude Giroux","Artem Zub, Thomas Chabot, Tim Stutzle, Brady Tkachuk, Drake Batherson","Artem Zub, Thomas Chabot, Tim Stutzle, Brady Tkachuk, Drake Batherson","Thomas Chabot, Tim Stutzle, Brady Tkachuk",15.0
Philadelphia Flyers,PHI,PHI.png,20222023,37,15,east,metro,none,0.473,-20.52,0.91,0.084,-9,+16,-19,86586976,-4086976.0,19,17,7,28,13,16,#fc4d47,#fc4d47,#3568f2,red,black,black,0.0,0.0,14,53391024.0,8,40492857,6,28242857,3,16350000,2.0,11250000.0,-4086976.0,Chuck Fletcher,"December 3, 2018",John Tortorella,"June 17, 2022",27.14,28.88,30.5,29.33,30.0,"Carter Hart, Nick Seeler, Travis Sanheim, Anthony Deangelo, Rasmus Ristolainen, Ivan Provorov, Wade Allison, Nicolas Deslauriers, Owen Tippett, Scott Laughton, Joel Farabee, Travis Konecny, Kevin Hayes, Samuel Ersson","Travis Sanheim, Rasmus Ristolainen, Ivan Provorov, Nicolas Deslauriers, Scott Laughton, Joel Farabee, Travis Konecny, Kevin Hayes","Travis Sanheim, Rasmus Ristolainen, Nicolas Deslauriers, Scott Laughton, Joel Farabee, Kevin Hayes","Travis Sanheim, Rasmus Ristolainen, Joel Farabee","Travis Sanheim, Joel Farabee",9.0
Pittsburgh Penguins,PIT,PIT.png,20222023,44,19,east,metro,none,0.509,+11.42,0.916,0.091,+3,+22,-15,84514837,-2014837.0,12,12,3,9,7,12,#3568f2,#3568f2,#052ca3,#3568f2,#3568f2,#3568f2,0.0,0.0,14,50975175.0,7,34450175,3,16225000,2,10125000,2.0,10125000.0,-2014837.0,Ron Hextall,"February 9, 2021",Mike Sullivan,"December 12, 2015",31.07,32.86,34.67,33.5,35.5,"Rickard Rakell, Bryan Rust, Jan Rutta, Kasperi Kapanen, Jeff Carter, Brock McGinn, Marcus Pettersson, Chad Ruhwedel, Mark Friedman, Casey DeSmith, Pierre-Olivier Joseph, Evgeni Malkin, Jake Guentzel, Sidney Crosby","Rickard Rakell, Bryan Rust, Jan Rutta, Brock McGinn, Marcus Pettersson, Evgeni Malkin, Sidney Crosby","Rickard Rakell, Bryan Rust, Evgeni Malkin","Rickard Rakell, Bryan Rust","Rickard Rakell, Bryan Rust",17.0
San Jose Sharks,SJS,SJS.png,20222023,32,12,west,pacific,none,0.447,-0.62,0.88,0.1,-23,+17,-16,83415956,-915956.0,22,16,4,19,21,4,#fc4d47,black,#052ca3,#fc4d47,#fc4d47,#052ca3,0.0,0.0,14,56260000.0,7,41137500,6,39137500,3,27637500,1.0,8137500.0,-915956.0,Mike Grier,"July 5, 2022",David Quinn,"July 21, 2022",29.07,31.71,33.17,35.33,35.0,"Erik Karlsson, Marc-Edouard Vlasic, Mario Ferraro, Nick Cicek, Jaycob Megna, Matthew Benning, Nico Sturm, Steven Lorentz, Alexander Barabanov, Oskar Lindblom, Kevin Labanc, Tomas Hertl, Kaapo Kahkonen, Logan Couture","Erik Karlsson, Marc-Edouard Vlasic, Mario Ferraro, Matthew Benning, Nico Sturm, Tomas Hertl, Logan Couture","Erik Karlsson, Marc-Edouard Vlasic, Mario Ferraro, Matthew Benning, Tomas Hertl, Logan Couture","Erik Karlsson, Tomas Hertl, Logan Couture",Tomas Hertl,13.0
St. Louis Blues,STL,STL.png,20222023,41,19,west,central,none,0.45,-18.52,0.896,0.096,-20,+22,-23,86169342,-3669342.0,21,12,11,27,19,7,#fc4d47,#3568f2,#3568f2,red,#fc4d47,#3568f2,0.0,0.0,14,60190000.0,10,56885833,8,50250000,6,41750000,4.0,29250000.0,-3669342.0,Doug Armstrong,"July 1, 2010",Craig Berube,"November 19, 2018",28.5,29.4,31.38,31.67,32.75,"Brayden Schenn, Pavel Buchnevich, Brandon Saad, Jordan Kyrou, Robert Thomas, Jake Neighbours, Nikita Alexandrov, Nathan Walker, Justin Faulk, Colton Parayko, Nick Leddy, Robert Bortuzzo, Calle Rosen, Jordan Binnington","Brayden Schenn, Pavel Buchnevich, Brandon Saad, Jordan Kyrou, Robert Thomas, Jake Neighbours, Justin Faulk, Colton Parayko, Nick Leddy, Jordan Binnington","Brayden Schenn, Brandon Saad, Jordan Kyrou, Robert Thomas, Justin Faulk, Colton Parayko, Nick Leddy, Jordan Binnington","Brayden Schenn, Jordan Kyrou, Robert Thomas, Justin Faulk, Colton Parayko, Jordan Binnington","Brayden Schenn, Jordan Kyrou, Robert Thomas, Colton Parayko",21.0
Tampa Bay Lightning,TBL,TBL.png,20222023,49,24,east,atlantic,top3,0.536,+11.62,0.914,0.095,+12,+25,-20,89878585,-7378585.0,8,9,8,7,9,8,#3568f2,#3568f2,#3568f2,#3568f2,#3568f2,#3568f2,0.0,0.0,14,73212500.0,9,60600000,7,51600000,7,51600000,6.0,42100000.0,-7378585.0,Julien BriseBois,"September 11, 2018",Jon Cooper,"March 25, 2013",28.71,28.67,29.29,30.29,31.83,"Brayden Point, Andrei Vasilevskiy, Haydn Fleury, Nick Perbix, Zach Bogosian, Erik Cernak, Mikhail Sergachev, Victor Hedman, Patrick Maroon, Nikita Kucherov, Steven Stamkos, Anthony Cirelli, Brandon Hagel, Nicholas Paul","Brayden Point, Andrei Vasilevskiy, Nick Perbix, Erik Cernak, Mikhail Sergachev, Victor Hedman, Nikita Kucherov, Anthony Cirelli, Nicholas Paul","Brayden Point, Andrei Vasilevskiy, Erik Cernak, Mikhail Sergachev, Nikita Kucherov, Anthony Cirelli, Nicholas Paul","Brayden Point, Andrei Vasilevskiy, Erik Cernak, Mikhail Sergachev, Nikita Kucherov, Anthony Cirelli, Nicholas Paul","Brayden Point, Andrei Vasilevskiy, Erik Cernak, Mikhail Sergachev, Anthony Cirelli, Nicholas Paul",31.0
Toronto Maple Leafs,TOR,TOR.png,20222023,55,24,east,atlantic,top3,0.584,+16.57,0.922,0.098,+28,+29,-21,88091438,-5591438.0,3,6,9,5,4,6,#052ca3,#052ca3,#3568f2,#052ca3,#052ca3,#052ca3,0.0,0.0,11,63393116.0,4,31503000,2,9600000,1,7500000,1.0,7500000.0,-5591438.0,Kyle Dubas,"May 11, 2018",Sheldon Keefe,"November 20, 2019",29.27,31.0,32.5,32.0,34.0,"Mark Giordano, Rasmus Sandin, Timothy Liljegren, TJ Brodie, Morgan Rielly, Calle Jarnkrok, Matt Murray, Auston Matthews, John Tavares, Mitchell Marner, William Nylander","Morgan Rielly, Calle Jarnkrok, John Tavares, Mitchell Marner","Morgan Rielly, Calle Jarnkrok",Morgan Rielly,Morgan Rielly,28.0
Vancouver Canucks,VAN,VAN.png,20222023,37,17,west,pacific,none,0.478,-17.4,0.904,0.1,-8,+23,-32,87221546,-4721546.0,18,11,16,26,16,4,#fc4d47,#3568f2,black,red,black,#052ca3,0.0,0.0,14,58272500.0,7,40460000,5,32810000,3,23110000,1.0,8000000.0,-4721546.0,Patrik Allvin,"January 26, 2022",Bruce Boudreau,"December 5, 2021",27.64,29.0,30.4,31.67,35.0,"Brock Boeser, J.T. Miller, Conor Garland, Ilya Mikheyev, Curtis Lazar, Dakota Joshua, Jack Studnicka, Sheldon Dries, Quinn Hughes, Oliver Ekman-Larsson, Tyler Myers, Riley Stillman, Spencer Martin, Elias Pettersson","Brock Boeser, J.T. Miller, Conor Garland, Ilya Mikheyev, Curtis Lazar, Quinn Hughes, Oliver Ekman-Larsson","J.T. Miller, Conor Garland, Ilya Mikheyev, Quinn Hughes, Oliver Ekman-Larsson","J.T. Miller, Quinn Hughes, Oliver Ekman-Larsson",J.T. Miller,19.0
Vegas Golden Knights,VGK,VGK.png,20222023,56,27,west,pacific,top3,0.503,+17.39,0.91,0.086,+1,+26,-13,97731798,-15231798.0,14,8,1,4,13,15,black,#3568f2,#052ca3,#052ca3,black,black,0.0,0.0,19,67827484.0,12,51052484,6,37975000,4,27200000,0.0,0.0,-15231798.0,Kelly McCrimmon,"September 1, 2019",Bruce Cassidy,"June 14, 2022",28.79,29.08,30.67,33.25,,"Logan Thompson, Daniil Miromanov, Ben Hutton, Nicolas Hague, Brayden McNabb, Alec Martinez, Alex Pietrangelo, Paul Cotter, Michael Amadio, Jake Leschyshyn, Keegan Kolesar, William Carrier, Chandler Stephenson, Nicolas Roy, Reilly Smith, Jonathan Marchessault, William Karlsson, Mark Stone, Jack Eichel","Logan Thompson, Nicolas Hague, Brayden McNabb, Alex Pietrangelo, Paul Cotter, Jake Leschyshyn, Keegan Kolesar, Nicolas Roy, Reilly Smith, William Karlsson, Mark Stone, Jack Eichel","Alex Pietrangelo, Paul Cotter, Nicolas Roy, William Karlsson, Mark Stone, Jack Eichel","Alex Pietrangelo, Nicolas Roy, William Karlsson, Mark Stone",,22.0
Washington Capitals,WSH,WSH.png,20222023,50,22,east,metro,wc,0.535,+10.37,0.915,0.093,+13,+24,-17,91278053,-8778053.0,7,10,5,10,8,10,#3568f2,#3568f2,#052ca3,#3568f2,#3568f2,#3568f2,0.0,0.0,9,46400000.0,7,39900000,2,14750000,1,5250000,0.0,0.0,-8778053.0,Brian MacLellan,"May 26, 2014",Peter Laviolette,"September 15, 2020",32.78,35.0,37.5,36.0,,"Charlie Lindgren, Darcy Kuemper, Joe Snively, Nic Dowd, Anthony Mantha, T.J. Oshie, Evgeny Kuznetsov, Alex Ovechkin, Nicklas Backstrom","Charlie Lindgren, Darcy Kuemper, Nic Dowd, T.J. Oshie, Evgeny Kuznetsov, Alex Ovechkin, Nicklas Backstrom","Darcy Kuemper, Alex Ovechkin",Darcy Kuemper,,25.0
