full,team,season,PTS,W,Conference,Division,playoffs,gf%,xg_dif,sv%,shooting%,g_dif,PP_g_dif,PK_g_dif,projected_cap_hit,projected_cap_space,5on5_rank,PP_rank,PK_rank,XG_dif_rank,Save%_rank,Shooting%_rank,5on5_color,PP_color,PK_color,xg_color,sv_color,sh_color,expiring_contracts,expiring_salary,nhl_contracts_2324,2023-24 Salary,nhl_contracts_2425,2024-25 Salary,nhl_contracts_2526,2025-26 Salary,nhl_contracts_2627,2026-27 Salary,nhl_contracts_2728,2027-28 Salary,nhl_contracts_2829,2028-29 Salary,cap_remaining,logo,coach,coach_start,GM,gm_start,avg_age_2324,avg_age_2425,avg_age_2526,avg_age_2627,avg_age_2728,avg_age_2829,players_under_contract_2324,players_under_contract_2425,players_under_contract_2526,players_under_contract_2627,players_under_contract_2728,draft_capital_rank
Anaheim Ducks,ANA,20222023,58.0,23.0,west,pacific,none,0.399,-74.39,0.908,0.086,-80.0,+28.0,-74.0,75777500,7722500,27,21,21,32,10,13,red,#fc4d47,#fc4d47,red,#3568f2,black,0.0,0.0,22,0.0,13,45221667,10,39865000,3,18400000,1.0,7000000.0,1.0,7000000.0,7722500.0,ANA.png,Greg Cronin,"June 5, 2023",Pat Verbeek,"February 3, 2022",27.18,27.54,29.0,32.67,32.0,32.0,"Urho Vaakanainen, Tristan Luneau, Pavel Mintyukov, Jackson LaCombe, Jamie Drysdale, Ilya Lyubushkin, Radko Gudas, Cam Fowler, Benoit-Olivier Groulx, Brett Leason, Sam Carrick, Mason McTavish, Ross Johnston, Max Jones, Frank Vatrano, Ryan Strome, Jakob Silfverberg, Trevor Zegras, Adam Henrique, John Gibson, Lukas Dostal, Troy Terry","Tristan Luneau, Pavel Mintyukov, Jamie Drysdale, Radko Gudas, Cam Fowler, Mason McTavish, Ross Johnston, Frank Vatrano, Ryan Strome, Trevor Zegras, John Gibson, Lukas Dostal, Troy Terry","Tristan Luneau, Pavel Mintyukov, Jamie Drysdale, Radko Gudas, Cam Fowler, Ross Johnston, Ryan Strome, Trevor Zegras, John Gibson, Troy Terry","Ryan Strome, John Gibson, Troy Terry",Troy Terry,6.0
Arizona Coyotes,ARI,20222023,70.0,28.0,west,central,none,0.464,-43.91,0.909,0.099,-26.0,+37.0,-74.0,78821310,4678690,23,16,21,27,9,4,#fc4d47,black,#fc4d47,red,#3568f2,#052ca3,0.0,0.0,22,0.0,11,34324999,6,23625000,2,11450000,1.0,7150000.0,0.0,0.0,4678690.0,ARI.png,Andre Tourigny,"July 1, 2021",Bill Armstrong,"September 17, 2020",27.41,27.73,27.33,29.5,31.0,,"Connor Ingram, Karel Vejmelka, Travis Dermott, J.J. Moser, Juuso Valimaki, Troy Stecher, Joshua Brown, Sean Durzi, Matt Dumba, Michael Carcone, Liam O'Brien, Logan Cooley, Jack McBain, Travis Boyd, Nick Schmaltz, Barrett Hayton, Nick Bjugstad, Matias Maccelli, Alexander Kerfoot, Lawson Crouse, Jason Zucker, Clayton Keller","Connor Ingram, Karel Vejmelka, Michael Carcone, Logan Cooley, Jack McBain, Nick Schmaltz, Nick Bjugstad, Matias Maccelli, Alexander Kerfoot, Lawson Crouse, Clayton Keller","Connor Ingram, Logan Cooley, Nick Schmaltz, Matias Maccelli, Lawson Crouse, Clayton Keller","Lawson Crouse, Clayton Keller",Clayton Keller,2.0
Boston Bruins,BOS,20222023,135.0,65.0,east,atlantic,top3,0.637,+29.06,0.936,0.104,+94.0,+48.0,-26.0,83070834,429166,1,8,1,6,1,2,#052ca3,#3568f2,#052ca3,#052ca3,#052ca3,#052ca3,0.0,0.0,22,0.0,14,60157500,7,42220000,5,36100000,3.0,27250000.0,3.0,27250000.0,429166.0,BOS.png,Jim Montgomery,"July 1, 2022",Don Sweeney,"May 20, 2015",28.77,28.71,29.14,30.6,33.0,33.0,"Morgan Geekie, Linus Ullmark, Ian Mitchell, Kevin Shattenkirk, Derek Forbort, Matt Grzelcyk, Brandon Carlo, Hampus Lindholm, Jakub Lauko, Patrick Brown, Matthew Poitras, John Beecher, James van Riemsdyk, Milan Lucic, Jake DeBrusk, Pavel Zacha, Charlie Coyle, Brad Marchand, David Pastrnak, Trent Frederic, Jeremy Swayman, Charlie McAvoy","Morgan Geekie, Linus Ullmark, Brandon Carlo, Hampus Lindholm, Jakub Lauko, Patrick Brown, Matthew Poitras, John Beecher, Pavel Zacha, Charlie Coyle, Brad Marchand, David Pastrnak, Trent Frederic, Charlie McAvoy","Brandon Carlo, Hampus Lindholm, Matthew Poitras, Pavel Zacha, Charlie Coyle, David Pastrnak, Charlie McAvoy","Brandon Carlo, Hampus Lindholm, Pavel Zacha, David Pastrnak, Charlie McAvoy","Hampus Lindholm, David Pastrnak, Charlie McAvoy",31.0
Buffalo Sabres,BUF,20222023,91.0,42.0,east,atlantic,none,0.481,-11.67,0.897,0.098,-17.0,+50.0,-49.0,74723570,8776430,19,7,17,22,16,5,#fc4d47,#3568f2,#fc4d47,#fc4d47,black,#052ca3,0.0,0.0,23,0.0,12,60692737,9,55911904,6,46878571,5.0,37878571.0,5.0,37878571.0,8776430.0,BUF.png,Don Granato,"March 17, 2021",Kevyn Adams,"June 16, 2020",26.39,25.75,27.11,28.0,28.6,28.6,"Jeff Skinner, Tage Thompson, Dylan Cozens, Victor Olofsson, Alex Tuch, Jordan Greenway, Casey Mittelstadt, Kyle Okposo, Tyson Jost, Zach Benson, Peyton Krebs, John-Jason Peterka, Mattias Samuelsson, Connor Clifton, Erik Johnson, Henri Jokiharju, Jacob Bryson, Owen Power, Eric Comrie, Devon Levi, Ukko-Pekka Luukkonen, Rasmus Dahlin, Zemgus Girgensons","Jeff Skinner, Tage Thompson, Dylan Cozens, Alex Tuch, Jordan Greenway, Zach Benson, John-Jason Peterka, Mattias Samuelsson, Connor Clifton, Owen Power, Devon Levi, Rasmus Dahlin","Jeff Skinner, Tage Thompson, Dylan Cozens, Alex Tuch, Zach Benson, Mattias Samuelsson, Connor Clifton, Owen Power, Rasmus Dahlin","Jeff Skinner, Tage Thompson, Dylan Cozens, Mattias Samuelsson, Owen Power, Rasmus Dahlin","Tage Thompson, Dylan Cozens, Mattias Samuelsson, Owen Power, Rasmus Dahlin",12.0
Calgary Flames,CGY,20222023,93.0,38.0,west,pacific,none,0.52,+35.42,0.897,0.084,+15.0,+43.0,-33.0,84406000,-906000,14,12,6,3,16,15,black,#3568f2,#052ca3,#052ca3,black,black,0.0,0.0,22,0.0,13,57325000,7,43700000,4,28650000,3.0,23750000.0,3.0,23750000.0,-906000.0,CGY.png,Ryan Huska,"June 12, 2023",Craig Conroy,"May 23, 2023",28.86,30.15,33.86,34.75,36.67,36.67,"Nazem Kadri, Jacob Markstrom, Jonathan Huberdeau, Andrew Mangiapane, Mikael Backlund, Blake Coleman, Elias Lindholm, Yegor Sharangovich, Dillon Dube, Matthew Coronato, Daniel Vladar, Walker Duehr, AJ Greer, Adam Ruzicka, MacKenzie Weegar, Noah Hanifin, Rasmus Andersson, Christopher Tanev, Nikita Zadorov, Jordan Oesterle, Dennis Gilbert, Dryden Hunt","Nazem Kadri, Jacob Markstrom, Jonathan Huberdeau, Andrew Mangiapane, Mikael Backlund, Blake Coleman, Yegor Sharangovich, Matthew Coronato, Daniel Vladar, Walker Duehr, MacKenzie Weegar, Rasmus Andersson, Dryden Hunt","Nazem Kadri, Jacob Markstrom, Jonathan Huberdeau, Mikael Backlund, Blake Coleman, MacKenzie Weegar, Rasmus Andersson","Nazem Kadri, Jonathan Huberdeau, Blake Coleman, MacKenzie Weegar","Nazem Kadri, Jonathan Huberdeau, MacKenzie Weegar",19.0
Carolina Hurricanes,CAR,20222023,113.0,52.0,east,metro,top3,0.55,+63.26,0.908,0.082,+34.0,+39.0,-26.0,82579417,920583,7,15,1,1,10,16,#3568f2,black,#052ca3,#052ca3,#3568f2,black,0.0,0.0,21,0.0,9,46100000,4,21970000,3,17470000,2.0,14570000.0,2.0,14570000.0,920583.0,CAR.png,Rod Brind'Amour,"May 8, 2018",Don Waddell,"May 8, 2018",29.86,32.67,31.0,32.0,30.5,30.5,"Brent Burns, Anthony Deangelo, Brett Pesce, Brady Skjei, Sebastian Aho, Teuvo Teravainen, Jesperi Kotkaniemi, Michael Bunting, Jalen Chatfield, Martin Necas, Jesper Fast, Jordan Martinook, Jack Drury, Seth Jarvis, Brendan Lemieux, Stefan Noesen, Dmitry Orlov, Jordan Staal, Frederik Andersen, Antti Raanta, Jaccob Slavin","Brent Burns, Sebastian Aho, Jesperi Kotkaniemi, Michael Bunting, Jesper Fast, Dmitry Orlov, Jordan Staal, Frederik Andersen, Jaccob Slavin","Sebastian Aho, Jesperi Kotkaniemi, Michael Bunting, Jordan Staal","Sebastian Aho, Jesperi Kotkaniemi, Jordan Staal","Sebastian Aho, Jesperi Kotkaniemi",13.0
Chicago Blackhawks,CHI,20222023,59.0,26.0,west,central,none,0.393,-57.42,0.9,0.084,-81.0,+25.0,-45.0,69710124,13789876,28,22,13,31,14,15,red,#fc4d47,black,red,black,black,0.0,0.0,23,0.0,9,29897500,4,15768333,1,9500000,1.0,9500000.0,1.0,9500000.0,13789876.0,CHI.png,Luke Richardson,"June 27, 2022",Kyle Davidson,"October 26, 2021",28.0,27.33,27.0,33.0,35.0,35.0,"Tyler Johnson, Arvid Soderblom, Petr Mrazek, Alex Vlasic, Wyatt Kaiser, Andreas Athanasiou, Nick Foligno, Corey Perry, Jason Dickinson, Ryan Donato, Connor Bedard, Cole Guttman, Taylor Hall, Lukas Reichel, Reese Johnson, Boris Katchouk, Taylor Raddysh, Seth Jones, Nikita Zaitsev, Connor Murphy, Jarred Tinordi, Kevin Korchinski, Mackenzie Entwistle","Arvid Soderblom, Wyatt Kaiser, Andreas Athanasiou, Ryan Donato, Connor Bedard, Taylor Hall, Seth Jones, Connor Murphy, Kevin Korchinski","Connor Bedard, Seth Jones, Connor Murphy, Kevin Korchinski",Seth Jones,Seth Jones,1.0
Colorado Avalanche,COL,20222023,109.0,51.0,west,central,top3,0.542,+15.42,0.922,0.087,+29.0,+52.0,-43.0,89975000,-6475000,9,6,12,13,2,12,#3568f2,#052ca3,#3568f2,black,#052ca3,#3568f2,0.0,0.0,23,0.0,14,77025000,9,55475000,8,50975000,4.0,28475000.0,4.0,28475000.0,-6475000.0,COL.png,Jared Bednar,"August 25, 2016",Chris MacFarland,"July 11, 2022",28.91,29.29,30.67,31.12,34.25,34.25,"Nathan MacKinnon, Alexandar Georgiev, Justus Annunen, Ivan Prosvetov, Jack Johnson, Kurtis MacDermid, Riley Tufte, Bowen Byram, Devon Toews, Josh Manson, Samuel Girard, Cale Makar, Fredrik Olofsson, Jonathan Drouin, Andrew Cogliano, Tomas Tatar, Miles Wood, Ross Colton, Ryan Johansen, Artturi Lehkonen, Valeri Nichushkin, Mikko Rantanen, Logan O'Connor","Nathan MacKinnon, Alexandar Georgiev, Bowen Byram, Devon Toews, Josh Manson, Samuel Girard, Cale Makar, Miles Wood, Ross Colton, Ryan Johansen, Artturi Lehkonen, Valeri Nichushkin, Mikko Rantanen, Logan O'Connor","Nathan MacKinnon, Devon Toews, Josh Manson, Samuel Girard, Cale Makar, Miles Wood, Ross Colton, Artturi Lehkonen, Valeri Nichushkin","Nathan MacKinnon, Devon Toews, Samuel Girard, Cale Makar, Miles Wood, Ross Colton, Artturi Lehkonen, Valeri Nichushkin","Nathan MacKinnon, Devon Toews, Miles Wood, Valeri Nichushkin",26.0
Columbus Blue Jackets,CBJ,20222023,59.0,25.0,east,metro,none,0.388,-46.89,0.896,0.081,-91.0,+30.0,-48.0,79533333,3966667,29,20,16,28,17,17,red,#fc4d47,black,red,#fc4d47,#fc4d47,0.0,0.0,23,0.0,13,53393333,9,42468333,3,21400000,2.0,16000000.0,2.0,16000000.0,3966667.0,CBJ.png,Pascal Vincent,"September 17, 2023",Jarmo Kekalainen,"February 13, 2013",26.52,28.62,29.33,33.33,35.5,35.5,"Kent Johnson, Kirill Marchenko, Johnny Gaudreau, Jack Roslovic, Boone Jenner, Sean Kuraly, Eric Robinson, Alexandre Texier, Justin Danforth, Adam Fantilli, Patrik Laine, Cole Sillinger, Emil Bemstrom, Liam Foudy, Damon Severson, Ivan Provorov, Erik Gudbranson, Adam Boqvist, Jake Bean, David Jiricek, Andrew Peeke, Spencer Martin, Elvis Merzlikins","Johnny Gaudreau, Boone Jenner, Sean Kuraly, Justin Danforth, Adam Fantilli, Patrik Laine, Damon Severson, Ivan Provorov, Erik Gudbranson, Adam Boqvist, David Jiricek, Andrew Peeke, Elvis Merzlikins","Johnny Gaudreau, Boone Jenner, Adam Fantilli, Patrik Laine, Damon Severson, Erik Gudbranson, David Jiricek, Andrew Peeke, Elvis Merzlikins","Johnny Gaudreau, Damon Severson, Elvis Merzlikins","Johnny Gaudreau, Damon Severson",15.0
Dallas Stars,DAL,20222023,108.0,47.0,west,central,top3,0.561,+25.74,0.919,0.099,+44.0,+58.0,-29.0,83042829,457171,5,2,4,8,4,4,#052ca3,#052ca3,#052ca3,#3568f2,#052ca3,#052ca3,0.0,0.0,22,0.0,13,69131667,5,39000000,3,26750000,2.0,16900000.0,2.0,16900000.0,457171.0,DAL.png,Peter DeBoer,"June 21, 2022",Jim Nill,"April 29, 2013",29.77,30.69,29.6,31.0,31.0,31.0,"Evgeni Dadonov, Matt Duchene, Radek Faksa, Joe Pavelski, Jamie Benn, Jason Robertson, Tyler Seguin, Roope Hintz, Craig Smith, Mason Marchment, Ty Dellandrea, Sam Steel, Jake Oettinger, Joel Hanley, Thomas Harley, Nils Lundkvist, Jani Hakanpaa, Ryan Suter, Esa Lindell, Miro Heiskanen, Wyatt Johnston, Scott Wedgewood","Evgeni Dadonov, Radek Faksa, Jamie Benn, Jason Robertson, Tyler Seguin, Roope Hintz, Mason Marchment, Jake Oettinger, Joel Hanley, Ryan Suter, Esa Lindell, Miro Heiskanen, Wyatt Johnston","Jason Robertson, Tyler Seguin, Roope Hintz, Mason Marchment, Miro Heiskanen","Tyler Seguin, Roope Hintz, Miro Heiskanen","Roope Hintz, Miro Heiskanen",25.0
Detroit Red Wings,DET,20222023,80.0,35.0,east,atlantic,none,0.462,-14.12,0.9,0.095,-28.0,+40.0,-45.0,78343473,5156527,24,14,13,23,14,8,red,black,black,#fc4d47,black,#3568f2,0.0,0.0,22,0.0,13,55843750,7,38850000,4,27300000,2.0,13800000.0,1.0,8700000.0,5156527.0,DET.png,Derek Lalonde,"June 30, 2022",Steve Yzerman,"April 19, 2019",28.91,30.62,31.43,31.25,33.5,33.0,"Moritz Seider, Alex Lyon, James Reimer, Ville Husso, Jeff Petry, Olli Maatta, Jake Walman, Justin Holl, Shayne Gostisbehere, Ben Chiarot, Joseph Veleno, Lucas Raymond, Christian Fischer, Michael Rasmussen, Daniel Sprong, Klim Kostin, Robby Fabbri, David Perron, J.T. Compher, Andrew Copp, Alex DeBrincat, Dylan Larkin","Alex Lyon, Ville Husso, Jeff Petry, Olli Maatta, Jake Walman, Justin Holl, Ben Chiarot, Klim Kostin, Robby Fabbri, J.T. Compher, Andrew Copp, Alex DeBrincat, Dylan Larkin","Jake Walman, Justin Holl, Ben Chiarot, J.T. Compher, Andrew Copp, Alex DeBrincat, Dylan Larkin","J.T. Compher, Andrew Copp, Alex DeBrincat, Dylan Larkin","J.T. Compher, Dylan Larkin",14.0
Edmonton Oilers,EDM,20222023,109.0,50.0,west,pacific,top3,0.541,+35.16,0.912,0.098,+32.0,+76.0,-41.0,83890792,-390792,8,1,10,4,7,5,#3568f2,#052ca3,#3568f2,#052ca3,#3568f2,#052ca3,0.0,0.0,21,0.0,14,72500000,9,53850000,4,24875000,3.0,19875000.0,2.0,14375000.0,-390792.0,EDM.png,Jay Woodcroft,"February 10, 2022",Ken Holland,"May 7, 2019",28.86,30.79,32.33,34.0,35.67,35.0,"Brett Kulak, Cody Ceci, Stuart Skinner, Philip Broberg, Jack Campbell, Markus Niemelainen, Vincent Desharnais, Evan Bouchard, Mattias Ekholm, Ryan McLeod, Connor Brown, Evander Kane, Zach Hyman, Leon Draisaitl, Connor McDavid, Ryan Nugent-Hopkins, Mattias Janmark, Dylan Holloway, Derek Ryan, Darnell Nurse, Warren Foegele","Brett Kulak, Cody Ceci, Stuart Skinner, Jack Campbell, Evan Bouchard, Mattias Ekholm, Ryan McLeod, Evander Kane, Zach Hyman, Leon Draisaitl, Connor McDavid, Ryan Nugent-Hopkins, Derek Ryan, Darnell Nurse","Brett Kulak, Stuart Skinner, Jack Campbell, Mattias Ekholm, Evander Kane, Zach Hyman, Connor McDavid, Ryan Nugent-Hopkins, Darnell Nurse","Jack Campbell, Zach Hyman, Ryan Nugent-Hopkins, Darnell Nurse","Zach Hyman, Ryan Nugent-Hopkins, Darnell Nurse",24.0
Florida Panthers,FLA,20222023,92.0,42.0,east,atlantic,none,0.533,+22.74,0.908,0.09,+26.0,+54.0,-56.0,82750001,749999,11,4,19,10,10,11,#3568f2,#052ca3,#fc4d47,#3568f2,#3568f2,#3568f2,0.0,0.0,23,0.0,10,48364167,6,38000000,4,25500000,2.0,19500000.0,2.0,19500000.0,749999.0,FLA.png,Paul Maurice,"June 22, 2022",Bill Zito,"September 2, 2020",28.35,28.6,31.33,31.0,32.5,32.5,"Sam Bennett, Josh Mahura, Dmitry Kulikov, Mike Reilly, Oliver Ekman-Larsson, Niko Mikkola, Gustav Forsling, Ryan Lomberg, Mackie Samoskevich, Anton Lundell, Kevin Stenlund, Steven Lorentz, Nick Cousins, Aleksander Barkov, Matthew Tkachuk, Sam Reinhart, Carter Verhaeghe, Evan Rodrigues, Eetu Luostarinen, Uvis Balinskis, Sergei Bobrovsky, Justin Sourdif, Anthony Stolarz","Sam Bennett, Niko Mikkola, Mackie Samoskevich, Aleksander Barkov, Matthew Tkachuk, Carter Verhaeghe, Evan Rodrigues, Eetu Luostarinen, Sergei Bobrovsky, Justin Sourdif","Niko Mikkola, Aleksander Barkov, Matthew Tkachuk, Evan Rodrigues, Eetu Luostarinen, Sergei Bobrovsky","Aleksander Barkov, Matthew Tkachuk, Evan Rodrigues, Eetu Luostarinen","Aleksander Barkov, Matthew Tkachuk",29.0
Los Angeles Kings,LAK,20222023,104.0,47.0,west,pacific,top3,0.522,+24.8,0.902,0.09,+16.0,+54.0,-52.0,83376667,123333,13,4,18,9,12,11,black,#052ca3,#fc4d47,#3568f2,#3568f2,#3568f2,0.0,0.0,22,0.0,12,62225000,8,53700000,6,41200000,4.0,24700000.0,3.0,20500000.0,123333.0,LAK.png,Todd McLellan,"April 16, 2019",Rob Blake,"April 10, 2017",28.14,29.25,31.75,31.83,32.0,31.33,"Pheonix Copley, Cam Talbot, Michael Anderson, Tobias Bjornfot, Jordan Spence, Andreas Englund, Matt Roy, Vladislav Gavrikov, Blake Lizotte, Trevor Lewis, Jaret Anderson-Dolan, Alex Laferriere, Arthur Kaliyev, Quinton Byfield, Carl Grundstrom, Trevor Moore, Adrian Kempe, Drew Doughty, Pierre-Luc Dubois, Anze Kopitar, Phillip Danault, Kevin Fiala","Michael Anderson, Tobias Bjornfot, Andreas Englund, Vladislav Gavrikov, Alex Laferriere, Trevor Moore, Adrian Kempe, Drew Doughty, Pierre-Luc Dubois, Anze Kopitar, Phillip Danault, Kevin Fiala","Michael Anderson, Trevor Moore, Adrian Kempe, Drew Doughty, Pierre-Luc Dubois, Anze Kopitar, Phillip Danault, Kevin Fiala","Michael Anderson, Trevor Moore, Drew Doughty, Pierre-Luc Dubois, Phillip Danault, Kevin Fiala","Michael Anderson, Trevor Moore, Pierre-Luc Dubois, Kevin Fiala",23.0
Minnesota Wild,MIN,20222023,103.0,46.0,west,central,top3,0.508,+1.53,0.922,0.085,+5.0,+46.0,-29.0,83456921,43079,15,10,4,17,2,14,black,#3568f2,#052ca3,#fc4d47,#052ca3,black,0.0,0.0,22,0.0,15,60238333,10,52800000,7,35925000,5.0,24350000.0,2.0,12250000.0,43079.0,MIN.png,Dean Evason,"February 14, 2020",Bill Guerin,"August 21, 2019",29.91,30.2,31.9,32.86,34.0,30.0,"Kirill Kaprizov, Marc-Andre Fleury, Dakota Mermis, Matthew Boldy, Mats Zuccarello, Joel Eriksson Ek, Marcus Foligno, Frederick Gaudreau, Marcus Johansson, Brandon Duhaime, Marco Rossi, Connor Dewar, Patrick Maroon, Jared Spurgeon, Jonas Brodin, Jake Middleton, Alex Goligoski, Jon Merrill, Brock Faber, Calen Addison, Filip Gustavsson, Ryan Hartman","Kirill Kaprizov, Matthew Boldy, Mats Zuccarello, Joel Eriksson Ek, Marcus Foligno, Frederick Gaudreau, Marcus Johansson, Marco Rossi, Jared Spurgeon, Jonas Brodin, Jake Middleton, Jon Merrill, Brock Faber, Filip Gustavsson, Ryan Hartman","Kirill Kaprizov, Matthew Boldy, Mats Zuccarello, Joel Eriksson Ek, Marcus Foligno, Frederick Gaudreau, Jared Spurgeon, Jonas Brodin, Filip Gustavsson, Ryan Hartman","Matthew Boldy, Joel Eriksson Ek, Marcus Foligno, Frederick Gaudreau, Jared Spurgeon, Jonas Brodin, Ryan Hartman","Matthew Boldy, Joel Eriksson Ek, Marcus Foligno, Frederick Gaudreau, Jonas Brodin",18.0
Montreal Canadiens,MTL,20222023,68.0,31.0,east,atlantic,none,0.442,-56.74,0.897,0.096,-46.0,+30.0,-65.0,88727916,-5227916,25,20,20,30,16,7,red,#fc4d47,#fc4d47,red,black,#3568f2,0.0,0.0,23,0.0,17,54695000,7,38862500,5,30625000,2.0,15725000.0,2.0,15725000.0,-5227916.0,MTL.png,Martin St. Louis,"February 9, 2022",Kent Hughes,"January 18, 2022",26.48,27.47,28.57,29.6,29.0,29.0,"Johnathan Kovacevic, Jake Allen, Samuel Montembeault, Cayden Primeau, Arber Xhekaj, Kaiden Guhle, Justin Barron, Jordan Harris, Nick Suzuki, Cole Caufield, Brendan Gallagher, Josh Anderson, Kirby Dach, Tanner Pearson, Alex Newhook, Sean Monahan, Jake Evans, Rafael Harvey-Pinard, Juraj Slafkovsky, Michael Pezzetta, Jesse Ylonen, Michael Matheson, David Savard","Johnathan Kovacevic, Jake Allen, Cayden Primeau, Kaiden Guhle, Jordan Harris, Nick Suzuki, Cole Caufield, Brendan Gallagher, Josh Anderson, Kirby Dach, Alex Newhook, Jake Evans, Rafael Harvey-Pinard, Juraj Slafkovsky, Michael Pezzetta, Michael Matheson, David Savard","Nick Suzuki, Cole Caufield, Brendan Gallagher, Josh Anderson, Kirby Dach, Alex Newhook, Michael Matheson","Nick Suzuki, Cole Caufield, Brendan Gallagher, Josh Anderson, Alex Newhook","Nick Suzuki, Cole Caufield",4.0
Nashville Predators,NSH,20222023,92.0,42.0,west,central,none,0.491,-17.34,0.92,0.086,-6.0,+35.0,-39.0,76368365,7131635,18,17,9,24,3,13,#fc4d47,#fc4d47,#3568f2,red,#052ca3,black,0.0,0.0,23,0.0,11,47898643,7,36416143,3,22059000,2.0,17559000.0,1.0,8500000.0,7131635.0,NSH.png,Andrew Brunette,"May 31, 2023",Barry Trotz,"July 1, 2023",28.7,31.36,33.86,35.33,37.0,35.0,"Philip Tomasino, Kevin Lankinen, Juuse Saros, Jeremy Lauzon, Dante Fabbro, Alexandre Carrier, Luke Schenn, Tyson Barrie, Ryan McDonagh, Roman Josi, Cole Smith, Kiefer Sherwood, Michael McCarron, Samuel Fagemo, Luke Evangelista, Thomas Novak, Filip Forsberg, Ryan O'Reilly, Gustav Nyquist, Colton Sissons, Cody Glass, Yakov Trenin, Juuso Parssinen","Juuse Saros, Jeremy Lauzon, Luke Schenn, Ryan McDonagh, Roman Josi, Luke Evangelista, Filip Forsberg, Ryan O'Reilly, Gustav Nyquist, Colton Sissons, Cody Glass","Jeremy Lauzon, Luke Schenn, Ryan McDonagh, Roman Josi, Filip Forsberg, Ryan O'Reilly, Colton Sissons","Roman Josi, Filip Forsberg, Ryan O'Reilly","Roman Josi, Filip Forsberg",3.0
New Jersey Devils,NJD,20222023,112.0,52.0,east,metro,top3,0.572,+57.78,0.912,0.095,+56.0,+33.0,-29.0,81580833,1919167,2,18,4,2,7,8,#052ca3,#fc4d47,#052ca3,#052ca3,#3568f2,#3568f2,0.0,0.0,23,0.0,15,66494167,9,57875000,8,54725000,5.0,37075000.0,3.0,24675000.0,1919167.0,NJD.png,Lindy Ruff,"July 9, 2020",Tom Fitzgerald,"January 12, 2020",27.61,27.87,30.11,30.5,32.0,30.67,"Luke Hughes, Vitek Vanecek, Akira Schmid, Kevin Bahl, Jonas Siegenthaler, Colin Miller, Timo Meier, Jack Hughes, Jesper Bratt, Nico Hischier, Ondrej Palat, Tyler Toffoli, Erik Haula, Michael McLeod, Nathan Bastian, Curtis Lazar, Tomas Nosek, Alexander Holtz, Dawson Mercer, Chris Tierney, Dougie Hamilton, John Marino, Brendan Smith","Luke Hughes, Vitek Vanecek, Kevin Bahl, Jonas Siegenthaler, Timo Meier, Jack Hughes, Jesper Bratt, Nico Hischier, Ondrej Palat, Erik Haula, Nathan Bastian, Curtis Lazar, Alexander Holtz, Dougie Hamilton, John Marino","Jonas Siegenthaler, Timo Meier, Jack Hughes, Jesper Bratt, Nico Hischier, Ondrej Palat, Erik Haula, Dougie Hamilton, John Marino","Jonas Siegenthaler, Timo Meier, Jack Hughes, Jesper Bratt, Nico Hischier, Ondrej Palat, Dougie Hamilton, John Marino","Jonas Siegenthaler, Timo Meier, Jack Hughes, Jesper Bratt, Dougie Hamilton",20.0
New York Islanders,NYI,20222023,93.0,42.0,east,metro,none,0.539,-3.75,0.92,0.093,+28.0,+24.0,-27.0,83986625,-486625,10,23,2,18,3,9,#3568f2,#fc4d47,#052ca3,#fc4d47,#052ca3,#3568f2,0.0,0.0,23,0.0,18,81412500,11,61550000,9,49550000,7.0,44300000.0,7.0,44300000.0,-486625.0,NYI.png,Lane Lambert,"May 16, 2022",Lou Lamoriello,"June 5, 2018",29.39,30.44,32.82,33.44,34.29,34.29,"Mathew Barzal, Anders Lee, Bo Horvat, Adam Pelech, Ryan Pulock, Hudson Fasching, Julien Gauthier, Simon Holmstrom, Oliver Wahlstrom, Matt Martin, Cal Clutterbuck, Casey Cizikas, Pierre Engvall, Kyle Palmieri, Jean-Gabriel Pageau, Noah Dobson, Scott Mayfield, Alexander Romanov, Sebastian Aho, Samuel Bolduc, Ilya Sorokin, Semyon Varlamov, Brock Nelson","Mathew Barzal, Anders Lee, Bo Horvat, Adam Pelech, Ryan Pulock, Hudson Fasching, Julien Gauthier, Casey Cizikas, Pierre Engvall, Kyle Palmieri, Jean-Gabriel Pageau, Noah Dobson, Scott Mayfield, Alexander Romanov, Samuel Bolduc, Ilya Sorokin, Semyon Varlamov, Brock Nelson","Mathew Barzal, Anders Lee, Bo Horvat, Adam Pelech, Ryan Pulock, Casey Cizikas, Pierre Engvall, Jean-Gabriel Pageau, Scott Mayfield, Ilya Sorokin, Semyon Varlamov","Mathew Barzal, Bo Horvat, Adam Pelech, Ryan Pulock, Casey Cizikas, Pierre Engvall, Scott Mayfield, Ilya Sorokin, Semyon Varlamov","Mathew Barzal, Bo Horvat, Adam Pelech, Ryan Pulock, Pierre Engvall, Scott Mayfield, Ilya Sorokin",22.0
New York Rangers,NYR,20222023,107.0,47.0,east,metro,top3,0.549,-4.05,0.919,0.097,+35.0,+48.0,-26.0,81996583,1503417,6,8,1,19,4,6,#052ca3,#3568f2,#052ca3,#fc4d47,#052ca3,#052ca3,0.0,0.0,22,0.0,14,72151524,8,57847024,6,38204167,3.0,23625000.0,3.0,23625000.0,1503417.0,NYR.png,Peter Laviolette,"June 13, 2023",Chris Drury,"May 5, 2021",29.0,28.86,31.88,32.5,34.33,34.33,"Chris Kreider, Artemi Panarin, Mika Zibanejad, Vincent Trocheck, Alexis Lafreniere, Barclay Goodrow, Filip Chytil, Kaapo Kakko, Will Cuylle, Blake Wheeler, Nick Bonino, Jimmy Vesey, Tyler Pitlick, Adam Fox, Jacob Trouba, Zachary Jones, Ryan Lindgren, Braden Schneider, Erik Gustafsson, Igor Shesterkin, Jonathan Quick, K'Andre Miller","Chris Kreider, Artemi Panarin, Mika Zibanejad, Vincent Trocheck, Alexis Lafreniere, Barclay Goodrow, Filip Chytil, Will Cuylle, Jimmy Vesey, Adam Fox, Jacob Trouba, Zachary Jones, Igor Shesterkin, K'Andre Miller","Chris Kreider, Artemi Panarin, Mika Zibanejad, Vincent Trocheck, Barclay Goodrow, Filip Chytil, Adam Fox, Jacob Trouba","Chris Kreider, Mika Zibanejad, Vincent Trocheck, Barclay Goodrow, Filip Chytil, Adam Fox","Mika Zibanejad, Vincent Trocheck, Adam Fox",27.0
Ottawa Senators,OTT,20222023,86.0,39.0,east,atlantic,none,0.465,+16.36,0.902,0.08,-25.0,+58.0,-45.0,81799047,1700953,22,2,13,12,12,18,#fc4d47,#052ca3,black,#3568f2,#3568f2,#fc4d47,1.0,0.0,20,0.0,15,66554047,9,49905714,7,46180714,5.0,36605714.0,2.0,16400000.0,1700953.0,OTT.png,D. J. Smith,"May 23, 2019",Pierre Dorion,"April 10, 2016",27.45,28.33,28.22,28.86,30.2,27.0,"Anton Forsberg, Brady Tkachuk, Claude Giroux, Vladimir Tarasenko, Drake Batherson, Mathieu Joseph, Dominik Kubalik, Ridly Greig, Mark Kastelic, Rourke Chartier, Zack MacEwen, Parker Kelly, Tim Stutzle, Jakob Chychrun, Artem Zub, Erik Brannstrom, Travis Hamonic, Jake Sanderson, Joonas Korpisalo, Thomas Chabot","Anton Forsberg, Brady Tkachuk, Claude Giroux, Drake Batherson, Mathieu Joseph, Ridly Greig, Mark Kastelic, Zack MacEwen, Tim Stutzle, Jakob Chychrun, Artem Zub, Travis Hamonic, Jake Sanderson, Joonas Korpisalo, Thomas Chabot","Brady Tkachuk, Drake Batherson, Mathieu Joseph, Zack MacEwen, Tim Stutzle, Artem Zub, Jake Sanderson, Joonas Korpisalo, Thomas Chabot","Brady Tkachuk, Drake Batherson, Tim Stutzle, Artem Zub, Jake Sanderson, Joonas Korpisalo, Thomas Chabot","Brady Tkachuk, Tim Stutzle, Jake Sanderson, Joonas Korpisalo, Thomas Chabot",10.0
