full,team,logo,season,PTS,W,Conference,Division,playoffs,gf%,xg_dif,sv%,shooting%,g_dif,PP_g_dif,PK_g_dif,projected_cap_hit,projected_cap_space,5on5_rank,PP_rank,PK_rank,XG_dif_rank,Save%_rank,Shooting%_rank,5on5_color,PP_color,PK_color,xg_color,sv_color,sh_color,expiring_contracts,expiring_salary,nhl_contracts_2324,2023-24 Salary,nhl_contracts_2425,2024-25 Salary,nhl_contracts_2526,2025-26 Salary,nhl_contracts_2627,2026-27 Salary,nhl_contracts_2728,2027-28 Salary,cap_remaining,GM,gm_start,coach,coach_start,avg_age_2324,avg_age_2425,avg_age_2526,avg_age_2627,avg_age_2728,players_under_contract_2324,players_under_contract_2425,players_under_contract_2526,players_under_contract_2627,players_under_contract_2728,draft_capital_rank
Anaheim Ducks,ANA,ANA.png,20222023,47,20,west,pacific,none,0.386,-56.37,0.907,0.081,-67,+22,-56,68832586,13667414.0,31,20,20,32,16,19,red,#fc4d47,#fc4d47,red,black,#fc4d47,0.0,0.0,11,33176667.0,5,22444167,3,17900000,2,11400000,0.0,0.0,13667414.0,Pat Verbeek,"February 3, 2022",Dallas Eakins,"June 17, 2019",27.91,29.4,32.67,33.0,,"Jakob Silfverberg, Ryan Strome, Frank Vatrano, Isac Lundestrom, Max Jones, Mason McTavish, Sam Carrick, Brett Leason, Cam Fowler, Colton White, John Gibson","Ryan Strome, Frank Vatrano, Mason McTavish, Cam Fowler, John Gibson","Ryan Strome, Cam Fowler, John Gibson","Ryan Strome, John Gibson",,6.0
Arizona Coyotes,ARI,ARI.png,20222023,51,21,west,central,none,0.456,-36.79,0.911,0.097,-23,+30,-50,67280665,15219335.0,24,14,19,28,12,6,red,black,#fc4d47,red,#3568f2,#052ca3,0.0,0.0,13,37375000.0,5,24625000,3,17300000,2,11450000,1.0,7150000.0,15219335.0,Bill Armstrong,"September 17, 2020",Andre Tourigny,"July 1, 2021",26.85,27.2,28.33,28.5,30.0,"Juuso Valimaki, Patrik Nemeth, Jakob Chychrun, Liam O'Brien, Zack Kassian, Travis Boyd, Barrett Hayton, Lawson Crouse, Nick Schmaltz, Clayton Keller, J.J. Moser, Karel Vejmelka, Victor Soderstrom","Jakob Chychrun, Lawson Crouse, Nick Schmaltz, Clayton Keller, Karel Vejmelka","Lawson Crouse, Nick Schmaltz, Clayton Keller","Lawson Crouse, Clayton Keller",Clayton Keller,2.0
Boston Bruins,BOS,BOS.png,20222023,99,47,east,atlantic,top3,0.64,+20.54,0.937,0.105,+70,+39,-20,83287913,-787913.0,1,6,2,6,1,2,#052ca3,#052ca3,#052ca3,#052ca3,#052ca3,#052ca3,0.0,0.0,13,59812500.0,8,47225000,5,30100000,4,24850000,2.0,16000000.0,-787913.0,Don Sweeney,"May 20, 2015",Jim Montgomery,"July 1, 2022",29.15,30.62,30.0,30.25,33.0,"Matt Grzelcyk, Derek Forbort, Jakub Zboril, Linus Ullmark, Brandon Carlo, Hampus Lindholm, Charlie McAvoy, AJ Greer, Pavel Zacha, Jake DeBrusk, Charlie Coyle, Taylor Hall, Brad Marchand","Linus Ullmark, Brandon Carlo, Hampus Lindholm, Charlie McAvoy, Pavel Zacha, Charlie Coyle, Taylor Hall, Brad Marchand","Brandon Carlo, Hampus Lindholm, Charlie McAvoy, Pavel Zacha, Charlie Coyle","Brandon Carlo, Hampus Lindholm, Charlie McAvoy, Pavel Zacha","Hampus Lindholm, Charlie McAvoy",29.0
Buffalo Sabres,BUF,BUF.png,20222023,66,31,east,atlantic,none,0.51,-5.39,0.902,0.104,+6,+41,-37,64871248,17628752.0,15,4,14,22,20,3,black,#052ca3,black,#fc4d47,#fc4d47,#052ca3,0.0,0.0,16,54015237.0,6,29247737,4,27528571,4,27528571,3.0,18528571.0,17628752.0,Kevyn Adams,"June 16, 2020",Don Granato,"March 17, 2021",24.88,25.5,27.75,28.75,29.0,"Ukko-Pekka Luukkonen, Jeff Skinner, Victor Olofsson, Casey Mittelstadt, Tage Thompson, Dylan Cozens, Peyton Krebs, Jack Quinn, Rasmus Dahlin, Ilya Lyubushkin, Henri Jokiharju, Jacob Bryson, Mattias Samuelsson, Owen Power, Eric Comrie, John-Jason Peterka","Jeff Skinner, Tage Thompson, Dylan Cozens, Jack Quinn, Mattias Samuelsson, John-Jason Peterka","Jeff Skinner, Tage Thompson, Dylan Cozens, Mattias Samuelsson","Jeff Skinner, Tage Thompson, Dylan Cozens, Mattias Samuelsson","Tage Thompson, Dylan Cozens, Mattias Samuelsson",12.0
Calgary Flames,CGY,CGY.png,20222023,67,27,west,pacific,none,0.52,+25.2,0.895,0.083,+11,+35,-30,81725441,774559.0,13,10,8,4,21,17,black,#3568f2,#3568f2,#052ca3,#fc4d47,#fc4d47,0.0,0.0,18,79538333.0,8,47200000,6,39200000,4,28650000,3.0,23750000.0,774559.0,Brad Treliving,"April 28, 2014",Darryl Sutter,"March 4, 2021",28.89,30.88,33.0,34.25,36.0,"MacKenzie Weegar, Nikita Zadorov, Christopher Tanev, Rasmus Andersson, Noah Hanifin, Adam Ruzicka, Dillon Dube, Tyler Toffoli, Elias Lindholm, Blake Coleman, Mikael Backlund, Andrew Mangiapane, Jonathan Huberdeau, Nazem Kadri, Jakob Pelletier, Jacob Markstrom, Daniel Vladar, Dennis Gilbert","MacKenzie Weegar, Rasmus Andersson, Blake Coleman, Andrew Mangiapane, Jonathan Huberdeau, Nazem Kadri, Jacob Markstrom, Daniel Vladar","MacKenzie Weegar, Rasmus Andersson, Blake Coleman, Jonathan Huberdeau, Nazem Kadri, Jacob Markstrom","MacKenzie Weegar, Blake Coleman, Jonathan Huberdeau, Nazem Kadri","MacKenzie Weegar, Jonathan Huberdeau, Nazem Kadri",21.0
Carolina Hurricanes,CAR,CAR.png,20222023,86,39,east,metro,top3,0.573,+46.59,0.913,0.085,+35,+29,-21,86387507,-3887507.0,5,15,3,1,10,15,#052ca3,black,#052ca3,#052ca3,#3568f2,black,0.0,0.0,13,53504417.0,4,23150000,2,12570000,2,12570000,2.0,12570000.0,-3887507.0,Don Waddell,"May 8, 2018",Rod Brind'Amour,"May 8, 2018",27.85,29.25,25.0,26.0,28.0,"Stefan Noesen, Seth Jarvis, Jordan Martinook, Martin Necas, Jesperi Kotkaniemi, Teuvo Teravainen, Sebastian Aho, Andrei Svechnikov, Jaccob Slavin, Brady Skjei, Brent Burns, Jalen Chatfield, Brett Pesce","Jesperi Kotkaniemi, Andrei Svechnikov, Jaccob Slavin, Brent Burns","Jesperi Kotkaniemi, Andrei Svechnikov","Jesperi Kotkaniemi, Andrei Svechnikov","Jesperi Kotkaniemi, Andrei Svechnikov",11.0
Chicago Blackhawks,CHI,CHI.png,20222023,47,21,west,central,none,0.387,-45.87,0.903,0.081,-60,+21,-32,76828510,5671490.0,30,21,10,31,19,19,red,#fc4d47,#3568f2,red,#fc4d47,#fc4d47,0.0,0.0,11,30638333.0,2,13900000,2,13900000,1,9500000,1.0,9500000.0,5671490.0,Kyle Davidson,"October 26, 2021",Luke Richardson,"June 27, 2022",28.09,30.5,31.5,32.0,34.0,"Tyler Johnson, Jason Dickinson, Colin Blackwell, Cole Guttman, David Gust, Boris Katchouk, Taylor Raddysh, Seth Jones, Connor Murphy, Isaak Phillips, Petr Mrazek","Seth Jones, Connor Murphy","Seth Jones, Connor Murphy",Seth Jones,Seth Jones,1.0
Colorado Avalanche,COL,COL.png,20222023,73,34,west,central,top3,0.533,+6.95,0.929,0.079,+15,+36,-34,83140668,-640668.0,10,9,12,13,2,20,#3568f2,#3568f2,#3568f2,black,#052ca3,#fc4d47,0.0,0.0,12,62512500.0,9,55425000,6,41725000,5,37225000,2.0,18725000.0,-640668.0,Chris MacFarland,"July 11, 2022",Jared Bednar,"August 25, 2016",28.33,28.56,29.67,29.8,33.0,"Mikko Rantanen, Nathan MacKinnon, Valeri Nichushkin, Artturi Lehkonen, Logan O'Connor, Samuel Girard, Josh Manson, Devon Toews, Kurtis MacDermid, Alexandar Georgiev, Pavel Francouz, Cale Makar","Mikko Rantanen, Nathan MacKinnon, Valeri Nichushkin, Artturi Lehkonen, Logan O'Connor, Samuel Girard, Josh Manson, Alexandar Georgiev, Cale Makar","Nathan MacKinnon, Valeri Nichushkin, Artturi Lehkonen, Samuel Girard, Josh Manson, Cale Makar","Nathan MacKinnon, Valeri Nichushkin, Artturi Lehkonen, Samuel Girard, Cale Makar","Nathan MacKinnon, Valeri Nichushkin",26.0
Columbus Blue Jackets,CBJ,CBJ.png,20222023,46,20,east,metro,none,0.423,-24.48,0.906,0.082,-44,+19,-33,83244908,-744908.0,29,22,11,26,17,18,red,#fc4d47,#3568f2,red,#fc4d47,#fc4d47,0.0,0.0,17,51070833.0,8,39450000,6,34350000,2,15150000,1.0,9750000.0,-744908.0,Jarmo Kekalainen,"February 13, 2013",Brad Larsen,"June 10, 2021",25.82,29.12,30.5,32.5,35.0,"Sean Kuraly, Jack Roslovic, Jet Greaves, Elvis Merzlikins, Andrew Peeke, Nick Blankenburg, Adam Boqvist, Erik Gudbranson, Liam Foudy, Emil Bemstrom, Cole Sillinger, Kirill Marchenko, Boone Jenner, Kent Johnson, Eric Robinson, Patrik Laine, Johnny Gaudreau","Sean Kuraly, Elvis Merzlikins, Andrew Peeke, Adam Boqvist, Erik Gudbranson, Boone Jenner, Patrik Laine, Johnny Gaudreau","Elvis Merzlikins, Andrew Peeke, Erik Gudbranson, Boone Jenner, Patrik Laine, Johnny Gaudreau","Elvis Merzlikins, Johnny Gaudreau",Johnny Gaudreau,14.0
Dallas Stars,DAL,DAL.png,20222023,75,31,west,central,top3,0.562,+16.92,0.925,0.094,+31,+37,-24,81840360,659640.0,6,8,5,10,3,9,#052ca3,#3568f2,#052ca3,#3568f2,#052ca3,#3568f2,0.0,0.0,16,74869167.0,11,66094167,5,39000000,3,26750000,2.0,16900000.0,659640.0,Jim Nill,"April 29, 2013",Peter DeBoer,"June 21, 2022",29.19,29.36,29.0,30.67,30.5,"Jason Robertson, Joe Pavelski, Mason Marchment, Radek Faksa, Roope Hintz, Wyatt Johnston, Miro Heiskanen, Esa Lindell, Ryan Suter, Colin Miller, Jani Hakanpaa, Nils Lundkvist, Jake Oettinger, Scott Wedgewood, Jamie Benn, Tyler Seguin","Jason Robertson, Mason Marchment, Radek Faksa, Roope Hintz, Wyatt Johnston, Miro Heiskanen, Esa Lindell, Ryan Suter, Jake Oettinger, Jamie Benn, Tyler Seguin","Jason Robertson, Mason Marchment, Roope Hintz, Miro Heiskanen, Tyler Seguin","Roope Hintz, Miro Heiskanen, Tyler Seguin","Roope Hintz, Miro Heiskanen",25.0
Detroit Red Wings,DET,DET.png,20222023,64,28,east,atlantic,none,0.492,-11.42,0.909,0.099,-4,+28,-36,76272236,6227764.0,19,16,13,24,14,4,#fc4d47,black,black,red,black,#052ca3,0.0,0.0,15,48423333.0,7,27350000,3,13775000,1,5625000,0.0,0.0,6227764.0,Steve Yzerman,"April 19, 2019",Derek Lalonde,"June 30, 2022",27.07,29.43,31.67,32.0,,"David Perron, Ville Husso, Moritz Seider, Jake Walman, Olli Maatta, Filip Hronek, Ben Chiarot, Lucas Raymond, Jonatan Berggren, Michael Rasmussen, Filip Zadina, Dominik Kubalik, Andrew Copp, Jakub Vrana, Robby Fabbri","Ville Husso, Jake Walman, Olli Maatta, Ben Chiarot, Filip Zadina, Andrew Copp, Robby Fabbri","Jake Walman, Ben Chiarot, Andrew Copp",Andrew Copp,,10.0
Edmonton Oilers,EDM,EDM.png,20222023,72,32,west,pacific,wc,0.521,+23.74,0.91,0.093,+12,+57,-37,90864910,-8364910.0,12,1,14,5,13,10,#3568f2,#052ca3,black,#052ca3,black,#3568f2,0.0,0.0,15,73075833.0,11,65600000,9,53850000,4,24875000,3.0,19875000.0,-8364910.0,Ken Holland,"May 7, 2019",Jay Woodcroft,"February 10, 2022",28.53,30.73,31.89,33.5,35.0,"Jack Campbell, Vincent Desharnais, Philip Broberg, Brett Kulak, Cody Ceci, Mattias Ekholm, Darnell Nurse, Stuart Skinner, Warren Foegele, Kailer Yamamoto, Evander Kane, Ryan Nugent-Hopkins, Zach Hyman, Leon Draisaitl, Connor McDavid","Jack Campbell, Brett Kulak, Cody Ceci, Mattias Ekholm, Darnell Nurse, Stuart Skinner, Evander Kane, Ryan Nugent-Hopkins, Zach Hyman, Leon Draisaitl, Connor McDavid","Jack Campbell, Brett Kulak, Mattias Ekholm, Darnell Nurse, Stuart Skinner, Evander Kane, Ryan Nugent-Hopkins, Zach Hyman, Connor McDavid","Jack Campbell, Darnell Nurse, Ryan Nugent-Hopkins, Zach Hyman","Darnell Nurse, Ryan Nugent-Hopkins, Zach Hyman",28.0
Florida Panthers,FLA,FLA.png,20222023,66,30,east,atlantic,none,0.522,+17.84,0.907,0.088,+13,+39,-47,87702879,-5202879.0,11,6,17,8,16,13,#3568f2,#052ca3,#fc4d47,#3568f2,black,black,0.0,0.0,15,66508334.0,6,45591667,3,29500000,2,19500000,2.0,19500000.0,-5202879.0,Bill Zito,"September 2, 2020",Paul Maurice,"June 22, 2022",27.67,29.67,31.67,30.0,32.0,"Matthew Tkachuk, Sam Reinhart, Aaron Ekblad, Sergei Bobrovsky, Josh Mahura, Gustav Forsling, Brandon Montour, Ryan Lomberg, Anton Lundell, Nick Cousins, Eetu Luostarinen, Anthony Duclair, Carter Verhaeghe, Sam Bennett, Aleksander Barkov","Matthew Tkachuk, Aaron Ekblad, Sergei Bobrovsky, Carter Verhaeghe, Sam Bennett, Aleksander Barkov","Matthew Tkachuk, Sergei Bobrovsky, Aleksander Barkov","Matthew Tkachuk, Aleksander Barkov","Matthew Tkachuk, Aleksander Barkov",31.0
Los Angeles Kings,LAK,LAK.png,20222023,76,34,west,pacific,top3,0.488,+6.74,0.893,0.089,-7,+44,-41,81692884,807116.0,20,3,15,14,23,12,#fc4d47,#052ca3,black,black,#fc4d47,#3568f2,0.0,0.0,16,66013334.0,6,38000000,5,34000000,4,28500000,2.0,12000000.0,807116.0,Rob Blake,"April 10, 2017",Todd McLellan,"April 16, 2019",28.06,29.83,30.6,32.0,30.5,"Sean Walker, Sean Durzi, Michael Anderson, Pheonix Copley, Matt Roy, Drew Doughty, Phillip Danault, Arthur Kaliyev, Quinton Byfield, Carl Grundstrom, Blake Lizotte, Alex Iafallo, Viktor Arvidsson, Adrian Kempe, Kevin Fiala, Anze Kopitar","Michael Anderson, Drew Doughty, Phillip Danault, Alex Iafallo, Adrian Kempe, Kevin Fiala","Michael Anderson, Drew Doughty, Phillip Danault, Adrian Kempe, Kevin Fiala","Michael Anderson, Drew Doughty, Phillip Danault, Kevin Fiala","Michael Anderson, Kevin Fiala",15.0
Minnesota Wild,MIN,MIN.png,20222023,74,34,west,central,top3,0.483,+5.09,0.916,0.077,-8,+38,-23,80828448,1671552.0,21,7,4,17,7,21,#fc4d47,#3568f2,#052ca3,#fc4d47,#3568f2,#fc4d47,0.0,0.0,13,52575000.0,7,35475000,4,28825000,3,19825000,2.0,12250000.0,1671552.0,Bill Guerin,"August 21, 2019",Dean Evason,"February 14, 2020",30.31,29.0,29.25,30.67,29.5,"Mats Zuccarello, Kirill Kaprizov, Joel Eriksson Ek, Marcus Foligno, Jordan Greenway, Ryan Hartman, Matthew Boldy, Connor Dewar, Jared Spurgeon, Jacob Middleton, Alex Goligoski, Jon Merrill, Marc-Andre Fleury","Kirill Kaprizov, Joel Eriksson Ek, Jordan Greenway, Matthew Boldy, Jared Spurgeon, Jacob Middleton, Jon Merrill","Kirill Kaprizov, Joel Eriksson Ek, Matthew Boldy, Jared Spurgeon","Joel Eriksson Ek, Matthew Boldy, Jared Spurgeon","Joel Eriksson Ek, Matthew Boldy",18.0
Montreal Canadiens,MTL,MTL.png,20222023,56,26,east,atlantic,none,0.447,-41.82,0.902,0.092,-29,+22,-48,95421377,-12921377.0,27,20,18,30,20,11,red,#fc4d47,#fc4d47,red,#fc4d47,#3568f2,0.0,0.0,16,50867500.0,11,39842500,4,21612500,2,13375000,1.0,7875000.0,-12921377.0,Kent Hughes,"January 18, 2022",Martin St. Louis,"February 9, 2022",27.5,28.36,28.5,29.5,29.0,"Samuel Montembeault, Jake Allen, Johnathan Kovacevic, Jordan Harris, Kaiden Guhle, Justin Barron, David Savard, Joel Edmundson, Michael Matheson, Rem Pitlick, Kirby Dach, Joel Armia, Christian Dvorak, Mike Hoffman, Josh Anderson, Nick Suzuki","Jake Allen, Johnathan Kovacevic, Jordan Harris, Kaiden Guhle, David Savard, Michael Matheson, Kirby Dach, Joel Armia, Christian Dvorak, Josh Anderson, Nick Suzuki","Michael Matheson, Kirby Dach, Josh Anderson, Nick Suzuki","Josh Anderson, Nick Suzuki",Nick Suzuki,4.0
Nashville Predators,NSH,NSH.png,20222023,64,29,west,central,none,0.508,-2.4,0.921,0.088,+4,+26,-34,79829889,2670111.0,16,18,12,21,4,13,black,#fc4d47,#3568f2,#fc4d47,#052ca3,black,0.0,0.0,14,56155309.0,8,46666143,5,28666143,1,9059000,1.0,9059000.0,2670111.0,David Poile,"July 9, 1997",John Hynes,"January 7, 2020",28.93,31.88,33.2,36.0,38.0,"Jeremy Lauzon, Tyson Barrie, Ryan McDonagh, Roman Josi, Cole Smith, Thomas Novak, Philip Tomasino, Matt Duchene, Ryan Johansen, Mikael Granlund, Colton Sissons, Yakov Trenin, Juuso Parssinen, Juuse Saros","Jeremy Lauzon, Ryan McDonagh, Roman Josi, Matt Duchene, Ryan Johansen, Mikael Granlund, Colton Sissons, Juuse Saros","Jeremy Lauzon, Ryan McDonagh, Roman Josi, Matt Duchene, Colton Sissons",Roman Josi,Roman Josi,3.0
New Jersey Devils,NJD,NJD.png,20222023,83,39,east,metro,top3,0.59,+34.6,0.917,0.096,+49,+23,-25,83668837,-1168837.0,2,19,6,2,6,7,#052ca3,#fc4d47,#052ca3,#052ca3,#052ca3,#3568f2,0.0,0.0,10,44295000.0,7,41450000,6,38050000,6,38050000,3.0,20400000.0,-1168837.0,Tom Fitzgerald,"January 12, 2020",Lindy Ruff,"July 9, 2020",26.8,28.0,28.83,29.83,31.0,"Vitek Vanecek, Brendan Smith, Jonas Siegenthaler, Dougie Hamilton, Graeme Clarke, Dawson Mercer, John Marino, Nico Hischier, Jack Hughes, Ondrej Palat","Vitek Vanecek, Jonas Siegenthaler, Dougie Hamilton, John Marino, Nico Hischier, Jack Hughes, Ondrej Palat","Jonas Siegenthaler, Dougie Hamilton, John Marino, Nico Hischier, Jack Hughes, Ondrej Palat","Jonas Siegenthaler, Dougie Hamilton, John Marino, Nico Hischier, Jack Hughes, Ondrej Palat","Jonas Siegenthaler, Dougie Hamilton, Jack Hughes",24.0
New York Islanders,NYI,NYI.png,20222023,70,31,east,metro,wc,0.531,-8.83,0.921,0.092,+17,+21,-24,81302463,1197537.0,9,21,5,23,4,11,#3568f2,#fc4d47,#052ca3,#fc4d47,#052ca3,#3568f2,0.0,0.0,18,71400833.0,11,57650000,7,40150000,5,32050000,4.0,29550000.0,1197537.0,Lou Lamoriello,"June 5, 2018",Lane Lambert,"May 16, 2022",28.72,30.18,31.71,32.0,33.0,"Brock Nelson, Ilya Sorokin, Sebastian Aho, Alexander Romanov, Noah Dobson, Adam Pelech, Ryan Pulock, Arnaud Durandeau, Otto Koivula, Simon Holmstrom, Ross Johnston, Matt Martin, Casey Cizikas, Bo Horvat, Kyle Palmieri, Anders Lee, Josh Bailey, Mathew Barzal","Brock Nelson, Alexander Romanov, Noah Dobson, Adam Pelech, Ryan Pulock, Ross Johnston, Casey Cizikas, Bo Horvat, Kyle Palmieri, Anders Lee, Mathew Barzal","Adam Pelech, Ryan Pulock, Ross Johnston, Casey Cizikas, Bo Horvat, Anders Lee, Mathew Barzal","Adam Pelech, Ryan Pulock, Casey Cizikas, Bo Horvat, Mathew Barzal","Adam Pelech, Ryan Pulock, Bo Horvat, Mathew Barzal",23.0
New York Rangers,NYR,NYR.png,20222023,77,34,east,metro,top3,0.538,+1.68,0.914,0.095,+20,+35,-23,82470960,29040.0,8,10,4,20,9,8,#3568f2,#3568f2,#052ca3,#fc4d47,#3568f2,#3568f2,0.0,0.0,12,65763691.0,10,60663691,7,53409524,5,33766667,3.0,23625000.0,29040.0,Chris Drury,"May 5, 2021",Gerard Gallant,"June 16, 2021",28.92,30.8,32.14,32.8,33.67,"Mika Zibanejad, Chris Kreider, Artemi Panarin, Vincent Trocheck, Barclay Goodrow, Kaapo Kakko, Adam Fox, Jacob Trouba, Ryan Lindgren, Jimmy Vesey, Ben Harpur, Igor Shesterkin","Mika Zibanejad, Chris Kreider, Artemi Panarin, Vincent Trocheck, Barclay Goodrow, Adam Fox, Jacob Trouba, Jimmy Vesey, Ben Harpur, Igor Shesterkin","Mika Zibanejad, Chris Kreider, Artemi Panarin, Vincent Trocheck, Barclay Goodrow, Adam Fox, Jacob Trouba","Mika Zibanejad, Chris Kreider, Vincent Trocheck, Barclay Goodrow, Adam Fox","Mika Zibanejad, Vincent Trocheck, Adam Fox",27.0
Ottawa Senators,OTT,OTT.png,20222023,64,30,east,atlantic,none,0.451,+11.19,0.903,0.076,-25,+49,-30,77750485,4749515.0,25,2,8,12,19,22,red,#052ca3,#3568f2,#3568f2,#fc4d47,#fc4d47,0.0,0.0,10,46103214.0,8,44415714,6,37080714,5,34130714,3.0,24555714.0,4749515.0,Pierre Dorion,"April 10, 2016",D. J. Smith,"May 23, 2019",25.8,27.62,27.5,28.2,29.33,"Jake Sanderson, Artem Zub, Thomas Chabot, Parker Kelly, Mark Kastelic, Tim Stutzle, Brady Tkachuk, Drake Batherson, Claude Giroux, Mathieu Joseph","Artem Zub, Thomas Chabot, Mark Kastelic, Tim Stutzle, Brady Tkachuk, Drake Batherson, Claude Giroux, Mathieu Joseph","Artem Zub, Thomas Chabot, Tim Stutzle, Brady Tkachuk, Drake Batherson, Mathieu Joseph","Artem Zub, Thomas Chabot, Tim Stutzle, Brady Tkachuk, Drake Batherson","Thomas Chabot, Tim Stutzle, Brady Tkachuk",19.0
Philadelphia Flyers,PHI,PHI.png,20222023,56,23,east,metro,none,0.458,-25.65,0.908,0.081,-22,+19,-28,86729151,-4229151.0,23,22,7,27,15,19,#fc4d47,#fc4d47,#3568f2,red,black,#fc4d47,0.0,0.0,14,48631857.0,8,35817857,6,28242857,3,16350000,2.0,11250000.0,-4229151.0,Chuck Fletcher,"December 3, 2018",John Tortorella,"June 17, 2022",27.36,28.75,30.83,29.67,30.5,"Ivan Provorov, Rasmus Ristolainen, Nick Seeler, Travis Sanheim, Wade Allison, Anthony Deangelo, Nicolas Deslauriers, Owen Tippett, Scott Laughton, Joel Farabee, Kevin Hayes, Elliot Desnoyers, Carter Hart, Felix Sandstrom","Ivan Provorov, Rasmus Ristolainen, Travis Sanheim, Nicolas Deslauriers, Scott Laughton, Joel Farabee, Kevin Hayes, Elliot Desnoyers","Rasmus Ristolainen, Travis Sanheim, Nicolas Deslauriers, Scott Laughton, Joel Farabee, Kevin Hayes","Rasmus Ristolainen, Travis Sanheim, Joel Farabee","Travis Sanheim, Joel Farabee",13.0
Pittsburgh Penguins,PIT,PIT.png,20222023,69,30,east,metro,wc,0.504,+17.05,0.915,0.085,+2,+34,-31,83148599,-648599.0,17,11,9,9,8,15,#fc4d47,#3568f2,#3568f2,#3568f2,#3568f2,black,0.0,0.0,15,60125175.0,9,46800175,4,22325000,3,16225000,3.0,16225000.0,-648599.0,Ron Hextall,"February 9, 2021",Mike Sullivan,"December 12, 2015",32.07,33.89,35.5,35.33,37.33,"Rickard Rakell, Jeff Carter, Brock McGinn, Jeff Petry, Kris Letang, Marcus Pettersson, Jan Rutta, Pierre-Olivier Joseph, Chad Ruhwedel, Mark Friedman, Casey DeSmith, Bryan Rust, Jake Guentzel, Sidney Crosby, Evgeni Malkin","Rickard Rakell, Brock McGinn, Jeff Petry, Kris Letang, Marcus Pettersson, Jan Rutta, Bryan Rust, Sidney Crosby, Evgeni Malkin","Rickard Rakell, Kris Letang, Bryan Rust, Evgeni Malkin","Rickard Rakell, Kris Letang, Bryan Rust","Rickard Rakell, Kris Letang, Bryan Rust",17.0
San Jose Sharks,SJS,SJS.png,20222023,48,18,west,pacific,none,0.456,+5.9,0.888,0.096,-28,+18,-25,82653740,-153740.0,26,23,6,16,25,7,red,#fc4d47,#052ca3,black,red,#3568f2,0.0,0.0,14,57675000.0,7,41137500,6,39137500,3,27637500,1.0,8137500.0,-153740.0,Mike Grier,"July 5, 2022",David Quinn,"July 21, 2022",29.64,31.71,33.17,35.33,35.0,"Tomas Hertl, Logan Couture, Kevin Labanc, Alexander Barabanov, Nico Sturm, Steven Lorentz, Erik Karlsson, Oskar Lindblom, Mario Ferraro, Marc-Edouard Vlasic, Kaapo Kahkonen, Jacob MacDonald, Matthew Benning, Radim Simek","Tomas Hertl, Logan Couture, Nico Sturm, Erik Karlsson, Mario Ferraro, Marc-Edouard Vlasic, Matthew Benning","Tomas Hertl, Logan Couture, Erik Karlsson, Mario Ferraro, Marc-Edouard Vlasic, Matthew Benning","Tomas Hertl, Logan Couture, Erik Karlsson",Tomas Hertl,7.0
St. Louis Blues,STL,STL.png,20222023,57,26,west,central,none,0.437,-37.61,0.894,0.095,-38,+27,-28,82755928,-255928.0,28,17,7,29,22,8,red,#fc4d47,#3568f2,red,#fc4d47,#3568f2,0.0,0.0,16,72329167.0,10,62550000,9,56750000,7,48250000,4.0,29250000.0,-255928.0,Doug Armstrong,"July 1, 2010",Craig Berube,"November 19, 2018",29.56,30.5,31.67,32.14,32.75,"Jordan Binnington, Calle Rosen, Torey Krug, Marco Scandella, Nick Leddy, Colton Parayko, Justin Faulk, Nathan Walker, Nikita Alexandrov, Robert Bortuzzo, Robert Thomas, Kasperi Kapanen, Brandon Saad, Pavel Buchnevich, Brayden Schenn, Jordan Kyrou","Jordan Binnington, Torey Krug, Nick Leddy, Colton Parayko, Justin Faulk, Robert Thomas, Brandon Saad, Pavel Buchnevich, Brayden Schenn, Jordan Kyrou","Jordan Binnington, Torey Krug, Nick Leddy, Colton Parayko, Justin Faulk, Robert Thomas, Brandon Saad, Brayden Schenn, Jordan Kyrou","Jordan Binnington, Torey Krug, Colton Parayko, Justin Faulk, Robert Thomas, Brayden Schenn, Jordan Kyrou","Colton Parayko, Robert Thomas, Brayden Schenn, Jordan Kyrou",5.0
Tampa Bay Lightning,TBL,TBL.png,20222023,78,37,east,atlantic,top3,0.539,+14.46,0.915,0.099,+22,+40,-31,89561599,-7061599.0,7,5,9,11,8,4,#3568f2,#052ca3,#3568f2,#3568f2,#3568f2,#052ca3,0.0,0.0,14,73212500.0,9,60600000,7,51600000,7,51600000,6.0,42100000.0,-7061599.0,Julien BriseBois,"September 11, 2018",Jon Cooper,"March 25, 2013",28.79,28.67,29.29,30.29,31.83,"Andrei Vasilevskiy, Zach Bogosian, Nick Perbix, Erik Cernak, Mikhail Sergachev, Victor Hedman, Haydn Fleury, Brandon Hagel, Patrick Maroon, Nicholas Paul, Anthony Cirelli, Steven Stamkos, Brayden Point, Nikita Kucherov","Andrei Vasilevskiy, Nick Perbix, Erik Cernak, Mikhail Sergachev, Victor Hedman, Nicholas Paul, Anthony Cirelli, Brayden Point, Nikita Kucherov","Andrei Vasilevskiy, Erik Cernak, Mikhail Sergachev, Nicholas Paul, Anthony Cirelli, Brayden Point, Nikita Kucherov","Andrei Vasilevskiy, Erik Cernak, Mikhail Sergachev, Nicholas Paul, Anthony Cirelli, Brayden Point, Nikita Kucherov","Andrei Vasilevskiy, Erik Cernak, Mikhail Sergachev, Nicholas Paul, Anthony Cirelli, Brayden Point",32.0
Toronto Maple Leafs,TOR,TOR.png,20222023,82,37,east,atlantic,top3,0.577,+29.01,0.919,0.098,+40,+41,-24,88771379,-6271379.0,3,4,5,3,5,5,#052ca3,#052ca3,#052ca3,#052ca3,#052ca3,#052ca3,0.0,0.0,12,61555616.0,6,34603000,2,9600000,1,7500000,1.0,7500000.0,-6271379.0,Kyle Dubas,"May 11, 2018",Sheldon Keefe,"November 20, 2019",29.42,30.17,32.5,32.0,34.0,"William Nylander, Auston Matthews, John Tavares, Calle Jarnkrok, Sam Lafferty, Morgan Rielly, TJ Brodie, Jake McCabe, Timothy Liljegren, Conor Timmins, Mark Giordano, Mitchell Marner","John Tavares, Calle Jarnkrok, Morgan Rielly, Jake McCabe, Conor Timmins, Mitchell Marner","Calle Jarnkrok, Morgan Rielly",Morgan Rielly,Morgan Rielly,30.0
Vancouver Canucks,VAN,VAN.png,20222023,53,24,west,pacific,none,0.462,-18.03,0.891,0.097,-23,+34,-44,87815766,-5315766.0,24,11,16,25,24,6,red,#3568f2,black,red,red,#052ca3,0.0,0.0,15,60445417.0,7,38786667,4,25800000,2,15850000,1.0,8000000.0,-5315766.0,Patrik Allvin,"January 26, 2022",Rick Tocchet,"January 22, 2023",26.47,27.43,29.25,30.0,35.0,"Tyler Myers, Jack Studnicka, Thatcher Demko, Sheldon Dries, Dakota Joshua, Aatu Raty, Nils Åman, Vasily Podkolzin, Andrei Kuzmenko, Anthony Beauvillier, Conor Garland, J.T. Miller, Quinn Hughes, Elias Pettersson, Brock Boeser","Thatcher Demko, Aatu Raty, Andrei Kuzmenko, Conor Garland, J.T. Miller, Quinn Hughes, Brock Boeser","Thatcher Demko, Conor Garland, J.T. Miller, Quinn Hughes","J.T. Miller, Quinn Hughes",J.T. Miller,9.0
Vegas Golden Knights,VGK,VGK.png,20222023,76,35,west,pacific,top3,0.515,+19.71,0.912,0.088,+8,+29,-19,95137293,-12637293.0,14,15,1,7,11,13,black,black,#052ca3,#3568f2,#3568f2,black,0.0,0.0,17,63981650.0,11,47969150,6,31225000,4,20450000,1.0,2750000.0,-12637293.0,Kelly McCrimmon,"September 1, 2019",Bruce Cassidy,"June 14, 2022",29.29,29.55,30.33,32.75,32.0,"William Carrier, Keegan Kolesar, William Karlsson, Jack Eichel, Ben Hutton, Nicolas Hague, Zach Whitecloud, Brayden McNabb, Shea Theodore, Alec Martinez, Alex Pietrangelo, Paul Cotter, Michael Amadio, Jonathan Marchessault, Nicolas Roy, Chandler Stephenson, Reilly Smith","Keegan Kolesar, William Karlsson, Jack Eichel, Nicolas Hague, Zach Whitecloud, Brayden McNabb, Shea Theodore, Alex Pietrangelo, Paul Cotter, Nicolas Roy, Reilly Smith","William Karlsson, Jack Eichel, Zach Whitecloud, Alex Pietrangelo, Paul Cotter, Nicolas Roy","William Karlsson, Zach Whitecloud, Alex Pietrangelo, Nicolas Roy",Zach Whitecloud,20.0
