full,team,logo,season,PTS,W,Conference,Division,playoffs,gf%,xg_dif,sv%,shooting%,g_dif,PP_g_dif,PK_g_dif,projected_cap_hit,projected_cap_space,5on5_rank,PP_rank,PK_rank,XG_dif_rank,Save%_rank,Shooting%_rank,5on5_color,PP_color,PK_color,xg_color,sv_color,sh_color,expiring_contracts,expiring_salary,nhl_contracts_2324,2023-24 Salary,nhl_contracts_2425,2024-25 Salary,nhl_contracts_2526,2025-26 Salary,nhl_contracts_2627,2026-27 Salary,nhl_contracts_2728,2027-28 Salary,cap_remaining,GM,gm_start,coach,coach_start,avg_age_2324,avg_age_2425,avg_age_2526,avg_age_2627,avg_age_2728,players_under_contract_2324,players_under_contract_2425,players_under_contract_2526,players_under_contract_2627,players_under_contract_2728,draft_capital_rank
Anaheim Ducks,ANA,ANA.png,20222023,45,19,west,pacific,none,0.379,-55.59,0.906,0.08,-70,+21,-54,68650153,13849847.0,31,21,21,32,15,20,red,#fc4d47,#fc4d47,red,black,#fc4d47,0.0,0.0,11,33176667.0,5,22444167,3,17900000,2,11400000,0.0,0.0,13849847.0,Pat Verbeek,"February 3, 2022",Dallas Eakins,"June 17, 2019",27.91,29.4,32.67,33.0,,"John Gibson, Colton White, Cam Fowler, Brett Leason, Sam Carrick, Mason McTavish, Max Jones, Isac Lundestrom, Ryan Strome, Jakob Silfverberg, Frank Vatrano","John Gibson, Cam Fowler, Mason McTavish, Ryan Strome, Frank Vatrano","John Gibson, Cam Fowler, Ryan Strome","John Gibson, Ryan Strome",,7.0
Arizona Coyotes,ARI,ARI.png,20222023,49,20,west,central,none,0.45,-37.67,0.911,0.096,-26,+30,-50,66459719,16040281.0,25,13,20,29,12,7,red,black,#fc4d47,red,#3568f2,#3568f2,0.0,0.0,14,38650000.0,5,24625000,3,17300000,2,11450000,1.0,7150000.0,16040281.0,Bill Armstrong,"September 17, 2020",Andre Tourigny,"July 1, 2021",27.07,27.2,28.33,28.5,30.0,"Karel Vejmelka, Victor Soderstrom, J.J. Moser, Joshua Brown, Juuso Valimaki, Patrik Nemeth, Jakob Chychrun, Travis Boyd, Barrett Hayton, Zack Kassian, Lawson Crouse, Nick Schmaltz, Liam O'Brien, Clayton Keller","Karel Vejmelka, Jakob Chychrun, Lawson Crouse, Nick Schmaltz, Clayton Keller","Lawson Crouse, Nick Schmaltz, Clayton Keller","Lawson Crouse, Clayton Keller",Clayton Keller,2.0
Boston Bruins,BOS,BOS.png,20222023,95,45,east,atlantic,top3,0.643,+25.24,0.937,0.104,+69,+38,-20,83474399,-974399.0,1,7,2,4,1,3,#052ca3,#3568f2,#052ca3,#052ca3,#052ca3,#052ca3,0.0,0.0,13,59812500.0,8,47225000,5,30100000,4,24850000,2.0,16000000.0,-974399.0,Don Sweeney,"May 20, 2015",Jim Montgomery,"July 1, 2022",29.15,30.62,30.0,30.25,33.0,"Brandon Carlo, Matt Grzelcyk, Derek Forbort, Linus Ullmark, Jakub Zboril, Hampus Lindholm, Charlie McAvoy, Taylor Hall, Pavel Zacha, Jake DeBrusk, Charlie Coyle, Brad Marchand, AJ Greer","Brandon Carlo, Linus Ullmark, Hampus Lindholm, Charlie McAvoy, Taylor Hall, Pavel Zacha, Charlie Coyle, Brad Marchand","Brandon Carlo, Hampus Lindholm, Charlie McAvoy, Pavel Zacha, Charlie Coyle","Brandon Carlo, Hampus Lindholm, Charlie McAvoy, Pavel Zacha","Hampus Lindholm, Charlie McAvoy",29.0
Buffalo Sabres,BUF,BUF.png,20222023,66,31,east,atlantic,none,0.513,-3.99,0.902,0.105,+8,+40,-36,64535572,17964428.0,15,5,14,22,19,2,black,#052ca3,black,#fc4d47,#fc4d47,#052ca3,0.0,0.0,16,54015237.0,6,29247737,4,27528571,4,27528571,3.0,18528571.0,17964428.0,Kevyn Adams,"June 16, 2020",Don Granato,"March 17, 2021",24.88,25.5,27.75,28.75,29.0,"Ukko-Pekka Luukkonen, Eric Comrie, Owen Power, Mattias Samuelsson, Jacob Bryson, Henri Jokiharju, Ilya Lyubushkin, Rasmus Dahlin, Jack Quinn, Peyton Krebs, Dylan Cozens, Tage Thompson, Jeff Skinner, Casey Mittelstadt, John-Jason Peterka, Victor Olofsson","Mattias Samuelsson, Jack Quinn, Dylan Cozens, Tage Thompson, Jeff Skinner, John-Jason Peterka","Mattias Samuelsson, Dylan Cozens, Tage Thompson, Jeff Skinner","Mattias Samuelsson, Dylan Cozens, Tage Thompson, Jeff Skinner","Mattias Samuelsson, Dylan Cozens, Tage Thompson",13.0
Calgary Flames,CGY,CGY.png,20222023,66,27,west,pacific,none,0.519,+21.25,0.896,0.084,+10,+35,-29,81725441,774559.0,13,9,8,6,21,17,black,#3568f2,#3568f2,#052ca3,#fc4d47,#fc4d47,0.0,0.0,18,79538333.0,8,47200000,6,39200000,4,28650000,3.0,23750000.0,774559.0,Brad Treliving,"April 28, 2014",Darryl Sutter,"March 4, 2021",28.89,30.88,33.0,34.25,36.0,"Daniel Vladar, Jacob Markstrom, Dennis Gilbert, MacKenzie Weegar, Nikita Zadorov, Christopher Tanev, Rasmus Andersson, Noah Hanifin, Adam Ruzicka, Jakob Pelletier, Dillon Dube, Tyler Toffoli, Elias Lindholm, Blake Coleman, Mikael Backlund, Nazem Kadri, Jonathan Huberdeau, Andrew Mangiapane","Daniel Vladar, Jacob Markstrom, MacKenzie Weegar, Rasmus Andersson, Blake Coleman, Nazem Kadri, Jonathan Huberdeau, Andrew Mangiapane","Jacob Markstrom, MacKenzie Weegar, Rasmus Andersson, Blake Coleman, Nazem Kadri, Jonathan Huberdeau","MacKenzie Weegar, Blake Coleman, Nazem Kadri, Jonathan Huberdeau","MacKenzie Weegar, Nazem Kadri, Jonathan Huberdeau",21.0
Carolina Hurricanes,CAR,CAR.png,20222023,86,39,east,metro,top3,0.573,+46.59,0.913,0.085,+35,+29,-21,85657777,-3157777.0,4,14,3,1,10,16,#052ca3,black,#052ca3,#052ca3,#3568f2,black,0.0,0.0,13,53504417.0,4,23150000,2,12570000,2,12570000,2.0,12570000.0,-3157777.0,Don Waddell,"May 8, 2018",Rod Brind'Amour,"May 8, 2018",27.85,29.25,25.0,26.0,28.0,"Jalen Chatfield, Brett Pesce, Brady Skjei, Brent Burns, Stefan Noesen, Seth Jarvis, Jordan Martinook, Martin Necas, Jesperi Kotkaniemi, Teuvo Teravainen, Jaccob Slavin, Sebastian Aho, Andrei Svechnikov","Brent Burns, Jesperi Kotkaniemi, Jaccob Slavin, Andrei Svechnikov","Jesperi Kotkaniemi, Andrei Svechnikov","Jesperi Kotkaniemi, Andrei Svechnikov","Jesperi Kotkaniemi, Andrei Svechnikov",11.0
Chicago Blackhawks,CHI,CHI.png,20222023,47,21,west,central,none,0.395,-45.79,0.904,0.083,-54,+19,-31,78105537,4394463.0,30,22,10,31,17,18,red,#fc4d47,#3568f2,red,#fc4d47,#fc4d47,0.0,0.0,11,30638333.0,2,13900000,2,13900000,1,9500000,1.0,9500000.0,4394463.0,Kyle Davidson,"October 26, 2021",Luke Richardson,"June 27, 2022",28.09,30.5,31.5,32.0,34.0,"Boris Katchouk, Tyler Johnson, Jason Dickinson, David Gust, Petr Mrazek, Isaak Phillips, Connor Murphy, Seth Jones, Taylor Raddysh, Colin Blackwell, Cole Guttman","Connor Murphy, Seth Jones","Connor Murphy, Seth Jones",Seth Jones,Seth Jones,1.0
Colorado Avalanche,COL,COL.png,20222023,71,33,west,central,wc,0.527,+6.66,0.928,0.079,+12,+36,-34,83516276,-1016276.0,11,8,13,14,2,21,#3568f2,#3568f2,black,black,#052ca3,#fc4d47,0.0,0.0,13,63275000.0,9,55425000,6,41725000,5,37225000,2.0,18725000.0,-1016276.0,Chris MacFarland,"July 11, 2022",Jared Bednar,"August 25, 2016",28.85,28.56,29.67,29.8,33.0,"Mikko Rantanen, Alexandar Georgiev, Nathan MacKinnon, Valeri Nichushkin, Artturi Lehkonen, Pavel Francouz, Logan O'Connor, Cale Makar, Samuel Girard, Josh Manson, Devon Toews, Kurtis MacDermid, Brad Hunt","Mikko Rantanen, Alexandar Georgiev, Nathan MacKinnon, Valeri Nichushkin, Artturi Lehkonen, Logan O'Connor, Cale Makar, Samuel Girard, Josh Manson","Nathan MacKinnon, Valeri Nichushkin, Artturi Lehkonen, Cale Makar, Samuel Girard, Josh Manson","Nathan MacKinnon, Valeri Nichushkin, Artturi Lehkonen, Cale Makar, Samuel Girard","Nathan MacKinnon, Valeri Nichushkin",28.0
Columbus Blue Jackets,CBJ,CBJ.png,20222023,44,19,east,metro,none,0.417,-25.88,0.905,0.081,-46,+18,-32,84331327,-1831327.0,29,23,11,27,16,19,red,#fc4d47,#3568f2,red,black,#fc4d47,0.0,0.0,17,51075000.0,8,39450000,6,34350000,2,15150000,1.0,9750000.0,-1831327.0,Jarmo Kekalainen,"February 13, 2013",Brad Larsen,"June 10, 2021",26.18,29.12,30.5,32.5,35.0,"Johnny Gaudreau, Patrik Laine, Jack Roslovic, Boone Jenner, Sean Kuraly, Eric Robinson, Kent Johnson, Kirill Marchenko, Cole Sillinger, Emil Bemstrom, Liam Foudy, Adam Boqvist, Nick Blankenburg, Andrew Peeke, Billy Sweezey, Elvis Merzlikins, Erik Gudbranson","Johnny Gaudreau, Patrik Laine, Boone Jenner, Sean Kuraly, Adam Boqvist, Andrew Peeke, Elvis Merzlikins, Erik Gudbranson","Johnny Gaudreau, Patrik Laine, Boone Jenner, Andrew Peeke, Elvis Merzlikins, Erik Gudbranson","Johnny Gaudreau, Elvis Merzlikins",Johnny Gaudreau,15.0
Dallas Stars,DAL,DAL.png,20222023,74,31,west,central,top3,0.565,+14.8,0.927,0.094,+32,+36,-24,82205225,294775.0,6,8,5,11,3,9,#052ca3,#3568f2,#052ca3,#3568f2,#052ca3,#3568f2,0.0,0.0,16,74869167.0,11,66094167,5,39000000,3,26750000,2.0,16900000.0,294775.0,Jim Nill,"April 29, 2013",Peter DeBoer,"June 21, 2022",29.19,29.36,29.0,30.67,30.5,"Esa Lindell, Ryan Suter, Colin Miller, Jani Hakanpaa, Jake Oettinger, Scott Wedgewood, Miro Heiskanen, Nils Lundkvist, Wyatt Johnston, Roope Hintz, Radek Faksa, Mason Marchment, Joe Pavelski, Jason Robertson, Jamie Benn, Tyler Seguin","Esa Lindell, Ryan Suter, Jake Oettinger, Miro Heiskanen, Wyatt Johnston, Roope Hintz, Radek Faksa, Mason Marchment, Jason Robertson, Jamie Benn, Tyler Seguin","Miro Heiskanen, Roope Hintz, Mason Marchment, Jason Robertson, Tyler Seguin","Miro Heiskanen, Roope Hintz, Tyler Seguin","Miro Heiskanen, Roope Hintz",27.0
Detroit Red Wings,DET,DET.png,20222023,64,28,east,atlantic,none,0.498,-9.57,0.91,0.1,-1,+28,-33,76272236,6227764.0,18,15,12,23,13,4,#fc4d47,black,#3568f2,#fc4d47,black,#052ca3,0.0,0.0,14,45023333.0,6,23950000,2,10375000,1,5625000,0.0,0.0,6227764.0,Steve Yzerman,"April 19, 2019",Derek Lalonde,"June 30, 2022",26.93,29.5,32.5,32.0,,"Andrew Copp, Jakub Vrana, David Perron, Robby Fabbri, Dominik Kubalik, Filip Zadina, Michael Rasmussen, Lucas Raymond, Jonatan Berggren, Moritz Seider, Ville Husso, Olli Maatta, Filip Hronek, Ben Chiarot","Andrew Copp, Robby Fabbri, Filip Zadina, Ville Husso, Olli Maatta, Ben Chiarot","Andrew Copp, Ben Chiarot",Andrew Copp,,10.0
Edmonton Oilers,EDM,EDM.png,20222023,72,32,west,pacific,top3,0.525,+22.99,0.911,0.093,+14,+57,-37,90837545,-8337545.0,10,1,15,5,12,10,#3568f2,#052ca3,black,#052ca3,#3568f2,#3568f2,0.0,0.0,14,70813333.0,10,59600000,8,47850000,4,24875000,3.0,19875000.0,-8337545.0,Ken Holland,"May 7, 2019",Jay Woodcroft,"February 10, 2022",28.57,30.4,31.5,33.5,35.0,"Evander Kane, Stuart Skinner, Connor McDavid, Leon Draisaitl, Zach Hyman, Ryan Nugent-Hopkins, Kailer Yamamoto, Warren Foegele, Darnell Nurse, Tyson Barrie, Cody Ceci, Brett Kulak, Philip Broberg, Jack Campbell","Evander Kane, Stuart Skinner, Connor McDavid, Leon Draisaitl, Zach Hyman, Ryan Nugent-Hopkins, Darnell Nurse, Cody Ceci, Brett Kulak, Jack Campbell","Evander Kane, Stuart Skinner, Connor McDavid, Zach Hyman, Ryan Nugent-Hopkins, Darnell Nurse, Brett Kulak, Jack Campbell","Zach Hyman, Ryan Nugent-Hopkins, Darnell Nurse, Jack Campbell","Zach Hyman, Ryan Nugent-Hopkins, Darnell Nurse",22.0
Florida Panthers,FLA,FLA.png,20222023,64,29,east,atlantic,none,0.515,+17.32,0.906,0.087,+9,+39,-46,87702879,-5202879.0,14,6,18,8,15,14,black,#052ca3,#fc4d47,#3568f2,black,black,0.0,0.0,15,66508334.0,6,45591667,3,29500000,2,19500000,2.0,19500000.0,-5202879.0,Bill Zito,"September 2, 2020",Paul Maurice,"June 22, 2022",27.67,29.67,31.67,30.0,32.0,"Sergei Bobrovsky, Aleksander Barkov, Matthew Tkachuk, Sam Reinhart, Sam Bennett, Carter Verhaeghe, Anthony Duclair, Nick Cousins, Anton Lundell, Eetu Luostarinen, Aaron Ekblad, Brandon Montour, Gustav Forsling, Josh Mahura, Ryan Lomberg","Sergei Bobrovsky, Aleksander Barkov, Matthew Tkachuk, Sam Bennett, Carter Verhaeghe, Aaron Ekblad","Sergei Bobrovsky, Aleksander Barkov, Matthew Tkachuk","Aleksander Barkov, Matthew Tkachuk","Aleksander Barkov, Matthew Tkachuk",30.0
Los Angeles Kings,LAK,LAK.png,20222023,74,33,west,pacific,top3,0.487,+7.41,0.894,0.087,-7,+44,-41,81692884,807116.0,20,3,16,13,22,14,#fc4d47,#052ca3,black,black,#fc4d47,black,0.0,0.0,16,68913334.0,7,42200000,6,38200000,5,32700000,3.0,16200000.0,807116.0,Rob Blake,"April 10, 2017",Todd McLellan,"April 16, 2019",28.12,29.71,30.5,31.8,31.33,"Matt Roy, Sean Walker, Sean Durzi, Michael Anderson, Pheonix Copley, Drew Doughty, Arthur Kaliyev, Quinton Byfield, Blake Lizotte, Trevor Moore, Alex Iafallo, Viktor Arvidsson, Adrian Kempe, Phillip Danault, Kevin Fiala, Anze Kopitar","Michael Anderson, Drew Doughty, Trevor Moore, Alex Iafallo, Adrian Kempe, Phillip Danault, Kevin Fiala","Michael Anderson, Drew Doughty, Trevor Moore, Adrian Kempe, Phillip Danault, Kevin Fiala","Michael Anderson, Drew Doughty, Trevor Moore, Phillip Danault, Kevin Fiala","Michael Anderson, Trevor Moore, Kevin Fiala",16.0
Minnesota Wild,MIN,MIN.png,20222023,72,33,west,central,top3,0.483,+5.91,0.915,0.078,-8,+38,-23,79891961,2608039.0,21,7,4,15,8,22,#fc4d47,#3568f2,#052ca3,black,#3568f2,#fc4d47,0.0,0.0,13,52575000.0,7,35475000,4,28825000,3,19825000,2.0,12250000.0,2608039.0,Bill Guerin,"August 21, 2019",Dean Evason,"February 14, 2020",30.31,29.0,29.25,30.67,29.5,"Kirill Kaprizov, Mats Zuccarello, Joel Eriksson Ek, Marcus Foligno, Jordan Greenway, Ryan Hartman, Matthew Boldy, Connor Dewar, Jared Spurgeon, Jacob Middleton, Alex Goligoski, Jon Merrill, Marc-Andre Fleury","Kirill Kaprizov, Joel Eriksson Ek, Jordan Greenway, Matthew Boldy, Jared Spurgeon, Jacob Middleton, Jon Merrill","Kirill Kaprizov, Joel Eriksson Ek, Matthew Boldy, Jared Spurgeon","Joel Eriksson Ek, Matthew Boldy, Jared Spurgeon","Joel Eriksson Ek, Matthew Boldy",17.0
Montreal Canadiens,MTL,MTL.png,20222023,54,25,east,atlantic,none,0.443,-41.58,0.901,0.092,-31,+22,-48,95421377,-12921377.0,27,20,19,30,20,11,red,#fc4d47,#fc4d47,red,#fc4d47,#3568f2,0.0,0.0,15,50004167.0,10,38979167,4,21612500,2,13375000,1.0,7875000.0,-12921377.0,Kent Hughes,"January 18, 2022",Martin St. Louis,"February 9, 2022",27.87,28.9,28.5,29.5,29.0,"Samuel Montembeault, Jake Allen, Johnathan Kovacevic, Jordan Harris, Justin Barron, David Savard, Joel Edmundson, Michael Matheson, Rem Pitlick, Kirby Dach, Joel Armia, Christian Dvorak, Mike Hoffman, Nick Suzuki, Josh Anderson","Jake Allen, Johnathan Kovacevic, Jordan Harris, David Savard, Michael Matheson, Kirby Dach, Joel Armia, Christian Dvorak, Nick Suzuki, Josh Anderson","Michael Matheson, Kirby Dach, Nick Suzuki, Josh Anderson","Nick Suzuki, Josh Anderson",Nick Suzuki,4.0
Nashville Predators,NSH,NSH.png,20222023,64,29,west,central,none,0.512,-1.26,0.921,0.088,+6,+26,-34,79818335,2681665.0,16,17,13,21,4,13,black,#fc4d47,black,#fc4d47,#052ca3,black,0.0,0.0,15,66405309.0,10,61416143,7,43416143,2,17559000,2.0,17559000.0,2681665.0,David Poile,"July 9, 1997",John Hynes,"January 7, 2020",29.0,31.9,33.14,34.0,36.0,"Juuse Saros, Jeremy Lauzon, Mattias Ekholm, Ryan McDonagh, Roman Josi, Juuso Parssinen, Philip Tomasino, Filip Forsberg, Matt Duchene, Ryan Johansen, Mikael Granlund, Colton Sissons, Yakov Trenin, Thomas Novak, Cole Smith","Juuse Saros, Jeremy Lauzon, Mattias Ekholm, Ryan McDonagh, Roman Josi, Filip Forsberg, Matt Duchene, Ryan Johansen, Mikael Granlund, Colton Sissons","Jeremy Lauzon, Mattias Ekholm, Ryan McDonagh, Roman Josi, Filip Forsberg, Matt Duchene, Colton Sissons","Roman Josi, Filip Forsberg","Roman Josi, Filip Forsberg",3.0
New Jersey Devils,NJD,NJD.png,20222023,83,39,east,metro,top3,0.59,+34.6,0.917,0.096,+49,+23,-25,83644310,-1144310.0,2,19,6,2,7,7,#052ca3,#fc4d47,#052ca3,#052ca3,#3568f2,#3568f2,0.0,0.0,9,43444167.0,7,41450000,6,38050000,6,38050000,3.0,20400000.0,-1144310.0,Tom Fitzgerald,"January 12, 2020",Lindy Ruff,"July 9, 2020",27.33,28.0,28.83,29.83,31.0,"Vitek Vanecek, Brendan Smith, John Marino, Dougie Hamilton, Dawson Mercer, Jonas Siegenthaler, Jack Hughes, Nico Hischier, Ondrej Palat","Vitek Vanecek, John Marino, Dougie Hamilton, Jonas Siegenthaler, Jack Hughes, Nico Hischier, Ondrej Palat","John Marino, Dougie Hamilton, Jonas Siegenthaler, Jack Hughes, Nico Hischier, Ondrej Palat","John Marino, Dougie Hamilton, Jonas Siegenthaler, Jack Hughes, Nico Hischier, Ondrej Palat","Dougie Hamilton, Jonas Siegenthaler, Jack Hughes",26.0
New York Islanders,NYI,NYI.png,20222023,69,31,east,metro,wc,0.531,-9.65,0.92,0.093,+17,+21,-24,80755166,1744834.0,9,21,5,24,5,10,#3568f2,#fc4d47,#052ca3,red,#052ca3,#3568f2,0.0,0.0,18,71400833.0,11,57650000,7,40150000,5,32050000,4.0,29550000.0,1744834.0,Lou Lamoriello,"June 5, 2018",Lane Lambert,"May 16, 2022",28.72,30.18,31.71,32.0,33.0,"Anders Lee, Ilya Sorokin, Sebastian Aho, Alexander Romanov, Noah Dobson, Adam Pelech, Ryan Pulock, Mathew Barzal, Arnaud Durandeau, Otto Koivula, Simon Holmstrom, Ross Johnston, Matt Martin, Casey Cizikas, Bo Horvat, Kyle Palmieri, Josh Bailey, Brock Nelson","Anders Lee, Alexander Romanov, Noah Dobson, Adam Pelech, Ryan Pulock, Mathew Barzal, Ross Johnston, Casey Cizikas, Bo Horvat, Kyle Palmieri, Brock Nelson","Anders Lee, Adam Pelech, Ryan Pulock, Mathew Barzal, Ross Johnston, Casey Cizikas, Bo Horvat","Adam Pelech, Ryan Pulock, Mathew Barzal, Casey Cizikas, Bo Horvat","Adam Pelech, Ryan Pulock, Mathew Barzal, Bo Horvat",25.0
New York Rangers,NYR,NYR.png,20222023,77,34,east,metro,top3,0.538,+1.68,0.914,0.095,+20,+35,-23,81832447,667553.0,8,9,4,19,9,8,#3568f2,#3568f2,#052ca3,#fc4d47,#3568f2,#3568f2,0.0,0.0,12,65763691.0,10,60663691,7,53409524,5,33766667,3.0,23625000.0,667553.0,Chris Drury,"May 5, 2021",Gerard Gallant,"June 16, 2021",28.92,30.8,32.14,32.8,33.67,"Chris Kreider, Vincent Trocheck, Artemi Panarin, Mika Zibanejad, Barclay Goodrow, Jimmy Vesey, Adam Fox, Jacob Trouba, Ryan Lindgren, Ben Harpur, Kaapo Kakko, Igor Shesterkin","Chris Kreider, Vincent Trocheck, Artemi Panarin, Mika Zibanejad, Barclay Goodrow, Jimmy Vesey, Adam Fox, Jacob Trouba, Ben Harpur, Igor Shesterkin","Chris Kreider, Vincent Trocheck, Artemi Panarin, Mika Zibanejad, Barclay Goodrow, Adam Fox, Jacob Trouba","Chris Kreider, Vincent Trocheck, Mika Zibanejad, Barclay Goodrow, Adam Fox","Vincent Trocheck, Mika Zibanejad, Adam Fox",23.0
Ottawa Senators,OTT,OTT.png,20222023,60,28,east,atlantic,none,0.443,+9.34,0.903,0.075,-28,+46,-30,77750485,4749515.0,26,2,9,12,18,23,red,#052ca3,#3568f2,#3568f2,#fc4d47,#fc4d47,0.0,0.0,10,46103214.0,8,44415714,6,37080714,5,34130714,3.0,24555714.0,4749515.0,Pierre Dorion,"April 10, 2016",D. J. Smith,"May 23, 2019",25.8,27.62,27.5,28.2,29.33,"Jake Sanderson, Parker Kelly, Artem Zub, Thomas Chabot, Mark Kastelic, Tim Stutzle, Mathieu Joseph, Brady Tkachuk, Claude Giroux, Drake Batherson","Artem Zub, Thomas Chabot, Mark Kastelic, Tim Stutzle, Mathieu Joseph, Brady Tkachuk, Claude Giroux, Drake Batherson","Artem Zub, Thomas Chabot, Tim Stutzle, Mathieu Joseph, Brady Tkachuk, Drake Batherson","Artem Zub, Thomas Chabot, Tim Stutzle, Brady Tkachuk, Drake Batherson","Thomas Chabot, Tim Stutzle, Brady Tkachuk",19.0
Philadelphia Flyers,PHI,PHI.png,20222023,56,23,east,metro,none,0.458,-25.65,0.908,0.081,-22,+19,-28,86729151,-4229151.0,23,22,7,26,14,19,#fc4d47,#fc4d47,#3568f2,red,black,#fc4d47,0.0,0.0,14,48631857.0,8,35817857,6,28242857,3,16350000,2.0,11250000.0,-4229151.0,Chuck Fletcher,"December 3, 2018",John Tortorella,"June 17, 2022",27.36,28.75,30.83,29.67,30.5,"Wade Allison, Travis Sanheim, Anthony Deangelo, Nick Seeler, Rasmus Ristolainen, Ivan Provorov, Nicolas Deslauriers, Owen Tippett, Scott Laughton, Joel Farabee, Kevin Hayes, Carter Hart, Elliot Desnoyers, Felix Sandstrom","Travis Sanheim, Rasmus Ristolainen, Ivan Provorov, Nicolas Deslauriers, Scott Laughton, Joel Farabee, Kevin Hayes, Elliot Desnoyers","Travis Sanheim, Rasmus Ristolainen, Nicolas Deslauriers, Scott Laughton, Joel Farabee, Kevin Hayes","Travis Sanheim, Rasmus Ristolainen, Joel Farabee","Travis Sanheim, Joel Farabee",14.0
Pittsburgh Penguins,PIT,PIT.png,20222023,67,29,east,metro,wc,0.5,+15.91,0.915,0.084,0,+34,-31,83148599,-648599.0,17,10,10,9,8,17,#fc4d47,#3568f2,#3568f2,#3568f2,#3568f2,#fc4d47,0.0,0.0,15,60125175.0,9,46800175,4,22325000,3,16225000,3.0,16225000.0,-648599.0,Ron Hextall,"February 9, 2021",Mike Sullivan,"December 12, 2015",32.07,33.89,35.5,35.33,37.33,"Jeff Petry, Jake Guentzel, Bryan Rust, Rickard Rakell, Jeff Carter, Brock McGinn, Kris Letang, Marcus Pettersson, Jan Rutta, Pierre-Olivier Joseph, Chad Ruhwedel, Mark Friedman, Casey DeSmith, Evgeni Malkin, Sidney Crosby","Jeff Petry, Bryan Rust, Rickard Rakell, Brock McGinn, Kris Letang, Marcus Pettersson, Jan Rutta, Evgeni Malkin, Sidney Crosby","Bryan Rust, Rickard Rakell, Kris Letang, Evgeni Malkin","Bryan Rust, Rickard Rakell, Kris Letang","Bryan Rust, Rickard Rakell, Kris Letang",18.0
San Jose Sharks,SJS,SJS.png,20222023,48,18,west,pacific,none,0.458,+5.67,0.889,0.097,-26,+18,-25,82374010,125990.0,25,23,6,16,24,6,red,#fc4d47,#052ca3,black,red,#052ca3,0.0,0.0,14,57675000.0,7,41137500,6,39137500,3,27637500,1.0,8137500.0,125990.0,Mike Grier,"July 5, 2022",David Quinn,"July 21, 2022",29.64,31.71,33.17,35.33,35.0,"Radim Simek, Erik Karlsson, Matthew Benning, Jacob MacDonald, Kaapo Kahkonen, Mario Ferraro, Marc-Edouard Vlasic, Tomas Hertl, Steven Lorentz, Nico Sturm, Alexander Barabanov, Oskar Lindblom, Kevin Labanc, Logan Couture","Erik Karlsson, Matthew Benning, Mario Ferraro, Marc-Edouard Vlasic, Tomas Hertl, Nico Sturm, Logan Couture","Erik Karlsson, Matthew Benning, Mario Ferraro, Marc-Edouard Vlasic, Tomas Hertl, Logan Couture","Erik Karlsson, Tomas Hertl, Logan Couture",Tomas Hertl,6.0
St. Louis Blues,STL,STL.png,20222023,57,26,west,central,none,0.443,-36.06,0.896,0.095,-34,+27,-29,82755928,-255928.0,28,16,8,28,21,8,red,black,#3568f2,red,#fc4d47,#3568f2,0.0,0.0,16,72329167.0,10,62550000,9,56750000,7,48250000,4.0,29250000.0,-255928.0,Doug Armstrong,"July 1, 2010",Craig Berube,"November 19, 2018",29.56,30.5,31.67,32.14,32.75,"Nikita Alexandrov, Nathan Walker, Justin Faulk, Torey Krug, Colton Parayko, Nick Leddy, Marco Scandella, Robert Bortuzzo, Jordan Binnington, Calle Rosen, Robert Thomas, Kasperi Kapanen, Jordan Kyrou, Brayden Schenn, Pavel Buchnevich, Brandon Saad","Justin Faulk, Torey Krug, Colton Parayko, Nick Leddy, Jordan Binnington, Robert Thomas, Jordan Kyrou, Brayden Schenn, Pavel Buchnevich, Brandon Saad","Justin Faulk, Torey Krug, Colton Parayko, Nick Leddy, Jordan Binnington, Robert Thomas, Jordan Kyrou, Brayden Schenn, Brandon Saad","Justin Faulk, Torey Krug, Colton Parayko, Jordan Binnington, Robert Thomas, Jordan Kyrou, Brayden Schenn","Colton Parayko, Robert Thomas, Jordan Kyrou, Brayden Schenn",5.0
Tampa Bay Lightning,TBL,TBL.png,20222023,78,37,east,atlantic,top3,0.547,+14.96,0.915,0.1,+26,+39,-31,89561599,-7061599.0,7,6,10,10,8,4,#3568f2,#052ca3,#3568f2,#3568f2,#3568f2,#052ca3,0.0,0.0,14,73212500.0,9,60600000,7,51600000,7,51600000,6.0,42100000.0,-7061599.0,Julien BriseBois,"September 11, 2018",Jon Cooper,"March 25, 2013",28.79,28.67,29.29,30.29,31.83,"Nikita Kucherov, Steven Stamkos, Anthony Cirelli, Nicholas Paul, Brandon Hagel, Patrick Maroon, Brayden Point, Mikhail Sergachev, Victor Hedman, Haydn Fleury, Nick Perbix, Zach Bogosian, Erik Cernak, Andrei Vasilevskiy","Nikita Kucherov, Anthony Cirelli, Nicholas Paul, Brayden Point, Mikhail Sergachev, Victor Hedman, Nick Perbix, Erik Cernak, Andrei Vasilevskiy","Nikita Kucherov, Anthony Cirelli, Nicholas Paul, Brayden Point, Mikhail Sergachev, Erik Cernak, Andrei Vasilevskiy","Nikita Kucherov, Anthony Cirelli, Nicholas Paul, Brayden Point, Mikhail Sergachev, Erik Cernak, Andrei Vasilevskiy","Anthony Cirelli, Nicholas Paul, Brayden Point, Mikhail Sergachev, Erik Cernak, Andrei Vasilevskiy",32.0
Toronto Maple Leafs,TOR,TOR.png,20222023,82,37,east,atlantic,top3,0.577,+29.01,0.919,0.098,+40,+41,-24,89257866,-6757866.0,3,4,5,3,6,5,#052ca3,#052ca3,#052ca3,#052ca3,#052ca3,#052ca3,0.0,0.0,13,62955616.0,6,34603000,2,9600000,1,7500000,1.0,7500000.0,-6757866.0,Kyle Dubas,"May 11, 2018",Sheldon Keefe,"November 20, 2019",28.92,30.17,32.5,32.0,34.0,"TJ Brodie, John Tavares, Mitchell Marner, William Nylander, Calle Jarnkrok, Sam Lafferty, Morgan Rielly, Jake McCabe, Timothy Liljegren, Rasmus Sandin, Conor Timmins, Mark Giordano, Auston Matthews","John Tavares, Mitchell Marner, Calle Jarnkrok, Morgan Rielly, Jake McCabe, Conor Timmins","Calle Jarnkrok, Morgan Rielly",Morgan Rielly,Morgan Rielly,31.0
Vancouver Canucks,VAN,VAN.png,20222023,51,23,west,pacific,none,0.46,-15.91,0.891,0.096,-24,+34,-43,88553664,-6053664.0,24,10,17,25,23,7,red,#3568f2,#fc4d47,red,#fc4d47,#3568f2,0.0,0.0,16,57581528.0,6,33786667,3,20800000,2,15850000,1.0,8000000.0,-6053664.0,Patrik Allvin,"January 26, 2022",Rick Tocchet,"January 22, 2023",26.0,27.17,29.0,30.0,35.0,"Tyler Myers, Dakota Joshua, Arturs Silovs, Riley Stillman, Quinn Hughes, Sheldon Dries, Jack Studnicka, Aatu Raty, Nils Åman, Vasily Podkolzin, Andrei Kuzmenko, Anthony Beauvillier, Conor Garland, J.T. Miller, Brock Boeser, Elias Pettersson","Quinn Hughes, Aatu Raty, Andrei Kuzmenko, Conor Garland, J.T. Miller, Brock Boeser","Quinn Hughes, Conor Garland, J.T. Miller","Quinn Hughes, J.T. Miller",J.T. Miller,12.0
Vegas Golden Knights,VGK,VGK.png,20222023,76,35,west,pacific,top3,0.52,+19.99,0.912,0.089,+11,+29,-19,95136279,-12636279.0,12,14,1,7,11,12,#3568f2,black,#052ca3,#3568f2,#3568f2,#3568f2,0.0,0.0,17,63981650.0,11,47969150,6,31225000,4,20450000,1.0,2750000.0,-12636279.0,Kelly McCrimmon,"September 1, 2019",Bruce Cassidy,"June 14, 2022",29.29,29.55,30.33,32.75,32.0,"William Carrier, Keegan Kolesar, William Karlsson, Jack Eichel, Ben Hutton, Nicolas Hague, Zach Whitecloud, Brayden McNabb, Shea Theodore, Alec Martinez, Alex Pietrangelo, Paul Cotter, Michael Amadio, Jonathan Marchessault, Reilly Smith, Nicolas Roy, Chandler Stephenson","Keegan Kolesar, William Karlsson, Jack Eichel, Nicolas Hague, Zach Whitecloud, Brayden McNabb, Shea Theodore, Alex Pietrangelo, Paul Cotter, Reilly Smith, Nicolas Roy","William Karlsson, Jack Eichel, Zach Whitecloud, Alex Pietrangelo, Paul Cotter, Nicolas Roy","William Karlsson, Zach Whitecloud, Alex Pietrangelo, Nicolas Roy",Zach Whitecloud,20.0
