Philadelphia Flyers,PHI,20222023,77.0,32.0,east,metro,none,0.469,-23.1,0.907,0.084,-23.0,+25.0,-45.0,80719595,2780405,21,22,13,26,11,15,#fc4d47,#fc4d47,black,red,#3568f2,black,0.0,0.0,23,0.0,14,47041666,7,26103333,3,19000000,3.0,19000000.0,2.0,14000000.0,2780405.0,PHI.png,John Tortorella,"June 17, 2022",Daniel Briere,"March 10, 2023",27.3,28.21,29.43,30.67,32.67,34.5,"Garnet Hathaway, Felix Sandstrom, Samuel Ersson, Carter Hart, Nick Seeler, Emil Andrae, Marc Staal, Cam York, Sean Walker, Travis Sanheim, Bobby Brink, Ryan Poehling, Owen Tippett, Nicolas Deslauriers, Morgan Frost, Noah Cates, Scott Laughton, Joel Farabee, Travis Konecny, Cam Atkinson, Sean Couturier, Tyson Foerster, Yegor Zamula","Garnet Hathaway, Samuel Ersson, Emil Andrae, Cam York, Travis Sanheim, Nicolas Deslauriers, Morgan Frost, Noah Cates, Scott Laughton, Joel Farabee, Travis Konecny, Cam Atkinson, Sean Couturier, Tyson Foerster","Samuel Ersson, Emil Andrae, Travis Sanheim, Nicolas Deslauriers, Scott Laughton, Joel Farabee, Sean Couturier","Travis Sanheim, Joel Farabee, Sean Couturier","Travis Sanheim, Joel Farabee, Sean Couturier",5.0
Pittsburgh Penguins,PIT,20222023,91.0,40.0,east,metro,none,0.495,+27.01,0.911,0.082,-4.0,+47.0,-46.0,82554342,945658,17,9,14,7,8,16,#fc4d47,#3568f2,black,#3568f2,#3568f2,black,0.0,0.0,22,0.0,15,66975175,8,44200000,6,36100000,5.0,26100000.0,1.0,4500000.0,945658.0,PIT.png,Mike Sullivan,"December 12, 2015",Kyle Dubas,"August 3, 2023",31.18,32.73,34.75,35.0,36.6,34.0,"Jake Guentzel, Bryan Rust, Rickard Rakell, Lars Eller, Jeff Carter, Evgeni Malkin, Noel Acciari, Drew O'Connor, Reilly Smith, Sidney Crosby, Matt Nieto, Jansen Harkins, Pierre-Olivier Joseph, Kris Letang, Alex Nedeljkovic, Tristan Jarry, Ryan Shea, John Ludvig, Chad Ruhwedel, Marcus Pettersson, Ryan Graves, Erik Karlsson","Bryan Rust, Rickard Rakell, Lars Eller, Evgeni Malkin, Noel Acciari, Drew O'Connor, Reilly Smith, Sidney Crosby, Matt Nieto, Kris Letang, Tristan Jarry, John Ludvig, Marcus Pettersson, Ryan Graves, Erik Karlsson","Bryan Rust, Rickard Rakell, Evgeni Malkin, Noel Acciari, Kris Letang, Tristan Jarry, Ryan Graves, Erik Karlsson","Bryan Rust, Rickard Rakell, Kris Letang, Tristan Jarry, Ryan Graves, Erik Karlsson","Bryan Rust, Rickard Rakell, Kris Letang, Tristan Jarry, Ryan Graves",28.0
San Jose Sharks,SJS,20222023,60.0,22.0,west,pacific,none,0.426,-10.2,0.884,0.092,-63.0,+25.0,-37.0,80283334,3216666,26,22,8,21,18,10,red,#fc4d47,#3568f2,#fc4d47,#fc4d47,#3568f2,0.0,0.0,22,0.0,12,32200833,6,21600833,1,8137500,1.0,8137500.0,1.0,8137500.0,3216666.0,SJS.png,David Quinn,"July 21, 2022",Mike Grier,"July 5, 2022",27.68,29.42,31.0,33.0,35.0,35.0,"William Eklund, Givani Smith, Marc-Edouard Vlasic, Mario Ferraro, Jan Rutta, Matthew Benning, Nikolai Knyzhov, Thomas Bordeleau, Kyle Burroughs, Ty Emberson, Kaapo Kahkonen, Mackenzie Blackwood, Henry Thrun, Filip Zadina, Nico Sturm, Tomas Hertl, Kevin Labanc, Mike Hoffman, Anthony Duclair, Luke Kunin, Alexander Barabanov, Fabian Zetterlund","William Eklund, Givani Smith, Marc-Edouard Vlasic, Mario Ferraro, Jan Rutta, Matthew Benning, Nikolai Knyzhov, Kyle Burroughs, Mackenzie Blackwood, Nico Sturm, Tomas Hertl, Fabian Zetterlund","William Eklund, Marc-Edouard Vlasic, Mario Ferraro, Matthew Benning, Kyle Burroughs, Tomas Hertl",Tomas Hertl,Tomas Hertl,7.0
St. Louis Blues,STL,20222023,81.0,37.0,west,central,none,0.476,-47.97,0.9,0.103,-20.0,+32.0,-52.0,83218929,281071,20,19,18,29,14,3,#fc4d47,#fc4d47,#fc4d47,red,black,#052ca3,0.0,0.0,23,0.0,15,69782262,10,60321429,7,48250000,4.0,29250000.0,3.0,22750000.0,281071.0,STL.png,Craig Berube,"November 19, 2018",Doug Armstrong,"July 1, 2010",28.87,29.73,32.7,33.14,33.75,32.33,"Joel Hofer, Jordan Binnington, Scott Perunovich, Tyler Tucker, Robert Bortuzzo, Nick Leddy, Jordan Kyrou, Marco Scandella, Robert Thomas, Brayden Schenn, Brandon Saad, Kevin Hayes, Kasperi Kapanen, Jakub Vrana, Pavel Buchnevich, Samuel Blais, Jake Neighbours, Nikita Alexandrov, Oskar Sundqvist, Justin Faulk, Colton Parayko, Alexey Toropchenko, Torey Krug","Joel Hofer, Jordan Binnington, Tyler Tucker, Nick Leddy, Jordan Kyrou, Robert Thomas, Brayden Schenn, Brandon Saad, Kevin Hayes, Pavel Buchnevich, Jake Neighbours, Justin Faulk, Colton Parayko, Alexey Toropchenko, Torey Krug","Jordan Binnington, Nick Leddy, Jordan Kyrou, Robert Thomas, Brayden Schenn, Brandon Saad, Kevin Hayes, Justin Faulk, Colton Parayko, Torey Krug","Jordan Binnington, Jordan Kyrou, Robert Thomas, Brayden Schenn, Justin Faulk, Colton Parayko, Torey Krug","Jordan Kyrou, Robert Thomas, Brayden Schenn, Colton Parayko",9.0
Tampa Bay Lightning,TBL,20222023,98.0,46.0,east,atlantic,top3,0.523,+13.84,0.912,0.095,+17.0,+56.0,-42.0,90448333,-6948333,12,3,11,15,7,8,#3568f2,#052ca3,#3568f2,black,#3568f2,#3568f2,0.0,0.0,23,0.0,16,66390000,9,51575000,7,48600000,6.0,39100000.0,6.0,39100000.0,-6948333.0,TBL.png,Jon Cooper,"March 25, 2013",Julien BriseBois,"September 11, 2018",29.39,29.88,30.22,30.71,32.17,32.17,"Nicholas Paul, Brandon Hagel, Conor Sheary, Tanner Jeannot, Jonas Johansson, Anthony Cirelli, Steven Stamkos, Brayden Point, Matt Tomkins, Mikhail Sergachev, Haydn Fleury, Darren Raddysh, Michael Eyssimont, Luke Glendening, Austin Watson, Alex Barre-Boulet, Victor Hedman, Erik Cernak, Nick Perbix, Zach Bogosian, Calvin De Haan, Waltteri Merela, Nikita Kucherov","Nicholas Paul, Brandon Hagel, Conor Sheary, Tanner Jeannot, Jonas Johansson, Anthony Cirelli, Brayden Point, Matt Tomkins, Mikhail Sergachev, Darren Raddysh, Michael Eyssimont, Luke Glendening, Victor Hedman, Erik Cernak, Nick Perbix, Nikita Kucherov","Nicholas Paul, Brandon Hagel, Conor Sheary, Anthony Cirelli, Brayden Point, Mikhail Sergachev, Darren Raddysh, Erik Cernak, Nikita Kucherov","Nicholas Paul, Brandon Hagel, Anthony Cirelli, Brayden Point, Mikhail Sergachev, Erik Cernak, Nikita Kucherov","Nicholas Paul, Brandon Hagel, Anthony Cirelli, Brayden Point, Mikhail Sergachev, Erik Cernak",32.0
Toronto Maple Leafs,TOR,20222023,111.0,50.0,east,atlantic,top3,0.565,+31.7,0.919,0.096,+46.0,+53.0,-33.0,96756450,-13256450,4,5,6,5,4,7,#052ca3,#052ca3,#052ca3,#052ca3,#052ca3,#3568f2,0.0,0.0,20,0.0,11,53040500,6,27445833,3,23150000,2.0,20750000.0,1.0,7500000.0,-13256450.0,TOR.png,Sheldon Keefe,"November 20, 2019",Brad Treliving,"May 31, 2023",29.3,29.64,31.33,31.67,33.5,35.0,"Auston Matthews, John Tavares, Mitchell Marner, William Nylander, Tyler Bertuzzi, Max Domi, David Kampf, Calle Jarnkrok, Ryan Reaves, Matthew Knies, Fraser Minten, Noah Gregor, Morgan Rielly, TJ Brodie, John Klingberg, Jake McCabe, Timothy Liljegren, Mark Giordano, Ilya Samsonov, Joseph Woll","Auston Matthews, John Tavares, Mitchell Marner, David Kampf, Calle Jarnkrok, Ryan Reaves, Matthew Knies, Fraser Minten, Morgan Rielly, Jake McCabe, Joseph Woll","Auston Matthews, David Kampf, Calle Jarnkrok, Ryan Reaves, Fraser Minten, Morgan Rielly","Auston Matthews, David Kampf, Morgan Rielly","Auston Matthews, Morgan Rielly",30.0
Vancouver Canucks,VAN,20222023,83.0,38.0,west,pacific,none,0.47,-19.23,0.898,0.096,-23.0,+45.0,-47.0,85542917,-2042917,21,11,15,25,15,7,#fc4d47,#3568f2,black,red,black,#3568f2,0.0,0.0,22,0.0,13,47012500,5,29050000,2,15850000,1.0,8000000.0,1.0,8000000.0,-2042917.0,VAN.png,Rick Tocchet,"January 22, 2023",Patrik Allvin,"January 26, 2022",28.41,28.54,30.4,31.0,36.0,36.0,"Guillaume Brisebois, Noah Juulsen, Thatcher Demko, Casey DeSmith, Akito Hirose, Ian Cole, Filip Hronek, J.T. Miller, Elias Pettersson, Brock Boeser, Andrei Kuzmenko, Conor Garland, Anthony Beauvillier, Teddy Blueger, Pius Suter, Sam Lafferty, Nils Hoglander, Dakota Joshua, Phillip Di Giuseppe, Quinn Hughes, Tyler Myers, Carson Soucy","Guillaume Brisebois, Noah Juulsen, Thatcher Demko, Akito Hirose, J.T. Miller, Brock Boeser, Andrei Kuzmenko, Conor Garland, Pius Suter, Nils Hoglander, Phillip Di Giuseppe, Quinn Hughes, Carson Soucy","Thatcher Demko, J.T. Miller, Conor Garland, Quinn Hughes, Carson Soucy","J.T. Miller, Quinn Hughes",J.T. Miller,21.0
Vegas Golden Knights,VGK,20222023,111.0,51.0,west,pacific,top3,0.537,+16.7,0.918,0.095,+28.0,+37.0,-28.0,87648317,-4148317,10,16,3,11,5,8,#3568f2,black,#052ca3,#3568f2,#052ca3,#3568f2,0.0,0.0,22,0.0,15,61927484,7,42975000,5,32200000,1.0,5000000.0,0.0,0.0,-4148317.0,VGK.png,Bruce Cassidy,"June 14, 2022",Kelly McCrimmon,"September 1, 2019",28.14,29.13,31.0,33.4,33.0,,"Logan Thompson, Adin Hill, Brayden Pachal, Kaedan Korczak, Ben Hutton, Nicolas Hague, Brayden McNabb, Shea Theodore, Alex Pietrangelo, Paul Cotter, Michael Amadio, Mark Stone, William Karlsson, Jonathan Marchessault, Ivan Barbashev, Nicolas Roy, Chandler Stephenson, William Carrier, Keegan Kolesar, Pavel Dorofeyev, Jack Eichel, Jonas Rondbjerg","Logan Thompson, Adin Hill, Brayden Pachal, Nicolas Hague, Brayden McNabb, Shea Theodore, Alex Pietrangelo, Paul Cotter, Mark Stone, William Karlsson, Ivan Barbashev, Nicolas Roy, Keegan Kolesar, Jack Eichel, Jonas Rondbjerg","Alex Pietrangelo, Paul Cotter, Mark Stone, William Karlsson, Ivan Barbashev, Nicolas Roy, Jack Eichel","Alex Pietrangelo, Mark Stone, William Karlsson, Ivan Barbashev, Nicolas Roy",Ivan Barbashev,16.5
Washington Capitals,WSH,20222023,80.0,35.0,east,metro,none,0.474,-7.99,0.9,0.09,-20.0,+39.0,-35.0,84200834,-700834,20,15,7,20,14,11,#fc4d47,black,#3568f2,#fc4d47,black,#3568f2,0.0,0.0,21,0.0,15,71850000,9,45875000,3,16750000,2.0,11500000.0,1.0,6500000.0,-700834.0,WSH.png,Spencer Carbery,"May 30, 2023",Brian MacLellan,"May 26, 2014",30.1,32.8,33.56,33.33,33.5,35.0,"Trevor van Riemsdyk, Charlie Lindgren, Darcy Kuemper, Lucas Johansen, Alexander Alexeyev, Rasmus Sandin, Martin Fehervary, Nick Jensen, Sonny Milano, Beck Malenstyn, Matthew Phillips, Connor McMichael, Nic Dowd, Dylan Strome, Tom Wilson, Anthony Mantha, T.J. Oshie, Evgeny Kuznetsov, John Carlson, Alex Ovechkin, Nicklas Backstrom","Trevor van Riemsdyk, Charlie Lindgren, Darcy Kuemper, Alexander Alexeyev, Martin Fehervary, Nick Jensen, Sonny Milano, Nic Dowd, Dylan Strome, Tom Wilson, T.J. Oshie, Evgeny Kuznetsov, John Carlson, Alex Ovechkin, Nicklas Backstrom","Trevor van Riemsdyk, Darcy Kuemper, Martin Fehervary, Nick Jensen, Sonny Milano, Dylan Strome, Tom Wilson, John Carlson, Alex Ovechkin","Darcy Kuemper, Dylan Strome, Tom Wilson","Dylan Strome, Tom Wilson",8.0
Winnipeg Jets,WPG,20222023,95.0,46.0,west,central,none,0.5,+7.99,0.914,0.087,0.0,+41.0,-32.0,80957857,2542143,16,13,5,16,6,12,black,black,#052ca3,black,#052ca3,#3568f2,0.0,0.0,23,0.0,15,66822024,5,33642857,3,23250000,3.0,23250000.0,2.0,17000000.0,2542143.0,WPG.png,Rick Bowness,"July 3, 2022",Kevin Cheveldayoff,"June 8, 2011",28.26,29.47,31.8,33.33,35.33,36.0,"Dylan DeMelo, Connor Hellebuyck, Kyle Connor, Mark Scheifele, Nikolaj Ehlers, Alex Iafallo, Nino Niederreiter, Adam Lowry, Mason Appleton, Vladislav Namestnikov, Morgan Barron, Laurent Brossoit, Rasmus Kupari, David Gustafsson, Joshua Morrissey, Nate Schmidt, Neal Pionk, Brenden Dillon, Dylan Samberg, Logan Stanley, Declan Chisholm, Cole Perfetti, Gabriel Vilardi","Connor Hellebuyck, Kyle Connor, Mark Scheifele, Nikolaj Ehlers, Alex Iafallo, Adam Lowry, Mason Appleton, Vladislav Namestnikov, Morgan Barron, Rasmus Kupari, Joshua Morrissey, Nate Schmidt, Neal Pionk, Dylan Samberg, Gabriel Vilardi","Connor Hellebuyck, Kyle Connor, Mark Scheifele, Adam Lowry, Joshua Morrissey","Connor Hellebuyck, Mark Scheifele, Joshua Morrissey","Connor Hellebuyck, Mark Scheifele, Joshua Morrissey",16.5
Seattle Kraken,SEA,20222023,100.0,46.0,west,pacific,none,0.56,+14.28,0.901,0.109,+48.0,+35.0,-45.0,82556576,943424,3,17,13,14,13,1,#052ca3,#fc4d47,black,black,black,#052ca3,0.0,0.0,22,0.0,14,59825833,7,39250000,4,23750000,0.0,0.0,0.0,0.0,943424.0,SEA.png,Dave Hakstol,"June 24, 2021",Ron Francis,"July 18, 2019",29.73,30.57,31.71,32.0,,,"Joey Daccord, Philipp Grubauer, Jaycob Megna, William Borgen, Justin Schultz, Brian Dumoulin, Adam Larsson, Jamie Oleksiak, Vince Dunn, Pierre-Edouard Bellemare, Tye Kartye, Eeli Tolvanen, Kailer Yamamoto, Brandon Tanev, Alexander Wennberg, Jared McCann, Yanni Gourde, Oliver Bjorkstrand, Jaden Schwartz, Jordan Eberle, Andre Burakovsky, Matthew Beniers","Joey Daccord, Philipp Grubauer, William Borgen, Brian Dumoulin, Adam Larsson, Jamie Oleksiak, Vince Dunn, Tye Kartye, Brandon Tanev, Jared McCann, Yanni Gourde, Oliver Bjorkstrand, Jaden Schwartz, Andre Burakovsky","Philipp Grubauer, Jamie Oleksiak, Vince Dunn, Jared McCann, Oliver Bjorkstrand, Jaden Schwartz, Andre Burakovsky","Philipp Grubauer, Vince Dunn, Jared McCann, Andre Burakovsky",,11.0
