full,team,logo,season,PTS,W,Conference,Division,playoffs,gf%,xg_dif,sv%,shooting%,g_dif,PP_g_dif,PK_g_dif,projected_cap_hit,projected_cap_space,5on5_rank,PP_rank,PK_rank,XG_dif_rank,Save%_rank,Shooting%_rank,5on5_color,PP_color,PK_color,xg_color,sv_color,sh_color,expiring_contracts,expiring_salary,nhl_contracts_2324,2023-24 Salary,nhl_contracts_2425,2024-25 Salary,nhl_contracts_2526,2025-26 Salary,nhl_contracts_2627,2026-27 Salary,nhl_contracts_2728,2027-28 Salary,cap_remaining,GM,gm_start,coach,coach_start,avg_age_2324,avg_age_2425,avg_age_2526,avg_age_2627,avg_age_2728,players_under_contract_2324,players_under_contract_2425,players_under_contract_2526,players_under_contract_2627,players_under_contract_2728,draft_capital_rank
Anaheim Ducks,ANA,ANA.png,20222023,58,23,west,pacific,none,0.399,-148.79,0.908,0.086,-160,+56,-148,53626667,29873333.0,28,21,21,32,10,13,red,#fc4d47,#fc4d47,red,#3568f2,black,4.0,4122500.0,8,35444167.0,5,28150000,3,17650000,0.0,0.0,0.0,0.0,25750833.0,Pat Verbeek,"February 3, 2022",Greg Cronin,"June 5, 2023",29.5,31.25,34.2,34.67,,"John Gibson, Adam Henrique, Jakob Silfverberg, Ryan Strome, Frank Vatrano, Brock McGinn, Isac Lundestrom, Max Jones, Mason McTavish, Brett Leason, Cam Fowler, Radko Gudas, Robert Hagg, Colton White, Sam Carrick, Alex Killorn","John Gibson, Ryan Strome, Frank Vatrano, Brock McGinn, Mason McTavish, Cam Fowler, Radko Gudas, Alex Killorn","John Gibson, Ryan Strome, Cam Fowler, Radko Gudas, Alex Killorn","John Gibson, Ryan Strome, Alex Killorn",,6.0
Arizona Coyotes,ARI,ARI.png,20222023,70,28,west,central,none,0.464,-87.81,0.909,0.099,-52,+74,-148,67163811,16336189.0,23,16,21,27,9,4,#fc4d47,black,#fc4d47,red,#3568f2,#052ca3,2.0,1737083.0,8,28350000.0,4,19250000,2,11450000,1.0,7150000.0,0.0,0.0,14599106.0,Bill Armstrong,"September 17, 2020",Andre Tourigny,"July 1, 2021",27.76,28.88,28.75,29.0,30.0,"Liam O'Brien, Travis Boyd, Barrett Hayton, Nick Bjugstad, Jason Zucker, Nick Schmaltz, Lawson Crouse, Michael Carcone, Alexander Kerfoot, Josh Brown, Troy Stecher, Juuso Valimaki, J.J. Moser, Karel Vejmelka, Connor Ingram, Clayton Keller, Sean Durzi","Nick Bjugstad, Nick Schmaltz, Lawson Crouse, Michael Carcone, Alexander Kerfoot, Karel Vejmelka, Connor Ingram, Clayton Keller","Nick Schmaltz, Lawson Crouse, Connor Ingram, Clayton Keller","Lawson Crouse, Clayton Keller",Clayton Keller,2.0
Boston Bruins,BOS,BOS.png,20222023,135,65,east,atlantic,top3,0.637,+58.12,0.936,0.104,+188,+96,-52,77295834,6204166.0,1,8,1,6,1,2,#052ca3,#3568f2,#052ca3,#052ca3,#052ca3,#052ca3,2.0,1975000.0,10,55275000.0,6,41350000,5,36100000,3.0,27250000.0,3.0,27250000.0,4229166.0,Don Sweeney,"May 20, 2015",Jim Montgomery,"July 1, 2022",30.05,30.3,30.33,30.6,33.0,"Hampus Lindholm, Jayson Megna, Brandon Carlo, Derek Forbort, Jakub Zboril, Kevin Shattenkirk, Linus Ullmark, Matt Grzelcyk, Ian Mitchell, David Pastrnak, Charlie McAvoy, Patrick Brown, James van Riemsdyk, Milan Lucic, Morgan Geekie, A.J. Greer, Pavel Zacha, Charlie Coyle, Brad Marchand, Jake DeBrusk","Hampus Lindholm, Brandon Carlo, Linus Ullmark, David Pastrnak, Charlie McAvoy, Patrick Brown, Morgan Geekie, Pavel Zacha, Charlie Coyle, Brad Marchand","Hampus Lindholm, Brandon Carlo, David Pastrnak, Charlie McAvoy, Pavel Zacha, Charlie Coyle","Hampus Lindholm, Brandon Carlo, David Pastrnak, Charlie McAvoy, Pavel Zacha","Hampus Lindholm, David Pastrnak, Charlie McAvoy",31.0
Buffalo Sabres,BUF,BUF.png,20222023,91,42,east,atlantic,none,0.485,-23.57,0.897,0.099,-26,+100,-98,76786070,6713930.0,19,7,17,22,16,4,#fc4d47,#3568f2,#fc4d47,#fc4d47,black,#052ca3,0.0,0.0,9,40392737.0,6,35611904,4,27528571,3.0,18528571.0,3.0,18528571.0,6713930.0,Kevyn Adams,"June 16, 2020",Don Granato,"March 17, 2021",26.87,26.89,29.0,29.25,29.33,"Henri Jokiharju, Zemgus Girgensons, Tage Thompson, Tyson Jost, Riley Stillman, Owen Power, Jacob Bryson, Ilya Lyubushkin, Casey Mittelstadt, Erik Johnson, Mattias Samuelsson, Rasmus Dahlin, JJ Peterka, Peyton Krebs, Victor Olofsson, Jeff Skinner, Connor Clifton, Eric Comrie, Devon Levi, Alex Tuch, Dylan Cozens, Jordan Greenway, Kyle Okposo","Tage Thompson, Mattias Samuelsson, JJ Peterka, Jeff Skinner, Connor Clifton, Devon Levi, Alex Tuch, Dylan Cozens, Jordan Greenway","Tage Thompson, Mattias Samuelsson, Jeff Skinner, Connor Clifton, Alex Tuch, Dylan Cozens","Tage Thompson, Mattias Samuelsson, Jeff Skinner, Dylan Cozens","Tage Thompson, Mattias Samuelsson, Dylan Cozens",13.0
Calgary Flames,CGY,CGY.png,20222023,93,38,west,pacific,none,0.52,+70.84,0.897,0.084,+30,+86,-66,81100000,2400000.0,14,12,6,3,16,15,black,#3568f2,#052ca3,#052ca3,black,black,0.0,0.0,9,50300000.0,6,39200000,4,28650000,3.0,23750000.0,3.0,23750000.0,2400000.0,Craig Conroy,"May 23, 2023",Ryan Huska,"June 12, 2023",29.44,30.67,33.17,34.5,36.33,"Jacob Markstrom, Nikita Zadorov, Dennis Gilbert, Daniel Vladar, Jonathan Huberdeau, Noah Hanifin, Mikael Backlund, Nazem Kadri, Blake Coleman, Yegor Sharangovich, Dillon Dube, Adam Ruzicka, MacKenzie Weegar, Elias Lindholm, Rasmus Andersson, Chris Tanev, Andrew Mangiapane, Jordan Oesterle","Jacob Markstrom, Daniel Vladar, Jonathan Huberdeau, Nazem Kadri, Blake Coleman, Yegor Sharangovich, MacKenzie Weegar, Rasmus Andersson, Andrew Mangiapane","Jacob Markstrom, Jonathan Huberdeau, Nazem Kadri, Blake Coleman, MacKenzie Weegar, Rasmus Andersson","Jonathan Huberdeau, Nazem Kadri, Blake Coleman, MacKenzie Weegar","Jonathan Huberdeau, Nazem Kadri, MacKenzie Weegar",17.0
Carolina Hurricanes,CAR,CAR.png,20222023,113,52,east,metro,top3,0.55,+126.52,0.908,0.082,+68,+78,-52,80979417,2520583.0,7,15,1,1,10,16,#3568f2,black,#052ca3,#052ca3,#3568f2,black,0.0,0.0,9,38350000.0,4,14220000,3,9720000,1.0,4820000.0,1.0,4820000.0,2520583.0,Don Waddell,"May 8, 2018",Rod Brind'Amour,"May 8, 2018",29.23,32.0,30.0,31.0,29.0,"Brett Pesce, Brady Skjei, Antti Raanta, Brent Burns, Jaccob Slavin, Jack Drury, Martin Necas, Sebastian Aho, Dmitry Orlov, Teuvo Teravainen, Jesper Fast, Dylan Coghlan, Stefan Noesen, Jalen Chatfield, Jordan Martinook, Jordan Staal, Frederik Andersen, Michael Bunting, Jesperi Kotkaniemi, Brendan Lemieux, Seth Jarvis, Pyotr Kochetkov","Brent Burns, Jaccob Slavin, Dmitry Orlov, Jesper Fast, Jordan Staal, Frederik Andersen, Michael Bunting, Jesperi Kotkaniemi, Pyotr Kochetkov","Jordan Staal, Michael Bunting, Jesperi Kotkaniemi, Pyotr Kochetkov","Jordan Staal, Jesperi Kotkaniemi, Pyotr Kochetkov",Jesperi Kotkaniemi,11.0
Chicago Blackhawks,CHI,CHI.png,20222023,59,26,west,central,none,0.393,-114.84,0.9,0.084,-162,+50,-90,65534290,17965710.0,29,22,13,31,14,15,red,#fc4d47,black,red,black,black,1.0,750000.0,6,27112500.0,2,13900000,1,9500000,1.0,9500000.0,1.0,9500000.0,17215710.0,Kyle Davidson,"October 26, 2021",Luke Richardson,"June 27, 2022",29.68,29.83,32.0,32.0,34.0,"Ryan Donato, Cole Guttman, Reese Johnson, Seth Jones, Connor Murphy, Jarred Tinordi, Arvid Soderblom, MacKenzie Entwistle, Taylor Raddysh, Boris Katchouk, Nikita Zaitsev, Petr Mrazek, Andreas Athanasiou, Taylor Hall, Corey Perry, Tyler Johnson, Colin Blackwell, Jason Dickinson, Nick Foligno","Ryan Donato, Seth Jones, Connor Murphy, Arvid Soderblom, Andreas Athanasiou, Taylor Hall","Seth Jones, Connor Murphy",Seth Jones,Seth Jones,1.0
Colorado Avalanche,COL,COL.png,20222023,109,51,west,central,top3,0.543,+31.25,0.922,0.087,+60,+104,-86,83700000,-200000.0,9,6,12,13,2,12,#3568f2,#052ca3,#3568f2,black,#052ca3,#3568f2,1.0,1125000.0,12,65775000.0,7,44225000,6,39725000,3.0,21225000.0,3.0,21225000.0,-1325000.0,Chris MacFarland,"July 11, 2022",Jared Bednar,"August 25, 2016",29.37,28.75,30.14,30.5,33.33,"Jonathan Drouin, Kurtis MacDermid, Jack Johnson, Cale Makar, Andrew Cogliano, Fredrik Olofsson, Logan O'Connor, Pavel Francouz, Ryan Johansen, Artturi Lehkonen, Valeri Nichushkin, Mikko Rantanen, Bowen Byram, Miles Wood, Alexandar Georgiev, Samuel Girard, Josh Manson, Nathan MacKinnon, Devon Toews","Cale Makar, Logan O'Connor, Ryan Johansen, Artturi Lehkonen, Valeri Nichushkin, Mikko Rantanen, Bowen Byram, Miles Wood, Alexandar Georgiev, Samuel Girard, Josh Manson, Nathan MacKinnon","Cale Makar, Artturi Lehkonen, Valeri Nichushkin, Miles Wood, Samuel Girard, Josh Manson, Nathan MacKinnon","Cale Makar, Artturi Lehkonen, Valeri Nichushkin, Miles Wood, Samuel Girard, Nathan MacKinnon","Valeri Nichushkin, Miles Wood, Nathan MacKinnon",21.0
Columbus Blue Jackets,CBJ,CBJ.png,20222023,59,25,east,metro,none,0.387,-94.2,0.896,0.081,-184,+60,-96,79545833,3954167.0,30,20,16,28,17,17,red,#fc4d47,black,red,#fc4d47,#fc4d47,1.0,925000.0,12,52575000.0,7,40600000,3,21400000,2.0,16000000.0,2.0,16000000.0,3029167.0,Jarmo Kekalainen,"February 13, 2013",Mike Babcock,"July 1, 2023",26.36,29.08,31.14,32.67,34.5,"Andrew Peeke, Alexandre Texier, Daniil Tarasov, Damon Severson, Ivan Provorov, Kirill Marchenko, Liam Foudy, Yegor Chinakhov, Emil Bemstrom, Nick Blankenburg, Elvis Merzlikins, Patrik Laine, Cole Sillinger, Jack Roslovic, Erik Gudbranson, Eric Robinson, Boone Jenner, Adam Boqvist, Mathieu Olivier, Kent Johnson, Johnny Gaudreau, Sean Kuraly","Andrew Peeke, Daniil Tarasov, Damon Severson, Ivan Provorov, Elvis Merzlikins, Patrik Laine, Erik Gudbranson, Boone Jenner, Adam Boqvist, Mathieu Olivier, Johnny Gaudreau, Sean Kuraly","Andrew Peeke, Damon Severson, Elvis Merzlikins, Patrik Laine, Erik Gudbranson, Boone Jenner, Johnny Gaudreau","Damon Severson, Elvis Merzlikins, Johnny Gaudreau","Damon Severson, Johnny Gaudreau",14.0
Dallas Stars,DAL,DAL.png,20222023,108,47,west,central,top3,0.561,+51.48,0.919,0.099,+88,+116,-58,82917829,582171.0,5,2,4,8,4,4,#052ca3,#052ca3,#052ca3,#3568f2,#052ca3,#052ca3,1.0,863333.0,13,69131667.0,5,39000000,3,26750000,2.0,16900000.0,2.0,16900000.0,-281162.0,Jim Nill,"April 29, 2013",Peter DeBoer,"June 21, 2022",29.73,30.46,29.2,30.67,30.5,"Mason Marchment, Gavin Bayreuther, Scott Wedgewood, Esa Lindell, Roope Hintz, Jason Robertson, Jani Hakanpaa, Radek Faksa, Wyatt Johnston, Miro Heiskanen, Sam Steel, Thomas Harley, Joel Hanley, Evgenii Dadonov, Joe Pavelski, Ryan Suter, Matt Duchene, Nils Lundkvist, Jamie Benn, Tyler Seguin, Craig Smith, Jake Oettinger","Mason Marchment, Esa Lindell, Roope Hintz, Jason Robertson, Radek Faksa, Wyatt Johnston, Miro Heiskanen, Joel Hanley, Evgenii Dadonov, Ryan Suter, Jamie Benn, Tyler Seguin, Jake Oettinger","Mason Marchment, Roope Hintz, Jason Robertson, Miro Heiskanen, Tyler Seguin","Roope Hintz, Miro Heiskanen, Tyler Seguin","Roope Hintz, Miro Heiskanen",27.0
Detroit Red Wings,DET,DET.png,20222023,80,35,east,atlantic,none,0.462,-28.24,0.9,0.095,-56,+80,-90,75337223,8162777.0,25,14,13,23,14,8,red,black,black,#fc4d47,black,#3568f2,1.0,894167.0,11,52600000.0,7,38850000,4,27300000,2.0,13800000.0,1.0,8700000.0,7268610.0,Steve Yzerman,"April 19, 2019",Derek Lalonde,"June 30, 2022",28.3,29.73,31.29,31.0,33.0,"Lucas Raymond, Jonatan Berggren, Shayne Gostisbehere, Ben Chiarot, Robby Fabbri, Gustav Lindstrom, Christian Fischer, Klim Kostin, Jake Walman, Justin Holl, Dylan Larkin, Alex DeBrincat, David Perron, J.T. Compher, Andrew Copp, Daniel Sprong, Moritz Seider, Ville Husso, James Reimer, Olli Maatta","Ben Chiarot, Robby Fabbri, Klim Kostin, Jake Walman, Justin Holl, Dylan Larkin, Alex DeBrincat, J.T. Compher, Andrew Copp, Ville Husso, Olli Maatta","Ben Chiarot, Jake Walman, Justin Holl, Dylan Larkin, Alex DeBrincat, J.T. Compher, Andrew Copp","Dylan Larkin, Alex DeBrincat, J.T. Compher, Andrew Copp","Dylan Larkin, J.T. Compher",7.0
Edmonton Oilers,EDM,EDM.png,20222023,109,50,west,pacific,top3,0.541,+70.34,0.912,0.098,+64,+152,-82,77880000,5620000.0,8,1,10,4,7,5,#3568f2,#052ca3,#3568f2,#052ca3,#3568f2,#052ca3,2.0,1661333.0,13,67275000.0,9,53850000,4,24875000,3.0,19875000.0,2.0,14375000.0,3958667.0,Ken Holland,"May 7, 2019",Jay Woodcroft,"February 10, 2022",29.05,31.23,32.22,34.0,35.67,"Mattias Ekholm, Derek Ryan, Stuart Skinner, Jack Campbell, Philip Broberg, Darnell Nurse, Connor Brown, Ryan Nugent-Hopkins, Dylan Holloway, Brett Kulak, Warren Foegele, Markus Niemelainen, Vincent Desharnais, Connor McDavid, Leon Draisaitl, Zach Hyman, Evander Kane, Lane Pederson, Cody Ceci, Mattias Janmark","Mattias Ekholm, Derek Ryan, Stuart Skinner, Jack Campbell, Darnell Nurse, Ryan Nugent-Hopkins, Brett Kulak, Connor McDavid, Leon Draisaitl, Zach Hyman, Evander Kane, Lane Pederson, Cody Ceci","Mattias Ekholm, Stuart Skinner, Jack Campbell, Darnell Nurse, Ryan Nugent-Hopkins, Brett Kulak, Connor McDavid, Zach Hyman, Evander Kane","Jack Campbell, Darnell Nurse, Ryan Nugent-Hopkins, Zach Hyman","Darnell Nurse, Ryan Nugent-Hopkins, Zach Hyman",28.0
Florida Panthers,FLA,FLA.png,20222023,92,42,east,atlantic,wc,0.533,+45.47,0.908,0.09,+52,+108,-112,82362501,1137499.0,11,4,19,10,10,11,#3568f2,#052ca3,#fc4d47,#3568f2,#3568f2,#3568f2,0.0,0.0,8,51091667.0,5,35000000,3,22500000,2.0,19500000.0,2.0,19500000.0,1137499.0,Bill Zito,"September 2, 2020",Paul Maurice,"June 22, 2022",28.59,29.88,31.4,31.0,32.0,"Oliver Ekman-Larsson, Mike Reilly, Niko Mikkola, Anthony Stolarz, Sam Bennett, Sam Reinhart, Evan Rodrigues, Nick Cousins, Carter Verhaeghe, Aaron Ekblad, Sergei Bobrovsky, Steven Lorentz, Kevin Stenlund, Anton Lundell, Ryan Lomberg, Gustav Forsling, Matthew Tkachuk, Josh Mahura, Brandon Montour, Dmitry Kulikov, Aleksander Barkov, Eetu Luostarinen","Niko Mikkola, Sam Bennett, Evan Rodrigues, Carter Verhaeghe, Aaron Ekblad, Sergei Bobrovsky, Matthew Tkachuk, Aleksander Barkov","Niko Mikkola, Evan Rodrigues, Sergei Bobrovsky, Matthew Tkachuk, Aleksander Barkov","Evan Rodrigues, Matthew Tkachuk, Aleksander Barkov","Matthew Tkachuk, Aleksander Barkov",30.0
Los Angeles Kings,LAK,LAK.png,20222023,104,47,west,pacific,top3,0.522,+49.62,0.902,0.09,+32,+108,-104,84251667,-751667.0,13,4,18,9,12,11,black,#052ca3,#fc4d47,#3568f2,#3568f2,#3568f2,0.0,0.0,11,64438333.0,9,54563333,6,41200000,4.0,24700000.0,3.0,20500000.0,-751667.0,Rob Blake,"April 10, 2017",Todd McLellan,"April 16, 2019",28.59,29.36,30.44,31.67,31.75,"Trevor Lewis, Pheonix Copley, Andreas Englund, Matt Roy, Mikey Anderson, Drew Doughty, Carl Grundstrom, Arthur Kaliyev, Pierre-Luc Dubois, Brandt Clarke, Viktor Arvidsson, Anze Kopitar, Cam Talbot, Kevin Fiala, Phillip Danault, Jaret Anderson-Dolan, Quinton Byfield, Trevor Moore, Vladislav Gavrikov, Blake Lizotte, David Rittich, Adrian Kempe","Andreas Englund, Mikey Anderson, Drew Doughty, Pierre-Luc Dubois, Brandt Clarke, Anze Kopitar, Kevin Fiala, Phillip Danault, Trevor Moore, Vladislav Gavrikov, Adrian Kempe","Mikey Anderson, Drew Doughty, Pierre-Luc Dubois, Brandt Clarke, Anze Kopitar, Kevin Fiala, Phillip Danault, Trevor Moore, Adrian Kempe","Mikey Anderson, Drew Doughty, Pierre-Luc Dubois, Kevin Fiala, Phillip Danault, Trevor Moore","Mikey Anderson, Pierre-Luc Dubois, Kevin Fiala, Trevor Moore",23.0
Minnesota Wild,MIN,MIN.png,20222023,103,46,west,central,top3,0.508,+3.03,0.922,0.085,+10,+92,-58,75218588,8281412.0,15,10,4,17,2,14,black,#3568f2,#052ca3,#fc4d47,#052ca3,black,3.0,2332500.0,9,42575000.0,6,36925000,5,27925000,4.0,20350000.0,2.0,12250000.0,5948912.0,Bill Guerin,"August 21, 2019",Dean Evason,"February 14, 2020",31.25,30.44,30.67,32.0,32.75,"Jonas Brodin, Alex Goligoski, Jon Merrill, Marc-Andre Fleury, Connor Dewar, Marcus Foligno, Frederick Gaudreau, Joel Eriksson Ek, Mats Zuccarello, Matt Boldy, Kirill Kaprizov, Pat Maroon, Marcus Johansson, Jared Spurgeon, Ryan Hartman, Jake Middleton","Jonas Brodin, Jon Merrill, Frederick Gaudreau, Joel Eriksson Ek, Matt Boldy, Kirill Kaprizov, Marcus Johansson, Jared Spurgeon, Jake Middleton","Jonas Brodin, Frederick Gaudreau, Joel Eriksson Ek, Matt Boldy, Kirill Kaprizov, Jared Spurgeon","Jonas Brodin, Frederick Gaudreau, Joel Eriksson Ek, Matt Boldy, Jared Spurgeon","Jonas Brodin, Frederick Gaudreau, Joel Eriksson Ek, Matt Boldy",16.0
Montreal Canadiens,MTL,MTL.png,20222023,68,31,east,atlantic,none,0.442,-113.45,0.897,0.096,-92,+60,-130,87009166,-3509166.0,26,20,20,30,16,7,red,#fc4d47,#fc4d47,red,black,#3568f2,0.0,0.0,16,52855000.0,6,31012500,4,22775000,1.0,7875000.0,1.0,7875000.0,-3509166.0,Kent Hughes,"January 18, 2022",Martin St. Louis,"February 9, 2022",27.71,28.38,29.0,30.25,29.0,"David Savard, Johnathan Kovacevic, Justin Barron, Samuel Montembeault, Jordan Harris, Chris Wideman, Michael Pezzetta, Nick Suzuki, Brendan Gallagher, Josh Anderson, Mike Hoffman, Christian Dvorak, Rafael Harvey-Pinard, Kirby Dach, Joel Armia, Mike Matheson, Kaiden Guhle, Jake Evans, Jake Allen, Rem Pitlick, Alex Newhook","David Savard, Johnathan Kovacevic, Jordan Harris, Michael Pezzetta, Nick Suzuki, Brendan Gallagher, Josh Anderson, Christian Dvorak, Rafael Harvey-Pinard, Kirby Dach, Joel Armia, Mike Matheson, Kaiden Guhle, Jake Evans, Jake Allen, Alex Newhook","Nick Suzuki, Brendan Gallagher, Josh Anderson, Kirby Dach, Mike Matheson, Alex Newhook","Nick Suzuki, Brendan Gallagher, Josh Anderson, Alex Newhook",Nick Suzuki,8.0
Nashville Predators,NSH,NSH.png,20222023,92,42,west,central,none,0.491,-34.67,0.92,0.086,-12,+70,-78,75570865,7929135.0,18,17,9,24,3,13,#fc4d47,#fc4d47,#3568f2,red,#052ca3,black,0.0,0.0,9,38601143.0,6,27916143,2,13559000,1.0,9059000.0,0.0,0.0,7929135.0,Barry Trotz,"July 1, 2023",Andrew Brunette,"May 31, 2023",28.91,32.22,34.17,36.5,39.0,"Mark Jankowski, Ryan O'Reilly, Gustav Nyquist, Roman Josi, Kevin Lankinen, Juuse Saros, Jeremy Lauzon, Alexandre Carrier, Luke Schenn, Tyson Barrie, Ryan McDonagh, Cole Smith, Kiefer Sherwood, Michael McCarron, Colton Sissons, Dante Fabbro, Yakov Trenin, Philip Tomasino, Juuso Parssinen, Denis Gurianov, Tommy Novak, Cody Glass","Ryan O'Reilly, Gustav Nyquist, Roman Josi, Juuse Saros, Jeremy Lauzon, Luke Schenn, Ryan McDonagh, Colton Sissons, Cody Glass","Ryan O'Reilly, Roman Josi, Jeremy Lauzon, Luke Schenn, Ryan McDonagh, Colton Sissons","Ryan O'Reilly, Roman Josi",Roman Josi,3.0
New Jersey Devils,NJD,NJD.png,20222023,112,52,east,metro,top3,0.572,+115.57,0.912,0.095,+112,+66,-58,77892500,5607500.0,2,18,4,2,7,8,#052ca3,#fc4d47,#052ca3,#052ca3,#3568f2,#3568f2,1.0,795000.0,13,64550000.0,9,57875000,8,54725000,5.0,37075000.0,3.0,24675000.0,4812500.0,Tom Fitzgerald,"January 12, 2020",Lindy Ruff,"July 9, 2020",27.58,28.23,29.89,30.25,31.6,"Luke Hughes, Nathan Bastian, Nico Hischier, Jesper Bratt, Jack Hughes, Ondrej Palat, Tyler Toffoli, Akira Schmid, Michael McLeod, Curtis Lazar, Erik Haula, Dougie Hamilton, John Marino, Jonas Siegenthaler, Colin Miller, Brendan Smith, Timo Meier, Vitek Vanecek, Dawson Mercer","Luke Hughes, Nathan Bastian, Nico Hischier, Jesper Bratt, Jack Hughes, Ondrej Palat, Curtis Lazar, Erik Haula, Dougie Hamilton, John Marino, Jonas Siegenthaler, Timo Meier, Vitek Vanecek","Nico Hischier, Jesper Bratt, Jack Hughes, Ondrej Palat, Erik Haula, Dougie Hamilton, John Marino, Jonas Siegenthaler, Timo Meier","Nico Hischier, Jesper Bratt, Jack Hughes, Ondrej Palat, Dougie Hamilton, John Marino, Jonas Siegenthaler, Timo Meier","Jesper Bratt, Jack Hughes, Dougie Hamilton, Jonas Siegenthaler, Timo Meier",24.0
New York Islanders,NYI,NYI.png,20222023,93,42,east,metro,wc,0.539,-7.49,0.92,0.093,+56,+48,-54,83112500,387500.0,10,23,2,18,3,9,#3568f2,#fc4d47,#052ca3,#fc4d47,#052ca3,#3568f2,0.0,0.0,19,78262500.0,12,62650000,9,49550000,7.0,44300000.0,7.0,44300000.0,387500.0,Lou Lamoriello,"June 5, 2018",Lane Lambert,"May 16, 2022",29.65,30.21,32.42,33.0,33.71,"Matt Martin, Cal Clutterbuck, Pierre Engvall, Brock Nelson, Kyle Palmieri, Jean-Gabriel Pageau, Ross Johnston, Scott Mayfield, Julien Gauthier, Anders Lee, Karson Kuhlman, Ryan Pulock, Adam Pelech, Casey Cizikas, Mathew Barzal, Hudson Fasching, Ilya Sorokin, Alexander Romanov, Sebastian Aho, Semyon Varlamov, Samuel Bolduc, Bo Horvat, Noah Dobson","Pierre Engvall, Brock Nelson, Kyle Palmieri, Jean-Gabriel Pageau, Ross Johnston, Scott Mayfield, Julien Gauthier, Anders Lee, Ryan Pulock, Adam Pelech, Casey Cizikas, Mathew Barzal, Hudson Fasching, Ilya Sorokin, Alexander Romanov, Semyon Varlamov, Samuel Bolduc, Bo Horvat, Noah Dobson","Pierre Engvall, Jean-Gabriel Pageau, Ross Johnston, Scott Mayfield, Anders Lee, Ryan Pulock, Adam Pelech, Casey Cizikas, Mathew Barzal, Ilya Sorokin, Semyon Varlamov, Bo Horvat","Pierre Engvall, Scott Mayfield, Ryan Pulock, Adam Pelech, Casey Cizikas, Mathew Barzal, Ilya Sorokin, Semyon Varlamov, Bo Horvat","Pierre Engvall, Scott Mayfield, Ryan Pulock, Adam Pelech, Mathew Barzal, Ilya Sorokin, Bo Horvat",26.0
New York Rangers,NYR,NYR.png,20222023,107,47,east,metro,top3,0.549,-8.12,0.919,0.097,+70,+96,-52,81196583,2303417.0,6,8,1,19,4,6,#052ca3,#3568f2,#052ca3,#fc4d47,#052ca3,#052ca3,1.0,925000.0,13,69748191.0,8,57847024,6,38204167,3.0,23625000.0,3.0,23625000.0,1378417.0,Chris Drury,"May 5, 2021",Peter Laviolette,"June 13, 2023",29.77,30.38,31.75,32.33,34.33,"Jimmy Vesey, Nick Bonino, Blake Wheeler, Barclay Goodrow, Vincent Trocheck, Filip Chytil, Tyler Pitlick, Kaapo Kakko, Mika Zibanejad, Alex Belzile, Adam Fox, K'Andre Miller, Jacob Trouba, Chris Kreider, Jonathan Quick, Artemi Panarin, Ryan Lindgren, Igor Shesterkin, Ben Harpur, Erik Gustafsson, Braden Schneider, Connor Mackey","Jimmy Vesey, Barclay Goodrow, Vincent Trocheck, Filip Chytil, Mika Zibanejad, Alex Belzile, Adam Fox, K'Andre Miller, Jacob Trouba, Chris Kreider, Artemi Panarin, Igor Shesterkin, Ben Harpur","Barclay Goodrow, Vincent Trocheck, Filip Chytil, Mika Zibanejad, Adam Fox, Jacob Trouba, Chris Kreider, Artemi Panarin","Barclay Goodrow, Vincent Trocheck, Filip Chytil, Mika Zibanejad, Adam Fox, Chris Kreider","Vincent Trocheck, Mika Zibanejad, Adam Fox",25.0
Ottawa Senators,OTT,OTT.png,20222023,86,39,east,atlantic,none,0.465,+32.72,0.902,0.08,-50,+116,-90,78467380,5032620.0,22,2,13,12,12,18,#fc4d47,#052ca3,black,#3568f2,#3568f2,#fc4d47,1.0,925000.0,14,56559047.0,8,41855714,6,38130714,4.0,28555714.0,1.0,8350000.0,4107620.0,Pierre Dorion,"April 10, 2016",D. J. Smith,"May 23, 2019",26.44,27.93,28.5,29.17,30.75,"Dominik Kubalik, Parker Kelly, Drake Batherson, Mathieu Joseph, Ridly Greig, Mark Kastelic, Zack MacEwen, Thomas Chabot, Travis Hamonic, Jakob Chychrun, Claude Giroux, Erik Brannstrom, Artem Zub, Brady Tkachuk, Joonas Korpisalo, Jacob Bernard-Docker, Jake Sanderson, Tim Stutzle","Drake Batherson, Mathieu Joseph, Ridly Greig, Mark Kastelic, Zack MacEwen, Thomas Chabot, Travis Hamonic, Jakob Chychrun, Claude Giroux, Artem Zub, Brady Tkachuk, Joonas Korpisalo, Jacob Bernard-Docker, Tim Stutzle","Drake Batherson, Mathieu Joseph, Zack MacEwen, Thomas Chabot, Artem Zub, Brady Tkachuk, Joonas Korpisalo, Tim Stutzle","Drake Batherson, Thomas Chabot, Artem Zub, Brady Tkachuk, Joonas Korpisalo, Tim Stutzle","Thomas Chabot, Brady Tkachuk, Joonas Korpisalo, Tim Stutzle",22.0
Philadelphia Flyers,PHI,PHI.png,20222023,75,31,east,metro,none,0.463,-45.96,0.906,0.084,-54,+50,-90,82227095,1272905.0,24,22,13,26,11,15,red,#fc4d47,black,red,#3568f2,black,1.0,800000.0,10,38200000.0,5,21100000,3,16350000,2.0,11250000.0,1.0,6250000.0,472905.0,Daniel Briere,"March 10, 2023",John Tortorella,"June 17, 2022",28.0,29.0,30.8,30.0,31.0,"Marc Staal, Tony DeAngelo, Felix Sandstrom, Travis Sanheim, Tanner Laczynski, Ryan Poehling, Owen Tippett, Nicolas Deslauriers, Noah Cates, Scott Laughton, Joel Farabee, Travis Konecny, Garnet Hathaway, Wade Allison, Carter Hart, Nick Seeler, Cal Petersen, Cam York, Rasmus Ristolainen, Sean Walker","Travis Sanheim, Nicolas Deslauriers, Noah Cates, Scott Laughton, Joel Farabee, Travis Konecny, Garnet Hathaway, Cal Petersen, Cam York, Rasmus Ristolainen","Travis Sanheim, Nicolas Deslauriers, Scott Laughton, Joel Farabee, Rasmus Ristolainen","Travis Sanheim, Joel Farabee, Rasmus Ristolainen","Travis Sanheim, Joel Farabee",4.0
Pittsburgh Penguins,PIT,PIT.png,20222023,91,40,east,metro,none,0.495,+54.03,0.911,0.082,-8,+94,-92,85816842,-2316842.0,17,9,14,7,8,16,#fc4d47,#3568f2,black,#3568f2,#3568f2,black,1.0,750000.0,15,69275175.0,7,34200000,5,26100000,5.0,26100000.0,1.0,4500000.0,-3066842.0,Kyle Dubas (Interim),"June 1, 2023",Mike Sullivan,"December 12, 2015",31.87,33.73,34.43,34.6,36.6,"Mikael Granlund, Alex Nedeljkovic, Casey DeSmith, Sidney Crosby, Evgeni Malkin, Chad Ruhwedel, Jake Guentzel, Bryan Rust, Rickard Rakell, Jeff Carter, Tristan Jarry, Noel Acciari, Andreas Johnsson, Jeff Petry, Kris Letang, Ryan Graves, Marcus Pettersson, Jan Rutta, Reilly Smith, Lars Eller, Matt Nieto, Pierre-Olivier Joseph, Alexander Nylander","Mikael Granlund, Sidney Crosby, Evgeni Malkin, Bryan Rust, Rickard Rakell, Tristan Jarry, Noel Acciari, Jeff Petry, Kris Letang, Ryan Graves, Marcus Pettersson, Jan Rutta, Reilly Smith, Lars Eller, Matt Nieto","Evgeni Malkin, Bryan Rust, Rickard Rakell, Tristan Jarry, Noel Acciari, Kris Letang, Ryan Graves","Bryan Rust, Rickard Rakell, Tristan Jarry, Kris Letang, Ryan Graves","Bryan Rust, Rickard Rakell, Tristan Jarry, Kris Letang, Ryan Graves",20.0
San Jose Sharks,SJS,SJS.png,20222023,60,22,west,pacific,none,0.426,-20.42,0.884,0.092,-126,+50,-74,78033334,5466666.0,27,22,8,21,18,10,red,#fc4d47,#3568f2,#fc4d47,#fc4d47,#3568f2,0.0,0.0,13,48950833.0,8,41100833,3,27637500,1.0,8137500.0,1.0,8137500.0,5466666.0,Mike Grier,"July 5, 2022",David Quinn,"July 21, 2022",28.27,29.62,32.0,36.0,35.0,"Filip Zadina, Marc-Edouard Vlasic, Alexander Barabanov, Givani Smith, Jacob Peterson, Nikolai Knyzhov, Kyle Burroughs, Mackenzie Blackwood, Matt Benning, Jacob MacDonald, Kaapo Kahkonen, Kevin Labanc, Radim Simek, William Eklund, Erik Karlsson, Nico Sturm, Oskar Lindblom, Fabian Zetterlund, Logan Couture, Tomas Hertl, Mario Ferraro, Anthony Duclair","Marc-Edouard Vlasic, Givani Smith, Nikolai Knyzhov, Kyle Burroughs, Mackenzie Blackwood, Matt Benning, William Eklund, Erik Karlsson, Nico Sturm, Fabian Zetterlund, Logan Couture, Tomas Hertl, Mario Ferraro","Marc-Edouard Vlasic, Kyle Burroughs, Matt Benning, William Eklund, Erik Karlsson, Logan Couture, Tomas Hertl, Mario Ferraro","Erik Karlsson, Logan Couture, Tomas Hertl",Tomas Hertl,9.0
