full,team,logo,season,PTS,W,Conference,Division,playoffs,gf%,xg_dif,sv%,shooting%,g_dif,PP_g_dif,PK_g_dif,projected_cap_hit,projected_cap_space,5on5_rank,PP_rank,PK_rank,XG_dif_rank,Save%_rank,Shooting%_rank,5on5_color,PP_color,PK_color,xg_color,sv_color,sh_color,expiring_contracts,expiring_salary,nhl_contracts_2324,2023-24 Salary,nhl_contracts_2425,2024-25 Salary,nhl_contracts_2526,2025-26 Salary,nhl_contracts_2627,2026-27 Salary,nhl_contracts_2728,2027-28 Salary,cap_remaining,GM,gm_start,coach,coach_start,avg_age_2324,avg_age_2425,avg_age_2526,avg_age_2627,avg_age_2728,players_under_contract_2324,players_under_contract_2425,players_under_contract_2526,players_under_contract_2627,players_under_contract_2728,draft_capital_rank
Anaheim Ducks,ANA,ANA.png,20222023,56,23,west,pacific,none,0.391,-71.92,0.907,0.083,-82,+26,-68,68628937,13871063.0,28,23,21,32,15,18,red,#fc4d47,#fc4d47,red,black,#fc4d47,0.0,0.0,14,42676667.0,6,25194167,3,17900000,2,11400000,0.0,0.0,13871063.0,Pat Verbeek,"February 3, 2022",Dallas Eakins,"June 17, 2019",28.14,29.83,32.67,33.0,,"John Gibson, Colton White, Cam Fowler, Sam Carrick, Mason McTavish, Adam Henrique, Jakob Silfverberg, Nikita Nesterenko, Max Jones, Isac Lundestrom, Brock McGinn, Brett Leason, Frank Vatrano, Ryan Strome","John Gibson, Cam Fowler, Mason McTavish, Brock McGinn, Frank Vatrano, Ryan Strome","John Gibson, Cam Fowler, Ryan Strome","John Gibson, Ryan Strome",,7.0
Arizona Coyotes,ARI,ARI.png,20222023,67,27,west,central,none,0.462,-45.16,0.911,0.098,-26,+36,-69,66868138,15631862.0,23,18,22,28,11,4,#fc4d47,#fc4d47,#fc4d47,red,#3568f2,#052ca3,0.0,0.0,13,34050000.0,4,20025000,3,17300000,2,11450000,1.0,7150000.0,15631862.0,Bill Armstrong,"September 17, 2020",Andre Tourigny,"July 1, 2021",27.23,27.5,28.33,28.5,30.0,"Clayton Keller, Lawson Crouse, Zack Kassian, Barrett Hayton, Travis Boyd, Liam O'Brien, Patrik Nemeth, Juuso Valimaki, Joshua Brown, J.J. Moser, Victor Soderstrom, Karel Vejmelka, Nick Schmaltz","Clayton Keller, Lawson Crouse, Karel Vejmelka, Nick Schmaltz","Clayton Keller, Lawson Crouse, Nick Schmaltz","Clayton Keller, Lawson Crouse",Clayton Keller,1.0
Boston Bruins,BOS,BOS.png,20222023,125,60,east,atlantic,top3,0.636,+26.53,0.936,0.104,+87,+46,-25,84049570,-1549570.0,1,9,1,7,1,2,#052ca3,#3568f2,#052ca3,#3568f2,#052ca3,#052ca3,0.0,0.0,13,65062500.0,8,52475000,6,41350000,5,36100000,3.0,27250000.0,-1549570.0,Don Sweeney,"May 20, 2015",Jim Montgomery,"July 1, 2022",29.0,30.25,30.17,30.4,32.67,"David Pastrnak, Brad Marchand, Charlie Coyle, Jake DeBrusk, Pavel Zacha, AJ Greer, Charlie McAvoy, Hampus Lindholm, Brandon Carlo, Matt Grzelcyk, Derek Forbort, Jakub Zboril, Linus Ullmark","David Pastrnak, Brad Marchand, Charlie Coyle, Pavel Zacha, Charlie McAvoy, Hampus Lindholm, Brandon Carlo, Linus Ullmark","David Pastrnak, Charlie Coyle, Pavel Zacha, Charlie McAvoy, Hampus Lindholm, Brandon Carlo","David Pastrnak, Pavel Zacha, Charlie McAvoy, Hampus Lindholm, Brandon Carlo","David Pastrnak, Charlie McAvoy, Hampus Lindholm",31.0
Buffalo Sabres,BUF,BUF.png,20222023,81,37,east,atlantic,none,0.483,-11.37,0.897,0.099,-14,+47,-45,65395356,17104644.0,18,8,16,23,21,3,#fc4d47,#3568f2,black,#fc4d47,#fc4d47,#052ca3,0.0,0.0,20,64040237.0,9,37922737,5,32278571,4,27528571,3.0,18528571.0,17104644.0,Kevyn Adams,"June 16, 2020",Don Granato,"March 17, 2021",25.15,25.89,28.2,29.0,29.33,"Peyton Krebs, Jack Quinn, Casey Mittelstadt, Jordan Greenway, Victor Olofsson, Alex Tuch, Jeff Skinner, John-Jason Peterka, Rasmus Dahlin, Ilya Lyubushkin, Henri Jokiharju, Jacob Bryson, Riley Stillman, Mattias Samuelsson, Owen Power, Eric Comrie, Devon Levi, Ukko-Pekka Luukkonen, Tage Thompson, Dylan Cozens","Jack Quinn, Jordan Greenway, Alex Tuch, Jeff Skinner, John-Jason Peterka, Mattias Samuelsson, Devon Levi, Tage Thompson, Dylan Cozens","Alex Tuch, Jeff Skinner, Mattias Samuelsson, Tage Thompson, Dylan Cozens","Jeff Skinner, Mattias Samuelsson, Tage Thompson, Dylan Cozens","Mattias Samuelsson, Tage Thompson, Dylan Cozens",14.0
Calgary Flames,CGY,CGY.png,20222023,89,37,west,pacific,none,0.518,+33.53,0.895,0.085,+13,+43,-33,82280221,219779.0,12,12,9,3,23,16,#3568f2,#3568f2,#3568f2,#052ca3,#fc4d47,black,0.0,0.0,19,80463333.0,9,48125000,6,39200000,4,28650000,3.0,23750000.0,219779.0,Brad Treliving,"April 28, 2014",Darryl Sutter,"March 4, 2021",28.63,30.0,33.0,34.25,36.0,"Andrew Mangiapane, Mikael Backlund, Jonathan Huberdeau, Daniel Vladar, Nazem Kadri, Blake Coleman, Elias Lindholm, Tyler Toffoli, Dillon Dube, Matthew Coronato, Jakob Pelletier, Noah Hanifin, Rasmus Andersson, Christopher Tanev, Nikita Zadorov, MacKenzie Weegar, Dennis Gilbert, Jacob Markstrom, Adam Ruzicka","Andrew Mangiapane, Jonathan Huberdeau, Daniel Vladar, Nazem Kadri, Blake Coleman, Matthew Coronato, Rasmus Andersson, MacKenzie Weegar, Jacob Markstrom","Jonathan Huberdeau, Nazem Kadri, Blake Coleman, Rasmus Andersson, MacKenzie Weegar, Jacob Markstrom","Jonathan Huberdeau, Nazem Kadri, Blake Coleman, MacKenzie Weegar","Jonathan Huberdeau, Nazem Kadri, MacKenzie Weegar",18.0
Carolina Hurricanes,CAR,CAR.png,20222023,109,50,east,metro,top3,0.552,+58.44,0.909,0.081,+33,+39,-25,87703858,-5203858.0,6,15,1,1,13,20,#052ca3,black,#052ca3,#052ca3,black,#fc4d47,0.0,0.0,13,46679417.0,3,15400000,1,4820000,1,4820000,1.0,4820000.0,-5203858.0,Don Waddell,"May 8, 2018",Rod Brind'Amour,"May 8, 2018",28.08,31.33,25.0,26.0,28.0,"Brett Pesce, Brent Burns, Jaccob Slavin, Stefan Noesen, Seth Jarvis, Jack Drury, Jordan Martinook, Martin Necas, Jesperi Kotkaniemi, Teuvo Teravainen, Sebastian Aho, Jalen Chatfield, Brady Skjei","Brent Burns, Jaccob Slavin, Jesperi Kotkaniemi",Jesperi Kotkaniemi,Jesperi Kotkaniemi,Jesperi Kotkaniemi,13.0
Chicago Blackhawks,CHI,CHI.png,20222023,56,25,west,central,none,0.39,-60.05,0.901,0.085,-77,+25,-41,77417555,5082445.0,27,24,13,31,18,16,red,red,black,red,#fc4d47,black,0.0,0.0,15,37875000.0,3,14816667,2,13900000,1,9500000,1.0,9500000.0,5082445.0,Kyle Davidson,"October 26, 2021",Luke Richardson,"June 27, 2022",27.0,28.0,32.0,32.0,34.0,"Tyler Johnson, Jason Dickinson, Colin Blackwell, Cole Guttman, Lukas Reichel, Mackenzie Entwistle, Reese Johnson, Boris Katchouk, Taylor Raddysh, Seth Jones, Nikita Zaitsev, Connor Murphy, Wyatt Kaiser, Alex Vlasic, Petr Mrazek","Seth Jones, Connor Murphy, Wyatt Kaiser","Seth Jones, Connor Murphy",Seth Jones,Seth Jones,2.0
Colorado Avalanche,COL,COL.png,20222023,98,46,west,central,top3,0.535,+12.8,0.923,0.084,+22,+50,-41,83962474,-1462474.0,9,6,13,14,2,17,#3568f2,#052ca3,black,black,#052ca3,#fc4d47,0.0,0.0,13,63275000.0,9,55425000,6,41725000,5,37225000,2.0,18725000.0,-1462474.0,Chris MacFarland,"July 11, 2022",Jared Bednar,"August 25, 2016",29.0,28.67,29.83,30.0,33.5,"Mikko Rantanen, Pavel Francouz, Brad Hunt, Nathan MacKinnon, Valeri Nichushkin, Artturi Lehkonen, Alexandar Georgiev, Logan O'Connor, Kurtis MacDermid, Devon Toews, Josh Manson, Cale Makar, Samuel Girard","Mikko Rantanen, Nathan MacKinnon, Valeri Nichushkin, Artturi Lehkonen, Alexandar Georgiev, Logan O'Connor, Josh Manson, Cale Makar, Samuel Girard","Nathan MacKinnon, Valeri Nichushkin, Artturi Lehkonen, Josh Manson, Cale Makar, Samuel Girard","Nathan MacKinnon, Valeri Nichushkin, Artturi Lehkonen, Cale Makar, Samuel Girard","Nathan MacKinnon, Valeri Nichushkin",26.0
Columbus Blue Jackets,CBJ,CBJ.png,20222023,56,24,east,metro,none,0.393,-42.39,0.896,0.083,-82,+29,-43,81560860,939140.0,28,22,15,27,22,18,red,#fc4d47,black,red,#fc4d47,#fc4d47,0.0,0.0,16,50337500.0,9,40400000,6,34350000,2,15150000,1.0,9750000.0,939140.0,Jarmo Kekalainen,"February 13, 2013",Brad Larsen,"June 10, 2021",26.19,28.44,30.67,32.5,35.0,"Erik Gudbranson, Adam Boqvist, Nick Blankenburg, Andrew Peeke, Elvis Merzlikins, Liam Foudy, Emil Bemstrom, Kirill Marchenko, Kent Johnson, Hunter McKown, Eric Robinson, Sean Kuraly, Boone Jenner, Jack Roslovic, Johnny Gaudreau, Patrik Laine","Erik Gudbranson, Adam Boqvist, Andrew Peeke, Elvis Merzlikins, Hunter McKown, Sean Kuraly, Boone Jenner, Johnny Gaudreau, Patrik Laine","Erik Gudbranson, Andrew Peeke, Elvis Merzlikins, Boone Jenner, Johnny Gaudreau, Patrik Laine","Elvis Merzlikins, Johnny Gaudreau",Johnny Gaudreau,8.0
Dallas Stars,DAL,DAL.png,20222023,98,42,west,central,top3,0.554,+23.53,0.917,0.099,+37,+52,-28,82372829,127171.0,4,4,4,9,6,3,#052ca3,#052ca3,#052ca3,#3568f2,#052ca3,#052ca3,0.0,0.0,17,75732500.0,11,66094167,5,39000000,3,26750000,2.0,16900000.0,127171.0,Jim Nill,"April 29, 2013",Peter DeBoer,"June 21, 2022",28.82,29.36,29.0,30.67,30.5,"Colin Miller, Scott Wedgewood, Jake Oettinger, Thomas Harley, Nils Lundkvist, Jani Hakanpaa, Ryan Suter, Miro Heiskanen, Wyatt Johnston, Roope Hintz, Radek Faksa, Mason Marchment, Esa Lindell, Tyler Seguin, Joe Pavelski, Jamie Benn, Jason Robertson","Jake Oettinger, Ryan Suter, Miro Heiskanen, Wyatt Johnston, Roope Hintz, Radek Faksa, Mason Marchment, Esa Lindell, Tyler Seguin, Jamie Benn, Jason Robertson","Miro Heiskanen, Roope Hintz, Mason Marchment, Tyler Seguin, Jason Robertson","Miro Heiskanen, Roope Hintz, Tyler Seguin","Miro Heiskanen, Roope Hintz",25.0
Detroit Red Wings,DET,DET.png,20222023,79,35,east,atlantic,none,0.481,-10.06,0.905,0.098,-13,+38,-41,74476966,8023034.0,17,16,13,22,16,4,#fc4d47,black,black,#fc4d47,black,#052ca3,0.0,0.0,16,48650833.0,10,37925000,4,22475000,2,14325000,1.0,8700000.0,8023034.0,Steve Yzerman,"April 19, 2019",Derek Lalonde,"June 30, 2022",26.75,27.6,31.0,31.0,32.0,"Andrew Copp, David Perron, Dylan Larkin, Robby Fabbri, Dominik Kubalik, Filip Zadina, Marco Kasper, Jonatan Berggren, Austin Czarnik, Lucas Raymond, Ben Chiarot, Ville Husso, Olli Maatta, Moritz Seider, Simon Edvinsson, Jake Walman","Andrew Copp, Dylan Larkin, Robby Fabbri, Filip Zadina, Marco Kasper, Ben Chiarot, Ville Husso, Olli Maatta, Simon Edvinsson, Jake Walman","Andrew Copp, Dylan Larkin, Ben Chiarot, Jake Walman","Andrew Copp, Dylan Larkin",Dylan Larkin,4.0
Edmonton Oilers,EDM,EDM.png,20222023,103,47,west,pacific,top3,0.535,+33.07,0.911,0.097,+26,+75,-42,90961396,-8461396.0,7,1,14,4,11,5,#3568f2,#052ca3,black,#052ca3,#3568f2,#052ca3,0.0,0.0,15,73075833.0,11,65600000,9,53850000,4,24875000,3.0,19875000.0,-8461396.0,Ken Holland,"May 7, 2019",Jay Woodcroft,"February 10, 2022",28.6,30.73,31.89,33.5,35.0,"Warren Foegele, Connor McDavid, Leon Draisaitl, Zach Hyman, Ryan Nugent-Hopkins, Evander Kane, Kailer Yamamoto, Darnell Nurse, Mattias Ekholm, Cody Ceci, Brett Kulak, Philip Broberg, Vincent Desharnais, Jack Campbell, Stuart Skinner","Connor McDavid, Leon Draisaitl, Zach Hyman, Ryan Nugent-Hopkins, Evander Kane, Darnell Nurse, Mattias Ekholm, Cody Ceci, Brett Kulak, Jack Campbell, Stuart Skinner","Connor McDavid, Zach Hyman, Ryan Nugent-Hopkins, Evander Kane, Darnell Nurse, Mattias Ekholm, Brett Kulak, Jack Campbell, Stuart Skinner","Zach Hyman, Ryan Nugent-Hopkins, Darnell Nurse, Jack Campbell","Zach Hyman, Ryan Nugent-Hopkins, Darnell Nurse",27.0
Florida Panthers,FLA,FLA.png,20222023,87,40,east,atlantic,wc,0.533,+26.4,0.908,0.089,+25,+50,-57,87398420,-4898420.0,8,6,19,8,14,12,#3568f2,#052ca3,#fc4d47,#3568f2,black,#3568f2,0.0,0.0,15,66508334.0,6,45591667,3,29500000,2,19500000,2.0,19500000.0,-4898420.0,Bill Zito,"September 2, 2020",Paul Maurice,"June 22, 2022",27.67,29.67,31.67,30.0,32.0,"Sergei Bobrovsky, Aleksander Barkov, Matthew Tkachuk, Sam Bennett, Carter Verhaeghe, Anthony Duclair, Eetu Luostarinen, Sam Reinhart, Nick Cousins, Josh Mahura, Gustav Forsling, Aaron Ekblad, Brandon Montour, Ryan Lomberg, Anton Lundell","Sergei Bobrovsky, Aleksander Barkov, Matthew Tkachuk, Sam Bennett, Carter Verhaeghe, Aaron Ekblad","Sergei Bobrovsky, Aleksander Barkov, Matthew Tkachuk","Aleksander Barkov, Matthew Tkachuk","Aleksander Barkov, Matthew Tkachuk",30.0
Los Angeles Kings,LAK,LAK.png,20222023,100,45,west,pacific,top3,0.528,+22.53,0.903,0.091,+19,+51,-52,81159389,1340611.0,11,5,18,10,17,11,#3568f2,#052ca3,#fc4d47,#3568f2,#fc4d47,#3568f2,0.0,0.0,17,70213334.0,7,42200000,6,38200000,5,32700000,3.0,16200000.0,1340611.0,Rob Blake,"April 10, 2017",Todd McLellan,"April 16, 2019",28.12,29.86,30.67,32.0,31.67,"Pheonix Copley, Sean Walker, Michael Anderson, Sean Durzi, Blake Lizotte, Drew Doughty, Arthur Kaliyev, Quinton Byfield, Carl Grundstrom, Trevor Moore, Alex Iafallo, Viktor Arvidsson, Matt Roy, Anze Kopitar, Adrian Kempe, Kevin Fiala, Phillip Danault","Michael Anderson, Drew Doughty, Trevor Moore, Alex Iafallo, Adrian Kempe, Kevin Fiala, Phillip Danault","Michael Anderson, Drew Doughty, Trevor Moore, Adrian Kempe, Kevin Fiala, Phillip Danault","Michael Anderson, Drew Doughty, Trevor Moore, Kevin Fiala, Phillip Danault","Michael Anderson, Trevor Moore, Kevin Fiala",21.0
Minnesota Wild,MIN,MIN.png,20222023,98,44,west,central,top3,0.517,+2.42,0.923,0.085,+10,+45,-31,81450475,1049525.0,13,10,7,17,2,16,black,#3568f2,#3568f2,#fc4d47,#052ca3,black,0.0,0.0,13,55575000.0,7,38475000,5,34825000,4,25825000,3.0,18250000.0,1049525.0,Bill Guerin,"August 21, 2019",Dean Evason,"February 14, 2020",30.62,29.57,30.0,31.5,31.67,"Kirill Kaprizov, Mats Zuccarello, Joel Eriksson Ek, Marcus Foligno, Ryan Hartman, Matthew Boldy, Connor Dewar, Jared Spurgeon, Jonas Brodin, Jacob Middleton, Jon Merrill, Marc-Andre Fleury, Alex Goligoski","Kirill Kaprizov, Joel Eriksson Ek, Matthew Boldy, Jared Spurgeon, Jonas Brodin, Jacob Middleton, Jon Merrill","Kirill Kaprizov, Joel Eriksson Ek, Matthew Boldy, Jared Spurgeon, Jonas Brodin","Joel Eriksson Ek, Matthew Boldy, Jared Spurgeon, Jonas Brodin","Joel Eriksson Ek, Matthew Boldy, Jonas Brodin",16.0
Montreal Canadiens,MTL,MTL.png,20222023,66,30,east,atlantic,none,0.444,-52.34,0.898,0.096,-42,+30,-63,95887566,-13387566.0,25,21,20,30,20,6,red,#fc4d47,#fc4d47,red,#fc4d47,#052ca3,0.0,0.0,20,60727500.0,14,48940000,5,28112500,3,19875000,1.0,7875000.0,-13387566.0,Kent Hughes,"January 18, 2022",Martin St. Louis,"February 9, 2022",27.75,28.21,29.4,31.0,29.0,"Jake Allen, Chris Wideman, Johnathan Kovacevic, Jordan Harris, Kaiden Guhle, Justin Barron, David Savard, Joel Edmundson, Michael Matheson, Sean Farrell, Rem Pitlick, Jake Evans, Kirby Dach, Joel Armia, Christian Dvorak, Mike Hoffman, Samuel Montembeault, Josh Anderson, Nick Suzuki, Brendan Gallagher","Jake Allen, Johnathan Kovacevic, Jordan Harris, Kaiden Guhle, David Savard, Michael Matheson, Sean Farrell, Jake Evans, Kirby Dach, Joel Armia, Christian Dvorak, Josh Anderson, Nick Suzuki, Brendan Gallagher","Michael Matheson, Kirby Dach, Josh Anderson, Nick Suzuki, Brendan Gallagher","Josh Anderson, Nick Suzuki, Brendan Gallagher",Nick Suzuki,5.0
Nashville Predators,NSH,NSH.png,20222023,86,39,west,central,none,0.495,-14.33,0.92,0.087,-3,+34,-41,79326227,3173773.0,14,19,13,25,3,14,black,#fc4d47,black,red,#052ca3,black,0.0,0.0,16,56430309.0,7,41666143,5,28666143,1,9059000,1.0,9059000.0,3173773.0,David Poile,"July 9, 1997",John Hynes,"January 7, 2020",28.44,31.71,33.2,36.0,38.0,"Matt Duchene, Ryan Johansen, Colton Sissons, Philip Tomasino, Juuso Parssinen, Thomas Novak, Cole Smith, Mark Jankowski, Roman Josi, Ryan McDonagh, Tyson Barrie, Dante Fabbro, Jeremy Lauzon, Juuse Saros, Kevin Lankinen, Yakov Trenin","Matt Duchene, Ryan Johansen, Colton Sissons, Roman Josi, Ryan McDonagh, Jeremy Lauzon, Juuse Saros","Matt Duchene, Colton Sissons, Roman Josi, Ryan McDonagh, Jeremy Lauzon",Roman Josi,Roman Josi,3.0
New Jersey Devils,NJD,NJD.png,20222023,106,49,east,metro,top3,0.567,+55.66,0.912,0.093,+49,+30,-29,83676053,-1176053.0,2,21,5,2,10,9,#052ca3,#fc4d47,#052ca3,#052ca3,#3568f2,#3568f2,0.0,0.0,10,44444167.0,8,42450000,6,38050000,6,38050000,3.0,20400000.0,-1176053.0,Tom Fitzgerald,"January 12, 2020",Lindy Ruff,"July 9, 2020",27.6,28.38,29.0,30.0,31.0,"Curtis Lazar, Dawson Mercer, Dougie Hamilton, John Marino, Jonas Siegenthaler, Brendan Smith, Vitek Vanecek, Nico Hischier, Ondrej Palat, Jack Hughes","Curtis Lazar, Dougie Hamilton, John Marino, Jonas Siegenthaler, Vitek Vanecek, Nico Hischier, Ondrej Palat, Jack Hughes","Dougie Hamilton, John Marino, Jonas Siegenthaler, Nico Hischier, Ondrej Palat, Jack Hughes","Dougie Hamilton, John Marino, Jonas Siegenthaler, Nico Hischier, Ondrej Palat, Jack Hughes","Dougie Hamilton, Jonas Siegenthaler, Jack Hughes",23.0
New York Islanders,NYI,NYI.png,20222023,87,39,east,metro,wc,0.531,-7.01,0.92,0.092,+21,+24,-27,81117864,1382136.0,10,25,3,21,3,10,#3568f2,red,#052ca3,#fc4d47,#052ca3,#3568f2,0.0,0.0,18,76588333.0,12,62650000,8,45150000,5,32050000,4.0,29550000.0,1382136.0,Lou Lamoriello,"June 5, 2018",Lane Lambert,"May 16, 2022",29.72,30.42,32.0,32.2,33.25,"Sebastian Aho, Alexander Romanov, Noah Dobson, Adam Pelech, Ryan Pulock, Simon Holmstrom, Ross Johnston, Cal Clutterbuck, Casey Cizikas, Bo Horvat, Kyle Palmieri, Jean-Gabriel Pageau, Josh Bailey, Brock Nelson, Anders Lee, Mathew Barzal, Matt Martin, Ilya Sorokin","Alexander Romanov, Noah Dobson, Adam Pelech, Ryan Pulock, Ross Johnston, Casey Cizikas, Bo Horvat, Kyle Palmieri, Jean-Gabriel Pageau, Brock Nelson, Anders Lee, Mathew Barzal","Adam Pelech, Ryan Pulock, Ross Johnston, Casey Cizikas, Bo Horvat, Jean-Gabriel Pageau, Anders Lee, Mathew Barzal","Adam Pelech, Ryan Pulock, Casey Cizikas, Bo Horvat, Mathew Barzal","Adam Pelech, Ryan Pulock, Bo Horvat, Mathew Barzal",22.0
New York Rangers,NYR,NYR.png,20222023,103,46,east,metro,top3,0.552,-4.61,0.919,0.099,+36,+44,-26,82498392,1608.0,5,11,2,20,4,3,#052ca3,#3568f2,#052ca3,#fc4d47,#052ca3,#052ca3,0.0,0.0,14,71126191.0,11,65101191,8,57847024,6,38204167,3.0,23625000.0,1608.0,Chris Drury,"May 5, 2021",Gerard Gallant,"June 16, 2021",28.07,30.27,31.38,31.83,33.67,"Vincent Trocheck, Artemi Panarin, Mika Zibanejad, Chris Kreider, Ryan Lindgren, Barclay Goodrow, Filip Chytil, Kaapo Kakko, Jimmy Vesey, Adam Fox, Jacob Trouba, Ben Harpur, Braden Schneider, Igor Shesterkin","Vincent Trocheck, Artemi Panarin, Mika Zibanejad, Chris Kreider, Barclay Goodrow, Filip Chytil, Jimmy Vesey, Adam Fox, Jacob Trouba, Ben Harpur, Igor Shesterkin","Vincent Trocheck, Artemi Panarin, Mika Zibanejad, Chris Kreider, Barclay Goodrow, Filip Chytil, Adam Fox, Jacob Trouba","Vincent Trocheck, Mika Zibanejad, Chris Kreider, Barclay Goodrow, Filip Chytil, Adam Fox","Vincent Trocheck, Mika Zibanejad, Adam Fox",24.0
Ottawa Senators,OTT,OTT.png,20222023,81,37,east,atlantic,none,0.456,+11.08,0.901,0.079,-30,+57,-38,79312151,3187849.0,24,2,11,15,18,21,red,#052ca3,#3568f2,black,#fc4d47,#fc4d47,0.0,0.0,13,52483214.0,11,50795714,6,37080714,5,34130714,3.0,24555714.0,3187849.0,Pierre Dorion,"April 10, 2016",D. J. Smith,"May 23, 2019",25.23,26.73,27.5,28.2,29.33,"Tyler Kleven, Jake Sanderson, Mark Kastelic, Artem Zub, Jakob Chychrun, Thomas Chabot, Parker Kelly, Ridly Greig, Tim Stutzle, Brady Tkachuk, Claude Giroux, Drake Batherson, Mathieu Joseph","Tyler Kleven, Mark Kastelic, Artem Zub, Jakob Chychrun, Thomas Chabot, Ridly Greig, Tim Stutzle, Brady Tkachuk, Claude Giroux, Drake Batherson, Mathieu Joseph","Artem Zub, Thomas Chabot, Tim Stutzle, Brady Tkachuk, Drake Batherson, Mathieu Joseph","Artem Zub, Thomas Chabot, Tim Stutzle, Brady Tkachuk, Drake Batherson","Thomas Chabot, Tim Stutzle, Brady Tkachuk",28.0
Philadelphia Flyers,PHI,PHI.png,20222023,71,29,east,metro,none,0.47,-24.1,0.908,0.085,-20,+23,-41,86466568,-3966568.0,21,26,13,26,14,16,#fc4d47,red,black,red,black,black,0.0,0.0,15,54069357.0,8,40492857,6,28242857,3,16350000,2.0,11250000.0,-3966568.0,Daniel Briere (interim),"March 10, 2023",John Tortorella,"June 17, 2022",27.67,29.5,31.0,30.0,31.0,"Ivan Provorov, Tanner Laczynski, Wade Allison, Owen Tippett, Nicolas Deslauriers, Travis Konecny, Joel Farabee, Kevin Hayes, Rasmus Ristolainen, Scott Laughton, Anthony Deangelo, Travis Sanheim, Nick Seeler, Felix Sandstrom, Carter Hart","Ivan Provorov, Nicolas Deslauriers, Travis Konecny, Joel Farabee, Kevin Hayes, Rasmus Ristolainen, Scott Laughton, Travis Sanheim","Nicolas Deslauriers, Joel Farabee, Kevin Hayes, Rasmus Ristolainen, Scott Laughton, Travis Sanheim","Joel Farabee, Rasmus Ristolainen, Travis Sanheim","Joel Farabee, Travis Sanheim",11.0
Pittsburgh Penguins,PIT,PIT.png,20222023,86,38,east,metro,none,0.493,+26.87,0.91,0.082,-5,+42,-45,83777662,-1277662.0,15,13,16,6,12,19,black,black,black,#052ca3,#3568f2,#fc4d47,0.0,0.0,13,57575000.0,8,45025000,4,22325000,3,16225000,3.0,16225000.0,-1277662.0,Ron Hextall,"February 9, 2021",Mike Sullivan,"December 12, 2015",32.92,34.88,35.5,35.33,37.33,"Mikael Granlund, Jeff Carter, Rickard Rakell, Jeff Petry, Kris Letang, Jan Rutta, Pierre-Olivier Joseph, Chad Ruhwedel, Casey DeSmith, Bryan Rust, Jake Guentzel, Evgeni Malkin, Sidney Crosby","Mikael Granlund, Rickard Rakell, Jeff Petry, Kris Letang, Jan Rutta, Bryan Rust, Evgeni Malkin, Sidney Crosby","Rickard Rakell, Kris Letang, Bryan Rust, Evgeni Malkin","Rickard Rakell, Kris Letang, Bryan Rust","Rickard Rakell, Kris Letang, Bryan Rust",17.0
San Jose Sharks,SJS,SJS.png,20222023,60,22,west,pacific,none,0.44,-3.81,0.886,0.094,-48,+25,-34,82774614,-274614.0,26,24,10,19,24,8,red,red,#3568f2,#fc4d47,red,#3568f2,0.0,0.0,16,59504167.0,7,41137500,6,39137500,3,27637500,1.0,8137500.0,-274614.0,Mike Grier,"July 5, 2022",David Quinn,"July 21, 2022",28.88,32.0,33.5,35.67,35.0,"Tomas Hertl, Kaapo Kahkonen, Logan Couture, Kevin Labanc, Oskar Lindblom, Alexander Barabanov, Steven Lorentz, Thomas Bordeleau, Nico Sturm, Jacob MacDonald, Matthew Benning, Radim Simek, Mario Ferraro, Henry Thrun, Erik Karlsson, Marc-Edouard Vlasic","Tomas Hertl, Logan Couture, Nico Sturm, Matthew Benning, Mario Ferraro, Erik Karlsson, Marc-Edouard Vlasic","Tomas Hertl, Logan Couture, Matthew Benning, Mario Ferraro, Erik Karlsson, Marc-Edouard Vlasic","Tomas Hertl, Logan Couture, Erik Karlsson",Tomas Hertl,9.0
St. Louis Blues,STL,STL.png,20222023,79,36,west,central,none,0.474,-46.72,0.898,0.104,-21,+33,-46,83269648,-769648.0,22,20,17,29,20,2,#fc4d47,#fc4d47,#fc4d47,red,#fc4d47,#052ca3,0.0,0.0,18,75973333.0,11,63385833,9,56750000,7,48250000,4.0,29250000.0,-769648.0,Doug Armstrong,"July 1, 2010",Craig Berube,"November 19, 2018",29.44,30.0,31.89,32.29,32.75,"Calle Rosen, Robert Bortuzzo, Marco Scandella, Nick Leddy, Colton Parayko, Torey Krug, Justin Faulk, Jordan Binnington, Nathan Walker, Jordan Kyrou, Kasperi Kapanen, Brandon Saad, Pavel Buchnevich, Brayden Schenn, Jake Neighbours, Jakub Vrana, Samuel Blais, Robert Thomas","Nick Leddy, Colton Parayko, Torey Krug, Justin Faulk, Jordan Binnington, Jordan Kyrou, Brandon Saad, Pavel Buchnevich, Brayden Schenn, Jake Neighbours, Robert Thomas","Nick Leddy, Colton Parayko, Torey Krug, Justin Faulk, Jordan Binnington, Jordan Kyrou, Brandon Saad, Brayden Schenn, Robert Thomas","Colton Parayko, Torey Krug, Justin Faulk, Jordan Binnington, Jordan Kyrou, Brayden Schenn, Robert Thomas","Colton Parayko, Jordan Kyrou, Brayden Schenn, Robert Thomas",6.0
Tampa Bay Lightning,TBL,TBL.png,20222023,96,45,east,atlantic,top3,0.53,+13.9,0.914,0.095,+21,+53,-40,89618491,-7118491.0,10,3,12,12,8,7,#3568f2,#052ca3,#3568f2,#3568f2,#3568f2,#3568f2,0.0,0.0,15,73975000.0,9,60600000,7,51600000,7,51600000,6.0,42100000.0,-7118491.0,Julien BriseBois,"September 11, 2018",Jon Cooper,"March 25, 2013",28.87,28.89,29.57,30.57,32.17,"Andrei Vasilevskiy, Darren Raddysh, Haydn Fleury, Nick Perbix, Zach Bogosian, Mikhail Sergachev, Victor Hedman, Patrick Maroon, Erik Cernak, Nikita Kucherov, Brayden Point, Steven Stamkos, Nicholas Paul, Brandon Hagel, Anthony Cirelli","Andrei Vasilevskiy, Nick Perbix, Mikhail Sergachev, Victor Hedman, Erik Cernak, Nikita Kucherov, Brayden Point, Nicholas Paul, Anthony Cirelli","Andrei Vasilevskiy, Mikhail Sergachev, Erik Cernak, Nikita Kucherov, Brayden Point, Nicholas Paul, Anthony Cirelli","Andrei Vasilevskiy, Mikhail Sergachev, Erik Cernak, Nikita Kucherov, Brayden Point, Nicholas Paul, Anthony Cirelli","Andrei Vasilevskiy, Mikhail Sergachev, Erik Cernak, Brayden Point, Nicholas Paul, Anthony Cirelli",32.0
Toronto Maple Leafs,TOR,TOR.png,20222023,102,46,east,atlantic,top3,0.564,+27.67,0.918,0.097,+43,+48,-32,89069557,-6569557.0,3,7,8,5,5,5,#052ca3,#3568f2,#3568f2,#052ca3,#052ca3,#052ca3,0.0,0.0,13,66243116.0,6,34603000,2,9600000,1,7500000,1.0,7500000.0,-6569557.0,Kyle Dubas,"May 11, 2018",Sheldon Keefe,"November 20, 2019",29.54,30.33,33.0,33.0,35.0,"Auston Matthews, John Tavares, William Nylander, Calle Jarnkrok, Mitchell Marner, Morgan Rielly, TJ Brodie, Jake McCabe, Timothy Liljegren, Conor Timmins, Mark Giordano, Matt Murray, Sam Lafferty","John Tavares, Calle Jarnkrok, Mitchell Marner, Morgan Rielly, Jake McCabe, Conor Timmins","Calle Jarnkrok, Morgan Rielly",Morgan Rielly,Morgan Rielly,29.0
Vancouver Canucks,VAN,VAN.png,20222023,75,34,west,pacific,none,0.475,-14.12,0.896,0.099,-19,+40,-46,89044673,-6544673.0,20,14,17,24,22,3,#fc4d47,black,#fc4d47,red,#fc4d47,#052ca3,0.0,0.0,19,67258750.0,9,40275000,4,25800000,2,15850000,1.0,8000000.0,-6544673.0,Patrik Allvin,"January 26, 2022",Rick Tocchet,"January 22, 2023",27.0,28.89,29.75,30.5,36.0,"Filip Hronek, Thatcher Demko, Christian Wolanin, Guillaume Brisebois, Elias Pettersson, Brock Boeser, J.T. Miller, Conor Garland, Anthony Beauvillier, Andrei Kuzmenko, Aidan McDonough, Vasily Podkolzin, Nils Åman, Dakota Joshua, Jack Studnicka, Sheldon Dries, Phillip Di Giuseppe, Quinn Hughes, Tyler Myers","Thatcher Demko, Christian Wolanin, Guillaume Brisebois, Brock Boeser, J.T. Miller, Conor Garland, Andrei Kuzmenko, Phillip Di Giuseppe, Quinn Hughes","Thatcher Demko, J.T. Miller, Conor Garland, Quinn Hughes","J.T. Miller, Quinn Hughes",J.T. Miller,15.0
